Sheet: Sheet1
A1: Aircraft | B1: Profile | C1: Track | D1: Track Type | E1: Runway | F1: A/C Category | G1: Track Group | H1: Num Day | I1: Num Night | J1: Num Total | K1: % Day | L1: % Night | M1: % Total
A2: EA-18G | B2: 226A_EXP | C2: 07A2A | D2: Arrival | E2: 07 | F2: Based | G2: P3 P8 IFR and Growler VFR non breaks | H2: 0 | I2: 0 | J2: =SUM(RC[-2]:RC[-1]) -> 0 | K2: =IF(RC[-1]=0,0,RC[-3]/RC[-1]) -> 0 | L2: =IF(RC[-2]=0,0,RC[-3]/RC[-2]) -> 0 | M2: =IF(R[147]C[-3]=0,0,RC[-3]/R[147]C[-3]) -> 0
A3: EA-18G | B3: 226A_FLT | C3: 07A2A | D3: Arrival | E3: 07 | F3: Based | G3: P3 P8 IFR and Growler VFR non breaks | H3: 0 | I3: 0 | J3: =SUM(RC[-2]:RC[-1]) -> 0 | K3: =IF(RC[-1]=0,0,RC[-3]/RC[-1]) -> 0 | L3: =IF(RC[-2]=0,0,RC[-3]/RC[-2]) -> 0 | M3: =IF(R[146]C[-3]=0,0,RC[-3]/R[146]C[-3]) -> 0
A4: EA-18G | B4: 226A_FRS | C4: 07A2A | D4: Arrival | E4: 07 | F4: Based | G4: P3 P8 IFR and Growler VFR non breaks | H4: 0.2857142857142857 | I4: 0 | J4: =SUM(RC[-2]:RC[-1]) -> 0.2857142857142857 | K4: =IF(RC[-1]=0,0,RC[-3]/RC[-1]) -> 1 | L4: =IF(RC[-2]=0,0,RC[-3]/RC[-2]) -> 0 | M4: =IF(R[145]C[-3]=0,0,RC[-3]/R[145]C[-3]) -> 9.1324200913242039E-3
A5: EA-18G | B5: 226B_EXP | C5: 07A2B | D5: Arrival | E5: 07 | F5: Based | G5: P3 P8 IFR and Growler VFR non breaks | H5: 0 | I5: 0 | J5: =SUM(RC[-2]:RC[-1]) -> 0 | K5: =IF(RC[-1]=0,0,RC[-3]/RC[-1]) -> 0 | L5: =IF(RC[-2]=0,0,RC[-3]/RC[-2]) -> 0 | M5: =IF(R[144]C[-3]=0,0,RC[-3]/R[144]C[-3]) -> 0
A6: EA-18G | B6: 226B_FLT | C6: 07A2B | D6: Arrival | E6: 07 | F6: Based | G6: P3 P8 IFR and Growler VFR non breaks | H6: 0 | I6: 0 | J6: =SUM(RC[-2]:RC[-1]) -> 0 | K6: =IF(RC[-1]=0,0,RC[-3]/RC[-1]) -> 0 | L6: =IF(RC[-2]=0,0,RC[-3]/RC[-2]) -> 0 | M6: =IF(R[143]C[-3]=0,0,RC[-3]/R[143]C[-3]) -> 0
A7: EA-18G | B7: 226B_FRS | C7: 07A2B | D7: Arrival | E7: 07 | F7: Based | G7: P3 P8 IFR and Growler VFR non breaks | H7: 0 | I7: 0 | J7: =SUM(RC[-2]:RC[-1]) -> 0 | K7: =IF(RC[-1]=0,0,RC[-3]/RC[-1]) -> 0 | L7: =IF(RC[-2]=0,0,RC[-3]/RC[-2]) -> 0 | M7: =IF(R[142]C[-3]=0,0,RC[-3]/R[142]C[-3]) -> 0
A8: EA-18G | B8: 226C_EXP | C8: 07A2C | D8: Arrival | E8: 07 | F8: Based | G8: P3 P8 IFR and Growler VFR non breaks | H8: 0 | I8: 0 | J8: =SUM(RC[-2]:RC[-1]) -> 0 | K8: =IF(RC[-1]=0,0,RC[-3]/RC[-1]) -> 0 | L8: =IF(RC[-2]=0,0,RC[-3]/RC[-2]) -> 0 | M8: =IF(R[141]C[-3]=0,0,RC[-3]/R[141]C[-3]) -> 0
A9: EA-18G | B9: 226C_FLT | C9: 07A2C | D9: Arrival | E9: 07 | F9: Based | G9: P3 P8 IFR and Growler VFR non breaks | H9: 0 | I9: 0 | J9: =SUM(RC[-2]:RC[-1]) -> 0 | K9: =IF(RC[-1]=0,0,RC[-3]/RC[-1]) -> 0 | L9: =IF(RC[-2]=0,0,RC[-3]/RC[-2]) -> 0 | M9: =IF(R[140]C[-3]=0,0,RC[-3]/R[140]C[-3]) -> 0
A10: EA-18G | B10: 226C_FRS | C10: 07A2C | D10: Arrival | E10: 07 | F10: Based | G10: P3 P8 IFR and Growler VFR non breaks | H10: 0 | I10: 0 | J10: =SUM(RC[-2]:RC[-1]) -> 0 | K10: =IF(RC[-1]=0,0,RC[-3]/RC[-1]) -> 0 | L10: =IF(RC[-2]=0,0,RC[-3]/RC[-2]) -> 0 | M10: =IF(R[139]C[-3]=0,0,RC[-3]/R[139]C[-3]) -> 0
A11: EA-18G | B11: 227A_EXP | C11: 07A1A | D11: Arrival | E11: 07 | F11: Based | G11: P3 P8 IFR and Growler VFR non breaks | H11: 0 | I11: 0 | J11: =SUM(RC[-2]:RC[-1]) -> 0 | K11: =IF(RC[-1]=0,0,RC[-3]/RC[-1]) -> 0 | L11: =IF(RC[-2]=0,0,RC[-3]/RC[-2]) -> 0 | M11: =IF(R[138]C[-3]=0,0,RC[-3]/R[138]C[-3]) -> 0
A12: EA-18G | B12: 227A_FLT | C12: 07A1A | D12: Arrival | E12: 07 | F12: Based | G12: P3 P8 IFR and Growler VFR non breaks | H12: 0.14285714285714285 | I12: 0 | J12: =SUM(RC[-2]:RC[-1]) -> 0.14285714285714285 | K12: =IF(RC[-1]=0,0,RC[-3]/RC[-1]) -> 1 | L12: =IF(RC[-2]=0,0,RC[-3]/RC[-2]) -> 0 | M12: =IF(R[137]C[-3]=0,0,RC[-3]/R[137]C[-3]) -> 4.5662100456621019E-3
A13: EA-18G | B13: 227A_FRS | C13: 07A1A | D13: Arrival | E13: 07 | F13: Based | G13: P3 P8 IFR and Growler VFR non breaks | H13: 0.2857142857142857 | I13: 0 | J13: =SUM(RC[-2]:RC[-1]) -> 0.2857142857142857 | K13: =IF(RC[-1]=0,0,RC[-3]/RC[-1]) -> 1 | L13: =IF(RC[-2]=0,0,RC[-3]/RC[-2]) -> 0 | M13: =IF(R[136]C[-3]=0,0,RC[-3]/R[136]C[-3]) -> 9.1324200913242039E-3
A14: EA-18G | B14: 227B_EXP | C14: 07A3B | D14: Arrival | E14: 07 | F14: Based | G14: P3 P8 IFR and Growler VFR non breaks | H14: 0.2857142857142857 | I14: 0 | J14: =SUM(RC[-2]:RC[-1]) -> 0.2857142857142857 | K14: =IF(RC[-1]=0,0,RC[-3]/RC[-1]) -> 1 | L14: =IF(RC[-2]=0,0,RC[-3]/RC[-2]) -> 0 | M14: =IF(R[135]C[-3]=0,0,RC[-3]/R[135]C[-3]) -> 9.1324200913242039E-3
A15: EA-18G | B15: 227B_FLT | C15: 07A3B | D15: Arrival | E15: 07 | F15: Based | G15: P3 P8 IFR and Growler VFR non breaks | H15: 0.14285714285714285 | I15: 0 | J15: =SUM(RC[-2]:RC[-1]) -> 0.14285714285714285 | K15: =IF(RC[-1]=0,0,RC[-3]/RC[-1]) -> 1 | L15: =IF(RC[-2]=0,0,RC[-3]/RC[-2]) -> 0 | M15: =IF(R[134]C[-3]=0,0,RC[-3]/R[134]C[-3]) -> 4.5662100456621019E-3
A16: EA-18G | B16: 227B_FRS | C16: 07A3B | D16: Arrival | E16: 07 | F16: Based | G16: P3 P8 IFR and Growler VFR non breaks | H16: 0.14285714285714285 | I16: 0 | J16: =SUM(RC[-2]:RC[-1]) -> 0.14285714285714285 | K16: =IF(RC[-1]=0,0,RC[-3]/RC[-1]) -> 1 | L16: =IF(RC[-2]=0,0,RC[-3]/RC[-2]) -> 0 | M16: =IF(R[133]C[-3]=0,0,RC[-3]/R[133]C[-3]) -> 4.5662100456621019E-3
A17: EA-18G | B17: 227C_EXP | C17: 07A3C | D17: Arrival | E17: 07 | F17: Based | G17: P3 P8 IFR and Growler VFR non breaks | H17: 0 | I17: 0 | J17: =SUM(RC[-2]:RC[-1]) -> 0 | K17: =IF(RC[-1]=0,0,RC[-3]/RC[-1]) -> 0 | L17: =IF(RC[-2]=0,0,RC[-3]/RC[-2]) -> 0 | M17: =IF(R[132]C[-3]=0,0,RC[-3]/R[132]C[-3]) -> 0
A18: EA-18G | B18: 227C_FLT | C18: 07A3C | D18: Arrival | E18: 07 | F18: Based | G18: P3 P8 IFR and Growler VFR non breaks | H18: 0 | I18: 0 | J18: =SUM(RC[-2]:RC[-1]) -> 0 | K18: =IF(RC[-1]=0,0,RC[-3]/RC[-1]) -> 0 | L18: =IF(RC[-2]=0,0,RC[-3]/RC[-2]) -> 0 | M18: =IF(R[131]C[-3]=0,0,RC[-3]/R[131]C[-3]) -> 0
A19: EA-18G | B19: 227C_FRS | C19: 07A3C | D19: Arrival | E19: 07 | F19: Based | G19: P3 P8 IFR and Growler VFR non breaks | H19: 0 | I19: 0 | J19: =SUM(RC[-2]:RC[-1]) -> 0 | K19: =IF(RC[-1]=0,0,RC[-3]/RC[-1]) -> 0 | L19: =IF(RC[-2]=0,0,RC[-3]/RC[-2]) -> 0 | M19: =IF(R[130]C[-3]=0,0,RC[-3]/R[130]C[-3]) -> 0
A20: EA-18G | B20: 228A_EXP | C20: 14A1A | D20: Arrival | E20: 14 | F20: Based | G20: P3 P8 IFR and Growler VFR non breaks | H20: 0.42857142857142855 | I20: 0 | J20: =SUM(RC[-2]:RC[-1]) -> 0.42857142857142855 | K20: =IF(RC[-1]=0,0,RC[-3]/RC[-1]) -> 1 | L20: =IF(RC[-2]=0,0,RC[-3]/RC[-2]) -> 0 | M20: =IF(R[129]C[-3]=0,0,RC[-3]/R[129]C[-3]) -> 1.3698630136986306E-2
A21: EA-18G | B21: 228A_FLT | C21: 14A1A | D21: Arrival | E21: 14 | F21: Based | G21: P3 P8 IFR and Growler VFR non breaks | H21: 0.7142857142857143 | I21: 0 | J21: =SUM(RC[-2]:RC[-1]) -> 0.7142857142857143 | K21: =IF(RC[-1]=0,0,RC[-3]/RC[-1]) -> 1 | L21: =IF(RC[-2]=0,0,RC[-3]/RC[-2]) -> 0 | M21: =IF(R[128]C[-3]=0,0,RC[-3]/R[128]C[-3]) -> 2.2831050228310511E-2
A22: EA-18G | B22: 228A_FRS | C22: 14A1A | D22: Arrival | E22: 14 | F22: Based | G22: P3 P8 IFR and Growler VFR non breaks | H22: 0.7142857142857143 | I22: 0 | J22: =SUM(RC[-2]:RC[-1]) -> 0.7142857142857143 | K22: =IF(RC[-1]=0,0,RC[-3]/RC[-1]) -> 1 | L22: =IF(RC[-2]=0,0,RC[-3]/RC[-2]) -> 0 | M22: =IF(R[127]C[-3]=0,0,RC[-3]/R[127]C[-3]) -> 2.2831050228310511E-2
A23: EA-18G | B23: 228B_EXP | C23: 14A1B | D23: Arrival | E23: 14 | F23: Based | G23: P3 P8 IFR and Growler VFR non breaks | H23: 1.1428571428571428 | I23: 0 | J23: =SUM(RC[-2]:RC[-1]) -> 1.1428571428571428 | K23: =IF(RC[-1]=0,0,RC[-3]/RC[-1]) -> 1 | L23: =IF(RC[-2]=0,0,RC[-3]/RC[-2]) -> 0 | M23: =IF(R[126]C[-3]=0,0,RC[-3]/R[126]C[-3]) -> 3.6529680365296816E-2
A24: EA-18G | B24: 228B_FLT | C24: 14A1B | D24: Arrival | E24: 14 | F24: Based | G24: P3 P8 IFR and Growler VFR non breaks | H24: 1.5714285714285714 | I24: 0.2857142857142857 | J24: =SUM(RC[-2]:RC[-1]) -> 1.8571428571428572 | K24: =IF(RC[-1]=0,0,RC[-3]/RC[-1]) -> 0.84615384615384615 | L24: =IF(RC[-2]=0,0,RC[-3]/RC[-2]) -> 0.15384615384615383 | M24: =IF(R[125]C[-3]=0,0,RC[-3]/R[125]C[-3]) -> 5.936073059360733E-2
A25: EA-18G | B25: 228B_FRS | C25: 14A1B | D25: Arrival | E25: 14 | F25: Based | G25: P3 P8 IFR and Growler VFR non breaks | H25: 1 | I25: 0 | J25: =SUM(RC[-2]:RC[-1]) -> 1 | K25: =IF(RC[-1]=0,0,RC[-3]/RC[-1]) -> 1 | L25: =IF(RC[-2]=0,0,RC[-3]/RC[-2]) -> 0 | M25: =IF(R[124]C[-3]=0,0,RC[-3]/R[124]C[-3]) -> 3.1963470319634715E-2
A26: EA-18G | B26: 228C_EXP | C26: 14A1C | D26: Arrival | E26: 14 | F26: Based | G26: P3 P8 IFR and Growler VFR non breaks | H26: 1.5714285714285714 | I26: 0 | J26: =SUM(RC[-2]:RC[-1]) -> 1.5714285714285714 | K26: =IF(RC[-1]=0,0,RC[-3]/RC[-1]) -> 1 | L26: =IF(RC[-2]=0,0,RC[-3]/RC[-2]) -> 0 | M26: =IF(R[123]C[-3]=0,0,RC[-3]/R[123]C[-3]) -> 5.0228310502283123E-2
A27: EA-18G | B27: 228C_FLT | C27: 14A1C | D27: Arrival | E27: 14 | F27: Based | G27: P3 P8 IFR and Growler VFR non breaks | H27: 1.7142857142857142 | I27: 0 | J27: =SUM(RC[-2]:RC[-1]) -> 1.7142857142857142 | K27: =IF(RC[-1]=0,0,RC[-3]/RC[-1]) -> 1 | L27: =IF(RC[-2]=0,0,RC[-3]/RC[-2]) -> 0 | M27: =IF(R[122]C[-3]=0,0,RC[-3]/R[122]C[-3]) -> 5.4794520547945223E-2
A28: EA-18G | B28: 228C_FRS | C28: 14A1C | D28: Arrival | E28: 14 | F28: Based | G28: P3 P8 IFR and Growler VFR non breaks | H28: 2 | I28: 0 | J28: =SUM(RC[-2]:RC[-1]) -> 2 | K28: =IF(RC[-1]=0,0,RC[-3]/RC[-1]) -> 1 | L28: =IF(RC[-2]=0,0,RC[-3]/RC[-2]) -> 0 | M28: =IF(R[121]C[-3]=0,0,RC[-3]/R[121]C[-3]) -> 6.3926940639269431E-2
A29: EA-18G | B29: 229A_EXP | C29: 14A2A | D29: Arrival | E29: 14 | F29: Based | G29: P3 P8 IFR and Growler VFR non breaks | H29: 0 | I29: 0 | J29: =SUM(RC[-2]:RC[-1]) -> 0 | K29: =IF(RC[-1]=0,0,RC[-3]/RC[-1]) -> 0 | L29: =IF(RC[-2]=0,0,RC[-3]/RC[-2]) -> 0 | M29: =IF(R[120]C[-3]=0,0,RC[-3]/R[120]C[-3]) -> 0
A30: EA-18G | B30: 229A_FLT | C30: 14A2A | D30: Arrival | E30: 14 | F30: Based | G30: P3 P8 IFR and Growler VFR non breaks | H30: 0.42857142857142855 | I30: 0 | J30: =SUM(RC[-2]:RC[-1]) -> 0.42857142857142855 | K30: =IF(RC[-1]=0,0,RC[-3]/RC[-1]) -> 1 | L30: =IF(RC[-2]=0,0,RC[-3]/RC[-2]) -> 0 | M30: =IF(R[119]C[-3]=0,0,RC[-3]/R[119]C[-3]) -> 1.3698630136986306E-2
A31: EA-18G | B31: 229A_FRS | C31: 14A2A | D31: Arrival | E31: 14 | F31: Based | G31: P3 P8 IFR and Growler VFR non breaks | H31: 0.2857142857142857 | I31: 0 | J31: =SUM(RC[-2]:RC[-1]) -> 0.2857142857142857 | K31: =IF(RC[-1]=0,0,RC[-3]/RC[-1]) -> 1 | L31: =IF(RC[-2]=0,0,RC[-3]/RC[-2]) -> 0 | M31: =IF(R[118]C[-3]=0,0,RC[-3]/R[118]C[-3]) -> 9.1324200913242039E-3
A32: EA-18G | B32: 229B_EXP | C32: 14A2B | D32: Arrival | E32: 14 | F32: Based | G32: P3 P8 IFR and Growler VFR non breaks | H32: 1 | I32: 0 | J32: =SUM(RC[-2]:RC[-1]) -> 1 | K32: =IF(RC[-1]=0,0,RC[-3]/RC[-1]) -> 1 | L32: =IF(RC[-2]=0,0,RC[-3]/RC[-2]) -> 0 | M32: =IF(R[117]C[-3]=0,0,RC[-3]/R[117]C[-3]) -> 3.1963470319634715E-2
A33: EA-18G | B33: 229B_FLT | C33: 14A2B | D33: Arrival | E33: 14 | F33: Based | G33: P3 P8 IFR and Growler VFR non breaks | H33: 0.14285714285714285 | I33: 0 | J33: =SUM(RC[-2]:RC[-1]) -> 0.14285714285714285 | K33: =IF(RC[-1]=0,0,RC[-3]/RC[-1]) -> 1 | L33: =IF(RC[-2]=0,0,RC[-3]/RC[-2]) -> 0 | M33: =IF(R[116]C[-3]=0,0,RC[-3]/R[116]C[-3]) -> 4.5662100456621019E-3
A34: EA-18G | B34: 229B_FRS | C34: 14A2B | D34: Arrival | E34: 14 | F34: Based | G34: P3 P8 IFR and Growler VFR non breaks | H34: 1 | I34: 0 | J34: =SUM(RC[-2]:RC[-1]) -> 1 | K34: =IF(RC[-1]=0,0,RC[-3]/RC[-1]) -> 1 | L34: =IF(RC[-2]=0,0,RC[-3]/RC[-2]) -> 0 | M34: =IF(R[115]C[-3]=0,0,RC[-3]/R[115]C[-3]) -> 3.1963470319634715E-2
A35: EA-18G | B35: 229C_EXP | C35: 14A2C | D35: Arrival | E35: 14 | F35: Based | G35: P3 P8 IFR and Growler VFR non breaks | H35: 0 | I35: 0 | J35: =SUM(RC[-2]:RC[-1]) -> 0 | K35: =IF(RC[-1]=0,0,RC[-3]/RC[-1]) -> 0 | L35: =IF(RC[-2]=0,0,RC[-3]/RC[-2]) -> 0 | M35: =IF(R[114]C[-3]=0,0,RC[-3]/R[114]C[-3]) -> 0
A36: EA-18G | B36: 229C_FLT | C36: 14A2C | D36: Arrival | E36: 14 | F36: Based | G36: P3 P8 IFR and Growler VFR non breaks | H36: 0.5714285714285714 | I36: 0 | J36: =SUM(RC[-2]:RC[-1]) -> 0.5714285714285714 | K36: =IF(RC[-1]=0,0,RC[-3]/RC[-1]) -> 1 | L36: =IF(RC[-2]=0,0,RC[-3]/RC[-2]) -> 0 | M36: =IF(R[113]C[-3]=0,0,RC[-3]/R[113]C[-3]) -> 1.8264840182648408E-2
A37: EA-18G | B37: 229C_FRS | C37: 14A2C | D37: Arrival | E37: 14 | F37: Based | G37: P3 P8 IFR and Growler VFR non breaks | H37: 0.42857142857142855 | I37: 0 | J37: =SUM(RC[-2]:RC[-1]) -> 0.42857142857142855 | K37: =IF(RC[-1]=0,0,RC[-3]/RC[-1]) -> 1 | L37: =IF(RC[-2]=0,0,RC[-3]/RC[-2]) -> 0 | M37: =IF(R[112]C[-3]=0,0,RC[-3]/R[112]C[-3]) -> 1.3698630136986306E-2
A38: EA-18G | B38: 230A_EXP | C38: 25A1D | D38: Arrival | E38: 25 | F38: Based | G38: P3 P8 IFR and Growler VFR non breaks | H38: 0.7142857142857143 | I38: 0 | J38: =SUM(RC[-2]:RC[-1]) -> 0.7142857142857143 | K38: =IF(RC[-1]=0,0,RC[-3]/RC[-1]) -> 1 | L38: =IF(RC[-2]=0,0,RC[-3]/RC[-2]) -> 0 | M38: =IF(R[111]C[-3]=0,0,RC[-3]/R[111]C[-3]) -> 2.2831050228310511E-2
A39: EA-18G | B39: 230A_FLT | C39: 25A1D | D39: Arrival | E39: 25 | F39: Based | G39: P3 P8 IFR and Growler VFR non breaks | H39: 0.2857142857142857 | I39: 0 | J39: =SUM(RC[-2]:RC[-1]) -> 0.2857142857142857 | K39: =IF(RC[-1]=0,0,RC[-3]/RC[-1]) -> 1 | L39: =IF(RC[-2]=0,0,RC[-3]/RC[-2]) -> 0 | M39: =IF(R[110]C[-3]=0,0,RC[-3]/R[110]C[-3]) -> 9.1324200913242039E-3
A40: EA-18G | B40: 230A_FRS | C40: 25A1D | D40: Arrival | E40: 25 | F40: Based | G40: P3 P8 IFR and Growler VFR non breaks | H40: 0 | I40: 0 | J40: =SUM(RC[-2]:RC[-1]) -> 0 | K40: =IF(RC[-1]=0,0,RC[-3]/RC[-1]) -> 0 | L40: =IF(RC[-2]=0,0,RC[-3]/RC[-2]) -> 0 | M40: =IF(R[109]C[-3]=0,0,RC[-3]/R[109]C[-3]) -> 0
A41: EA-18G | B41: 231A_EXP | C41: 25A2A | D41: Arrival | E41: 25 | F41: Based | G41: P3 P8 IFR and Growler VFR non breaks | H41: 0 | I41: 0 | J41: =SUM(RC[-2]:RC[-1]) -> 0 | K41: =IF(RC[-1]=0,0,RC[-3]/RC[-1]) -> 0 | L41: =IF(RC[-2]=0,0,RC[-3]/RC[-2]) -> 0 | M41: =IF(R[108]C[-3]=0,0,RC[-3]/R[108]C[-3]) -> 0
A42: EA-18G | B42: 231A_FLT | C42: 25A2A | D42: Arrival | E42: 25 | F42: Based | G42: P3 P8 IFR and Growler VFR non breaks | H42: 0 | I42: 0 | J42: =SUM(RC[-2]:RC[-1]) -> 0 | K42: =IF(RC[-1]=0,0,RC[-3]/RC[-1]) -> 0 | L42: =IF(RC[-2]=0,0,RC[-3]/RC[-2]) -> 0 | M42: =IF(R[107]C[-3]=0,0,RC[-3]/R[107]C[-3]) -> 0
A43: EA-18G | B43: 231A_FRS | C43: 25A2A | D43: Arrival | E43: 25 | F43: Based | G43: P3 P8 IFR and Growler VFR non breaks | H43: 0.14285714285714285 | I43: 0 | J43: =SUM(RC[-2]:RC[-1]) -> 0.14285714285714285 | K43: =IF(RC[-1]=0,0,RC[-3]/RC[-1]) -> 1 | L43: =IF(RC[-2]=0,0,RC[-3]/RC[-2]) -> 0 | M43: =IF(R[106]C[-3]=0,0,RC[-3]/R[106]C[-3]) -> 4.5662100456621019E-3
A44: EA-18G | B44: 231B_EXP | C44: 25A2B | D44: Arrival | E44: 25 | F44: Based | G44: P3 P8 IFR and Growler VFR non breaks | H44: 0 | I44: 0 | J44: =SUM(RC[-2]:RC[-1]) -> 0 | K44: =IF(RC[-1]=0,0,RC[-3]/RC[-1]) -> 0 | L44: =IF(RC[-2]=0,0,RC[-3]/RC[-2]) -> 0 | M44: =IF(R[105]C[-3]=0,0,RC[-3]/R[105]C[-3]) -> 0
A45: EA-18G | B45: 231B_FLT | C45: 25A2B | D45: Arrival | E45: 25 | F45: Based | G45: P3 P8 IFR and Growler VFR non breaks | H45: 0 | I45: 0 | J45: =SUM(RC[-2]:RC[-1]) -> 0 | K45: =IF(RC[-1]=0,0,RC[-3]/RC[-1]) -> 0 | L45: =IF(RC[-2]=0,0,RC[-3]/RC[-2]) -> 0 | M45: =IF(R[104]C[-3]=0,0,RC[-3]/R[104]C[-3]) -> 0
A46: EA-18G | B46: 231B_FRS | C46: 25A2B | D46: Arrival | E46: 25 | F46: Based | G46: P3 P8 IFR and Growler VFR non breaks | H46: 0.2857142857142857 | I46: 0 | J46: =SUM(RC[-2]:RC[-1]) -> 0.2857142857142857 | K46: =IF(RC[-1]=0,0,RC[-3]/RC[-1]) -> 1 | L46: =IF(RC[-2]=0,0,RC[-3]/RC[-2]) -> 0 | M46: =IF(R[103]C[-3]=0,0,RC[-3]/R[103]C[-3]) -> 9.1324200913242039E-3
A47: EA-18G | B47: 231C_EXP | C47: 25A2C | D47: Arrival | E47: 25 | F47: Based | G47: P3 P8 IFR and Growler VFR non breaks | H47: 0 | I47: 0 | J47: =SUM(RC[-2]:RC[-1]) -> 0 | K47: =IF(RC[-1]=0,0,RC[-3]/RC[-1]) -> 0 | L47: =IF(RC[-2]=0,0,RC[-3]/RC[-2]) -> 0 | M47: =IF(R[102]C[-3]=0,0,RC[-3]/R[102]C[-3]) -> 0
A48: EA-18G | B48: 231C_FLT | C48: 25A2C | D48: Arrival | E48: 25 | F48: Based | G48: P3 P8 IFR and Growler VFR non breaks | H48: 0 | I48: 0 | J48: =SUM(RC[-2]:RC[-1]) -> 0 | K48: =IF(RC[-1]=0,0,RC[-3]/RC[-1]) -> 0 | L48: =IF(RC[-2]=0,0,RC[-3]/RC[-2]) -> 0 | M48: =IF(R[101]C[-3]=0,0,RC[-3]/R[101]C[-3]) -> 0
A49: EA-18G | B49: 231C_FRS | C49: 25A2C | D49: Arrival | E49: 25 | F49: Based | G49: P3 P8 IFR and Growler VFR non breaks | H49: 0 | I49: 0 | J49: =SUM(RC[-2]:RC[-1]) -> 0 | K49: =IF(RC[-1]=0,0,RC[-3]/RC[-1]) -> 0 | L49: =IF(RC[-2]=0,0,RC[-3]/RC[-2]) -> 0 | M49: =IF(R[100]C[-3]=0,0,RC[-3]/R[100]C[-3]) -> 0
A50: EA-18G | B50: 232A_EXP | C50: 25A2NA | D50: Arrival | E50: 25 | F50: Based | G50: P3 P8 IFR and Growler VFR non breaks | H50: 0 | I50: 0 | J50: =SUM(RC[-2]:RC[-1]) -> 0 | K50: =IF(RC[-1]=0,0,RC[-3]/RC[-1]) -> 0 | L50: =IF(RC[-2]=0,0,RC[-3]/RC[-2]) -> 0 | M50: =IF(R[99]C[-3]=0,0,RC[-3]/R[99]C[-3]) -> 0
A51: EA-18G | B51: 232A_FLT | C51: 25A2NA | D51: Arrival | E51: 25 | F51: Based | G51: P3 P8 IFR and Growler VFR non breaks | H51: 0 | I51: 0 | J51: =SUM(RC[-2]:RC[-1]) -> 0 | K51: =IF(RC[-1]=0,0,RC[-3]/RC[-1]) -> 0 | L51: =IF(RC[-2]=0,0,RC[-3]/RC[-2]) -> 0 | M51: =IF(R[98]C[-3]=0,0,RC[-3]/R[98]C[-3]) -> 0
A52: EA-18G | B52: 232A_FRS | C52: 25A2NA | D52: Arrival | E52: 25 | F52: Based | G52: P3 P8 IFR and Growler VFR non breaks | H52: 0 | I52: 0 | J52: =SUM(RC[-2]:RC[-1]) -> 0 | K52: =IF(RC[-1]=0,0,RC[-3]/RC[-1]) -> 0 | L52: =IF(RC[-2]=0,0,RC[-3]/RC[-2]) -> 0 | M52: =IF(R[97]C[-3]=0,0,RC[-3]/R[97]C[-3]) -> 0
A53: EA-18G | B53: 232B_EXP | C53: 25A2NB | D53: Arrival | E53: 25 | F53: Based | G53: P3 P8 IFR and Growler VFR non breaks | H53: 0 | I53: 0 | J53: =SUM(RC[-2]:RC[-1]) -> 0 | K53: =IF(RC[-1]=0,0,RC[-3]/RC[-1]) -> 0 | L53: =IF(RC[-2]=0,0,RC[-3]/RC[-2]) -> 0 | M53: =IF(R[96]C[-3]=0,0,RC[-3]/R[96]C[-3]) -> 0
A54: EA-18G | B54: 232B_FLT | C54: 25A2NB | D54: Arrival | E54: 25 | F54: Based | G54: P3 P8 IFR and Growler VFR non breaks | H54: 0.14285714285714285 | I54: 0 | J54: =SUM(RC[-2]:RC[-1]) -> 0.14285714285714285 | K54: =IF(RC[-1]=0,0,RC[-3]/RC[-1]) -> 1 | L54: =IF(RC[-2]=0,0,RC[-3]/RC[-2]) -> 0 | M54: =IF(R[95]C[-3]=0,0,RC[-3]/R[95]C[-3]) -> 4.5662100456621019E-3
A55: EA-18G | B55: 232B_FRS | C55: 25A2NB | D55: Arrival | E55: 25 | F55: Based | G55: P3 P8 IFR and Growler VFR non breaks | H55: 0 | I55: 0 | J55: =SUM(RC[-2]:RC[-1]) -> 0 | K55: =IF(RC[-1]=0,0,RC[-3]/RC[-1]) -> 0 | L55: =IF(RC[-2]=0,0,RC[-3]/RC[-2]) -> 0 | M55: =IF(R[94]C[-3]=0,0,RC[-3]/R[94]C[-3]) -> 0
A56: EA-18G | B56: 232C_EXP | C56: 25A2NC | D56: Arrival | E56: 25 | F56: Based | G56: P3 P8 IFR and Growler VFR non breaks | H56: 0 | I56: 0 | J56: =SUM(RC[-2]:RC[-1]) -> 0 | K56: =IF(RC[-1]=0,0,RC[-3]/RC[-1]) -> 0 | L56: =IF(RC[-2]=0,0,RC[-3]/RC[-2]) -> 0 | M56: =IF(R[93]C[-3]=0,0,RC[-3]/R[93]C[-3]) -> 0
A57: EA-18G | B57: 232C_FLT | C57: 25A2NC | D57: Arrival | E57: 25 | F57: Based | G57: P3 P8 IFR and Growler VFR non breaks | H57: 0 | I57: 0 | J57: =SUM(RC[-2]:RC[-1]) -> 0 | K57: =IF(RC[-1]=0,0,RC[-3]/RC[-1]) -> 0 | L57: =IF(RC[-2]=0,0,RC[-3]/RC[-2]) -> 0 | M57: =IF(R[92]C[-3]=0,0,RC[-3]/R[92]C[-3]) -> 0
A58: EA-18G | B58: 232C_FRS | C58: 25A2NC | D58: Arrival | E58: 25 | F58: Based | G58: P3 P8 IFR and Growler VFR non breaks | H58: 0 | I58: 0 | J58: =SUM(RC[-2]:RC[-1]) -> 0 | K58: =IF(RC[-1]=0,0,RC[-3]/RC[-1]) -> 0 | L58: =IF(RC[-2]=0,0,RC[-3]/RC[-2]) -> 0 | M58: =IF(R[91]C[-3]=0,0,RC[-3]/R[91]C[-3]) -> 0
A59: EA-18G | B59: 233A_EXP | C59: 32A1A | D59: Arrival | E59: 32 | F59: Based | G59: P3 P8 IFR and Growler VFR non breaks | H59: 0 | I59: 0 | J59: =SUM(RC[-2]:RC[-1]) -> 0 | K59: =IF(RC[-1]=0,0,RC[-3]/RC[-1]) -> 0 | L59: =IF(RC[-2]=0,0,RC[-3]/RC[-2]) -> 0 | M59: =IF(R[90]C[-3]=0,0,RC[-3]/R[90]C[-3]) -> 0
A60: EA-18G | B60: 233A_FLT | C60: 32A1A | D60: Arrival | E60: 32 | F60: Based | G60: P3 P8 IFR and Growler VFR non breaks | H60: 0 | I60: 0 | J60: =SUM(RC[-2]:RC[-1]) -> 0 | K60: =IF(RC[-1]=0,0,RC[-3]/RC[-1]) -> 0 | L60: =IF(RC[-2]=0,0,RC[-3]/RC[-2]) -> 0 | M60: =IF(R[89]C[-3]=0,0,RC[-3]/R[89]C[-3]) -> 0
A61: EA-18G | B61: 233A_FRS | C61: 32A1A | D61: Arrival | E61: 32 | F61: Based | G61: P3 P8 IFR and Growler VFR non breaks | H61: 0 | I61: 0 | J61: =SUM(RC[-2]:RC[-1]) -> 0 | K61: =IF(RC[-1]=0,0,RC[-3]/RC[-1]) -> 0 | L61: =IF(RC[-2]=0,0,RC[-3]/RC[-2]) -> 0 | M61: =IF(R[88]C[-3]=0,0,RC[-3]/R[88]C[-3]) -> 0
A62: EA-18G | B62: 233B_EXP | C62: 32A1B | D62: Arrival | E62: 32 | F62: Based | G62: P3 P8 IFR and Growler VFR non breaks | H62: 0 | I62: 0 | J62: =SUM(RC[-2]:RC[-1]) -> 0 | K62: =IF(RC[-1]=0,0,RC[-3]/RC[-1]) -> 0 | L62: =IF(RC[-2]=0,0,RC[-3]/RC[-2]) -> 0 | M62: =IF(R[87]C[-3]=0,0,RC[-3]/R[87]C[-3]) -> 0
A63: EA-18G | B63: 233B_FLT | C63: 32A1B | D63: Arrival | E63: 32 | F63: Based | G63: P3 P8 IFR and Growler VFR non breaks | H63: 0 | I63: 0 | J63: =SUM(RC[-2]:RC[-1]) -> 0 | K63: =IF(RC[-1]=0,0,RC[-3]/RC[-1]) -> 0 | L63: =IF(RC[-2]=0,0,RC[-3]/RC[-2]) -> 0 | M63: =IF(R[86]C[-3]=0,0,RC[-3]/R[86]C[-3]) -> 0
A64: EA-18G | B64: 233B_FRS | C64: 32A1B | D64: Arrival | E64: 32 | F64: Based | G64: P3 P8 IFR and Growler VFR non breaks | H64: 0 | I64: 0 | J64: =SUM(RC[-2]:RC[-1]) -> 0 | K64: =IF(RC[-1]=0,0,RC[-3]/RC[-1]) -> 0 | L64: =IF(RC[-2]=0,0,RC[-3]/RC[-2]) -> 0 | M64: =IF(R[85]C[-3]=0,0,RC[-3]/R[85]C[-3]) -> 0
A65: EA-18G | B65: 233C_EXP | C65: 32A1C | D65: Arrival | E65: 32 | F65: Based | G65: P3 P8 IFR and Growler VFR non breaks | H65: 0 | I65: 0 | J65: =SUM(RC[-2]:RC[-1]) -> 0 | K65: =IF(RC[-1]=0,0,RC[-3]/RC[-1]) -> 0 | L65: =IF(RC[-2]=0,0,RC[-3]/RC[-2]) -> 0 | M65: =IF(R[84]C[-3]=0,0,RC[-3]/R[84]C[-3]) -> 0
A66: EA-18G | B66: 233C_FLT | C66: 32A1C | D66: Arrival | E66: 32 | F66: Based | G66: P3 P8 IFR and Growler VFR non breaks | H66: 0 | I66: 0 | J66: =SUM(RC[-2]:RC[-1]) -> 0 | K66: =IF(RC[-1]=0,0,RC[-3]/RC[-1]) -> 0 | L66: =IF(RC[-2]=0,0,RC[-3]/RC[-2]) -> 0 | M66: =IF(R[83]C[-3]=0,0,RC[-3]/R[83]C[-3]) -> 0
A67: EA-18G | B67: 233C_FRS | C67: 32A1C | D67: Arrival | E67: 32 | F67: Based | G67: P3 P8 IFR and Growler VFR non breaks | H67: 0 | I67: 0 | J67: =SUM(RC[-2]:RC[-1]) -> 0 | K67: =IF(RC[-1]=0,0,RC[-3]/RC[-1]) -> 0 | L67: =IF(RC[-2]=0,0,RC[-3]/RC[-2]) -> 0 | M67: =IF(R[82]C[-3]=0,0,RC[-3]/R[82]C[-3]) -> 0
A68: EA-18G | B68: 234A_EXP | C68: 32A2A | D68: Arrival | E68: 32 | F68: Based | G68: P3 P8 IFR and Growler VFR non breaks | H68: 0 | I68: 0 | J68: =SUM(RC[-2]:RC[-1]) -> 0 | K68: =IF(RC[-1]=0,0,RC[-3]/RC[-1]) -> 0 | L68: =IF(RC[-2]=0,0,RC[-3]/RC[-2]) -> 0 | M68: =IF(R[81]C[-3]=0,0,RC[-3]/R[81]C[-3]) -> 0
A69: EA-18G | B69: 234A_FLT | C69: 32A2A | D69: Arrival | E69: 32 | F69: Based | G69: P3 P8 IFR and Growler VFR non breaks | H69: 0 | I69: 0 | J69: =SUM(RC[-2]:RC[-1]) -> 0 | K69: =IF(RC[-1]=0,0,RC[-3]/RC[-1]) -> 0 | L69: =IF(RC[-2]=0,0,RC[-3]/RC[-2]) -> 0 | M69: =IF(R[80]C[-3]=0,0,RC[-3]/R[80]C[-3]) -> 0
A70: EA-18G | B70: 234A_FRS | C70: 32A2A | D70: Arrival | E70: 32 | F70: Based | G70: P3 P8 IFR and Growler VFR non breaks | H70: 0 | I70: 0 | J70: =SUM(RC[-2]:RC[-1]) -> 0 | K70: =IF(RC[-1]=0,0,RC[-3]/RC[-1]) -> 0 | L70: =IF(RC[-2]=0,0,RC[-3]/RC[-2]) -> 0 | M70: =IF(R[79]C[-3]=0,0,RC[-3]/R[79]C[-3]) -> 0
A71: EA-18G | B71: 234B_EXP | C71: 32A2B | D71: Arrival | E71: 32 | F71: Based | G71: P3 P8 IFR and Growler VFR non breaks | H71: 0 | I71: 0 | J71: =SUM(RC[-2]:RC[-1]) -> 0 | K71: =IF(RC[-1]=0,0,RC[-3]/RC[-1]) -> 0 | L71: =IF(RC[-2]=0,0,RC[-3]/RC[-2]) -> 0 | M71: =IF(R[78]C[-3]=0,0,RC[-3]/R[78]C[-3]) -> 0
A72: EA-18G | B72: 234B_FLT | C72: 32A2B | D72: Arrival | E72: 32 | F72: Based | G72: P3 P8 IFR and Growler VFR non breaks | H72: 0 | I72: 0 | J72: =SUM(RC[-2]:RC[-1]) -> 0 | K72: =IF(RC[-1]=0,0,RC[-3]/RC[-1]) -> 0 | L72: =IF(RC[-2]=0,0,RC[-3]/RC[-2]) -> 0 | M72: =IF(R[77]C[-3]=0,0,RC[-3]/R[77]C[-3]) -> 0
A73: EA-18G | B73: 234B_FRS | C73: 32A2B | D73: Arrival | E73: 32 | F73: Based | G73: P3 P8 IFR and Growler VFR non breaks | H73: 0 | I73: 0 | J73: =SUM(RC[-2]:RC[-1]) -> 0 | K73: =IF(RC[-1]=0,0,RC[-3]/RC[-1]) -> 0 | L73: =IF(RC[-2]=0,0,RC[-3]/RC[-2]) -> 0 | M73: =IF(R[76]C[-3]=0,0,RC[-3]/R[76]C[-3]) -> 0
A74: EA-18G | B74: 234C_EXP | C74: 32A2C | D74: Arrival | E74: 32 | F74: Based | G74: P3 P8 IFR and Growler VFR non breaks | H74: 0 | I74: 0 | J74: =SUM(RC[-2]:RC[-1]) -> 0 | K74: =IF(RC[-1]=0,0,RC[-3]/RC[-1]) -> 0 | L74: =IF(RC[-2]=0,0,RC[-3]/RC[-2]) -> 0 | M74: =IF(R[75]C[-3]=0,0,RC[-3]/R[75]C[-3]) -> 0
A75: EA-18G | B75: 234C_FLT | C75: 32A2C | D75: Arrival | E75: 32 | F75: Based | G75: P3 P8 IFR and Growler VFR non breaks | H75: 0 | I75: 0 | J75: =SUM(RC[-2]:RC[-1]) -> 0 | K75: =IF(RC[-1]=0,0,RC[-3]/RC[-1]) -> 0 | L75: =IF(RC[-2]=0,0,RC[-3]/RC[-2]) -> 0 | M75: =IF(R[74]C[-3]=0,0,RC[-3]/R[74]C[-3]) -> 0
A76: EA-18G | B76: 234C_FRS | C76: 32A2C | D76: Arrival | E76: 32 | F76: Based | G76: P3 P8 IFR and Growler VFR non breaks | H76: 0 | I76: 0 | J76: =SUM(RC[-2]:RC[-1]) -> 0 | K76: =IF(RC[-1]=0,0,RC[-3]/RC[-1]) -> 0 | L76: =IF(RC[-2]=0,0,RC[-3]/RC[-2]) -> 0 | M76: =IF(R[73]C[-3]=0,0,RC[-3]/R[73]C[-3]) -> 0
A77: EA-18G | B77: 235A_EXP | C77: 07O1A_FRS | D77: Arrival | E77: 07 | F77: Based | G77: Overhead Break Arrival | H77: 0.14285714285714285 | I77: 0 | J77: =SUM(RC[-2]:RC[-1]) -> 0.14285714285714285 | K77: =IF(RC[-1]=0,0,RC[-3]/RC[-1]) -> 1 | L77: =IF(RC[-2]=0,0,RC[-3]/RC[-2]) -> 0 | M77: =IF(R[72]C[-3]=0,0,RC[-3]/R[72]C[-3]) -> 4.5662100456621019E-3
A78: EA-18G | B78: 235A_FLT | C78: 07O1A_FLT | D78: Arrival | E78: 07 | F78: Based | G78: Overhead Break Arrival | H78: 0.2857142857142857 | I78: 0 | J78: =SUM(RC[-2]:RC[-1]) -> 0.2857142857142857 | K78: =IF(RC[-1]=0,0,RC[-3]/RC[-1]) -> 1 | L78: =IF(RC[-2]=0,0,RC[-3]/RC[-2]) -> 0 | M78: =IF(R[71]C[-3]=0,0,RC[-3]/R[71]C[-3]) -> 9.1324200913242039E-3
A79: EA-18G | B79: 235A_FRS | C79: 07O1A_FRS | D79: Arrival | E79: 07 | F79: Based | G79: Overhead Break Arrival | H79: 0 | I79: 0 | J79: =SUM(RC[-2]:RC[-1]) -> 0 | K79: =IF(RC[-1]=0,0,RC[-3]/RC[-1]) -> 0 | L79: =IF(RC[-2]=0,0,RC[-3]/RC[-2]) -> 0 | M79: =IF(R[70]C[-3]=0,0,RC[-3]/R[70]C[-3]) -> 0
A80: EA-18G | B80: 235B_EXP | C80: 07O1B_FRS | D80: Arrival | E80: 07 | F80: Based | G80: Overhead Break Arrival | H80: 0 | I80: 0 | J80: =SUM(RC[-2]:RC[-1]) -> 0 | K80: =IF(RC[-1]=0,0,RC[-3]/RC[-1]) -> 0 | L80: =IF(RC[-2]=0,0,RC[-3]/RC[-2]) -> 0 | M80: =IF(R[69]C[-3]=0,0,RC[-3]/R[69]C[-3]) -> 0
A81: EA-18G | B81: 235B_FLT | C81: 07O1B_FLT | D81: Arrival | E81: 07 | F81: Based | G81: Overhead Break Arrival | H81: 0 | I81: 0 | J81: =SUM(RC[-2]:RC[-1]) -> 0 | K81: =IF(RC[-1]=0,0,RC[-3]/RC[-1]) -> 0 | L81: =IF(RC[-2]=0,0,RC[-3]/RC[-2]) -> 0 | M81: =IF(R[68]C[-3]=0,0,RC[-3]/R[68]C[-3]) -> 0
A82: EA-18G | B82: 235B_FRS | C82: 07O1B_FRS | D82: Arrival | E82: 07 | F82: Based | G82: Overhead Break Arrival | H82: 0.42857142857142855 | I82: 0 | J82: =SUM(RC[-2]:RC[-1]) -> 0.42857142857142855 | K82: =IF(RC[-1]=0,0,RC[-3]/RC[-1]) -> 1 | L82: =IF(RC[-2]=0,0,RC[-3]/RC[-2]) -> 0 | M82: =IF(R[67]C[-3]=0,0,RC[-3]/R[67]C[-3]) -> 1.3698630136986306E-2
A83: EA-18G | B83: 235C_EXP | C83: 07O1C_FRS | D83: Arrival | E83: 07 | F83: Based | G83: Overhead Break Arrival | H83: 0 | I83: 0 | J83: =SUM(RC[-2]:RC[-1]) -> 0 | K83: =IF(RC[-1]=0,0,RC[-3]/RC[-1]) -> 0 | L83: =IF(RC[-2]=0,0,RC[-3]/RC[-2]) -> 0 | M83: =IF(R[66]C[-3]=0,0,RC[-3]/R[66]C[-3]) -> 0
A84: EA-18G | B84: 235C_FLT | C84: 07O1C_FLT | D84: Arrival | E84: 07 | F84: Based | G84: Overhead Break Arrival | H84: 0 | I84: 0 | J84: =SUM(RC[-2]:RC[-1]) -> 0 | K84: =IF(RC[-1]=0,0,RC[-3]/RC[-1]) -> 0 | L84: =IF(RC[-2]=0,0,RC[-3]/RC[-2]) -> 0 | M84: =IF(R[65]C[-3]=0,0,RC[-3]/R[65]C[-3]) -> 0
A85: EA-18G | B85: 235C_FRS | C85: 07O1C_FRS | D85: Arrival | E85: 07 | F85: Based | G85: Overhead Break Arrival | H85: 0 | I85: 0 | J85: =SUM(RC[-2]:RC[-1]) -> 0 | K85: =IF(RC[-1]=0,0,RC[-3]/RC[-1]) -> 0 | L85: =IF(RC[-2]=0,0,RC[-3]/RC[-2]) -> 0 | M85: =IF(R[64]C[-3]=0,0,RC[-3]/R[64]C[-3]) -> 0
A86: EA-18G | B86: 236A_EXP | C86: 07O2A_FRS | D86: Arrival | E86: 07 | F86: Based | G86: Overhead Break Arrival | H86: 0 | I86: 0 | J86: =SUM(RC[-2]:RC[-1]) -> 0 | K86: =IF(RC[-1]=0,0,RC[-3]/RC[-1]) -> 0 | L86: =IF(RC[-2]=0,0,RC[-3]/RC[-2]) -> 0 | M86: =IF(R[63]C[-3]=0,0,RC[-3]/R[63]C[-3]) -> 0
A87: EA-18G | B87: 236A_FLT | C87: 07O2A_FLT | D87: Arrival | E87: 07 | F87: Based | G87: Overhead Break Arrival | H87: 0 | I87: 0 | J87: =SUM(RC[-2]:RC[-1]) -> 0 | K87: =IF(RC[-1]=0,0,RC[-3]/RC[-1]) -> 0 | L87: =IF(RC[-2]=0,0,RC[-3]/RC[-2]) -> 0 | M87: =IF(R[62]C[-3]=0,0,RC[-3]/R[62]C[-3]) -> 0
A88: EA-18G | B88: 236A_FRS | C88: 07O2A_FRS | D88: Arrival | E88: 07 | F88: Based | G88: Overhead Break Arrival | H88: 0.2857142857142857 | I88: 0 | J88: =SUM(RC[-2]:RC[-1]) -> 0.2857142857142857 | K88: =IF(RC[-1]=0,0,RC[-3]/RC[-1]) -> 1 | L88: =IF(RC[-2]=0,0,RC[-3]/RC[-2]) -> 0 | M88: =IF(R[61]C[-3]=0,0,RC[-3]/R[61]C[-3]) -> 9.1324200913242039E-3
A89: EA-18G | B89: 236B_EXP | C89: 07O2B_FRS | D89: Arrival | E89: 07 | F89: Based | G89: Overhead Break Arrival | H89: 0 | I89: 0 | J89: =SUM(RC[-2]:RC[-1]) -> 0 | K89: =IF(RC[-1]=0,0,RC[-3]/RC[-1]) -> 0 | L89: =IF(RC[-2]=0,0,RC[-3]/RC[-2]) -> 0 | M89: =IF(R[60]C[-3]=0,0,RC[-3]/R[60]C[-3]) -> 0
A90: EA-18G | B90: 236B_FLT | C90: 07O2B_FLT | D90: Arrival | E90: 07 | F90: Based | G90: Overhead Break Arrival | H90: 0 | I90: 0 | J90: =SUM(RC[-2]:RC[-1]) -> 0 | K90: =IF(RC[-1]=0,0,RC[-3]/RC[-1]) -> 0 | L90: =IF(RC[-2]=0,0,RC[-3]/RC[-2]) -> 0 | M90: =IF(R[59]C[-3]=0,0,RC[-3]/R[59]C[-3]) -> 0
A91: EA-18G | B91: 236B_FRS | C91: 07O2B_FRS | D91: Arrival | E91: 07 | F91: Based | G91: Overhead Break Arrival | H91: 0.14285714285714285 | I91: 0 | J91: =SUM(RC[-2]:RC[-1]) -> 0.14285714285714285 | K91: =IF(RC[-1]=0,0,RC[-3]/RC[-1]) -> 1 | L91: =IF(RC[-2]=0,0,RC[-3]/RC[-2]) -> 0 | M91: =IF(R[58]C[-3]=0,0,RC[-3]/R[58]C[-3]) -> 4.5662100456621019E-3
A92: EA-18G | B92: 236C_EXP | C92: 07O2C_FRS | D92: Arrival | E92: 07 | F92: Based | G92: Overhead Break Arrival | H92: 0 | I92: 0 | J92: =SUM(RC[-2]:RC[-1]) -> 0 | K92: =IF(RC[-1]=0,0,RC[-3]/RC[-1]) -> 0 | L92: =IF(RC[-2]=0,0,RC[-3]/RC[-2]) -> 0 | M92: =IF(R[57]C[-3]=0,0,RC[-3]/R[57]C[-3]) -> 0
A93: EA-18G | B93: 236C_FLT | C93: 07O2C_FLT | D93: Arrival | E93: 07 | F93: Based | G93: Overhead Break Arrival | H93: 0 | I93: 0 | J93: =SUM(RC[-2]:RC[-1]) -> 0 | K93: =IF(RC[-1]=0,0,RC[-3]/RC[-1]) -> 0 | L93: =IF(RC[-2]=0,0,RC[-3]/RC[-2]) -> 0 | M93: =IF(R[56]C[-3]=0,0,RC[-3]/R[56]C[-3]) -> 0
A94: EA-18G | B94: 236C_FRS | C94: 07O2C_FRS | D94: Arrival | E94: 07 | F94: Based | G94: Overhead Break Arrival | H94: 0 | I94: 0 | J94: =SUM(RC[-2]:RC[-1]) -> 0 | K94: =IF(RC[-1]=0,0,RC[-3]/RC[-1]) -> 0 | L94: =IF(RC[-2]=0,0,RC[-3]/RC[-2]) -> 0 | M94: =IF(R[55]C[-3]=0,0,RC[-3]/R[55]C[-3]) -> 0
A95: EA-18G | B95: 237A_EXP | C95: 14O1A_FRS | D95: Arrival | E95: 14 | F95: Based | G95: Overhead Break Arrival | H95: 0.5714285714285714 | I95: 0 | J95: =SUM(RC[-2]:RC[-1]) -> 0.5714285714285714 | K95: =IF(RC[-1]=0,0,RC[-3]/RC[-1]) -> 1 | L95: =IF(RC[-2]=0,0,RC[-3]/RC[-2]) -> 0 | M95: =IF(R[54]C[-3]=0,0,RC[-3]/R[54]C[-3]) -> 1.8264840182648408E-2
A96: EA-18G | B96: 237A_FLT | C96: 14O1A_FLT | D96: Arrival | E96: 14 | F96: Based | G96: Overhead Break Arrival | H96: 0.42857142857142855 | I96: 0 | J96: =SUM(RC[-2]:RC[-1]) -> 0.42857142857142855 | K96: =IF(RC[-1]=0,0,RC[-3]/RC[-1]) -> 1 | L96: =IF(RC[-2]=0,0,RC[-3]/RC[-2]) -> 0 | M96: =IF(R[53]C[-3]=0,0,RC[-3]/R[53]C[-3]) -> 1.3698630136986306E-2
A97: EA-18G | B97: 237A_FRS | C97: 14O1A_FRS | D97: Arrival | E97: 14 | F97: Based | G97: Overhead Break Arrival | H97: 0.42857142857142855 | I97: 0 | J97: =SUM(RC[-2]:RC[-1]) -> 0.42857142857142855 | K97: =IF(RC[-1]=0,0,RC[-3]/RC[-1]) -> 1 | L97: =IF(RC[-2]=0,0,RC[-3]/RC[-2]) -> 0 | M97: =IF(R[52]C[-3]=0,0,RC[-3]/R[52]C[-3]) -> 1.3698630136986306E-2
A98: EA-18G | B98: 237B_EXP | C98: 14O1B_FRS | D98: Arrival | E98: 14 | F98: Based | G98: Overhead Break Arrival | H98: 1.5714285714285714 | I98: 0 | J98: =SUM(RC[-2]:RC[-1]) -> 1.5714285714285714 | K98: =IF(RC[-1]=0,0,RC[-3]/RC[-1]) -> 1 | L98: =IF(RC[-2]=0,0,RC[-3]/RC[-2]) -> 0 | M98: =IF(R[51]C[-3]=0,0,RC[-3]/R[51]C[-3]) -> 5.0228310502283123E-2
A99: EA-18G | B99: 237B_FLT | C99: 14O1B_FLT | D99: Arrival | E99: 14 | F99: Based | G99: Overhead Break Arrival | H99: 1.7142857142857142 | I99: 0 | J99: =SUM(RC[-2]:RC[-1]) -> 1.7142857142857142 | K99: =IF(RC[-1]=0,0,RC[-3]/RC[-1]) -> 1 | L99: =IF(RC[-2]=0,0,RC[-3]/RC[-2]) -> 0 | M99: =IF(R[50]C[-3]=0,0,RC[-3]/R[50]C[-3]) -> 5.4794520547945223E-2
A100: EA-18G | B100: 237B_FRS | C100: 14O1B_FRS | D100: Arrival | E100: 14 | F100: Based | G100: Overhead Break Arrival | H100: 0.14285714285714285 | I100: 0 | J100: =SUM(RC[-2]:RC[-1]) -> 0.14285714285714285 | K100: =IF(RC[-1]=0,0,RC[-3]/RC[-1]) -> 1 | L100: =IF(RC[-2]=0,0,RC[-3]/RC[-2]) -> 0 | M100: =IF(R[49]C[-3]=0,0,RC[-3]/R[49]C[-3]) -> 4.5662100456621019E-3
A101: EA-18G | B101: 237C_EXP | C101: 14O1C_FRS | D101: Arrival | E101: 14 | F101: Based | G101: Overhead Break Arrival | H101: 0 | I101: 0 | J101: =SUM(RC[-2]:RC[-1]) -> 0 | K101: =IF(RC[-1]=0,0,RC[-3]/RC[-1]) -> 0 | L101: =IF(RC[-2]=0,0,RC[-3]/RC[-2]) -> 0 | M101: =IF(R[48]C[-3]=0,0,RC[-3]/R[48]C[-3]) -> 0
A102: EA-18G | B102: 237C_FLT | C102: 14O1C_FLT | D102: Arrival | E102: 14 | F102: Based | G102: Overhead Break Arrival | H102: 0 | I102: 0 | J102: =SUM(RC[-2]:RC[-1]) -> 0 | K102: =IF(RC[-1]=0,0,RC[-3]/RC[-1]) -> 0 | L102: =IF(RC[-2]=0,0,RC[-3]/RC[-2]) -> 0 | M102: =IF(R[47]C[-3]=0,0,RC[-3]/R[47]C[-3]) -> 0
A103: EA-18G | B103: 237C_FRS | C103: 14O1C_FRS | D103: Arrival | E103: 14 | F103: Based | G103: Overhead Break Arrival | H103: 0 | I103: 0 | J103: =SUM(RC[-2]:RC[-1]) -> 0 | K103: =IF(RC[-1]=0,0,RC[-3]/RC[-1]) -> 0 | L103: =IF(RC[-2]=0,0,RC[-3]/RC[-2]) -> 0 | M103: =IF(R[46]C[-3]=0,0,RC[-3]/R[46]C[-3]) -> 0
A104: EA-18G | B104: 238A_EXP | C104: 14O2A_FRS | D104: Arrival | E104: 14 | F104: Based | G104: Overhead Break Arrival | H104: 1 | I104: 0 | J104: =SUM(RC[-2]:RC[-1]) -> 1 | K104: =IF(RC[-1]=0,0,RC[-3]/RC[-1]) -> 1 | L104: =IF(RC[-2]=0,0,RC[-3]/RC[-2]) -> 0 | M104: =IF(R[45]C[-3]=0,0,RC[-3]/R[45]C[-3]) -> 3.1963470319634715E-2
A105: EA-18G | B105: 238A_FLT | C105: 14O2A_FLT | D105: Arrival | E105: 14 | F105: Based | G105: Overhead Break Arrival | H105: 1 | I105: 0 | J105: =SUM(RC[-2]:RC[-1]) -> 1 | K105: =IF(RC[-1]=0,0,RC[-3]/RC[-1]) -> 1 | L105: =IF(RC[-2]=0,0,RC[-3]/RC[-2]) -> 0 | M105: =IF(R[44]C[-3]=0,0,RC[-3]/R[44]C[-3]) -> 3.1963470319634715E-2
A106: EA-18G | B106: 238A_FRS | C106: 14O2A_FRS | D106: Arrival | E106: 14 | F106: Based | G106: Overhead Break Arrival | H106: 0.7142857142857143 | I106: 0 | J106: =SUM(RC[-2]:RC[-1]) -> 0.7142857142857143 | K106: =IF(RC[-1]=0,0,RC[-3]/RC[-1]) -> 1 | L106: =IF(RC[-2]=0,0,RC[-3]/RC[-2]) -> 0 | M106: =IF(R[43]C[-3]=0,0,RC[-3]/R[43]C[-3]) -> 2.2831050228310511E-2
A107: EA-18G | B107: 238B_EXP | C107: 14O2B_FRS | D107: Arrival | E107: 14 | F107: Based | G107: Overhead Break Arrival | H107: 0 | I107: 0 | J107: =SUM(RC[-2]:RC[-1]) -> 0 | K107: =IF(RC[-1]=0,0,RC[-3]/RC[-1]) -> 0 | L107: =IF(RC[-2]=0,0,RC[-3]/RC[-2]) -> 0 | M107: =IF(R[42]C[-3]=0,0,RC[-3]/R[42]C[-3]) -> 0
A108: EA-18G | B108: 238B_FLT | C108: 14O2B_FLT | D108: Arrival | E108: 14 | F108: Based | G108: Overhead Break Arrival | H108: 0.8571428571428571 | I108: 0 | J108: =SUM(RC[-2]:RC[-1]) -> 0.8571428571428571 | K108: =IF(RC[-1]=0,0,RC[-3]/RC[-1]) -> 1 | L108: =IF(RC[-2]=0,0,RC[-3]/RC[-2]) -> 0 | M108: =IF(R[41]C[-3]=0,0,RC[-3]/R[41]C[-3]) -> 2.7397260273972612E-2
A109: EA-18G | B109: 238B_FRS | C109: 14O2B_FRS | D109: Arrival | E109: 14 | F109: Based | G109: Overhead Break Arrival | H109: 0.14285714285714285 | I109: 0 | J109: =SUM(RC[-2]:RC[-1]) -> 0.14285714285714285 | K109: =IF(RC[-1]=0,0,RC[-3]/RC[-1]) -> 1 | L109: =IF(RC[-2]=0,0,RC[-3]/RC[-2]) -> 0 | M109: =IF(R[40]C[-3]=0,0,RC[-3]/R[40]C[-3]) -> 4.5662100456621019E-3
A110: EA-18G | B110: 238C_EXP | C110: 14O2C_FRS | D110: Arrival | E110: 14 | F110: Based | G110: Overhead Break Arrival | H110: 0 | I110: 0 | J110: =SUM(RC[-2]:RC[-1]) -> 0 | K110: =IF(RC[-1]=0,0,RC[-3]/RC[-1]) -> 0 | L110: =IF(RC[-2]=0,0,RC[-3]/RC[-2]) -> 0 | M110: =IF(R[39]C[-3]=0,0,RC[-3]/R[39]C[-3]) -> 0
A111: EA-18G | B111: 238C_FLT | C111: 14O2C_FLT | D111: Arrival | E111: 14 | F111: Based | G111: Overhead Break Arrival | H111: 0 | I111: 0 | J111: =SUM(RC[-2]:RC[-1]) -> 0 | K111: =IF(RC[-1]=0,0,RC[-3]/RC[-1]) -> 0 | L111: =IF(RC[-2]=0,0,RC[-3]/RC[-2]) -> 0 | M111: =IF(R[38]C[-3]=0,0,RC[-3]/R[38]C[-3]) -> 0
A112: EA-18G | B112: 238C_FRS | C112: 14O2C_FRS | D112: Arrival | E112: 14 | F112: Based | G112: Overhead Break Arrival | H112: 0 | I112: 0 | J112: =SUM(RC[-2]:RC[-1]) -> 0 | K112: =IF(RC[-1]=0,0,RC[-3]/RC[-1]) -> 0 | L112: =IF(RC[-2]=0,0,RC[-3]/RC[-2]) -> 0 | M112: =IF(R[37]C[-3]=0,0,RC[-3]/R[37]C[-3]) -> 0
A113: EA-18G | B113: 239B_EXP | C113: 25O1B_FRS | D113: Arrival | E113: 25 | F113: Based | G113: Overhead Break Arrival | H113: 0.14285714285714285 | I113: 0 | J113: =SUM(RC[-2]:RC[-1]) -> 0.14285714285714285 | K113: =IF(RC[-1]=0,0,RC[-3]/RC[-1]) -> 1 | L113: =IF(RC[-2]=0,0,RC[-3]/RC[-2]) -> 0 | M113: =IF(R[36]C[-3]=0,0,RC[-3]/R[36]C[-3]) -> 4.5662100456621019E-3
A114: EA-18G | B114: 239B_FLT | C114: 25O1B_FLT | D114: Arrival | E114: 25 | F114: Based | G114: Overhead Break Arrival | H114: 1 | I114: 0 | J114: =SUM(RC[-2]:RC[-1]) -> 1 | K114: =IF(RC[-1]=0,0,RC[-3]/RC[-1]) -> 1 | L114: =IF(RC[-2]=0,0,RC[-3]/RC[-2]) -> 0 | M114: =IF(R[35]C[-3]=0,0,RC[-3]/R[35]C[-3]) -> 3.1963470319634715E-2
A115: EA-18G | B115: 239B_FRS | C115: 25O1B_FRS | D115: Arrival | E115: 25 | F115: Based | G115: Overhead Break Arrival | H115: 0.42857142857142855 | I115: 0 | J115: =SUM(RC[-2]:RC[-1]) -> 0.42857142857142855 | K115: =IF(RC[-1]=0,0,RC[-3]/RC[-1]) -> 1 | L115: =IF(RC[-2]=0,0,RC[-3]/RC[-2]) -> 0 | M115: =IF(R[34]C[-3]=0,0,RC[-3]/R[34]C[-3]) -> 1.3698630136986306E-2
A116: EA-18G | B116: 239C_EXP | C116: 25O1C_FRS | D116: Arrival | E116: 25 | F116: Based | G116: Overhead Break Arrival | H116: 0 | I116: 0 | J116: =SUM(RC[-2]:RC[-1]) -> 0 | K116: =IF(RC[-1]=0,0,RC[-3]/RC[-1]) -> 0 | L116: =IF(RC[-2]=0,0,RC[-3]/RC[-2]) -> 0 | M116: =IF(R[33]C[-3]=0,0,RC[-3]/R[33]C[-3]) -> 0
A117: EA-18G | B117: 239C_FLT | C117: 25O1C_FLT | D117: Arrival | E117: 25 | F117: Based | G117: Overhead Break Arrival | H117: 0 | I117: 0 | J117: =SUM(RC[-2]:RC[-1]) -> 0 | K117: =IF(RC[-1]=0,0,RC[-3]/RC[-1]) -> 0 | L117: =IF(RC[-2]=0,0,RC[-3]/RC[-2]) -> 0 | M117: =IF(R[32]C[-3]=0,0,RC[-3]/R[32]C[-3]) -> 0
A118: EA-18G | B118: 239C_FRS | C118: 25O1C_FRS | D118: Arrival | E118: 25 | F118: Based | G118: Overhead Break Arrival | H118: 0 | I118: 0 | J118: =SUM(RC[-2]:RC[-1]) -> 0 | K118: =IF(RC[-1]=0,0,RC[-3]/RC[-1]) -> 0 | L118: =IF(RC[-2]=0,0,RC[-3]/RC[-2]) -> 0 | M118: =IF(R[31]C[-3]=0,0,RC[-3]/R[31]C[-3]) -> 0
A119: EA-18G | B119: 240B_EXP | C119: 25O2B_FRS | D119: Arrival | E119: 25 | F119: Based | G119: Overhead Break Arrival | H119: 0.2857142857142857 | I119: 0 | J119: =SUM(RC[-2]:RC[-1]) -> 0.2857142857142857 | K119: =IF(RC[-1]=0,0,RC[-3]/RC[-1]) -> 1 | L119: =IF(RC[-2]=0,0,RC[-3]/RC[-2]) -> 0 | M119: =IF(R[30]C[-3]=0,0,RC[-3]/R[30]C[-3]) -> 9.1324200913242039E-3
A120: EA-18G | B120: 240B_FLT | C120: 25O2B_FLT | D120: Arrival | E120: 25 | F120: Based | G120: Overhead Break Arrival | H120: 0.5714285714285714 | I120: 0 | J120: =SUM(RC[-2]:RC[-1]) -> 0.5714285714285714 | K120: =IF(RC[-1]=0,0,RC[-3]/RC[-1]) -> 1 | L120: =IF(RC[-2]=0,0,RC[-3]/RC[-2]) -> 0 | M120: =IF(R[29]C[-3]=0,0,RC[-3]/R[29]C[-3]) -> 1.8264840182648408E-2
A121: EA-18G | B121: 240B_FRS | C121: 25O2B_FRS | D121: Arrival | E121: 25 | F121: Based | G121: Overhead Break Arrival | H121: 0.2857142857142857 | I121: 0 | J121: =SUM(RC[-2]:RC[-1]) -> 0.2857142857142857 | K121: =IF(RC[-1]=0,0,RC[-3]/RC[-1]) -> 1 | L121: =IF(RC[-2]=0,0,RC[-3]/RC[-2]) -> 0 | M121: =IF(R[28]C[-3]=0,0,RC[-3]/R[28]C[-3]) -> 9.1324200913242039E-3
A122: EA-18G | B122: 240C_EXP | C122: 25O2C_FRS | D122: Arrival | E122: 25 | F122: Based | G122: Overhead Break Arrival | H122: 0 | I122: 0 | J122: =SUM(RC[-2]:RC[-1]) -> 0 | K122: =IF(RC[-1]=0,0,RC[-3]/RC[-1]) -> 0 | L122: =IF(RC[-2]=0,0,RC[-3]/RC[-2]) -> 0 | M122: =IF(R[27]C[-3]=0,0,RC[-3]/R[27]C[-3]) -> 0
A123: EA-18G | B123: 240C_FLT | C123: 25O2C_FLT | D123: Arrival | E123: 25 | F123: Based | G123: Overhead Break Arrival | H123: 0 | I123: 0 | J123: =SUM(RC[-2]:RC[-1]) -> 0 | K123: =IF(RC[-1]=0,0,RC[-3]/RC[-1]) -> 0 | L123: =IF(RC[-2]=0,0,RC[-3]/RC[-2]) -> 0 | M123: =IF(R[26]C[-3]=0,0,RC[-3]/R[26]C[-3]) -> 0
A124: EA-18G | B124: 240C_FRS | C124: 25O2C_FRS | D124: Arrival | E124: 25 | F124: Based | G124: Overhead Break Arrival | H124: 0.2857142857142857 | I124: 0 | J124: =SUM(RC[-2]:RC[-1]) -> 0.2857142857142857 | K124: =IF(RC[-1]=0,0,RC[-3]/RC[-1]) -> 1 | L124: =IF(RC[-2]=0,0,RC[-3]/RC[-2]) -> 0 | M124: =IF(R[25]C[-3]=0,0,RC[-3]/R[25]C[-3]) -> 9.1324200913242039E-3
A125: EA-18G | B125: 241B_EXP | C125: 32O1B_FRS | D125: Arrival | E125: 32 | F125: Based | G125: Overhead Break Arrival | H125: 0 | I125: 0 | J125: =SUM(RC[-2]:RC[-1]) -> 0 | K125: =IF(RC[-1]=0,0,RC[-3]/RC[-1]) -> 0 | L125: =IF(RC[-2]=0,0,RC[-3]/RC[-2]) -> 0 | M125: =IF(R[24]C[-3]=0,0,RC[-3]/R[24]C[-3]) -> 0
A126: EA-18G | B126: 241B_FLT | C126: 32O1B_FLT | D126: Arrival | E126: 32 | F126: Based | G126: Overhead Break Arrival | H126: 0 | I126: 0 | J126: =SUM(RC[-2]:RC[-1]) -> 0 | K126: =IF(RC[-1]=0,0,RC[-3]/RC[-1]) -> 0 | L126: =IF(RC[-2]=0,0,RC[-3]/RC[-2]) -> 0 | M126: =IF(R[23]C[-3]=0,0,RC[-3]/R[23]C[-3]) -> 0
A127: EA-18G | B127: 241B_FRS | C127: 32O1B_FRS | D127: Arrival | E127: 32 | F127: Based | G127: Overhead Break Arrival | H127: 0 | I127: 0 | J127: =SUM(RC[-2]:RC[-1]) -> 0 | K127: =IF(RC[-1]=0,0,RC[-3]/RC[-1]) -> 0 | L127: =IF(RC[-2]=0,0,RC[-3]/RC[-2]) -> 0 | M127: =IF(R[22]C[-3]=0,0,RC[-3]/R[22]C[-3]) -> 0
A128: EA-18G | B128: 241C_EXP | C128: 32O1C_FRS | D128: Arrival | E128: 32 | F128: Based | G128: Overhead Break Arrival | H128: 0 | I128: 0 | J128: =SUM(RC[-2]:RC[-1]) -> 0 | K128: =IF(RC[-1]=0,0,RC[-3]/RC[-1]) -> 0 | L128: =IF(RC[-2]=0,0,RC[-3]/RC[-2]) -> 0 | M128: =IF(R[21]C[-3]=0,0,RC[-3]/R[21]C[-3]) -> 0
A129: EA-18G | B129: 241C_FLT | C129: 32O1C_FLT | D129: Arrival | E129: 32 | F129: Based | G129: Overhead Break Arrival | H129: 0 | I129: 0 | J129: =SUM(RC[-2]:RC[-1]) -> 0 | K129: =IF(RC[-1]=0,0,RC[-3]/RC[-1]) -> 0 | L129: =IF(RC[-2]=0,0,RC[-3]/RC[-2]) -> 0 | M129: =IF(R[20]C[-3]=0,0,RC[-3]/R[20]C[-3]) -> 0
A130: EA-18G | B130: 241C_FRS | C130: 32O1C_FRS | D130: Arrival | E130: 32 | F130: Based | G130: Overhead Break Arrival | H130: 0 | I130: 0 | J130: =SUM(RC[-2]:RC[-1]) -> 0 | K130: =IF(RC[-1]=0,0,RC[-3]/RC[-1]) -> 0 | L130: =IF(RC[-2]=0,0,RC[-3]/RC[-2]) -> 0 | M130: =IF(R[19]C[-3]=0,0,RC[-3]/R[19]C[-3]) -> 0
A131: EA-18G | B131: 242B_EXP | C131: 32O2B_FRS | D131: Arrival | E131: 32 | F131: Based | G131: Overhead Break Arrival | H131: 0 | I131: 0 | J131: =SUM(RC[-2]:RC[-1]) -> 0 | K131: =IF(RC[-1]=0,0,RC[-3]/RC[-1]) -> 0 | L131: =IF(RC[-2]=0,0,RC[-3]/RC[-2]) -> 0 | M131: =IF(R[18]C[-3]=0,0,RC[-3]/R[18]C[-3]) -> 0
A132: EA-18G | B132: 242B_FLT | C132: 32O2B_FLT | D132: Arrival | E132: 32 | F132: Based | G132: Overhead Break Arrival | H132: 0 | I132: 0 | J132: =SUM(RC[-2]:RC[-1]) -> 0 | K132: =IF(RC[-1]=0,0,RC[-3]/RC[-1]) -> 0 | L132: =IF(RC[-2]=0,0,RC[-3]/RC[-2]) -> 0 | M132: =IF(R[17]C[-3]=0,0,RC[-3]/R[17]C[-3]) -> 0
A133: EA-18G | B133: 242B_FRS | C133: 32O2B_FRS | D133: Arrival | E133: 32 | F133: Based | G133: Overhead Break Arrival | H133: 0 | I133: 0 | J133: =SUM(RC[-2]:RC[-1]) -> 0 | K133: =IF(RC[-1]=0,0,RC[-3]/RC[-1]) -> 0 | L133: =IF(RC[-2]=0,0,RC[-3]/RC[-2]) -> 0 | M133: =IF(R[16]C[-3]=0,0,RC[-3]/R[16]C[-3]) -> 0
A134: EA-18G | B134: 242C_EXP | C134: 32O2C_FRS | D134: Arrival | E134: 32 | F134: Based | G134: Overhead Break Arrival | H134: 0 | I134: 0 | J134: =SUM(RC[-2]:RC[-1]) -> 0 | K134: =IF(RC[-1]=0,0,RC[-3]/RC[-1]) -> 0 | L134: =IF(RC[-2]=0,0,RC[-3]/RC[-2]) -> 0 | M134: =IF(R[15]C[-3]=0,0,RC[-3]/R[15]C[-3]) -> 0
A135: EA-18G | B135: 242C_FLT | C135: 32O2C_FLT | D135: Arrival | E135: 32 | F135: Based | G135: Overhead Break Arrival | H135: 0 | I135: 0 | J135: =SUM(RC[-2]:RC[-1]) -> 0 | K135: =IF(RC[-1]=0,0,RC[-3]/RC[-1]) -> 0 | L135: =IF(RC[-2]=0,0,RC[-3]/RC[-2]) -> 0 | M135: =IF(R[14]C[-3]=0,0,RC[-3]/R[14]C[-3]) -> 0
A136: EA-18G | B136: 242C_FRS | C136: 32O2C_FRS | D136: Arrival | E136: 32 | F136: Based | G136: Overhead Break Arrival | H136: 0 | I136: 0 | J136: =SUM(RC[-2]:RC[-1]) -> 0 | K136: =IF(RC[-1]=0,0,RC[-3]/RC[-1]) -> 0 | L136: =IF(RC[-2]=0,0,RC[-3]/RC[-2]) -> 0 | M136: =IF(R[13]C[-3]=0,0,RC[-3]/R[13]C[-3]) -> 0
A137: EA-18G | B137: 243_EXP | C137: 07AHT | D137: Arrival | E137: 07 | F137: Based | G137: HI TACAN Arrival | H137: 0 | I137: 0 | J137: =SUM(RC[-2]:RC[-1]) -> 0 | K137: =IF(RC[-1]=0,0,RC[-3]/RC[-1]) -> 0 | L137: =IF(RC[-2]=0,0,RC[-3]/RC[-2]) -> 0 | M137: =IF(R[12]C[-3]=0,0,RC[-3]/R[12]C[-3]) -> 0
A138: EA-18G | B138: 243_FLT | C138: 07AHT | D138: Arrival | E138: 07 | F138: Based | G138: HI TACAN Arrival | H138: 0 | I138: 0 | J138: =SUM(RC[-2]:RC[-1]) -> 0 | K138: =IF(RC[-1]=0,0,RC[-3]/RC[-1]) -> 0 | L138: =IF(RC[-2]=0,0,RC[-3]/RC[-2]) -> 0 | M138: =IF(R[11]C[-3]=0,0,RC[-3]/R[11]C[-3]) -> 0
A139: EA-18G | B139: 243_FRS | C139: 07AHT | D139: Arrival | E139: 07 | F139: Based | G139: HI TACAN Arrival | H139: 0 | I139: 0 | J139: =SUM(RC[-2]:RC[-1]) -> 0 | K139: =IF(RC[-1]=0,0,RC[-3]/RC[-1]) -> 0 | L139: =IF(RC[-2]=0,0,RC[-3]/RC[-2]) -> 0 | M139: =IF(R[10]C[-3]=0,0,RC[-3]/R[10]C[-3]) -> 0
A140: EA-18G | B140: 244_EXP | C140: 14AHT | D140: Arrival | E140: 14 | F140: Based | G140: HI TACAN Arrival | H140: 0.2857142857142857 | I140: 0 | J140: =SUM(RC[-2]:RC[-1]) -> 0.2857142857142857 | K140: =IF(RC[-1]=0,0,RC[-3]/RC[-1]) -> 1 | L140: =IF(RC[-2]=0,0,RC[-3]/RC[-2]) -> 0 | M140: =IF(R[9]C[-3]=0,0,RC[-3]/R[9]C[-3]) -> 9.1324200913242039E-3
A141: EA-18G | B141: 244_FLT | C141: 14AHT | D141: Arrival | E141: 14 | F141: Based | G141: HI TACAN Arrival | H141: 0.2857142857142857 | I141: 0 | J141: =SUM(RC[-2]:RC[-1]) -> 0.2857142857142857 | K141: =IF(RC[-1]=0,0,RC[-3]/RC[-1]) -> 1 | L141: =IF(RC[-2]=0,0,RC[-3]/RC[-2]) -> 0 | M141: =IF(R[8]C[-3]=0,0,RC[-3]/R[8]C[-3]) -> 9.1324200913242039E-3
A142: EA-18G | B142: 244_FRS | C142: 14AHT | D142: Arrival | E142: 14 | F142: Based | G142: HI TACAN Arrival | H142: 0 | I142: 0 | J142: =SUM(RC[-2]:RC[-1]) -> 0 | K142: =IF(RC[-1]=0,0,RC[-3]/RC[-1]) -> 0 | L142: =IF(RC[-2]=0,0,RC[-3]/RC[-2]) -> 0 | M142: =IF(R[7]C[-3]=0,0,RC[-3]/R[7]C[-3]) -> 0
A143: EA-18G | B143: 245_EXP | C143: 25AHT | D143: Arrival | E143: 25 | F143: Based | G143: HI TACAN Arrival | H143: 0 | I143: 0 | J143: =SUM(RC[-2]:RC[-1]) -> 0 | K143: =IF(RC[-1]=0,0,RC[-3]/RC[-1]) -> 0 | L143: =IF(RC[-2]=0,0,RC[-3]/RC[-2]) -> 0 | M143: =IF(R[6]C[-3]=0,0,RC[-3]/R[6]C[-3]) -> 0
A144: EA-18G | B144: 245_FLT | C144: 25AHT | D144: Arrival | E144: 25 | F144: Based | G144: HI TACAN Arrival | H144: 0 | I144: 0 | J144: =SUM(RC[-2]:RC[-1]) -> 0 | K144: =IF(RC[-1]=0,0,RC[-3]/RC[-1]) -> 0 | L144: =IF(RC[-2]=0,0,RC[-3]/RC[-2]) -> 0 | M144: =IF(R[5]C[-3]=0,0,RC[-3]/R[5]C[-3]) -> 0
A145: EA-18G | B145: 245_FRS | C145: 25AHT | D145: Arrival | E145: 25 | F145: Based | G145: HI TACAN Arrival | H145: 0 | I145: 0 | J145: =SUM(RC[-2]:RC[-1]) -> 0 | K145: =IF(RC[-1]=0,0,RC[-3]/RC[-1]) -> 0 | L145: =IF(RC[-2]=0,0,RC[-3]/RC[-2]) -> 0 | M145: =IF(R[4]C[-3]=0,0,RC[-3]/R[4]C[-3]) -> 0
A146: EA-18G | B146: 246_EXP | C146: 32AHT | D146: Arrival | E146: 32 | F146: Based | G146: HI TACAN Arrival | H146: 0 | I146: 0 | J146: =SUM(RC[-2]:RC[-1]) -> 0 | K146: =IF(RC[-1]=0,0,RC[-3]/RC[-1]) -> 0 | L146: =IF(RC[-2]=0,0,RC[-3]/RC[-2]) -> 0 | M146: =IF(R[3]C[-3]=0,0,RC[-3]/R[3]C[-3]) -> 0
A147: EA-18G | B147: 246_FLT | C147: 32AHT | D147: Arrival | E147: 32 | F147: Based | G147: HI TACAN Arrival | H147: 0 | I147: 0 | J147: =SUM(RC[-2]:RC[-1]) -> 0 | K147: =IF(RC[-1]=0,0,RC[-3]/RC[-1]) -> 0 | L147: =IF(RC[-2]=0,0,RC[-3]/RC[-2]) -> 0 | M147: =IF(R[2]C[-3]=0,0,RC[-3]/R[2]C[-3]) -> 0
A148: EA-18G | B148: 246_FRS | C148: 32AHT | D148: Arrival | E148: 32 | F148: Based | G148: HI TACAN Arrival | H148: 0 | I148: 0 | J148: =SUM(RC[-2]:RC[-1]) -> 0 | K148: =IF(RC[-1]=0,0,RC[-3]/RC[-1]) -> 0 | L148: =IF(RC[-2]=0,0,RC[-3]/RC[-2]) -> 0 | M148: =IF(R[1]C[-3]=0,0,RC[-3]/R[1]C[-3]) -> 0
G149: Subtotal | H149: 30.999999999999989 | I149: 0.2857142857142857 | J149: =SUM(R[-147]C:R[-1]C) -> 31.285714285714274 | K149: =IF(RC[-1]=0,0,RC[-3]/RC[-1]) -> 0.9908675799086758 | L149: =IF(RC[-2]=0,0,RC[-3]/RC[-2]) -> 9.1324200913242039E-3
A151: EA-18G | B151: 201A_EXP | C151: 07D1A | D151: Departure | E151: 07 | F151: Based | G151: Departure | H151: 0 | I151: 0 | J151: =SUM(RC[-2]:RC[-1]) -> 0 | K151: =IF(RC[-1]=0,0,RC[-3]/RC[-1]) -> 0 | L151: =IF(RC[-2]=0,0,RC[-3]/RC[-2]) -> 0 | M151: =IF(R[96]C[-3]=0,0,RC[-3]/R[96]C[-3]) -> 0
A152: EA-18G | B152: 201A_FLT | C152: 07D1A | D152: Departure | E152: 07 | F152: Based | G152: Departure | H152: 0 | I152: 0 | J152: =SUM(RC[-2]:RC[-1]) -> 0 | K152: =IF(RC[-1]=0,0,RC[-3]/RC[-1]) -> 0 | L152: =IF(RC[-2]=0,0,RC[-3]/RC[-2]) -> 0 | M152: =IF(R[95]C[-3]=0,0,RC[-3]/R[95]C[-3]) -> 0
A153: EA-18G | B153: 201A_FRS | C153: 07D1A | D153: Departure | E153: 07 | F153: Based | G153: Departure | H153: 0 | I153: 0 | J153: =SUM(RC[-2]:RC[-1]) -> 0 | K153: =IF(RC[-1]=0,0,RC[-3]/RC[-1]) -> 0 | L153: =IF(RC[-2]=0,0,RC[-3]/RC[-2]) -> 0 | M153: =IF(R[94]C[-3]=0,0,RC[-3]/R[94]C[-3]) -> 0
A154: EA-18G | B154: 202A_EXP | C154: 07D1B | D154: Departure | E154: 07 | F154: Based | G154: Departure | H154: 0.2857142857142857 | I154: 0 | J154: =SUM(RC[-2]:RC[-1]) -> 0.2857142857142857 | K154: =IF(RC[-1]=0,0,RC[-3]/RC[-1]) -> 1 | L154: =IF(RC[-2]=0,0,RC[-3]/RC[-2]) -> 0 | M154: =IF(R[93]C[-3]=0,0,RC[-3]/R[93]C[-3]) -> 7.7220077220077248E-3
A155: EA-18G | B155: 202A_FLT | C155: 07D1B | D155: Departure | E155: 07 | F155: Based | G155: Departure | H155: 0.7142857142857143 | I155: 0 | J155: =SUM(RC[-2]:RC[-1]) -> 0.7142857142857143 | K155: =IF(RC[-1]=0,0,RC[-3]/RC[-1]) -> 1 | L155: =IF(RC[-2]=0,0,RC[-3]/RC[-2]) -> 0 | M155: =IF(R[92]C[-3]=0,0,RC[-3]/R[92]C[-3]) -> 1.9305019305019312E-2
A156: EA-18G | B156: 202A_FRS | C156: 07D1B | D156: Departure | E156: 07 | F156: Based | G156: Departure | H156: 0 | I156: 0 | J156: =SUM(RC[-2]:RC[-1]) -> 0 | K156: =IF(RC[-1]=0,0,RC[-3]/RC[-1]) -> 0 | L156: =IF(RC[-2]=0,0,RC[-3]/RC[-2]) -> 0 | M156: =IF(R[91]C[-3]=0,0,RC[-3]/R[91]C[-3]) -> 0
A157: EA-18G | B157: 203A_EXP | C157: 07D1C | D157: Departure | E157: 07 | F157: Based | G157: Departure | H157: 0 | I157: 0 | J157: =SUM(RC[-2]:RC[-1]) -> 0 | K157: =IF(RC[-1]=0,0,RC[-3]/RC[-1]) -> 0 | L157: =IF(RC[-2]=0,0,RC[-3]/RC[-2]) -> 0 | M157: =IF(R[90]C[-3]=0,0,RC[-3]/R[90]C[-3]) -> 0
A158: EA-18G | B158: 203A_FLT | C158: 07D1C | D158: Departure | E158: 07 | F158: Based | G158: Departure | H158: 0 | I158: 0 | J158: =SUM(RC[-2]:RC[-1]) -> 0 | K158: =IF(RC[-1]=0,0,RC[-3]/RC[-1]) -> 0 | L158: =IF(RC[-2]=0,0,RC[-3]/RC[-2]) -> 0 | M158: =IF(R[89]C[-3]=0,0,RC[-3]/R[89]C[-3]) -> 0
A159: EA-18G | B159: 203A_FRS | C159: 07D1C | D159: Departure | E159: 07 | F159: Based | G159: Departure | H159: 0 | I159: 0 | J159: =SUM(RC[-2]:RC[-1]) -> 0 | K159: =IF(RC[-1]=0,0,RC[-3]/RC[-1]) -> 0 | L159: =IF(RC[-2]=0,0,RC[-3]/RC[-2]) -> 0 | M159: =IF(R[88]C[-3]=0,0,RC[-3]/R[88]C[-3]) -> 0
A160: EA-18G | B160: 204A_EXP | C160: 07D2A | D160: Departure | E160: 07 | F160: Based | G160: Departure | H160: 0.14285714285714285 | I160: 0 | J160: =SUM(RC[-2]:RC[-1]) -> 0.14285714285714285 | K160: =IF(RC[-1]=0,0,RC[-3]/RC[-1]) -> 1 | L160: =IF(RC[-2]=0,0,RC[-3]/RC[-2]) -> 0 | M160: =IF(R[87]C[-3]=0,0,RC[-3]/R[87]C[-3]) -> 3.8610038610038624E-3
A161: EA-18G | B161: 204A_FLT | C161: 07D2A | D161: Departure | E161: 07 | F161: Based | G161: Departure | H161: 0 | I161: 0 | J161: =SUM(RC[-2]:RC[-1]) -> 0 | K161: =IF(RC[-1]=0,0,RC[-3]/RC[-1]) -> 0 | L161: =IF(RC[-2]=0,0,RC[-3]/RC[-2]) -> 0 | M161: =IF(R[86]C[-3]=0,0,RC[-3]/R[86]C[-3]) -> 0
A162: EA-18G | B162: 204A_FRS | C162: 07D2A | D162: Departure | E162: 07 | F162: Based | G162: Departure | H162: 0 | I162: 0 | J162: =SUM(RC[-2]:RC[-1]) -> 0 | K162: =IF(RC[-1]=0,0,RC[-3]/RC[-1]) -> 0 | L162: =IF(RC[-2]=0,0,RC[-3]/RC[-2]) -> 0 | M162: =IF(R[85]C[-3]=0,0,RC[-3]/R[85]C[-3]) -> 0
A163: EA-18G | B163: 205A_EXP | C163: 07D2B | D163: Departure | E163: 07 | F163: Based | G163: Departure | H163: 0.2857142857142857 | I163: 0 | J163: =SUM(RC[-2]:RC[-1]) -> 0.2857142857142857 | K163: =IF(RC[-1]=0,0,RC[-3]/RC[-1]) -> 1 | L163: =IF(RC[-2]=0,0,RC[-3]/RC[-2]) -> 0 | M163: =IF(R[84]C[-3]=0,0,RC[-3]/R[84]C[-3]) -> 7.7220077220077248E-3
A164: EA-18G | B164: 205A_FLT | C164: 07D2B | D164: Departure | E164: 07 | F164: Based | G164: Departure | H164: 0.2857142857142857 | I164: 0 | J164: =SUM(RC[-2]:RC[-1]) -> 0.2857142857142857 | K164: =IF(RC[-1]=0,0,RC[-3]/RC[-1]) -> 1 | L164: =IF(RC[-2]=0,0,RC[-3]/RC[-2]) -> 0 | M164: =IF(R[83]C[-3]=0,0,RC[-3]/R[83]C[-3]) -> 7.7220077220077248E-3
A165: EA-18G | B165: 205A_FRS | C165: 07D2B | D165: Departure | E165: 07 | F165: Based | G165: Departure | H165: 0.42857142857142855 | I165: 0 | J165: =SUM(RC[-2]:RC[-1]) -> 0.42857142857142855 | K165: =IF(RC[-1]=0,0,RC[-3]/RC[-1]) -> 1 | L165: =IF(RC[-2]=0,0,RC[-3]/RC[-2]) -> 0 | M165: =IF(R[82]C[-3]=0,0,RC[-3]/R[82]C[-3]) -> 1.1583011583011588E-2
A166: EA-18G | B166: 206A_EXP | C166: 07D2C | D166: Departure | E166: 07 | F166: Based | G166: Departure | H166: 0 | I166: 0 | J166: =SUM(RC[-2]:RC[-1]) -> 0 | K166: =IF(RC[-1]=0,0,RC[-3]/RC[-1]) -> 0 | L166: =IF(RC[-2]=0,0,RC[-3]/RC[-2]) -> 0 | M166: =IF(R[81]C[-3]=0,0,RC[-3]/R[81]C[-3]) -> 0
A167: EA-18G | B167: 206A_FLT | C167: 07D2C | D167: Departure | E167: 07 | F167: Based | G167: Departure | H167: 0 | I167: 0 | J167: =SUM(RC[-2]:RC[-1]) -> 0 | K167: =IF(RC[-1]=0,0,RC[-3]/RC[-1]) -> 0 | L167: =IF(RC[-2]=0,0,RC[-3]/RC[-2]) -> 0 | M167: =IF(R[80]C[-3]=0,0,RC[-3]/R[80]C[-3]) -> 0
A168: EA-18G | B168: 206A_FRS | C168: 07D2C | D168: Departure | E168: 07 | F168: Based | G168: Departure | H168: 0 | I168: 0 | J168: =SUM(RC[-2]:RC[-1]) -> 0 | K168: =IF(RC[-1]=0,0,RC[-3]/RC[-1]) -> 0 | L168: =IF(RC[-2]=0,0,RC[-3]/RC[-2]) -> 0 | M168: =IF(R[79]C[-3]=0,0,RC[-3]/R[79]C[-3]) -> 0
A169: EA-18G | B169: 207A_EXP | C169: 14D1A | D169: Departure | E169: 14 | F169: Based | G169: Departure | H169: 1.7142857142857142 | I169: 0 | J169: =SUM(RC[-2]:RC[-1]) -> 1.7142857142857142 | K169: =IF(RC[-1]=0,0,RC[-3]/RC[-1]) -> 1 | L169: =IF(RC[-2]=0,0,RC[-3]/RC[-2]) -> 0 | M169: =IF(R[78]C[-3]=0,0,RC[-3]/R[78]C[-3]) -> 4.633204633204635E-2
A170: EA-18G | B170: 207A_FLT | C170: 14D1A | D170: Departure | E170: 14 | F170: Based | G170: Departure | H170: 2 | I170: 0 | J170: =SUM(RC[-2]:RC[-1]) -> 2 | K170: =IF(RC[-1]=0,0,RC[-3]/RC[-1]) -> 1 | L170: =IF(RC[-2]=0,0,RC[-3]/RC[-2]) -> 0 | M170: =IF(R[77]C[-3]=0,0,RC[-3]/R[77]C[-3]) -> 5.4054054054054078E-2
A171: EA-18G | B171: 207A_FRS | C171: 14D1A | D171: Departure | E171: 14 | F171: Based | G171: Departure | H171: 0.5714285714285714 | I171: 0 | J171: =SUM(RC[-2]:RC[-1]) -> 0.5714285714285714 | K171: =IF(RC[-1]=0,0,RC[-3]/RC[-1]) -> 1 | L171: =IF(RC[-2]=0,0,RC[-3]/RC[-2]) -> 0 | M171: =IF(R[76]C[-3]=0,0,RC[-3]/R[76]C[-3]) -> 1.544401544401545E-2
A172: EA-18G | B172: 208A_EXP | C172: 14D1B | D172: Departure | E172: 14 | F172: Based | G172: Departure | H172: 2.7142857142857144 | I172: 0 | J172: =SUM(RC[-2]:RC[-1]) -> 2.7142857142857144 | K172: =IF(RC[-1]=0,0,RC[-3]/RC[-1]) -> 1 | L172: =IF(RC[-2]=0,0,RC[-3]/RC[-2]) -> 0 | M172: =IF(R[75]C[-3]=0,0,RC[-3]/R[75]C[-3]) -> 7.3359073359073393E-2
A173: EA-18G | B173: 208A_FLT | C173: 14D1B | D173: Departure | E173: 14 | F173: Based | G173: Departure | H173: 4.4285714285714288 | I173: 0 | J173: =SUM(RC[-2]:RC[-1]) -> 4.4285714285714288 | K173: =IF(RC[-1]=0,0,RC[-3]/RC[-1]) -> 1 | L173: =IF(RC[-2]=0,0,RC[-3]/RC[-2]) -> 0 | M173: =IF(R[74]C[-3]=0,0,RC[-3]/R[74]C[-3]) -> 0.11969111969111974
A174: EA-18G | B174: 208A_FRS | C174: 14D1B | D174: Departure | E174: 14 | F174: Based | G174: Departure | H174: 2.2857142857142856 | I174: 0 | J174: =SUM(RC[-2]:RC[-1]) -> 2.2857142857142856 | K174: =IF(RC[-1]=0,0,RC[-3]/RC[-1]) -> 1 | L174: =IF(RC[-2]=0,0,RC[-3]/RC[-2]) -> 0 | M174: =IF(R[73]C[-3]=0,0,RC[-3]/R[73]C[-3]) -> 6.1776061776061798E-2
A175: EA-18G | B175: 209A_EXP | C175: 14D1C | D175: Departure | E175: 14 | F175: Based | G175: Departure | H175: 1 | I175: 0 | J175: =SUM(RC[-2]:RC[-1]) -> 1 | K175: =IF(RC[-1]=0,0,RC[-3]/RC[-1]) -> 1 | L175: =IF(RC[-2]=0,0,RC[-3]/RC[-2]) -> 0 | M175: =IF(R[72]C[-3]=0,0,RC[-3]/R[72]C[-3]) -> 2.7027027027027039E-2
A176: EA-18G | B176: 209A_FLT | C176: 14D1C | D176: Departure | E176: 14 | F176: Based | G176: Departure | H176: 0.5714285714285714 | I176: 0 | J176: =SUM(RC[-2]:RC[-1]) -> 0.5714285714285714 | K176: =IF(RC[-1]=0,0,RC[-3]/RC[-1]) -> 1 | L176: =IF(RC[-2]=0,0,RC[-3]/RC[-2]) -> 0 | M176: =IF(R[71]C[-3]=0,0,RC[-3]/R[71]C[-3]) -> 1.544401544401545E-2
A177: EA-18G | B177: 209A_FRS | C177: 14D1C | D177: Departure | E177: 14 | F177: Based | G177: Departure | H177: 0 | I177: 0 | J177: =SUM(RC[-2]:RC[-1]) -> 0 | K177: =IF(RC[-1]=0,0,RC[-3]/RC[-1]) -> 0 | L177: =IF(RC[-2]=0,0,RC[-3]/RC[-2]) -> 0 | M177: =IF(R[70]C[-3]=0,0,RC[-3]/R[70]C[-3]) -> 0
A178: EA-18G | B178: 210A_EXP | C178: 14D2A | D178: Departure | E178: 14 | F178: Based | G178: Departure | H178: 0.2857142857142857 | I178: 0 | J178: =SUM(RC[-2]:RC[-1]) -> 0.2857142857142857 | K178: =IF(RC[-1]=0,0,RC[-3]/RC[-1]) -> 1 | L178: =IF(RC[-2]=0,0,RC[-3]/RC[-2]) -> 0 | M178: =IF(R[69]C[-3]=0,0,RC[-3]/R[69]C[-3]) -> 7.7220077220077248E-3
A179: EA-18G | B179: 210A_FLT | C179: 14D2A | D179: Departure | E179: 14 | F179: Based | G179: Departure | H179: 0.8571428571428571 | I179: 0 | J179: =SUM(RC[-2]:RC[-1]) -> 0.8571428571428571 | K179: =IF(RC[-1]=0,0,RC[-3]/RC[-1]) -> 1 | L179: =IF(RC[-2]=0,0,RC[-3]/RC[-2]) -> 0 | M179: =IF(R[68]C[-3]=0,0,RC[-3]/R[68]C[-3]) -> 2.3166023166023175E-2
A180: EA-18G | B180: 210A_FRS | C180: 14D2A | D180: Departure | E180: 14 | F180: Based | G180: Departure | H180: 2.2857142857142856 | I180: 0 | J180: =SUM(RC[-2]:RC[-1]) -> 2.2857142857142856 | K180: =IF(RC[-1]=0,0,RC[-3]/RC[-1]) -> 1 | L180: =IF(RC[-2]=0,0,RC[-3]/RC[-2]) -> 0 | M180: =IF(R[67]C[-3]=0,0,RC[-3]/R[67]C[-3]) -> 6.1776061776061798E-2
A181: EA-18G | B181: 211A_EXP | C181: 14D2B | D181: Departure | E181: 14 | F181: Based | G181: Departure | H181: 1.4285714285714286 | I181: 0 | J181: =SUM(RC[-2]:RC[-1]) -> 1.4285714285714286 | K181: =IF(RC[-1]=0,0,RC[-3]/RC[-1]) -> 1 | L181: =IF(RC[-2]=0,0,RC[-3]/RC[-2]) -> 0 | M181: =IF(R[66]C[-3]=0,0,RC[-3]/R[66]C[-3]) -> 3.8610038610038623E-2
A182: EA-18G | B182: 211A_FLT | C182: 14D2B | D182: Departure | E182: 14 | F182: Based | G182: Departure | H182: 1.5714285714285714 | I182: 0 | J182: =SUM(RC[-2]:RC[-1]) -> 1.5714285714285714 | K182: =IF(RC[-1]=0,0,RC[-3]/RC[-1]) -> 1 | L182: =IF(RC[-2]=0,0,RC[-3]/RC[-2]) -> 0 | M182: =IF(R[65]C[-3]=0,0,RC[-3]/R[65]C[-3]) -> 4.2471042471042483E-2
A183: EA-18G | B183: 211A_FRS | C183: 14D2B | D183: Departure | E183: 14 | F183: Based | G183: Departure | H183: 1.2857142857142858 | I183: 0 | J183: =SUM(RC[-2]:RC[-1]) -> 1.2857142857142858 | K183: =IF(RC[-1]=0,0,RC[-3]/RC[-1]) -> 1 | L183: =IF(RC[-2]=0,0,RC[-3]/RC[-2]) -> 0 | M183: =IF(R[64]C[-3]=0,0,RC[-3]/R[64]C[-3]) -> 3.4749034749034763E-2
A184: EA-18G | B184: 212A_EXP | C184: 14D2C | D184: Departure | E184: 14 | F184: Based | G184: Departure | H184: 0.14285714285714285 | I184: 0 | J184: =SUM(RC[-2]:RC[-1]) -> 0.14285714285714285 | K184: =IF(RC[-1]=0,0,RC[-3]/RC[-1]) -> 1 | L184: =IF(RC[-2]=0,0,RC[-3]/RC[-2]) -> 0 | M184: =IF(R[63]C[-3]=0,0,RC[-3]/R[63]C[-3]) -> 3.8610038610038624E-3
A185: EA-18G | B185: 212A_FLT | C185: 14D2C | D185: Departure | E185: 14 | F185: Based | G185: Departure | H185: 0 | I185: 0 | J185: =SUM(RC[-2]:RC[-1]) -> 0 | K185: =IF(RC[-1]=0,0,RC[-3]/RC[-1]) -> 0 | L185: =IF(RC[-2]=0,0,RC[-3]/RC[-2]) -> 0 | M185: =IF(R[62]C[-3]=0,0,RC[-3]/R[62]C[-3]) -> 0
A186: EA-18G | B186: 212A_FRS | C186: 14D2C | D186: Departure | E186: 14 | F186: Based | G186: Departure | H186: 0.14285714285714285 | I186: 0 | J186: =SUM(RC[-2]:RC[-1]) -> 0.14285714285714285 | K186: =IF(RC[-1]=0,0,RC[-3]/RC[-1]) -> 1 | L186: =IF(RC[-2]=0,0,RC[-3]/RC[-2]) -> 0 | M186: =IF(R[61]C[-3]=0,0,RC[-3]/R[61]C[-3]) -> 3.8610038610038624E-3
A187: EA-18G | B187: 213A_EXP | C187: 25D1A | D187: Departure | E187: 25 | F187: Based | G187: Departure | H187: 0.2857142857142857 | I187: 0 | J187: =SUM(RC[-2]:RC[-1]) -> 0.2857142857142857 | K187: =IF(RC[-1]=0,0,RC[-3]/RC[-1]) -> 1 | L187: =IF(RC[-2]=0,0,RC[-3]/RC[-2]) -> 0 | M187: =IF(R[60]C[-3]=0,0,RC[-3]/R[60]C[-3]) -> 7.7220077220077248E-3
A188: EA-18G | B188: 213A_FLT | C188: 25D1A | D188: Departure | E188: 25 | F188: Based | G188: Departure | H188: 0.2857142857142857 | I188: 0 | J188: =SUM(RC[-2]:RC[-1]) -> 0.2857142857142857 | K188: =IF(RC[-1]=0,0,RC[-3]/RC[-1]) -> 1 | L188: =IF(RC[-2]=0,0,RC[-3]/RC[-2]) -> 0 | M188: =IF(R[59]C[-3]=0,0,RC[-3]/R[59]C[-3]) -> 7.7220077220077248E-3
A189: EA-18G | B189: 213A_FRS | C189: 25D1A | D189: Departure | E189: 25 | F189: Based | G189: Departure | H189: 0.2857142857142857 | I189: 0 | J189: =SUM(RC[-2]:RC[-1]) -> 0.2857142857142857 | K189: =IF(RC[-1]=0,0,RC[-3]/RC[-1]) -> 1 | L189: =IF(RC[-2]=0,0,RC[-3]/RC[-2]) -> 0 | M189: =IF(R[58]C[-3]=0,0,RC[-3]/R[58]C[-3]) -> 7.7220077220077248E-3
A190: EA-18G | B190: 214A_EXP | C190: 25D1B | D190: Departure | E190: 25 | F190: Based | G190: Departure | H190: 0.42857142857142855 | I190: 0 | J190: =SUM(RC[-2]:RC[-1]) -> 0.42857142857142855 | K190: =IF(RC[-1]=0,0,RC[-3]/RC[-1]) -> 1 | L190: =IF(RC[-2]=0,0,RC[-3]/RC[-2]) -> 0 | M190: =IF(R[57]C[-3]=0,0,RC[-3]/R[57]C[-3]) -> 1.1583011583011588E-2
A191: EA-18G | B191: 214A_FLT | C191: 25D1B | D191: Departure | E191: 25 | F191: Based | G191: Departure | H191: 0.7142857142857143 | I191: 0 | J191: =SUM(RC[-2]:RC[-1]) -> 0.7142857142857143 | K191: =IF(RC[-1]=0,0,RC[-3]/RC[-1]) -> 1 | L191: =IF(RC[-2]=0,0,RC[-3]/RC[-2]) -> 0 | M191: =IF(R[56]C[-3]=0,0,RC[-3]/R[56]C[-3]) -> 1.9305019305019312E-2
A192: EA-18G | B192: 214A_FRS | C192: 25D1B | D192: Departure | E192: 25 | F192: Based | G192: Departure | H192: 0.14285714285714285 | I192: 0 | J192: =SUM(RC[-2]:RC[-1]) -> 0.14285714285714285 | K192: =IF(RC[-1]=0,0,RC[-3]/RC[-1]) -> 1 | L192: =IF(RC[-2]=0,0,RC[-3]/RC[-2]) -> 0 | M192: =IF(R[55]C[-3]=0,0,RC[-3]/R[55]C[-3]) -> 3.8610038610038624E-3
A193: EA-18G | B193: 215A_EXP | C193: 25D1C | D193: Departure | E193: 25 | F193: Based | G193: Departure | H193: 0.14285714285714285 | I193: 0 | J193: =SUM(RC[-2]:RC[-1]) -> 0.14285714285714285 | K193: =IF(RC[-1]=0,0,RC[-3]/RC[-1]) -> 1 | L193: =IF(RC[-2]=0,0,RC[-3]/RC[-2]) -> 0 | M193: =IF(R[54]C[-3]=0,0,RC[-3]/R[54]C[-3]) -> 3.8610038610038624E-3
A194: EA-18G | B194: 215A_FLT | C194: 25D1C | D194: Departure | E194: 25 | F194: Based | G194: Departure | H194: 0.14285714285714285 | I194: 0 | J194: =SUM(RC[-2]:RC[-1]) -> 0.14285714285714285 | K194: =IF(RC[-1]=0,0,RC[-3]/RC[-1]) -> 1 | L194: =IF(RC[-2]=0,0,RC[-3]/RC[-2]) -> 0 | M194: =IF(R[53]C[-3]=0,0,RC[-3]/R[53]C[-3]) -> 3.8610038610038624E-3
A195: EA-18G | B195: 215A_FRS | C195: 25D1C | D195: Departure | E195: 25 | F195: Based | G195: Departure | H195: 0 | I195: 0 | J195: =SUM(RC[-2]:RC[-1]) -> 0 | K195: =IF(RC[-1]=0,0,RC[-3]/RC[-1]) -> 0 | L195: =IF(RC[-2]=0,0,RC[-3]/RC[-2]) -> 0 | M195: =IF(R[52]C[-3]=0,0,RC[-3]/R[52]C[-3]) -> 0
A196: EA-18G | B196: 216A_EXP | C196: 25D2A | D196: Departure | E196: 25 | F196: Based | G196: Departure | H196: 0.14285714285714285 | I196: 0 | J196: =SUM(RC[-2]:RC[-1]) -> 0.14285714285714285 | K196: =IF(RC[-1]=0,0,RC[-3]/RC[-1]) -> 1 | L196: =IF(RC[-2]=0,0,RC[-3]/RC[-2]) -> 0 | M196: =IF(R[51]C[-3]=0,0,RC[-3]/R[51]C[-3]) -> 3.8610038610038624E-3
A197: EA-18G | B197: 216A_FLT | C197: 25D2A | D197: Departure | E197: 25 | F197: Based | G197: Departure | H197: 0.42857142857142855 | I197: 0 | J197: =SUM(RC[-2]:RC[-1]) -> 0.42857142857142855 | K197: =IF(RC[-1]=0,0,RC[-3]/RC[-1]) -> 1 | L197: =IF(RC[-2]=0,0,RC[-3]/RC[-2]) -> 0 | M197: =IF(R[50]C[-3]=0,0,RC[-3]/R[50]C[-3]) -> 1.1583011583011588E-2
A198: EA-18G | B198: 216A_FRS | C198: 25D2A | D198: Departure | E198: 25 | F198: Based | G198: Departure | H198: 0.42857142857142855 | I198: 0 | J198: =SUM(RC[-2]:RC[-1]) -> 0.42857142857142855 | K198: =IF(RC[-1]=0,0,RC[-3]/RC[-1]) -> 1 | L198: =IF(RC[-2]=0,0,RC[-3]/RC[-2]) -> 0 | M198: =IF(R[49]C[-3]=0,0,RC[-3]/R[49]C[-3]) -> 1.1583011583011588E-2
A199: EA-18G | B199: 217A_EXP | C199: 25D2B | D199: Departure | E199: 25 | F199: Based | G199: Departure | H199: 0.14285714285714285 | I199: 0 | J199: =SUM(RC[-2]:RC[-1]) -> 0.14285714285714285 | K199: =IF(RC[-1]=0,0,RC[-3]/RC[-1]) -> 1 | L199: =IF(RC[-2]=0,0,RC[-3]/RC[-2]) -> 0 | M199: =IF(R[48]C[-3]=0,0,RC[-3]/R[48]C[-3]) -> 3.8610038610038624E-3
A200: EA-18G | B200: 217A_FLT | C200: 25D2B | D200: Departure | E200: 25 | F200: Based | G200: Departure | H200: 0.42857142857142855 | I200: 0 | J200: =SUM(RC[-2]:RC[-1]) -> 0.42857142857142855 | K200: =IF(RC[-1]=0,0,RC[-3]/RC[-1]) -> 1 | L200: =IF(RC[-2]=0,0,RC[-3]/RC[-2]) -> 0 | M200: =IF(R[47]C[-3]=0,0,RC[-3]/R[47]C[-3]) -> 1.1583011583011588E-2
A201: EA-18G | B201: 217A_FRS | C201: 25D2B | D201: Departure | E201: 25 | F201: Based | G201: Departure | H201: 0.42857142857142855 | I201: 0 | J201: =SUM(RC[-2]:RC[-1]) -> 0.42857142857142855 | K201: =IF(RC[-1]=0,0,RC[-3]/RC[-1]) -> 1 | L201: =IF(RC[-2]=0,0,RC[-3]/RC[-2]) -> 0 | M201: =IF(R[46]C[-3]=0,0,RC[-3]/R[46]C[-3]) -> 1.1583011583011588E-2
A202: EA-18G | B202: 218A_EXP | C202: 25D2C | D202: Departure | E202: 25 | F202: Based | G202: Departure | H202: 0 | I202: 0 | J202: =SUM(RC[-2]:RC[-1]) -> 0 | K202: =IF(RC[-1]=0,0,RC[-3]/RC[-1]) -> 0 | L202: =IF(RC[-2]=0,0,RC[-3]/RC[-2]) -> 0 | M202: =IF(R[45]C[-3]=0,0,RC[-3]/R[45]C[-3]) -> 0
A203: EA-18G | B203: 218A_FLT | C203: 25D2C | D203: Departure | E203: 25 | F203: Based | G203: Departure | H203: 0 | I203: 0 | J203: =SUM(RC[-2]:RC[-1]) -> 0 | K203: =IF(RC[-1]=0,0,RC[-3]/RC[-1]) -> 0 | L203: =IF(RC[-2]=0,0,RC[-3]/RC[-2]) -> 0 | M203: =IF(R[44]C[-3]=0,0,RC[-3]/R[44]C[-3]) -> 0
A204: EA-18G | B204: 218A_FRS | C204: 25D2C | D204: Departure | E204: 25 | F204: Based | G204: Departure | H204: 0.14285714285714285 | I204: 0 | J204: =SUM(RC[-2]:RC[-1]) -> 0.14285714285714285 | K204: =IF(RC[-1]=0,0,RC[-3]/RC[-1]) -> 1 | L204: =IF(RC[-2]=0,0,RC[-3]/RC[-2]) -> 0 | M204: =IF(R[43]C[-3]=0,0,RC[-3]/R[43]C[-3]) -> 3.8610038610038624E-3
A205: EA-18G | B205: 219A_EXP | C205: 32D1A | D205: Departure | E205: 32 | F205: Based | G205: Departure | H205: 0 | I205: 0 | J205: =SUM(RC[-2]:RC[-1]) -> 0 | K205: =IF(RC[-1]=0,0,RC[-3]/RC[-1]) -> 0 | L205: =IF(RC[-2]=0,0,RC[-3]/RC[-2]) -> 0 | M205: =IF(R[42]C[-3]=0,0,RC[-3]/R[42]C[-3]) -> 0
A206: EA-18G | B206: 219A_FLT | C206: 32D1A | D206: Departure | E206: 32 | F206: Based | G206: Departure | H206: 0 | I206: 0 | J206: =SUM(RC[-2]:RC[-1]) -> 0 | K206: =IF(RC[-1]=0,0,RC[-3]/RC[-1]) -> 0 | L206: =IF(RC[-2]=0,0,RC[-3]/RC[-2]) -> 0 | M206: =IF(R[41]C[-3]=0,0,RC[-3]/R[41]C[-3]) -> 0
A207: EA-18G | B207: 219A_FRS | C207: 32D1A | D207: Departure | E207: 32 | F207: Based | G207: Departure | H207: 0 | I207: 0 | J207: =SUM(RC[-2]:RC[-1]) -> 0 | K207: =IF(RC[-1]=0,0,RC[-3]/RC[-1]) -> 0 | L207: =IF(RC[-2]=0,0,RC[-3]/RC[-2]) -> 0 | M207: =IF(R[40]C[-3]=0,0,RC[-3]/R[40]C[-3]) -> 0
A208: EA-18G | B208: 220A_EXP | C208: 32D1B | D208: Departure | E208: 32 | F208: Based | G208: Departure | H208: 0 | I208: 0 | J208: =SUM(RC[-2]:RC[-1]) -> 0 | K208: =IF(RC[-1]=0,0,RC[-3]/RC[-1]) -> 0 | L208: =IF(RC[-2]=0,0,RC[-3]/RC[-2]) -> 0 | M208: =IF(R[39]C[-3]=0,0,RC[-3]/R[39]C[-3]) -> 0
A209: EA-18G | B209: 220A_FLT | C209: 32D1B | D209: Departure | E209: 32 | F209: Based | G209: Departure | H209: 0 | I209: 0 | J209: =SUM(RC[-2]:RC[-1]) -> 0 | K209: =IF(RC[-1]=0,0,RC[-3]/RC[-1]) -> 0 | L209: =IF(RC[-2]=0,0,RC[-3]/RC[-2]) -> 0 | M209: =IF(R[38]C[-3]=0,0,RC[-3]/R[38]C[-3]) -> 0
A210: EA-18G | B210: 220A_FRS | C210: 32D1B | D210: Departure | E210: 32 | F210: Based | G210: Departure | H210: 0 | I210: 0 | J210: =SUM(RC[-2]:RC[-1]) -> 0 | K210: =IF(RC[-1]=0,0,RC[-3]/RC[-1]) -> 0 | L210: =IF(RC[-2]=0,0,RC[-3]/RC[-2]) -> 0 | M210: =IF(R[37]C[-3]=0,0,RC[-3]/R[37]C[-3]) -> 0
A211: EA-18G | B211: 221A_EXP | C211: 32D1C | D211: Departure | E211: 32 | F211: Based | G211: Departure | H211: 0 | I211: 0 | J211: =SUM(RC[-2]:RC[-1]) -> 0 | K211: =IF(RC[-1]=0,0,RC[-3]/RC[-1]) -> 0 | L211: =IF(RC[-2]=0,0,RC[-3]/RC[-2]) -> 0 | M211: =IF(R[36]C[-3]=0,0,RC[-3]/R[36]C[-3]) -> 0
A212: EA-18G | B212: 221A_FLT | C212: 32D1C | D212: Departure | E212: 32 | F212: Based | G212: Departure | H212: 0 | I212: 0 | J212: =SUM(RC[-2]:RC[-1]) -> 0 | K212: =IF(RC[-1]=0,0,RC[-3]/RC[-1]) -> 0 | L212: =IF(RC[-2]=0,0,RC[-3]/RC[-2]) -> 0 | M212: =IF(R[35]C[-3]=0,0,RC[-3]/R[35]C[-3]) -> 0
A213: EA-18G | B213: 221A_FRS | C213: 32D1C | D213: Departure | E213: 32 | F213: Based | G213: Departure | H213: 0 | I213: 0 | J213: =SUM(RC[-2]:RC[-1]) -> 0 | K213: =IF(RC[-1]=0,0,RC[-3]/RC[-1]) -> 0 | L213: =IF(RC[-2]=0,0,RC[-3]/RC[-2]) -> 0 | M213: =IF(R[34]C[-3]=0,0,RC[-3]/R[34]C[-3]) -> 0
A214: EA-18G | B214: 222A_EXP | C214: 32D2A | D214: Departure | E214: 32 | F214: Based | G214: Departure | H214: 0 | I214: 0 | J214: =SUM(RC[-2]:RC[-1]) -> 0 | K214: =IF(RC[-1]=0,0,RC[-3]/RC[-1]) -> 0 | L214: =IF(RC[-2]=0,0,RC[-3]/RC[-2]) -> 0 | M214: =IF(R[33]C[-3]=0,0,RC[-3]/R[33]C[-3]) -> 0
A215: EA-18G | B215: 222A_FLT | C215: 32D2A | D215: Departure | E215: 32 | F215: Based | G215: Departure | H215: 0 | I215: 0 | J215: =SUM(RC[-2]:RC[-1]) -> 0 | K215: =IF(RC[-1]=0,0,RC[-3]/RC[-1]) -> 0 | L215: =IF(RC[-2]=0,0,RC[-3]/RC[-2]) -> 0 | M215: =IF(R[32]C[-3]=0,0,RC[-3]/R[32]C[-3]) -> 0
A216: EA-18G | B216: 222A_FRS | C216: 32D2A | D216: Departure | E216: 32 | F216: Based | G216: Departure | H216: 0 | I216: 0 | J216: =SUM(RC[-2]:RC[-1]) -> 0 | K216: =IF(RC[-1]=0,0,RC[-3]/RC[-1]) -> 0 | L216: =IF(RC[-2]=0,0,RC[-3]/RC[-2]) -> 0 | M216: =IF(R[31]C[-3]=0,0,RC[-3]/R[31]C[-3]) -> 0
A217: EA-18G | B217: 223A_EXP | C217: 32D2B | D217: Departure | E217: 32 | F217: Based | G217: Departure | H217: 0 | I217: 0 | J217: =SUM(RC[-2]:RC[-1]) -> 0 | K217: =IF(RC[-1]=0,0,RC[-3]/RC[-1]) -> 0 | L217: =IF(RC[-2]=0,0,RC[-3]/RC[-2]) -> 0 | M217: =IF(R[30]C[-3]=0,0,RC[-3]/R[30]C[-3]) -> 0
A218: EA-18G | B218: 223A_FLT | C218: 32D2B | D218: Departure | E218: 32 | F218: Based | G218: Departure | H218: 0 | I218: 0 | J218: =SUM(RC[-2]:RC[-1]) -> 0 | K218: =IF(RC[-1]=0,0,RC[-3]/RC[-1]) -> 0 | L218: =IF(RC[-2]=0,0,RC[-3]/RC[-2]) -> 0 | M218: =IF(R[29]C[-3]=0,0,RC[-3]/R[29]C[-3]) -> 0
A219: EA-18G | B219: 223A_FRS | C219: 32D2B | D219: Departure | E219: 32 | F219: Based | G219: Departure | H219: 0 | I219: 0 | J219: =SUM(RC[-2]:RC[-1]) -> 0 | K219: =IF(RC[-1]=0,0,RC[-3]/RC[-1]) -> 0 | L219: =IF(RC[-2]=0,0,RC[-3]/RC[-2]) -> 0 | M219: =IF(R[28]C[-3]=0,0,RC[-3]/R[28]C[-3]) -> 0
A220: EA-18G | B220: 224A_EXP | C220: 32D2C | D220: Departure | E220: 32 | F220: Based | G220: Departure | H220: 0 | I220: 0 | J220: =SUM(RC[-2]:RC[-1]) -> 0 | K220: =IF(RC[-1]=0,0,RC[-3]/RC[-1]) -> 0 | L220: =IF(RC[-2]=0,0,RC[-3]/RC[-2]) -> 0 | M220: =IF(R[27]C[-3]=0,0,RC[-3]/R[27]C[-3]) -> 0
A221: EA-18G | B221: 224A_FLT | C221: 32D2C | D221: Departure | E221: 32 | F221: Based | G221: Departure | H221: 0 | I221: 0 | J221: =SUM(RC[-2]:RC[-1]) -> 0 | K221: =IF(RC[-1]=0,0,RC[-3]/RC[-1]) -> 0 | L221: =IF(RC[-2]=0,0,RC[-3]/RC[-2]) -> 0 | M221: =IF(R[26]C[-3]=0,0,RC[-3]/R[26]C[-3]) -> 0
A222: EA-18G | B222: 224A_FRS | C222: 32D2C | D222: Departure | E222: 32 | F222: Based | G222: Departure | H222: 0 | I222: 0 | J222: =SUM(RC[-2]:RC[-1]) -> 0 | K222: =IF(RC[-1]=0,0,RC[-3]/RC[-1]) -> 0 | L222: =IF(RC[-2]=0,0,RC[-3]/RC[-2]) -> 0 | M222: =IF(R[25]C[-3]=0,0,RC[-3]/R[25]C[-3]) -> 0
A223: EA-18G | B223: 247P_FH | C223: 07WC14P | D223: Departure | E223: 07 | F223: Based | G223: Interfacility Ault Field to Coupeville | H223: 0 | I223: 0 | J223: =SUM(RC[-2]:RC[-1]) -> 0 | K223: =IF(RC[-1]=0,0,RC[-3]/RC[-1]) -> 0 | L223: =IF(RC[-2]=0,0,RC[-3]/RC[-2]) -> 0 | M223: =IF(R[24]C[-3]=0,0,RC[-3]/R[24]C[-3]) -> 0
A224: EA-18G | B224: 247P_FL | C224: 07WC14P | D224: Departure | E224: 07 | F224: Based | G224: Interfacility Ault Field to Coupeville | H224: 0 | I224: 0 | J224: =SUM(RC[-2]:RC[-1]) -> 0 | K224: =IF(RC[-1]=0,0,RC[-3]/RC[-1]) -> 0 | L224: =IF(RC[-2]=0,0,RC[-3]/RC[-2]) -> 0 | M224: =IF(R[23]C[-3]=0,0,RC[-3]/R[23]C[-3]) -> 0
A225: EA-18G | B225: 247P_FO | C225: 07WC14P | D225: Departure | E225: 07 | F225: Based | G225: Interfacility Ault Field to Coupeville | H225: 0.2857142857142857 | I225: 0 | J225: =SUM(RC[-2]:RC[-1]) -> 0.2857142857142857 | K225: =IF(RC[-1]=0,0,RC[-3]/RC[-1]) -> 1 | L225: =IF(RC[-2]=0,0,RC[-3]/RC[-2]) -> 0 | M225: =IF(R[22]C[-3]=0,0,RC[-3]/R[22]C[-3]) -> 7.7220077220077248E-3
A226: EA-18G | B226: 248P_FH | C226: 07WC32P | D226: Departure | E226: 07 | F226: Based | G226: Interfacility Ault Field to Coupeville | H226: 0 | I226: 0 | J226: =SUM(RC[-2]:RC[-1]) -> 0 | K226: =IF(RC[-1]=0,0,RC[-3]/RC[-1]) -> 0 | L226: =IF(RC[-2]=0,0,RC[-3]/RC[-2]) -> 0 | M226: =IF(R[21]C[-3]=0,0,RC[-3]/R[21]C[-3]) -> 0
A227: EA-18G | B227: 248P_FL | C227: 07WC32P | D227: Departure | E227: 07 | F227: Based | G227: Interfacility Ault Field to Coupeville | H227: 0 | I227: 0 | J227: =SUM(RC[-2]:RC[-1]) -> 0 | K227: =IF(RC[-1]=0,0,RC[-3]/RC[-1]) -> 0 | L227: =IF(RC[-2]=0,0,RC[-3]/RC[-2]) -> 0 | M227: =IF(R[20]C[-3]=0,0,RC[-3]/R[20]C[-3]) -> 0
A228: EA-18G | B228: 248P_FO | C228: 07WC32P | D228: Departure | E228: 07 | F228: Based | G228: Interfacility Ault Field to Coupeville | H228: 0 | I228: 0 | J228: =SUM(RC[-2]:RC[-1]) -> 0 | K228: =IF(RC[-1]=0,0,RC[-3]/RC[-1]) -> 0 | L228: =IF(RC[-2]=0,0,RC[-3]/RC[-2]) -> 0 | M228: =IF(R[19]C[-3]=0,0,RC[-3]/R[19]C[-3]) -> 0
A229: EA-18G | B229: 249P_FH | C229: 14WC14P | D229: Departure | E229: 14 | F229: Based | G229: Interfacility Ault Field to Coupeville | H229: 0 | I229: 0 | J229: =SUM(RC[-2]:RC[-1]) -> 0 | K229: =IF(RC[-1]=0,0,RC[-3]/RC[-1]) -> 0 | L229: =IF(RC[-2]=0,0,RC[-3]/RC[-2]) -> 0 | M229: =IF(R[18]C[-3]=0,0,RC[-3]/R[18]C[-3]) -> 0
A230: EA-18G | B230: 249P_FL | C230: 14WC14P | D230: Departure | E230: 14 | F230: Based | G230: Interfacility Ault Field to Coupeville | H230: 1.5714285714285714 | I230: 0 | J230: =SUM(RC[-2]:RC[-1]) -> 1.5714285714285714 | K230: =IF(RC[-1]=0,0,RC[-3]/RC[-1]) -> 1 | L230: =IF(RC[-2]=0,0,RC[-3]/RC[-2]) -> 0 | M230: =IF(R[17]C[-3]=0,0,RC[-3]/R[17]C[-3]) -> 4.2471042471042483E-2
A231: EA-18G | B231: 249P_FO | C231: 14WC14P | D231: Departure | E231: 14 | F231: Based | G231: Interfacility Ault Field to Coupeville | H231: 2.8571428571428572 | I231: 0 | J231: =SUM(RC[-2]:RC[-1]) -> 2.8571428571428572 | K231: =IF(RC[-1]=0,0,RC[-3]/RC[-1]) -> 1 | L231: =IF(RC[-2]=0,0,RC[-3]/RC[-2]) -> 0 | M231: =IF(R[16]C[-3]=0,0,RC[-3]/R[16]C[-3]) -> 7.7220077220077246E-2
A232: EA-18G | B232: 250P_FH | C232: 14WC32P | D232: Departure | E232: 14 | F232: Based | G232: Interfacility Ault Field to Coupeville | H232: 0 | I232: 0 | J232: =SUM(RC[-2]:RC[-1]) -> 0 | K232: =IF(RC[-1]=0,0,RC[-3]/RC[-1]) -> 0 | L232: =IF(RC[-2]=0,0,RC[-3]/RC[-2]) -> 0 | M232: =IF(R[15]C[-3]=0,0,RC[-3]/R[15]C[-3]) -> 0
A233: EA-18G | B233: 250P_FL | C233: 14WC32P | D233: Departure | E233: 14 | F233: Based | G233: Interfacility Ault Field to Coupeville | H233: 0 | I233: 0 | J233: =SUM(RC[-2]:RC[-1]) -> 0 | K233: =IF(RC[-1]=0,0,RC[-3]/RC[-1]) -> 0 | L233: =IF(RC[-2]=0,0,RC[-3]/RC[-2]) -> 0 | M233: =IF(R[14]C[-3]=0,0,RC[-3]/R[14]C[-3]) -> 0
A234: EA-18G | B234: 250P_FO | C234: 14WC32P | D234: Departure | E234: 14 | F234: Based | G234: Interfacility Ault Field to Coupeville | H234: 0 | I234: 0 | J234: =SUM(RC[-2]:RC[-1]) -> 0 | K234: =IF(RC[-1]=0,0,RC[-3]/RC[-1]) -> 0 | L234: =IF(RC[-2]=0,0,RC[-3]/RC[-2]) -> 0 | M234: =IF(R[13]C[-3]=0,0,RC[-3]/R[13]C[-3]) -> 0
A235: EA-18G | B235: 251P_FH | C235: 25WC14P | D235: Departure | E235: 25 | F235: Based | G235: Interfacility Ault Field to Coupeville | H235: 0 | I235: 0 | J235: =SUM(RC[-2]:RC[-1]) -> 0 | K235: =IF(RC[-1]=0,0,RC[-3]/RC[-1]) -> 0 | L235: =IF(RC[-2]=0,0,RC[-3]/RC[-2]) -> 0 | M235: =IF(R[12]C[-3]=0,0,RC[-3]/R[12]C[-3]) -> 0
A236: EA-18G | B236: 251P_FL | C236: 25WC14P | D236: Departure | E236: 25 | F236: Based | G236: Interfacility Ault Field to Coupeville | H236: 0 | I236: 0 | J236: =SUM(RC[-2]:RC[-1]) -> 0 | K236: =IF(RC[-1]=0,0,RC[-3]/RC[-1]) -> 0 | L236: =IF(RC[-2]=0,0,RC[-3]/RC[-2]) -> 0 | M236: =IF(R[11]C[-3]=0,0,RC[-3]/R[11]C[-3]) -> 0
A237: EA-18G | B237: 251P_FO | C237: 25WC14P | D237: Departure | E237: 25 | F237: Based | G237: Interfacility Ault Field to Coupeville | H237: 0 | I237: 0 | J237: =SUM(RC[-2]:RC[-1]) -> 0 | K237: =IF(RC[-1]=0,0,RC[-3]/RC[-1]) -> 0 | L237: =IF(RC[-2]=0,0,RC[-3]/RC[-2]) -> 0 | M237: =IF(R[10]C[-3]=0,0,RC[-3]/R[10]C[-3]) -> 0
A238: EA-18G | B238: 252P_FH | C238: 25WC32P | D238: Departure | E238: 25 | F238: Based | G238: Interfacility Ault Field to Coupeville | H238: 0 | I238: 0 | J238: =SUM(RC[-2]:RC[-1]) -> 0 | K238: =IF(RC[-1]=0,0,RC[-3]/RC[-1]) -> 0 | L238: =IF(RC[-2]=0,0,RC[-3]/RC[-2]) -> 0 | M238: =IF(R[9]C[-3]=0,0,RC[-3]/R[9]C[-3]) -> 0
A239: EA-18G | B239: 252P_FL | C239: 25WC32P | D239: Departure | E239: 25 | F239: Based | G239: Interfacility Ault Field to Coupeville | H239: 0.8571428571428571 | I239: 0 | J239: =SUM(RC[-2]:RC[-1]) -> 0.8571428571428571 | K239: =IF(RC[-1]=0,0,RC[-3]/RC[-1]) -> 1 | L239: =IF(RC[-2]=0,0,RC[-3]/RC[-2]) -> 0 | M239: =IF(R[8]C[-3]=0,0,RC[-3]/R[8]C[-3]) -> 2.3166023166023175E-2
A240: EA-18G | B240: 252P_FO | C240: 25WC32P | D240: Departure | E240: 25 | F240: Based | G240: Interfacility Ault Field to Coupeville | H240: 1.4285714285714286 | I240: 0 | J240: =SUM(RC[-2]:RC[-1]) -> 1.4285714285714286 | K240: =IF(RC[-1]=0,0,RC[-3]/RC[-1]) -> 1 | L240: =IF(RC[-2]=0,0,RC[-3]/RC[-2]) -> 0 | M240: =IF(R[7]C[-3]=0,0,RC[-3]/R[7]C[-3]) -> 3.8610038610038623E-2
A241: EA-18G | B241: 253P_FH | C241: 32WC14P | D241: Departure | E241: 32 | F241: Based | G241: Interfacility Ault Field to Coupeville | H241: 0 | I241: 0 | J241: =SUM(RC[-2]:RC[-1]) -> 0 | K241: =IF(RC[-1]=0,0,RC[-3]/RC[-1]) -> 0 | L241: =IF(RC[-2]=0,0,RC[-3]/RC[-2]) -> 0 | M241: =IF(R[6]C[-3]=0,0,RC[-3]/R[6]C[-3]) -> 0
A242: EA-18G | B242: 253P_FL | C242: 32WC14P | D242: Departure | E242: 32 | F242: Based | G242: Interfacility Ault Field to Coupeville | H242: 0 | I242: 0 | J242: =SUM(RC[-2]:RC[-1]) -> 0 | K242: =IF(RC[-1]=0,0,RC[-3]/RC[-1]) -> 0 | L242: =IF(RC[-2]=0,0,RC[-3]/RC[-2]) -> 0 | M242: =IF(R[5]C[-3]=0,0,RC[-3]/R[5]C[-3]) -> 0
A243: EA-18G | B243: 253P_FO | C243: 32WC14P | D243: Departure | E243: 32 | F243: Based | G243: Interfacility Ault Field to Coupeville | H243: 0 | I243: 0 | J243: =SUM(RC[-2]:RC[-1]) -> 0 | K243: =IF(RC[-1]=0,0,RC[-3]/RC[-1]) -> 0 | L243: =IF(RC[-2]=0,0,RC[-3]/RC[-2]) -> 0 | M243: =IF(R[4]C[-3]=0,0,RC[-3]/R[4]C[-3]) -> 0
A244: EA-18G | B244: 254P_FH | C244: 32WC32P | D244: Departure | E244: 32 | F244: Based | G244: Interfacility Ault Field to Coupeville | H244: 0 | I244: 0 | J244: =SUM(RC[-2]:RC[-1]) -> 0 | K244: =IF(RC[-1]=0,0,RC[-3]/RC[-1]) -> 0 | L244: =IF(RC[-2]=0,0,RC[-3]/RC[-2]) -> 0 | M244: =IF(R[3]C[-3]=0,0,RC[-3]/R[3]C[-3]) -> 0
A245: EA-18G | B245: 254P_FL | C245: 32WC32P | D245: Departure | E245: 32 | F245: Based | G245: Interfacility Ault Field to Coupeville | H245: 0 | I245: 0 | J245: =SUM(RC[-2]:RC[-1]) -> 0 | K245: =IF(RC[-1]=0,0,RC[-3]/RC[-1]) -> 0 | L245: =IF(RC[-2]=0,0,RC[-3]/RC[-2]) -> 0 | M245: =IF(R[2]C[-3]=0,0,RC[-3]/R[2]C[-3]) -> 0
A246: EA-18G | B246: 254P_FO | C246: 32WC32P | D246: Departure | E246: 32 | F246: Based | G246: Interfacility Ault Field to Coupeville | H246: 0 | I246: 0 | J246: =SUM(RC[-2]:RC[-1]) -> 0 | K246: =IF(RC[-1]=0,0,RC[-3]/RC[-1]) -> 0 | L246: =IF(RC[-2]=0,0,RC[-3]/RC[-2]) -> 0 | M246: =IF(R[1]C[-3]=0,0,RC[-3]/R[1]C[-3]) -> 0
G247: Subtotal | H247: 36.999999999999986 | I247: 0 | J247: =SUM(R[-96]C:R[-1]C) -> 36.999999999999986 | K247: =IF(RC[-1]=0,0,RC[-3]/RC[-1]) -> 1 | L247: =IF(RC[-2]=0,0,RC[-3]/RC[-2]) -> 0
A249: EA-18G | B249: 263L | C249: 07PL | D249: Closed Pattern | E249: 07 | F249: Based | G249: Depart and Re-enter Pattern | H249: 0 | I249: 0 | J249: =SUM(RC[-2]:RC[-1]) -> 0 | K249: =IF(RC[-1]=0,0,RC[-3]/RC[-1]) -> 0 | L249: =IF(RC[-2]=0,0,RC[-3]/RC[-2]) -> 0 | M249: =IF(R[68]C[-3]=0,0,RC[-3]/R[68]C[-3]) -> 0
A250: EA-18G | B250: 263R | C250: 07PR | D250: Closed Pattern | E250: 07 | F250: Based | G250: Depart and Re-enter Pattern | H250: 0 | I250: 0 | J250: =SUM(RC[-2]:RC[-1]) -> 0 | K250: =IF(RC[-1]=0,0,RC[-3]/RC[-1]) -> 0 | L250: =IF(RC[-2]=0,0,RC[-3]/RC[-2]) -> 0 | M250: =IF(R[67]C[-3]=0,0,RC[-3]/R[67]C[-3]) -> 0
A251: EA-18G | B251: 264L | C251: 14PL | D251: Closed Pattern | E251: 14 | F251: Based | G251: Depart and Re-enter Pattern | H251: 0.5714285714285714 | I251: 0 | J251: =SUM(RC[-2]:RC[-1]) -> 0.5714285714285714 | K251: =IF(RC[-1]=0,0,RC[-3]/RC[-1]) -> 1 | L251: =IF(RC[-2]=0,0,RC[-3]/RC[-2]) -> 0 | M251: =IF(R[66]C[-3]=0,0,RC[-3]/R[66]C[-3]) -> 5.7553708401258692E-3
A252: EA-18G | B252: 264R | C252: 14PR | D252: Closed Pattern | E252: 14 | F252: Based | G252: Depart and Re-enter Pattern | H252: 0 | I252: 0 | J252: =SUM(RC[-2]:RC[-1]) -> 0 | K252: =IF(RC[-1]=0,0,RC[-3]/RC[-1]) -> 0 | L252: =IF(RC[-2]=0,0,RC[-3]/RC[-2]) -> 0 | M252: =IF(R[65]C[-3]=0,0,RC[-3]/R[65]C[-3]) -> 0
A253: EA-18G | B253: 265L | C253: 25PL | D253: Closed Pattern | E253: 25 | F253: Based | G253: Depart and Re-enter Pattern | H253: 0 | I253: 0 | J253: =SUM(RC[-2]:RC[-1]) -> 0 | K253: =IF(RC[-1]=0,0,RC[-3]/RC[-1]) -> 0 | L253: =IF(RC[-2]=0,0,RC[-3]/RC[-2]) -> 0 | M253: =IF(R[64]C[-3]=0,0,RC[-3]/R[64]C[-3]) -> 0
A254: EA-18G | B254: 265R | C254: 25PR | D254: Closed Pattern | E254: 25 | F254: Based | G254: Depart and Re-enter Pattern | H254: 0 | I254: 0 | J254: =SUM(RC[-2]:RC[-1]) -> 0 | K254: =IF(RC[-1]=0,0,RC[-3]/RC[-1]) -> 0 | L254: =IF(RC[-2]=0,0,RC[-3]/RC[-2]) -> 0 | M254: =IF(R[63]C[-3]=0,0,RC[-3]/R[63]C[-3]) -> 0
A255: EA-18G | B255: 266L | C255: 32PL | D255: Closed Pattern | E255: 32 | F255: Based | G255: Depart and Re-enter Pattern | H255: 0 | I255: 0 | J255: =SUM(RC[-2]:RC[-1]) -> 0 | K255: =IF(RC[-1]=0,0,RC[-3]/RC[-1]) -> 0 | L255: =IF(RC[-2]=0,0,RC[-3]/RC[-2]) -> 0 | M255: =IF(R[62]C[-3]=0,0,RC[-3]/R[62]C[-3]) -> 0
A256: EA-18G | B256: 266R | C256: 32PR | D256: Closed Pattern | E256: 32 | F256: Based | G256: Depart and Re-enter Pattern | H256: 0 | I256: 0 | J256: =SUM(RC[-2]:RC[-1]) -> 0 | K256: =IF(RC[-1]=0,0,RC[-3]/RC[-1]) -> 0 | L256: =IF(RC[-2]=0,0,RC[-3]/RC[-2]) -> 0 | M256: =IF(R[61]C[-3]=0,0,RC[-3]/R[61]C[-3]) -> 0
A257: EA-18G | B257: 267A | C257: 07F1B | D257: Closed Pattern | E257: 07 | F257: Based | G257: Touch and Go at Ault Field | H257: 0.14285714285714285 | I257: 0 | J257: =SUM(RC[-2]:RC[-1]) -> 0.14285714285714285 | K257: =IF(RC[-1]=0,0,RC[-3]/RC[-1]) -> 1 | L257: =IF(RC[-2]=0,0,RC[-3]/RC[-2]) -> 0 | M257: =IF(R[60]C[-3]=0,0,RC[-3]/R[60]C[-3]) -> 1.4388427100314673E-3
A258: EA-18G | B258: 267B | C258: 07F1C | D258: Closed Pattern | E258: 07 | F258: Based | G258: Touch and Go at Ault Field | H258: 0 | I258: 0 | J258: =SUM(RC[-2]:RC[-1]) -> 0 | K258: =IF(RC[-1]=0,0,RC[-3]/RC[-1]) -> 0 | L258: =IF(RC[-2]=0,0,RC[-3]/RC[-2]) -> 0 | M258: =IF(R[59]C[-3]=0,0,RC[-3]/R[59]C[-3]) -> 0
A259: EA-18G | B259: 268A | C259: 14F1B | D259: Closed Pattern | E259: 14 | F259: Based | G259: Touch and Go at Ault Field | H259: 1 | I259: 0 | J259: =SUM(RC[-2]:RC[-1]) -> 1 | K259: =IF(RC[-1]=0,0,RC[-3]/RC[-1]) -> 1 | L259: =IF(RC[-2]=0,0,RC[-3]/RC[-2]) -> 0 | M259: =IF(R[58]C[-3]=0,0,RC[-3]/R[58]C[-3]) -> 1.0071898970220271E-2
A260: EA-18G | B260: 268B | C260: 14F1C | D260: Closed Pattern | E260: 14 | F260: Based | G260: Touch and Go at Ault Field | H260: 0 | I260: 0 | J260: =SUM(RC[-2]:RC[-1]) -> 0 | K260: =IF(RC[-1]=0,0,RC[-3]/RC[-1]) -> 0 | L260: =IF(RC[-2]=0,0,RC[-3]/RC[-2]) -> 0 | M260: =IF(R[57]C[-3]=0,0,RC[-3]/R[57]C[-3]) -> 0
A261: EA-18G | B261: 269A | C261: 25F1B | D261: Closed Pattern | E261: 25 | F261: Based | G261: Touch and Go at Ault Field | H261: 0 | I261: 0 | J261: =SUM(RC[-2]:RC[-1]) -> 0 | K261: =IF(RC[-1]=0,0,RC[-3]/RC[-1]) -> 0 | L261: =IF(RC[-2]=0,0,RC[-3]/RC[-2]) -> 0 | M261: =IF(R[56]C[-3]=0,0,RC[-3]/R[56]C[-3]) -> 0
A262: EA-18G | B262: 269B | C262: 25F1C | D262: Closed Pattern | E262: 25 | F262: Based | G262: Touch and Go at Ault Field | H262: 0 | I262: 0 | J262: =SUM(RC[-2]:RC[-1]) -> 0 | K262: =IF(RC[-1]=0,0,RC[-3]/RC[-1]) -> 0 | L262: =IF(RC[-2]=0,0,RC[-3]/RC[-2]) -> 0 | M262: =IF(R[55]C[-3]=0,0,RC[-3]/R[55]C[-3]) -> 0
A263: EA-18G | B263: 270B | C263: 32F1C | D263: Closed Pattern | E263: 32 | F263: Based | G263: Touch and Go at Ault Field | H263: 0 | I263: 0 | J263: =SUM(RC[-2]:RC[-1]) -> 0 | K263: =IF(RC[-1]=0,0,RC[-3]/RC[-1]) -> 0 | L263: =IF(RC[-2]=0,0,RC[-3]/RC[-2]) -> 0 | M263: =IF(R[54]C[-3]=0,0,RC[-3]/R[54]C[-3]) -> 0
A264: EA-18G | B264: 273PDA | C264: 14FCP1 | D264: Closed Pattern | E264: 14_OLF | F264: Based | G264: FCLP at Coupeville | H264: 15.856999999999999 | I264: 0 | J264: =SUM(RC[-2]:RC[-1]) -> 15.856999999999999 | K264: =IF(RC[-1]=0,0,RC[-3]/RC[-1]) -> 1 | L264: =IF(RC[-2]=0,0,RC[-3]/RC[-2]) -> 0 | M264: =IF(R[53]C[-3]=0,0,RC[-3]/R[53]C[-3]) -> 0.15971010197078284
A265: EA-18G | B265: 273PDB | C265: 14FCP2 | D265: Closed Pattern | E265: 14_OLF | F265: Based | G265: FCLP at Coupeville | H265: 6.8570000000000002 | I265: 0 | J265: =SUM(RC[-2]:RC[-1]) -> 6.8570000000000002 | K265: =IF(RC[-1]=0,0,RC[-3]/RC[-1]) -> 1 | L265: =IF(RC[-2]=0,0,RC[-3]/RC[-2]) -> 0 | M265: =IF(R[52]C[-3]=0,0,RC[-3]/R[52]C[-3]) -> 6.9063011238800404E-2
A266: EA-18G | B266: 273PDC | C266: 14FCP3 | D266: Closed Pattern | E266: 14_OLF | F266: Based | G266: FCLP at Coupeville | H266: 6.4290000000000003 | I266: 0 | J266: =SUM(RC[-2]:RC[-1]) -> 6.4290000000000003 | K266: =IF(RC[-1]=0,0,RC[-3]/RC[-1]) -> 1 | L266: =IF(RC[-2]=0,0,RC[-3]/RC[-2]) -> 0 | M266: =IF(R[51]C[-3]=0,0,RC[-3]/R[51]C[-3]) -> 6.4752238479546129E-2
A267: EA-18G | B267: 273PDX | C267: 14FCPX | D267: Closed Pattern | E267: 14_OLF | F267: Based | G267: FCLP at Coupeville | H267: 17.856999999999999 | I267: 0 | J267: =SUM(RC[-2]:RC[-1]) -> 17.856999999999999 | K267: =IF(RC[-1]=0,0,RC[-3]/RC[-1]) -> 1 | L267: =IF(RC[-2]=0,0,RC[-3]/RC[-2]) -> 0 | M267: =IF(R[50]C[-3]=0,0,RC[-3]/R[50]C[-3]) -> 0.17985389991122339
A268: EA-18G | B268: 273PDY | C268: 14FCPY | D268: Closed Pattern | E268: 14_OLF | F268: Based | G268: FCLP at Coupeville | H268: 0 | I268: 0 | J268: =SUM(RC[-2]:RC[-1]) -> 0 | K268: =IF(RC[-1]=0,0,RC[-3]/RC[-1]) -> 0 | L268: =IF(RC[-2]=0,0,RC[-3]/RC[-2]) -> 0 | M268: =IF(R[50]C[-3]=0,0,RC[-3]/R[50]C[-3]) -> 0
A269: EA-18G | B269: 276PDA | C269: 32FCP1 | D269: Closed Pattern | E269: 32_OLF | F269: Based | G269: FCLP at Coupeville | H269: 18.713999999999999 | I269: 0 | J269: =SUM(RC[-2]:RC[-1]) -> 18.713999999999999 | K269: =IF(RC[-1]=0,0,RC[-3]/RC[-1]) -> 1 | L269: =IF(RC[-2]=0,0,RC[-3]/RC[-2]) -> 0 | M269: =IF(R[48]C[-3]=0,0,RC[-3]/R[48]C[-3]) -> 0.18848551732870214
A270: EA-18G | B270: 276PDB | C270: 32FCP2 | D270: Closed Pattern | E270: 32_OLF | F270: Based | G270: FCLP at Coupeville | H270: 5.4290000000000003 | I270: 0 | J270: =SUM(RC[-2]:RC[-1]) -> 5.4290000000000003 | K270: =IF(RC[-1]=0,0,RC[-3]/RC[-1]) -> 1 | L270: =IF(RC[-2]=0,0,RC[-3]/RC[-2]) -> 0 | M270: =IF(R[47]C[-3]=0,0,RC[-3]/R[47]C[-3]) -> 5.4680339509325861E-2
A271: EA-18G | B271: 276PDC | C271: 32FCP3 | D271: Closed Pattern | E271: 32_OLF | F271: Based | G271: FCLP at Coupeville | H271: 0.42899999999999999 | I271: 0 | J271: =SUM(RC[-2]:RC[-1]) -> 0.42899999999999999 | K271: =IF(RC[-1]=0,0,RC[-3]/RC[-1]) -> 1 | L271: =IF(RC[-2]=0,0,RC[-3]/RC[-2]) -> 0 | M271: =IF(R[46]C[-3]=0,0,RC[-3]/R[46]C[-3]) -> 4.3208446582244965E-3
A272: EA-18G | B272: 276PDX | C272: 32FCPX | D272: Closed Pattern | E272: 32_OLF | F272: Based | G272: FCLP at Coupeville | H272: 3.8570000000000002 | I272: 0 | J272: =SUM(RC[-2]:RC[-1]) -> 3.8570000000000002 | K272: =IF(RC[-1]=0,0,RC[-3]/RC[-1]) -> 1 | L272: =IF(RC[-2]=0,0,RC[-3]/RC[-2]) -> 0 | M272: =IF(R[45]C[-3]=0,0,RC[-3]/R[45]C[-3]) -> 3.8847314328139593E-2
A273: EA-18G | B273: 276PDY | C273: 32FCPY | D273: Closed Pattern | E273: 32_OLF | F273: Based | G273: FCLP at Coupeville | H273: 0 | I273: 0 | J273: =SUM(RC[-2]:RC[-1]) -> 0 | K273: =IF(RC[-1]=0,0,RC[-3]/RC[-1]) -> 0 | L273: =IF(RC[-2]=0,0,RC[-3]/RC[-2]) -> 0 | M273: =IF(R[45]C[-3]=0,0,RC[-3]/R[45]C[-3]) -> 0
A274: EA-18G | B274: 277A_EXP | C274: 07G1A | D274: Closed Pattern | E274: 07 | F274: Based | G274: GCA Pattern | H274: 0 | I274: 0 | J274: =SUM(RC[-2]:RC[-1]) -> 0 | K274: =IF(RC[-1]=0,0,RC[-3]/RC[-1]) -> 0 | L274: =IF(RC[-2]=0,0,RC[-3]/RC[-2]) -> 0 | M274: =IF(R[43]C[-3]=0,0,RC[-3]/R[43]C[-3]) -> 0
A275: EA-18G | B275: 277A_FLT | C275: 07G1A | D275: Closed Pattern | E275: 07 | F275: Based | G275: GCA Pattern | H275: 0 | I275: 0 | J275: =SUM(RC[-2]:RC[-1]) -> 0 | K275: =IF(RC[-1]=0,0,RC[-3]/RC[-1]) -> 0 | L275: =IF(RC[-2]=0,0,RC[-3]/RC[-2]) -> 0 | M275: =IF(R[42]C[-3]=0,0,RC[-3]/R[42]C[-3]) -> 0
A276: EA-18G | B276: 277A_FRS | C276: 07G1A | D276: Closed Pattern | E276: 07 | F276: Based | G276: GCA Pattern | H276: 0 | I276: 0 | J276: =SUM(RC[-2]:RC[-1]) -> 0 | K276: =IF(RC[-1]=0,0,RC[-3]/RC[-1]) -> 0 | L276: =IF(RC[-2]=0,0,RC[-3]/RC[-2]) -> 0 | M276: =IF(R[41]C[-3]=0,0,RC[-3]/R[41]C[-3]) -> 0
A277: EA-18G | B277: 277B_EXP | C277: 07G1B | D277: Closed Pattern | E277: 07 | F277: Based | G277: GCA Pattern | H277: 0 | I277: 0 | J277: =SUM(RC[-2]:RC[-1]) -> 0 | K277: =IF(RC[-1]=0,0,RC[-3]/RC[-1]) -> 0 | L277: =IF(RC[-2]=0,0,RC[-3]/RC[-2]) -> 0 | M277: =IF(R[40]C[-3]=0,0,RC[-3]/R[40]C[-3]) -> 0
A278: EA-18G | B278: 277B_FLT | C278: 07G1B | D278: Closed Pattern | E278: 07 | F278: Based | G278: GCA Pattern | H278: 0 | I278: 0 | J278: =SUM(RC[-2]:RC[-1]) -> 0 | K278: =IF(RC[-1]=0,0,RC[-3]/RC[-1]) -> 0 | L278: =IF(RC[-2]=0,0,RC[-3]/RC[-2]) -> 0 | M278: =IF(R[39]C[-3]=0,0,RC[-3]/R[39]C[-3]) -> 0
A279: EA-18G | B279: 277B_FRS | C279: 07G1B | D279: Closed Pattern | E279: 07 | F279: Based | G279: GCA Pattern | H279: 0 | I279: 0 | J279: =SUM(RC[-2]:RC[-1]) -> 0 | K279: =IF(RC[-1]=0,0,RC[-3]/RC[-1]) -> 0 | L279: =IF(RC[-2]=0,0,RC[-3]/RC[-2]) -> 0 | M279: =IF(R[38]C[-3]=0,0,RC[-3]/R[38]C[-3]) -> 0
A280: EA-18G | B280: 277C_EXP | C280: 07G1C | D280: Closed Pattern | E280: 07 | F280: Based | G280: GCA Pattern | H280: 0 | I280: 0 | J280: =SUM(RC[-2]:RC[-1]) -> 0 | K280: =IF(RC[-1]=0,0,RC[-3]/RC[-1]) -> 0 | L280: =IF(RC[-2]=0,0,RC[-3]/RC[-2]) -> 0 | M280: =IF(R[37]C[-3]=0,0,RC[-3]/R[37]C[-3]) -> 0
A281: EA-18G | B281: 277C_FLT | C281: 07G1C | D281: Closed Pattern | E281: 07 | F281: Based | G281: GCA Pattern | H281: 0 | I281: 0 | J281: =SUM(RC[-2]:RC[-1]) -> 0 | K281: =IF(RC[-1]=0,0,RC[-3]/RC[-1]) -> 0 | L281: =IF(RC[-2]=0,0,RC[-3]/RC[-2]) -> 0 | M281: =IF(R[36]C[-3]=0,0,RC[-3]/R[36]C[-3]) -> 0
A282: EA-18G | B282: 277C_FRS | C282: 07G1C | D282: Closed Pattern | E282: 07 | F282: Based | G282: GCA Pattern | H282: 0 | I282: 0 | J282: =SUM(RC[-2]:RC[-1]) -> 0 | K282: =IF(RC[-1]=0,0,RC[-3]/RC[-1]) -> 0 | L282: =IF(RC[-2]=0,0,RC[-3]/RC[-2]) -> 0 | M282: =IF(R[35]C[-3]=0,0,RC[-3]/R[35]C[-3]) -> 0
A283: EA-18G | B283: 278A_EXP | C283: 14G1A | D283: Closed Pattern | E283: 14 | F283: Based | G283: GCA Pattern | H283: 0 | I283: 0 | J283: =SUM(RC[-2]:RC[-1]) -> 0 | K283: =IF(RC[-1]=0,0,RC[-3]/RC[-1]) -> 0 | L283: =IF(RC[-2]=0,0,RC[-3]/RC[-2]) -> 0 | M283: =IF(R[34]C[-3]=0,0,RC[-3]/R[34]C[-3]) -> 0
A284: EA-18G | B284: 278A_FLT | C284: 14G1A | D284: Closed Pattern | E284: 14 | F284: Based | G284: GCA Pattern | H284: 0 | I284: 0 | J284: =SUM(RC[-2]:RC[-1]) -> 0 | K284: =IF(RC[-1]=0,0,RC[-3]/RC[-1]) -> 0 | L284: =IF(RC[-2]=0,0,RC[-3]/RC[-2]) -> 0 | M284: =IF(R[33]C[-3]=0,0,RC[-3]/R[33]C[-3]) -> 0
A285: EA-18G | B285: 278A_FRS | C285: 14G1A | D285: Closed Pattern | E285: 14 | F285: Based | G285: GCA Pattern | H285: 0 | I285: 0 | J285: =SUM(RC[-2]:RC[-1]) -> 0 | K285: =IF(RC[-1]=0,0,RC[-3]/RC[-1]) -> 0 | L285: =IF(RC[-2]=0,0,RC[-3]/RC[-2]) -> 0 | M285: =IF(R[32]C[-3]=0,0,RC[-3]/R[32]C[-3]) -> 0
A286: EA-18G | B286: 278B_EXP | C286: 14G1B | D286: Closed Pattern | E286: 14 | F286: Based | G286: GCA Pattern | H286: 0 | I286: 0 | J286: =SUM(RC[-2]:RC[-1]) -> 0 | K286: =IF(RC[-1]=0,0,RC[-3]/RC[-1]) -> 0 | L286: =IF(RC[-2]=0,0,RC[-3]/RC[-2]) -> 0 | M286: =IF(R[31]C[-3]=0,0,RC[-3]/R[31]C[-3]) -> 0
A287: EA-18G | B287: 278B_FLT | C287: 14G1B | D287: Closed Pattern | E287: 14 | F287: Based | G287: GCA Pattern | H287: 0 | I287: 0 | J287: =SUM(RC[-2]:RC[-1]) -> 0 | K287: =IF(RC[-1]=0,0,RC[-3]/RC[-1]) -> 0 | L287: =IF(RC[-2]=0,0,RC[-3]/RC[-2]) -> 0 | M287: =IF(R[30]C[-3]=0,0,RC[-3]/R[30]C[-3]) -> 0
A288: EA-18G | B288: 278B_FRS | C288: 14G1B | D288: Closed Pattern | E288: 14 | F288: Based | G288: GCA Pattern | H288: 0.14285714285714285 | I288: 0 | J288: =SUM(RC[-2]:RC[-1]) -> 0.14285714285714285 | K288: =IF(RC[-1]=0,0,RC[-3]/RC[-1]) -> 1 | L288: =IF(RC[-2]=0,0,RC[-3]/RC[-2]) -> 0 | M288: =IF(R[29]C[-3]=0,0,RC[-3]/R[29]C[-3]) -> 1.4388427100314673E-3
A289: EA-18G | B289: 278C_EXP | C289: 14G1C | D289: Closed Pattern | E289: 14 | F289: Based | G289: GCA Pattern | H289: 0 | I289: 0 | J289: =SUM(RC[-2]:RC[-1]) -> 0 | K289: =IF(RC[-1]=0,0,RC[-3]/RC[-1]) -> 0 | L289: =IF(RC[-2]=0,0,RC[-3]/RC[-2]) -> 0 | M289: =IF(R[28]C[-3]=0,0,RC[-3]/R[28]C[-3]) -> 0
A290: EA-18G | B290: 278C_FLT | C290: 14G1C | D290: Closed Pattern | E290: 14 | F290: Based | G290: GCA Pattern | H290: 0 | I290: 0 | J290: =SUM(RC[-2]:RC[-1]) -> 0 | K290: =IF(RC[-1]=0,0,RC[-3]/RC[-1]) -> 0 | L290: =IF(RC[-2]=0,0,RC[-3]/RC[-2]) -> 0 | M290: =IF(R[27]C[-3]=0,0,RC[-3]/R[27]C[-3]) -> 0
A291: EA-18G | B291: 278C_FRS | C291: 14G1C | D291: Closed Pattern | E291: 14 | F291: Based | G291: GCA Pattern | H291: 0.14285714285714285 | I291: 0 | J291: =SUM(RC[-2]:RC[-1]) -> 0.14285714285714285 | K291: =IF(RC[-1]=0,0,RC[-3]/RC[-1]) -> 1 | L291: =IF(RC[-2]=0,0,RC[-3]/RC[-2]) -> 0 | M291: =IF(R[26]C[-3]=0,0,RC[-3]/R[26]C[-3]) -> 1.4388427100314673E-3
A292: EA-18G | B292: 279A_EXP | C292: 25G1A | D292: Closed Pattern | E292: 25 | F292: Based | G292: GCA Pattern | H292: 0 | I292: 0 | J292: =SUM(RC[-2]:RC[-1]) -> 0 | K292: =IF(RC[-1]=0,0,RC[-3]/RC[-1]) -> 0 | L292: =IF(RC[-2]=0,0,RC[-3]/RC[-2]) -> 0 | M292: =IF(R[25]C[-3]=0,0,RC[-3]/R[25]C[-3]) -> 0
A293: EA-18G | B293: 279A_FLT | C293: 25G1A | D293: Closed Pattern | E293: 25 | F293: Based | G293: GCA Pattern | H293: 0 | I293: 0 | J293: =SUM(RC[-2]:RC[-1]) -> 0 | K293: =IF(RC[-1]=0,0,RC[-3]/RC[-1]) -> 0 | L293: =IF(RC[-2]=0,0,RC[-3]/RC[-2]) -> 0 | M293: =IF(R[24]C[-3]=0,0,RC[-3]/R[24]C[-3]) -> 0
A294: EA-18G | B294: 279A_FRS | C294: 25G1A | D294: Closed Pattern | E294: 25 | F294: Based | G294: GCA Pattern | H294: 0 | I294: 0 | J294: =SUM(RC[-2]:RC[-1]) -> 0 | K294: =IF(RC[-1]=0,0,RC[-3]/RC[-1]) -> 0 | L294: =IF(RC[-2]=0,0,RC[-3]/RC[-2]) -> 0 | M294: =IF(R[23]C[-3]=0,0,RC[-3]/R[23]C[-3]) -> 0
A295: EA-18G | B295: 279B_EXP | C295: 25G1B | D295: Closed Pattern | E295: 25 | F295: Based | G295: GCA Pattern | H295: 0 | I295: 0 | J295: =SUM(RC[-2]:RC[-1]) -> 0 | K295: =IF(RC[-1]=0,0,RC[-3]/RC[-1]) -> 0 | L295: =IF(RC[-2]=0,0,RC[-3]/RC[-2]) -> 0 | M295: =IF(R[22]C[-3]=0,0,RC[-3]/R[22]C[-3]) -> 0
A296: EA-18G | B296: 279B_FLT | C296: 25G1B | D296: Closed Pattern | E296: 25 | F296: Based | G296: GCA Pattern | H296: 0 | I296: 0 | J296: =SUM(RC[-2]:RC[-1]) -> 0 | K296: =IF(RC[-1]=0,0,RC[-3]/RC[-1]) -> 0 | L296: =IF(RC[-2]=0,0,RC[-3]/RC[-2]) -> 0 | M296: =IF(R[21]C[-3]=0,0,RC[-3]/R[21]C[-3]) -> 0
A297: EA-18G | B297: 279B_FRS | C297: 25G1B | D297: Closed Pattern | E297: 25 | F297: Based | G297: GCA Pattern | H297: 0 | I297: 0 | J297: =SUM(RC[-2]:RC[-1]) -> 0 | K297: =IF(RC[-1]=0,0,RC[-3]/RC[-1]) -> 0 | L297: =IF(RC[-2]=0,0,RC[-3]/RC[-2]) -> 0 | M297: =IF(R[20]C[-3]=0,0,RC[-3]/R[20]C[-3]) -> 0
A298: EA-18G | B298: 279C_EXP | C298: 25G1C | D298: Closed Pattern | E298: 25 | F298: Based | G298: GCA Pattern | H298: 0 | I298: 0 | J298: =SUM(RC[-2]:RC[-1]) -> 0 | K298: =IF(RC[-1]=0,0,RC[-3]/RC[-1]) -> 0 | L298: =IF(RC[-2]=0,0,RC[-3]/RC[-2]) -> 0 | M298: =IF(R[19]C[-3]=0,0,RC[-3]/R[19]C[-3]) -> 0
A299: EA-18G | B299: 279C_FLT | C299: 25G1C | D299: Closed Pattern | E299: 25 | F299: Based | G299: GCA Pattern | H299: 0 | I299: 0 | J299: =SUM(RC[-2]:RC[-1]) -> 0 | K299: =IF(RC[-1]=0,0,RC[-3]/RC[-1]) -> 0 | L299: =IF(RC[-2]=0,0,RC[-3]/RC[-2]) -> 0 | M299: =IF(R[18]C[-3]=0,0,RC[-3]/R[18]C[-3]) -> 0
A300: EA-18G | B300: 279C_FRS | C300: 25G1C | D300: Closed Pattern | E300: 25 | F300: Based | G300: GCA Pattern | H300: 0 | I300: 0 | J300: =SUM(RC[-2]:RC[-1]) -> 0 | K300: =IF(RC[-1]=0,0,RC[-3]/RC[-1]) -> 0 | L300: =IF(RC[-2]=0,0,RC[-3]/RC[-2]) -> 0 | M300: =IF(R[17]C[-3]=0,0,RC[-3]/R[17]C[-3]) -> 0
A301: EA-18G | B301: 280A_EXP | C301: 32G1A | D301: Closed Pattern | E301: 32 | F301: Based | G301: GCA Pattern | H301: 0 | I301: 0 | J301: =SUM(RC[-2]:RC[-1]) -> 0 | K301: =IF(RC[-1]=0,0,RC[-3]/RC[-1]) -> 0 | L301: =IF(RC[-2]=0,0,RC[-3]/RC[-2]) -> 0 | M301: =IF(R[16]C[-3]=0,0,RC[-3]/R[16]C[-3]) -> 0
A302: EA-18G | B302: 280A_FLT | C302: 32G1A | D302: Closed Pattern | E302: 32 | F302: Based | G302: GCA Pattern | H302: 0 | I302: 0 | J302: =SUM(RC[-2]:RC[-1]) -> 0 | K302: =IF(RC[-1]=0,0,RC[-3]/RC[-1]) -> 0 | L302: =IF(RC[-2]=0,0,RC[-3]/RC[-2]) -> 0 | M302: =IF(R[15]C[-3]=0,0,RC[-3]/R[15]C[-3]) -> 0
A303: EA-18G | B303: 280A_FRS | C303: 32G1A | D303: Closed Pattern | E303: 32 | F303: Based | G303: GCA Pattern | H303: 0 | I303: 0 | J303: =SUM(RC[-2]:RC[-1]) -> 0 | K303: =IF(RC[-1]=0,0,RC[-3]/RC[-1]) -> 0 | L303: =IF(RC[-2]=0,0,RC[-3]/RC[-2]) -> 0 | M303: =IF(R[14]C[-3]=0,0,RC[-3]/R[14]C[-3]) -> 0
A304: EA-18G | B304: 280B_EXP | C304: 32G1B | D304: Closed Pattern | E304: 32 | F304: Based | G304: GCA Pattern | H304: 0 | I304: 0 | J304: =SUM(RC[-2]:RC[-1]) -> 0 | K304: =IF(RC[-1]=0,0,RC[-3]/RC[-1]) -> 0 | L304: =IF(RC[-2]=0,0,RC[-3]/RC[-2]) -> 0 | M304: =IF(R[13]C[-3]=0,0,RC[-3]/R[13]C[-3]) -> 0
A305: EA-18G | B305: 280B_FLT | C305: 32G1B | D305: Closed Pattern | E305: 32 | F305: Based | G305: GCA Pattern | H305: 0 | I305: 0 | J305: =SUM(RC[-2]:RC[-1]) -> 0 | K305: =IF(RC[-1]=0,0,RC[-3]/RC[-1]) -> 0 | L305: =IF(RC[-2]=0,0,RC[-3]/RC[-2]) -> 0 | M305: =IF(R[12]C[-3]=0,0,RC[-3]/R[12]C[-3]) -> 0
A306: EA-18G | B306: 280B_FRS | C306: 32G1B | D306: Closed Pattern | E306: 32 | F306: Based | G306: GCA Pattern | H306: 0 | I306: 0 | J306: =SUM(RC[-2]:RC[-1]) -> 0 | K306: =IF(RC[-1]=0,0,RC[-3]/RC[-1]) -> 0 | L306: =IF(RC[-2]=0,0,RC[-3]/RC[-2]) -> 0 | M306: =IF(R[11]C[-3]=0,0,RC[-3]/R[11]C[-3]) -> 0
A307: EA-18G | B307: 280C_EXP | C307: 32G1C | D307: Closed Pattern | E307: 32 | F307: Based | G307: GCA Pattern | H307: 0 | I307: 0 | J307: =SUM(RC[-2]:RC[-1]) -> 0 | K307: =IF(RC[-1]=0,0,RC[-3]/RC[-1]) -> 0 | L307: =IF(RC[-2]=0,0,RC[-3]/RC[-2]) -> 0 | M307: =IF(R[10]C[-3]=0,0,RC[-3]/R[10]C[-3]) -> 0
A308: EA-18G | B308: 280C_FLT | C308: 32G1C | D308: Closed Pattern | E308: 32 | F308: Based | G308: GCA Pattern | H308: 0 | I308: 0 | J308: =SUM(RC[-2]:RC[-1]) -> 0 | K308: =IF(RC[-1]=0,0,RC[-3]/RC[-1]) -> 0 | L308: =IF(RC[-2]=0,0,RC[-3]/RC[-2]) -> 0 | M308: =IF(R[9]C[-3]=0,0,RC[-3]/R[9]C[-3]) -> 0
A309: EA-18G | B309: 280C_FRS | C309: 32G1C | D309: Closed Pattern | E309: 32 | F309: Based | G309: GCA Pattern | H309: 0 | I309: 0 | J309: =SUM(RC[-2]:RC[-1]) -> 0 | K309: =IF(RC[-1]=0,0,RC[-3]/RC[-1]) -> 0 | L309: =IF(RC[-2]=0,0,RC[-3]/RC[-2]) -> 0 | M309: =IF(R[8]C[-3]=0,0,RC[-3]/R[8]C[-3]) -> 0
A310: EA-18G | B310: 281A_m | C310: 07F1B | D310: Closed Pattern | E310: 07 | F310: Based | G310: FCLP at Ault Field | H310: 0 | I310: 0 | J310: =SUM(RC[-2]:RC[-1]) -> 0 | K310: =IF(RC[-1]=0,0,RC[-3]/RC[-1]) -> 0 | L310: =IF(RC[-2]=0,0,RC[-3]/RC[-2]) -> 0 | M310: =IF(R[7]C[-3]=0,0,RC[-3]/R[7]C[-3]) -> 0
A311: EA-18G | B311: 281B_m | C311: 07F1C | D311: Closed Pattern | E311: 07 | F311: Based | G311: FCLP at Ault Field | H311: 0 | I311: 0 | J311: =SUM(RC[-2]:RC[-1]) -> 0 | K311: =IF(RC[-1]=0,0,RC[-3]/RC[-1]) -> 0 | L311: =IF(RC[-2]=0,0,RC[-3]/RC[-2]) -> 0 | M311: =IF(R[6]C[-3]=0,0,RC[-3]/R[6]C[-3]) -> 0
A312: EA-18G | B312: 282A_m | C312: 14F1B | D312: Closed Pattern | E312: 14 | F312: Based | G312: FCLP at Ault Field | H312: 17.714285714285715 | I312: 0 | J312: =SUM(RC[-2]:RC[-1]) -> 17.714285714285715 | K312: =IF(RC[-1]=0,0,RC[-3]/RC[-1]) -> 1 | L312: =IF(RC[-2]=0,0,RC[-3]/RC[-2]) -> 0 | M312: =IF(R[5]C[-3]=0,0,RC[-3]/R[5]C[-3]) -> 0.17841649604390197
A313: EA-18G | B313: 282B_m | C313: 14F1C | D313: Closed Pattern | E313: 14 | F313: Based | G313: FCLP at Ault Field | H313: 4.1428571428571432 | I313: 0 | J313: =SUM(RC[-2]:RC[-1]) -> 4.1428571428571432 | K313: =IF(RC[-1]=0,0,RC[-3]/RC[-1]) -> 1 | L313: =IF(RC[-2]=0,0,RC[-3]/RC[-2]) -> 0 | M313: =IF(R[4]C[-3]=0,0,RC[-3]/R[4]C[-3]) -> 4.172643859091256E-2
A314: EA-18G | B314: 283A_m | C314: 25F1B | D314: Closed Pattern | E314: 25 | F314: Based | G314: FCLP at Ault Field | H314: 0 | I314: 0 | J314: =SUM(RC[-2]:RC[-1]) -> 0 | K314: =IF(RC[-1]=0,0,RC[-3]/RC[-1]) -> 0 | L314: =IF(RC[-2]=0,0,RC[-3]/RC[-2]) -> 0 | M314: =IF(R[3]C[-3]=0,0,RC[-3]/R[3]C[-3]) -> 0
A315: EA-18G | B315: 283B_m | C315: 25F1C | D315: Closed Pattern | E315: 25 | F315: Based | G315: FCLP at Ault Field | H315: 0 | I315: 0 | J315: =SUM(RC[-2]:RC[-1]) -> 0 | K315: =IF(RC[-1]=0,0,RC[-3]/RC[-1]) -> 0 | L315: =IF(RC[-2]=0,0,RC[-3]/RC[-2]) -> 0 | M315: =IF(R[2]C[-3]=0,0,RC[-3]/R[2]C[-3]) -> 0
A316: EA-18G | B316: 284B_m | C316: 32F1C | D316: Closed Pattern | E316: 32 | F316: Based | G316: FCLP at Ault Field | H316: 0 | I316: 0 | J316: =SUM(RC[-2]:RC[-1]) -> 0 | K316: =IF(RC[-1]=0,0,RC[-3]/RC[-1]) -> 0 | L316: =IF(RC[-2]=0,0,RC[-3]/RC[-2]) -> 0 | M316: =IF(R[1]C[-3]=0,0,RC[-3]/R[1]C[-3]) -> 0
G317: Subtotal | H317: 23.857142857142858 | I317: 0 | J317: =SUM(R[-68]C:R[-1]C) -> 99.286142857142863 | K317: =IF(RC[-1]=0,0,RC[-3]/RC[-1]) -> 0.24028673257525507 | L317: =IF(RC[-2]=0,0,RC[-3]/RC[-2]) -> 0
A319: EA-18G | B319: 255_FLT | C319: 14CW07_FLT | D319: Interfacility | E319: 14_OLF | F319: Based | G319: Interfacility Coupeville to Ault Field | H319: 0 | I319: 0 | J319: =SUM(RC[-2]:RC[-1]) -> 0 | K319: =IF(RC[-1]=0,0,RC[-3]/RC[-1]) -> 0 | L319: =IF(RC[-2]=0,0,RC[-3]/RC[-2]) -> 0 | M319: =IF(R[16]C[-3]=0,0,RC[-3]/R[16]C[-3]) -> 0
A320: EA-18G | B320: 255_FRS | C320: 14CW07_FRS | D320: Interfacility | E320: 14_OLF | F320: Based | G320: Interfacility Coupeville to Ault Field | H320: 0 | I320: 0 | J320: =SUM(RC[-2]:RC[-1]) -> 0 | K320: =IF(RC[-1]=0,0,RC[-3]/RC[-1]) -> 0 | L320: =IF(RC[-2]=0,0,RC[-3]/RC[-2]) -> 0 | M320: =IF(R[15]C[-3]=0,0,RC[-3]/R[15]C[-3]) -> 0
A321: EA-18G | B321: 256_FLT | C321: 14CW14_FLT | D321: Interfacility | E321: 14_OLF | F321: Based | G321: Interfacility Coupeville to Ault Field | H321: 1.5714285714285714 | I321: 0 | J321: =SUM(RC[-2]:RC[-1]) -> 1.5714285714285714 | K321: =IF(RC[-1]=0,0,RC[-3]/RC[-1]) -> 1 | L321: =IF(RC[-2]=0,0,RC[-3]/RC[-2]) -> 0 | M321: =IF(R[14]C[-3]=0,0,RC[-3]/R[14]C[-3]) -> 0.22448979591836735
A322: EA-18G | B322: 256_FRS | C322: 14CW14_FRS | D322: Interfacility | E322: 14_OLF | F322: Based | G322: Interfacility Coupeville to Ault Field | H322: 3.1428571428571428 | I322: 0 | J322: =SUM(RC[-2]:RC[-1]) -> 3.1428571428571428 | K322: =IF(RC[-1]=0,0,RC[-3]/RC[-1]) -> 1 | L322: =IF(RC[-2]=0,0,RC[-3]/RC[-2]) -> 0 | M322: =IF(R[13]C[-3]=0,0,RC[-3]/R[13]C[-3]) -> 0.44897959183673469
A323: EA-18G | B323: 257_FLT | C323: 14CW25_FLT | D323: Interfacility | E323: 14_OLF | F323: Based | G323: Interfacility Coupeville to Ault Field | H323: 0 | I323: 0 | J323: =SUM(RC[-2]:RC[-1]) -> 0 | K323: =IF(RC[-1]=0,0,RC[-3]/RC[-1]) -> 0 | L323: =IF(RC[-2]=0,0,RC[-3]/RC[-2]) -> 0 | M323: =IF(R[12]C[-3]=0,0,RC[-3]/R[12]C[-3]) -> 0
A324: EA-18G | B324: 257_FRS | C324: 14CW25_FRS | D324: Interfacility | E324: 14_OLF | F324: Based | G324: Interfacility Coupeville to Ault Field | H324: 0 | I324: 0 | J324: =SUM(RC[-2]:RC[-1]) -> 0 | K324: =IF(RC[-1]=0,0,RC[-3]/RC[-1]) -> 0 | L324: =IF(RC[-2]=0,0,RC[-3]/RC[-2]) -> 0 | M324: =IF(R[11]C[-3]=0,0,RC[-3]/R[11]C[-3]) -> 0
A325: EA-18G | B325: 258_FLT | C325: 14CW32_FLT | D325: Interfacility | E325: 14_OLF | F325: Based | G325: Interfacility Coupeville to Ault Field | H325: 0 | I325: 0 | J325: =SUM(RC[-2]:RC[-1]) -> 0 | K325: =IF(RC[-1]=0,0,RC[-3]/RC[-1]) -> 0 | L325: =IF(RC[-2]=0,0,RC[-3]/RC[-2]) -> 0 | M325: =IF(R[10]C[-3]=0,0,RC[-3]/R[10]C[-3]) -> 0
A326: EA-18G | B326: 258_FRS | C326: 14CW32_FRS | D326: Interfacility | E326: 14_OLF | F326: Based | G326: Interfacility Coupeville to Ault Field | H326: 0 | I326: 0 | J326: =SUM(RC[-2]:RC[-1]) -> 0 | K326: =IF(RC[-1]=0,0,RC[-3]/RC[-1]) -> 0 | L326: =IF(RC[-2]=0,0,RC[-3]/RC[-2]) -> 0 | M326: =IF(R[9]C[-3]=0,0,RC[-3]/R[9]C[-3]) -> 0
A327: EA-18G | B327: 259_FLT | C327: 32CW07_FLT | D327: Interfacility | E327: 32_OLF | F327: Based | G327: Interfacility Coupeville to Ault Field | H327: 0 | I327: 0 | J327: =SUM(RC[-2]:RC[-1]) -> 0 | K327: =IF(RC[-1]=0,0,RC[-3]/RC[-1]) -> 0 | L327: =IF(RC[-2]=0,0,RC[-3]/RC[-2]) -> 0 | M327: =IF(R[8]C[-3]=0,0,RC[-3]/R[8]C[-3]) -> 0
A328: EA-18G | B328: 259_FRS | C328: 32CW07_FRS | D328: Interfacility | E328: 32_OLF | F328: Based | G328: Interfacility Coupeville to Ault Field | H328: 0 | I328: 0 | J328: =SUM(RC[-2]:RC[-1]) -> 0 | K328: =IF(RC[-1]=0,0,RC[-3]/RC[-1]) -> 0 | L328: =IF(RC[-2]=0,0,RC[-3]/RC[-2]) -> 0 | M328: =IF(R[7]C[-3]=0,0,RC[-3]/R[7]C[-3]) -> 0
A329: EA-18G | B329: 260_FLT | C329: 32CW14_FLT | D329: Interfacility | E329: 32_OLF | F329: Based | G329: Interfacility Coupeville to Ault Field | H329: 0 | I329: 0 | J329: =SUM(RC[-2]:RC[-1]) -> 0 | K329: =IF(RC[-1]=0,0,RC[-3]/RC[-1]) -> 0 | L329: =IF(RC[-2]=0,0,RC[-3]/RC[-2]) -> 0 | M329: =IF(R[6]C[-3]=0,0,RC[-3]/R[6]C[-3]) -> 0
A330: EA-18G | B330: 260_FRS | C330: 32CW14_FRS | D330: Interfacility | E330: 32_OLF | F330: Based | G330: Interfacility Coupeville to Ault Field | H330: 0 | I330: 0 | J330: =SUM(RC[-2]:RC[-1]) -> 0 | K330: =IF(RC[-1]=0,0,RC[-3]/RC[-1]) -> 0 | L330: =IF(RC[-2]=0,0,RC[-3]/RC[-2]) -> 0 | M330: =IF(R[5]C[-3]=0,0,RC[-3]/R[5]C[-3]) -> 0
A331: EA-18G | B331: 261_FLT | C331: 32CW25_FLT | D331: Interfacility | E331: 32_OLF | F331: Based | G331: Interfacility Coupeville to Ault Field | H331: 0.8571428571428571 | I331: 0 | J331: =SUM(RC[-2]:RC[-1]) -> 0.8571428571428571 | K331: =IF(RC[-1]=0,0,RC[-3]/RC[-1]) -> 1 | L331: =IF(RC[-2]=0,0,RC[-3]/RC[-2]) -> 0 | M331: =IF(R[4]C[-3]=0,0,RC[-3]/R[4]C[-3]) -> 0.12244897959183673
A332: EA-18G | B332: 261_FRS | C332: 32CW25_FRS | D332: Interfacility | E332: 32_OLF | F332: Based | G332: Interfacility Coupeville to Ault Field | H332: 1.4285714285714286 | I332: 0 | J332: =SUM(RC[-2]:RC[-1]) -> 1.4285714285714286 | K332: =IF(RC[-1]=0,0,RC[-3]/RC[-1]) -> 1 | L332: =IF(RC[-2]=0,0,RC[-3]/RC[-2]) -> 0 | M332: =IF(R[3]C[-3]=0,0,RC[-3]/R[3]C[-3]) -> 0.20408163265306123
A333: EA-18G | B333: 262_FLT | C333: 32CW32_FLT | D333: Interfacility | E333: 32_OLF | F333: Based | G333: Interfacility Coupeville to Ault Field | H333: 0 | I333: 0 | J333: =SUM(RC[-2]:RC[-1]) -> 0 | K333: =IF(RC[-1]=0,0,RC[-3]/RC[-1]) -> 0 | L333: =IF(RC[-2]=0,0,RC[-3]/RC[-2]) -> 0 | M333: =IF(R[2]C[-3]=0,0,RC[-3]/R[2]C[-3]) -> 0
A334: EA-18G | B334: 262_FRS | C334: 32CW32_FRS | D334: Interfacility | E334: 32_OLF | F334: Based | G334: Interfacility Coupeville to Ault Field | H334: 0 | I334: 0 | J334: =SUM(RC[-2]:RC[-1]) -> 0 | K334: =IF(RC[-1]=0,0,RC[-3]/RC[-1]) -> 0 | L334: =IF(RC[-2]=0,0,RC[-3]/RC[-2]) -> 0 | M334: =IF(R[1]C[-3]=0,0,RC[-3]/R[1]C[-3]) -> 0
G335: Subtotal | H335: 7 | I335: 0 | J335: =SUM(R[-16]C:R[-1]C) -> 7 | K335: =IF(RC[-1]=0,0,RC[-3]/RC[-1]) -> 1 | L335: =IF(RC[-2]=0,0,RC[-3]/RC[-2]) -> 0
A336: Aircraft | B336: Profile | C336: Track | D336: Track Type | E336: Runway | F336: A/C Category | G336: Track Group | H336: Num Day | I336: Num Night | J336: Num Total | K336: % Day | L336: % Night | M336: % Total
A337: P-3C | B337: 321 | C337: 07A1A | D337: Arrival | E337: 07 | F337: Based | G337: P3 P8 C9 VFR non breaks | H337: 0 | I337: 0 | J337: =SUM(RC[-2]:RC[-1]) -> 0 | K337: =IF(RC[-1]=0,0,RC[-3]/RC[-1]) -> 0 | L337: =IF(RC[-2]=0,0,RC[-3]/RC[-2]) -> 0 | M337: =IF(R[26]C[-3]=0,0,RC[-3]/R[26]C[-3]) -> 0
A338: P-3C | B338: 322 | C338: 07A4D | D338: Arrival | E338: 07 | F338: Based | G338: P3 P8 C9 VFR non breaks | H338: 0 | I338: 0 | J338: =SUM(RC[-2]:RC[-1]) -> 0 | K338: =IF(RC[-1]=0,0,RC[-3]/RC[-1]) -> 0 | L338: =IF(RC[-2]=0,0,RC[-3]/RC[-2]) -> 0 | M338: =IF(R[25]C[-3]=0,0,RC[-3]/R[25]C[-3]) -> 0
A339: P-3C | B339: 323 | C339: 07A3B | D339: Arrival | E339: 07 | F339: Based | G339: P3 P8 C9 VFR non breaks | H339: 0 | I339: 0 | J339: =SUM(RC[-2]:RC[-1]) -> 0 | K339: =IF(RC[-1]=0,0,RC[-3]/RC[-1]) -> 0 | L339: =IF(RC[-2]=0,0,RC[-3]/RC[-2]) -> 0 | M339: =IF(R[24]C[-3]=0,0,RC[-3]/R[24]C[-3]) -> 0
A340: P-3C | B340: 324 | C340: 25A3D | D340: Arrival | E340: 25 | F340: Based | G340: P3 P8 C9 VFR non breaks | H340: 0 | I340: 0 | J340: =SUM(RC[-2]:RC[-1]) -> 0 | K340: =IF(RC[-1]=0,0,RC[-3]/RC[-1]) -> 0 | L340: =IF(RC[-2]=0,0,RC[-3]/RC[-2]) -> 0 | M340: =IF(R[23]C[-3]=0,0,RC[-3]/R[23]C[-3]) -> 0
A341: P-3C | B341: 325 | C341: 25A4B | D341: Arrival | E341: 25 | F341: Based | G341: P3 P8 C9 VFR non breaks | H341: 0 | I341: 0 | J341: =SUM(RC[-2]:RC[-1]) -> 0 | K341: =IF(RC[-1]=0,0,RC[-3]/RC[-1]) -> 0 | L341: =IF(RC[-2]=0,0,RC[-3]/RC[-2]) -> 0 | M341: =IF(R[22]C[-3]=0,0,RC[-3]/R[22]C[-3]) -> 0
A342: P-3C | B342: 326 | C342: 25A4C | D342: Arrival | E342: 25 | F342: Based | G342: P3 P8 C9 VFR non breaks | H342: 0 | I342: 0 | J342: =SUM(RC[-2]:RC[-1]) -> 0 | K342: =IF(RC[-1]=0,0,RC[-3]/RC[-1]) -> 0 | L342: =IF(RC[-2]=0,0,RC[-3]/RC[-2]) -> 0 | M342: =IF(R[21]C[-3]=0,0,RC[-3]/R[21]C[-3]) -> 0
A343: P-3C | B343: 328 | C343: 14A3D | D343: Arrival | E343: 14 | F343: Based | G343: P3 P8 C9 VFR non breaks | H343: 0.8571428571428571 | I343: 0 | J343: =SUM(RC[-2]:RC[-1]) -> 0.8571428571428571 | K343: =IF(RC[-1]=0,0,RC[-3]/RC[-1]) -> 1 | L343: =IF(RC[-2]=0,0,RC[-3]/RC[-2]) -> 0 | M343: =IF(R[20]C[-3]=0,0,RC[-3]/R[20]C[-3]) -> 0.31578947368421056
A344: P-3C | B344: 330 | C344: 14A4D | D344: Arrival | E344: 14 | F344: Based | G344: P3 P8 C9 VFR non breaks | H344: 0.2857142857142857 | I344: 0 | J344: =SUM(RC[-2]:RC[-1]) -> 0.2857142857142857 | K344: =IF(RC[-1]=0,0,RC[-3]/RC[-1]) -> 1 | L344: =IF(RC[-2]=0,0,RC[-3]/RC[-2]) -> 0 | M344: =IF(R[19]C[-3]=0,0,RC[-3]/R[19]C[-3]) -> 0.10526315789473685
A345: P-3C | B345: 332 | C345: 32A3D | D345: Arrival | E345: 32 | F345: Based | G345: P3 P8 C9 VFR non breaks | H345: 0 | I345: 0 | J345: =SUM(RC[-2]:RC[-1]) -> 0 | K345: =IF(RC[-1]=0,0,RC[-3]/RC[-1]) -> 0 | L345: =IF(RC[-2]=0,0,RC[-3]/RC[-2]) -> 0 | M345: =IF(R[18]C[-3]=0,0,RC[-3]/R[18]C[-3]) -> 0
A346: P-3C | B346: 334 | C346: 32A4D | D346: Arrival | E346: 32 | F346: Based | G346: P3 P8 C9 VFR non breaks | H346: 0 | I346: 0 | J346: =SUM(RC[-2]:RC[-1]) -> 0 | K346: =IF(RC[-1]=0,0,RC[-3]/RC[-1]) -> 0 | L346: =IF(RC[-2]=0,0,RC[-3]/RC[-2]) -> 0 | M346: =IF(R[17]C[-3]=0,0,RC[-3]/R[17]C[-3]) -> 0
A347: P-3C | B347: 336B | C347: 07A2B | D347: Arrival | E347: 07 | F347: Based | G347: P3 P8 IFR and Growler VFR non breaks | H347: 0 | I347: 0 | J347: =SUM(RC[-2]:RC[-1]) -> 0 | K347: =IF(RC[-1]=0,0,RC[-3]/RC[-1]) -> 0 | L347: =IF(RC[-2]=0,0,RC[-3]/RC[-2]) -> 0 | M347: =IF(R[16]C[-3]=0,0,RC[-3]/R[16]C[-3]) -> 0
A348: P-3C | B348: 336C | C348: 07A2C | D348: Arrival | E348: 07 | F348: Based | G348: P3 P8 IFR and Growler VFR non breaks | H348: 0 | I348: 0 | J348: =SUM(RC[-2]:RC[-1]) -> 0 | K348: =IF(RC[-1]=0,0,RC[-3]/RC[-1]) -> 0 | L348: =IF(RC[-2]=0,0,RC[-3]/RC[-2]) -> 0 | M348: =IF(R[15]C[-3]=0,0,RC[-3]/R[15]C[-3]) -> 0
A349: P-3C | B349: 337B | C349: 14A1B | D349: Arrival | E349: 14 | F349: Based | G349: P3 P8 IFR and Growler VFR non breaks | H349: 0.8571428571428571 | I349: 0 | J349: =SUM(RC[-2]:RC[-1]) -> 0.8571428571428571 | K349: =IF(RC[-1]=0,0,RC[-3]/RC[-1]) -> 1 | L349: =IF(RC[-2]=0,0,RC[-3]/RC[-2]) -> 0 | M349: =IF(R[14]C[-3]=0,0,RC[-3]/R[14]C[-3]) -> 0.31578947368421056
A350: P-3C | B350: 337C | C350: 14A1C | D350: Arrival | E350: 14 | F350: Based | G350: P3 P8 IFR and Growler VFR non breaks | H350: 0 | I350: 0 | J350: =SUM(RC[-2]:RC[-1]) -> 0 | K350: =IF(RC[-1]=0,0,RC[-3]/RC[-1]) -> 0 | L350: =IF(RC[-2]=0,0,RC[-3]/RC[-2]) -> 0 | M350: =IF(R[13]C[-3]=0,0,RC[-3]/R[13]C[-3]) -> 0
A351: P-3C | B351: 338B | C351: 14A2B | D351: Arrival | E351: 14 | F351: Based | G351: P3 P8 IFR and Growler VFR non breaks | H351: 0 | I351: 0 | J351: =SUM(RC[-2]:RC[-1]) -> 0 | K351: =IF(RC[-1]=0,0,RC[-3]/RC[-1]) -> 0 | L351: =IF(RC[-2]=0,0,RC[-3]/RC[-2]) -> 0 | M351: =IF(R[12]C[-3]=0,0,RC[-3]/R[12]C[-3]) -> 0
A352: P-3C | B352: 338C | C352: 14A2C | D352: Arrival | E352: 14 | F352: Based | G352: P3 P8 IFR and Growler VFR non breaks | H352: 0 | I352: 0 | J352: =SUM(RC[-2]:RC[-1]) -> 0 | K352: =IF(RC[-1]=0,0,RC[-3]/RC[-1]) -> 0 | L352: =IF(RC[-2]=0,0,RC[-3]/RC[-2]) -> 0 | M352: =IF(R[11]C[-3]=0,0,RC[-3]/R[11]C[-3]) -> 0
A353: P-3C | B353: 339D | C353: 25A1D | D353: Arrival | E353: 25 | F353: Based | G353: P3 P8 IFR and Growler VFR non breaks | H353: 0.42857142857142855 | I353: 0 | J353: =SUM(RC[-2]:RC[-1]) -> 0.42857142857142855 | K353: =IF(RC[-1]=0,0,RC[-3]/RC[-1]) -> 1 | L353: =IF(RC[-2]=0,0,RC[-3]/RC[-2]) -> 0 | M353: =IF(R[10]C[-3]=0,0,RC[-3]/R[10]C[-3]) -> 0.15789473684210528
A354: P-3C | B354: 340B | C354: 25A2B | D354: Arrival | E354: 25 | F354: Based | G354: P3 P8 IFR and Growler VFR non breaks | H354: 0.2857142857142857 | I354: 0 | J354: =SUM(RC[-2]:RC[-1]) -> 0.2857142857142857 | K354: =IF(RC[-1]=0,0,RC[-3]/RC[-1]) -> 1 | L354: =IF(RC[-2]=0,0,RC[-3]/RC[-2]) -> 0 | M354: =IF(R[9]C[-3]=0,0,RC[-3]/R[9]C[-3]) -> 0.10526315789473685
A355: P-3C | B355: 340C | C355: 25A2C | D355: Arrival | E355: 25 | F355: Based | G355: P3 P8 IFR and Growler VFR non breaks | H355: 0 | I355: 0 | J355: =SUM(RC[-2]:RC[-1]) -> 0 | K355: =IF(RC[-1]=0,0,RC[-3]/RC[-1]) -> 0 | L355: =IF(RC[-2]=0,0,RC[-3]/RC[-2]) -> 0 | M355: =IF(R[8]C[-3]=0,0,RC[-3]/R[8]C[-3]) -> 0
A356: P-3C | B356: 341C | C356: 32A1C | D356: Arrival | E356: 32 | F356: Based | G356: P3 P8 IFR and Growler VFR non breaks | H356: 0 | I356: 0 | J356: =SUM(RC[-2]:RC[-1]) -> 0 | K356: =IF(RC[-1]=0,0,RC[-3]/RC[-1]) -> 0 | L356: =IF(RC[-2]=0,0,RC[-3]/RC[-2]) -> 0 | M356: =IF(R[7]C[-3]=0,0,RC[-3]/R[7]C[-3]) -> 0
A357: P-3C | B357: 342B | C357: 32A2B | D357: Arrival | E357: 32 | F357: Based | G357: P3 P8 IFR and Growler VFR non breaks | H357: 0 | I357: 0 | J357: =SUM(RC[-2]:RC[-1]) -> 0 | K357: =IF(RC[-1]=0,0,RC[-3]/RC[-1]) -> 0 | L357: =IF(RC[-2]=0,0,RC[-3]/RC[-2]) -> 0 | M357: =IF(R[6]C[-3]=0,0,RC[-3]/R[6]C[-3]) -> 0
A358: P-3C | B358: 342C | C358: 32A2C | D358: Arrival | E358: 32 | F358: Based | G358: P3 P8 IFR and Growler VFR non breaks | H358: 0 | I358: 0 | J358: =SUM(RC[-2]:RC[-1]) -> 0 | K358: =IF(RC[-1]=0,0,RC[-3]/RC[-1]) -> 0 | L358: =IF(RC[-2]=0,0,RC[-3]/RC[-2]) -> 0 | M358: =IF(R[5]C[-3]=0,0,RC[-3]/R[5]C[-3]) -> 0
A359: P-3C | B359: 343 | C359: 07ALT | D359: Arrival | E359: 07 | F359: Based | G359: HI TACAN Arrival | H359: 0 | I359: 0 | J359: =SUM(RC[-2]:RC[-1]) -> 0 | K359: =IF(RC[-1]=0,0,RC[-3]/RC[-1]) -> 0 | L359: =IF(RC[-2]=0,0,RC[-3]/RC[-2]) -> 0 | M359: =IF(R[4]C[-3]=0,0,RC[-3]/R[4]C[-3]) -> 0
A360: P-3C | B360: 344 | C360: 14ALT | D360: Arrival | E360: 14 | F360: Based | G360: HI TACAN Arrival | H360: 0 | I360: 0 | J360: =SUM(RC[-2]:RC[-1]) -> 0 | K360: =IF(RC[-1]=0,0,RC[-3]/RC[-1]) -> 0 | L360: =IF(RC[-2]=0,0,RC[-3]/RC[-2]) -> 0 | M360: =IF(R[3]C[-3]=0,0,RC[-3]/R[3]C[-3]) -> 0
A361: P-3C | B361: 345 | C361: 25ALT | D361: Arrival | E361: 25 | F361: Based | G361: HI TACAN Arrival | H361: 0 | I361: 0 | J361: =SUM(RC[-2]:RC[-1]) -> 0 | K361: =IF(RC[-1]=0,0,RC[-3]/RC[-1]) -> 0 | L361: =IF(RC[-2]=0,0,RC[-3]/RC[-2]) -> 0 | M361: =IF(R[2]C[-3]=0,0,RC[-3]/R[2]C[-3]) -> 0
A362: P-3C | B362: 346 | C362: 32ALT | D362: Arrival | E362: 32 | F362: Based | G362: HI TACAN Arrival | H362: 0 | I362: 0 | J362: =SUM(RC[-2]:RC[-1]) -> 0 | K362: =IF(RC[-1]=0,0,RC[-3]/RC[-1]) -> 0 | L362: =IF(RC[-2]=0,0,RC[-3]/RC[-2]) -> 0 | M362: =IF(R[1]C[-3]=0,0,RC[-3]/R[1]C[-3]) -> 0
G363: Subtotal | H363: 2.714285714285714 | I363: 0 | J363: =SUM(R[-26]C:R[-1]C) -> 2.714285714285714 | K363: =IF(RC[-1]=0,0,RC[-3]/RC[-1]) -> 1 | L363: =IF(RC[-2]=0,0,RC[-3]/RC[-2]) -> 0
A365: P-3C | B365: 301 | C365: 07D1B | D365: Departure | E365: 07 | F365: Based | G365: Departure | H365: 0.42857142857142855 | I365: 0 | J365: =SUM(RC[-2]:RC[-1]) -> 0.42857142857142855 | K365: =IF(RC[-1]=0,0,RC[-3]/RC[-1]) -> 1 | L365: =IF(RC[-2]=0,0,RC[-3]/RC[-2]) -> 0 | M365: =IF(R[16]C[-3]=0,0,RC[-3]/R[16]C[-3]) -> 0.15000000000000002
A366: P-3C | B366: 302 | C366: 07D1C | D366: Departure | E366: 07 | F366: Based | G366: Departure | H366: 0 | I366: 0 | J366: =SUM(RC[-2]:RC[-1]) -> 0 | K366: =IF(RC[-1]=0,0,RC[-3]/RC[-1]) -> 0 | L366: =IF(RC[-2]=0,0,RC[-3]/RC[-2]) -> 0 | M366: =IF(R[15]C[-3]=0,0,RC[-3]/R[15]C[-3]) -> 0
A367: P-3C | B367: 303 | C367: 07D2B | D367: Departure | E367: 07 | F367: Based | G367: Departure | H367: 0 | I367: 0 | J367: =SUM(RC[-2]:RC[-1]) -> 0 | K367: =IF(RC[-1]=0,0,RC[-3]/RC[-1]) -> 0 | L367: =IF(RC[-2]=0,0,RC[-3]/RC[-2]) -> 0 | M367: =IF(R[14]C[-3]=0,0,RC[-3]/R[14]C[-3]) -> 0
A368: P-3C | B368: 304 | C368: 07D2C | D368: Departure | E368: 07 | F368: Based | G368: Departure | H368: 0 | I368: 0 | J368: =SUM(RC[-2]:RC[-1]) -> 0 | K368: =IF(RC[-1]=0,0,RC[-3]/RC[-1]) -> 0 | L368: =IF(RC[-2]=0,0,RC[-3]/RC[-2]) -> 0 | M368: =IF(R[13]C[-3]=0,0,RC[-3]/R[13]C[-3]) -> 0
A369: P-3C | B369: 305 | C369: 14D1B | D369: Departure | E369: 14 | F369: Based | G369: Departure | H369: 1 | I369: 0 | J369: =SUM(RC[-2]:RC[-1]) -> 1 | K369: =IF(RC[-1]=0,0,RC[-3]/RC[-1]) -> 1 | L369: =IF(RC[-2]=0,0,RC[-3]/RC[-2]) -> 0 | M369: =IF(R[12]C[-3]=0,0,RC[-3]/R[12]C[-3]) -> 0.35000000000000003
A370: P-3C | B370: 306 | C370: 14D1C | D370: Departure | E370: 14 | F370: Based | G370: Departure | H370: 0 | I370: 0 | J370: =SUM(RC[-2]:RC[-1]) -> 0 | K370: =IF(RC[-1]=0,0,RC[-3]/RC[-1]) -> 0 | L370: =IF(RC[-2]=0,0,RC[-3]/RC[-2]) -> 0 | M370: =IF(R[11]C[-3]=0,0,RC[-3]/R[11]C[-3]) -> 0
A371: P-3C | B371: 307 | C371: 14D2B | D371: Departure | E371: 14 | F371: Based | G371: Departure | H371: 0.5714285714285714 | I371: 0 | J371: =SUM(RC[-2]:RC[-1]) -> 0.5714285714285714 | K371: =IF(RC[-1]=0,0,RC[-3]/RC[-1]) -> 1 | L371: =IF(RC[-2]=0,0,RC[-3]/RC[-2]) -> 0 | M371: =IF(R[10]C[-3]=0,0,RC[-3]/R[10]C[-3]) -> 0.2
A372: P-3C | B372: 308 | C372: 14D2C | D372: Departure | E372: 14 | F372: Based | G372: Departure | H372: 0 | I372: 0 | J372: =SUM(RC[-2]:RC[-1]) -> 0 | K372: =IF(RC[-1]=0,0,RC[-3]/RC[-1]) -> 0 | L372: =IF(RC[-2]=0,0,RC[-3]/RC[-2]) -> 0 | M372: =IF(R[9]C[-3]=0,0,RC[-3]/R[9]C[-3]) -> 0
A373: P-3C | B373: 309 | C373: 25D1B | D373: Departure | E373: 25 | F373: Based | G373: Departure | H373: 0.2857142857142857 | I373: 0 | J373: =SUM(RC[-2]:RC[-1]) -> 0.2857142857142857 | K373: =IF(RC[-1]=0,0,RC[-3]/RC[-1]) -> 1 | L373: =IF(RC[-2]=0,0,RC[-3]/RC[-2]) -> 0 | M373: =IF(R[8]C[-3]=0,0,RC[-3]/R[8]C[-3]) -> 0.1
A374: P-3C | B374: 310 | C374: 25D1C | D374: Departure | E374: 25 | F374: Based | G374: Departure | H374: 0 | I374: 0 | J374: =SUM(RC[-2]:RC[-1]) -> 0 | K374: =IF(RC[-1]=0,0,RC[-3]/RC[-1]) -> 0 | L374: =IF(RC[-2]=0,0,RC[-3]/RC[-2]) -> 0 | M374: =IF(R[7]C[-3]=0,0,RC[-3]/R[7]C[-3]) -> 0
A375: P-3C | B375: 311 | C375: 25D2B | D375: Departure | E375: 25 | F375: Based | G375: Departure | H375: 0.42857142857142855 | I375: 0 | J375: =SUM(RC[-2]:RC[-1]) -> 0.42857142857142855 | K375: =IF(RC[-1]=0,0,RC[-3]/RC[-1]) -> 1 | L375: =IF(RC[-2]=0,0,RC[-3]/RC[-2]) -> 0 | M375: =IF(R[6]C[-3]=0,0,RC[-3]/R[6]C[-3]) -> 0.15000000000000002
A376: P-3C | B376: 312 | C376: 25D2C | D376: Departure | E376: 25 | F376: Based | G376: Departure | H376: 0.14285714285714285 | I376: 0 | J376: =SUM(RC[-2]:RC[-1]) -> 0.14285714285714285 | K376: =IF(RC[-1]=0,0,RC[-3]/RC[-1]) -> 1 | L376: =IF(RC[-2]=0,0,RC[-3]/RC[-2]) -> 0 | M376: =IF(R[5]C[-3]=0,0,RC[-3]/R[5]C[-3]) -> 0.05
A377: P-3C | B377: 313 | C377: 32D1B | D377: Departure | E377: 32 | F377: Based | G377: Departure | H377: 0 | I377: 0 | J377: =SUM(RC[-2]:RC[-1]) -> 0 | K377: =IF(RC[-1]=0,0,RC[-3]/RC[-1]) -> 0 | L377: =IF(RC[-2]=0,0,RC[-3]/RC[-2]) -> 0 | M377: =IF(R[4]C[-3]=0,0,RC[-3]/R[4]C[-3]) -> 0
A378: P-3C | B378: 314 | C378: 32D1C | D378: Departure | E378: 32 | F378: Based | G378: Departure | H378: 0 | I378: 0 | J378: =SUM(RC[-2]:RC[-1]) -> 0 | K378: =IF(RC[-1]=0,0,RC[-3]/RC[-1]) -> 0 | L378: =IF(RC[-2]=0,0,RC[-3]/RC[-2]) -> 0 | M378: =IF(R[3]C[-3]=0,0,RC[-3]/R[3]C[-3]) -> 0
A379: P-3C | B379: 315 | C379: 32D2B | D379: Departure | E379: 32 | F379: Based | G379: Departure | H379: 0 | I379: 0 | J379: =SUM(RC[-2]:RC[-1]) -> 0 | K379: =IF(RC[-1]=0,0,RC[-3]/RC[-1]) -> 0 | L379: =IF(RC[-2]=0,0,RC[-3]/RC[-2]) -> 0 | M379: =IF(R[2]C[-3]=0,0,RC[-3]/R[2]C[-3]) -> 0
A380: P-3C | B380: 316 | C380: 32D2C | D380: Departure | E380: 32 | F380: Based | G380: Departure | H380: 0 | I380: 0 | J380: =SUM(RC[-2]:RC[-1]) -> 0 | K380: =IF(RC[-1]=0,0,RC[-3]/RC[-1]) -> 0 | L380: =IF(RC[-2]=0,0,RC[-3]/RC[-2]) -> 0 | M380: =IF(R[1]C[-3]=0,0,RC[-3]/R[1]C[-3]) -> 0
G381: Subtotal | H381: 2.8571428571428568 | I381: 0 | J381: =SUM(R[-16]C:R[-1]C) -> 2.8571428571428568 | K381: =IF(RC[-1]=0,0,RC[-3]/RC[-1]) -> 1 | L381: =IF(RC[-2]=0,0,RC[-3]/RC[-2]) -> 0
A383: P-3C | B383: 347B | C383: 07G1B | D383: Closed Pattern | E383: 07 | F383: Based | G383: GCA Pattern | H383: 0 | I383: 0 | J383: =SUM(RC[-2]:RC[-1]) -> 0 | K383: =IF(RC[-1]=0,0,RC[-3]/RC[-1]) -> 0 | L383: =IF(RC[-2]=0,0,RC[-3]/RC[-2]) -> 0 | M383: =IF(R[12]C[-3]=0,0,RC[-3]/R[12]C[-3]) -> 0
A384: P-3C | B384: 347C | C384: 07G1C | D384: Closed Pattern | E384: 07 | F384: Based | G384: GCA Pattern | H384: 0 | I384: 0 | J384: =SUM(RC[-2]:RC[-1]) -> 0 | K384: =IF(RC[-1]=0,0,RC[-3]/RC[-1]) -> 0 | L384: =IF(RC[-2]=0,0,RC[-3]/RC[-2]) -> 0 | M384: =IF(R[11]C[-3]=0,0,RC[-3]/R[11]C[-3]) -> 0
A385: P-3C | B385: 348B | C385: 14G1B | D385: Closed Pattern | E385: 14 | F385: Based | G385: GCA Pattern | H385: 0.2857142857142857 | I385: 0 | J385: =SUM(RC[-2]:RC[-1]) -> 0.2857142857142857 | K385: =IF(RC[-1]=0,0,RC[-3]/RC[-1]) -> 1 | L385: =IF(RC[-2]=0,0,RC[-3]/RC[-2]) -> 0 | M385: =IF(R[10]C[-3]=0,0,RC[-3]/R[10]C[-3]) -> 0.1
A386: P-3C | B386: 348C | C386: 14G1C | D386: Closed Pattern | E386: 14 | F386: Based | G386: GCA Pattern | H386: 0.5714285714285714 | I386: 0 | J386: =SUM(RC[-2]:RC[-1]) -> 0.5714285714285714 | K386: =IF(RC[-1]=0,0,RC[-3]/RC[-1]) -> 1 | L386: =IF(RC[-2]=0,0,RC[-3]/RC[-2]) -> 0 | M386: =IF(R[9]C[-3]=0,0,RC[-3]/R[9]C[-3]) -> 0.2
A387: P-3C | B387: 349B | C387: 25G1B | D387: Closed Pattern | E387: 25 | F387: Based | G387: GCA Pattern | H387: 0 | I387: 0 | J387: =SUM(RC[-2]:RC[-1]) -> 0 | K387: =IF(RC[-1]=0,0,RC[-3]/RC[-1]) -> 0 | L387: =IF(RC[-2]=0,0,RC[-3]/RC[-2]) -> 0 | M387: =IF(R[8]C[-3]=0,0,RC[-3]/R[8]C[-3]) -> 0
A388: P-3C | B388: 349C | C388: 25G1C | D388: Closed Pattern | E388: 25 | F388: Based | G388: GCA Pattern | H388: 0 | I388: 0 | J388: =SUM(RC[-2]:RC[-1]) -> 0 | K388: =IF(RC[-1]=0,0,RC[-3]/RC[-1]) -> 0 | L388: =IF(RC[-2]=0,0,RC[-3]/RC[-2]) -> 0 | M388: =IF(R[7]C[-3]=0,0,RC[-3]/R[7]C[-3]) -> 0
A389: P-3C | B389: 350B | C389: 32G1B | D389: Closed Pattern | E389: 32 | F389: Based | G389: GCA Pattern | H389: 0 | I389: 0 | J389: =SUM(RC[-2]:RC[-1]) -> 0 | K389: =IF(RC[-1]=0,0,RC[-3]/RC[-1]) -> 0 | L389: =IF(RC[-2]=0,0,RC[-3]/RC[-2]) -> 0 | M389: =IF(R[6]C[-3]=0,0,RC[-3]/R[6]C[-3]) -> 0
A390: P-3C | B390: 350C | C390: 32G1C | D390: Closed Pattern | E390: 32 | F390: Based | G390: GCA Pattern | H390: 0 | I390: 0 | J390: =SUM(RC[-2]:RC[-1]) -> 0 | K390: =IF(RC[-1]=0,0,RC[-3]/RC[-1]) -> 0 | L390: =IF(RC[-2]=0,0,RC[-3]/RC[-2]) -> 0 | M390: =IF(R[5]C[-3]=0,0,RC[-3]/R[5]C[-3]) -> 0
A391: P-3C | B391: 351B | C391: 07TU1C | D391: Closed Pattern | E391: 07 | F391: Based | G391: Touch and Go at Ault Field | H391: 0 | I391: 0 | J391: =SUM(RC[-2]:RC[-1]) -> 0 | K391: =IF(RC[-1]=0,0,RC[-3]/RC[-1]) -> 0 | L391: =IF(RC[-2]=0,0,RC[-3]/RC[-2]) -> 0 | M391: =IF(R[4]C[-3]=0,0,RC[-3]/R[4]C[-3]) -> 0
A392: P-3C | B392: 352B | C392: 14TU1C | D392: Closed Pattern | E392: 14 | F392: Based | G392: Touch and Go at Ault Field | H392: 0.5714285714285714 | I392: 0 | J392: =SUM(RC[-2]:RC[-1]) -> 0.5714285714285714 | K392: =IF(RC[-1]=0,0,RC[-3]/RC[-1]) -> 1 | L392: =IF(RC[-2]=0,0,RC[-3]/RC[-2]) -> 0 | M392: =IF(R[3]C[-3]=0,0,RC[-3]/R[3]C[-3]) -> 0.2
A393: P-3C | B393: 353B | C393: 25TU1C | D393: Closed Pattern | E393: 25 | F393: Based | G393: Touch and Go at Ault Field | H393: 1.4285714285714286 | I393: 0 | J393: =SUM(RC[-2]:RC[-1]) -> 1.4285714285714286 | K393: =IF(RC[-1]=0,0,RC[-3]/RC[-1]) -> 1 | L393: =IF(RC[-2]=0,0,RC[-3]/RC[-2]) -> 0 | M393: =IF(R[2]C[-3]=0,0,RC[-3]/R[2]C[-3]) -> 0.50000000000000011
A394: P-3C | B394: 354B | C394: 32TU1C | D394: Closed Pattern | E394: 32 | F394: Based | G394: Touch and Go at Ault Field | H394: 0 | I394: 0 | J394: =SUM(RC[-2]:RC[-1]) -> 0 | K394: =IF(RC[-1]=0,0,RC[-3]/RC[-1]) -> 0 | L394: =IF(RC[-2]=0,0,RC[-3]/RC[-2]) -> 0 | M394: =IF(R[1]C[-3]=0,0,RC[-3]/R[1]C[-3]) -> 0
G395: Subtotal | H395: 2.8571428571428568 | I395: 0 | J395: =SUM(R[-12]C:R[-1]C) -> 2.8571428571428568 | K395: =IF(RC[-1]=0,0,RC[-3]/RC[-1]) -> 1 | L395: =IF(RC[-2]=0,0,RC[-3]/RC[-2]) -> 0
A396: Aircraft | B396: Profile | C396: Track | D396: Track Type | E396: Runway | F396: A/C Category | G396: Track Group | H396: Num Day | I396: Num Night | J396: Num Total | K396: % Day | L396: % Night | M396: % Total
A397: P-8 | B397: 521 | C397: 07A1A | D397: Arrival | E397: 07 | F397: Based | G397: P3 P8 C9 VFR non breaks | H397: 0 | I397: 0 | J397: =SUM(RC[-2]:RC[-1]) -> 0 | K397: =IF(RC[-1]=0,0,RC[-3]/RC[-1]) -> 0 | L397: =IF(RC[-2]=0,0,RC[-3]/RC[-2]) -> 0 | M397: =IF(R[26]C[-3]=0,0,RC[-3]/R[26]C[-3]) -> 0
A398: P-8 | B398: 522 | C398: 07A3B | D398: Arrival | E398: 07 | F398: Based | G398: P3 P8 C9 VFR non breaks | H398: 0 | I398: 0 | J398: =SUM(RC[-2]:RC[-1]) -> 0 | K398: =IF(RC[-1]=0,0,RC[-3]/RC[-1]) -> 0 | L398: =IF(RC[-2]=0,0,RC[-3]/RC[-2]) -> 0 | M398: =IF(R[25]C[-3]=0,0,RC[-3]/R[25]C[-3]) -> 0
A399: P-8 | B399: 523 | C399: 07A4D | D399: Arrival | E399: 07 | F399: Based | G399: P3 P8 C9 VFR non breaks | H399: 0 | I399: 0 | J399: =SUM(RC[-2]:RC[-1]) -> 0 | K399: =IF(RC[-1]=0,0,RC[-3]/RC[-1]) -> 0 | L399: =IF(RC[-2]=0,0,RC[-3]/RC[-2]) -> 0 | M399: =IF(R[24]C[-3]=0,0,RC[-3]/R[24]C[-3]) -> 0
A400: P-8 | B400: 525 | C400: 14A3D | D400: Arrival | E400: 14 | F400: Based | G400: P3 P8 C9 VFR non breaks | H400: 1.1428571428571428 | I400: 0.14285714285714285 | J400: =SUM(RC[-2]:RC[-1]) -> 1.2857142857142856 | K400: =IF(RC[-1]=0,0,RC[-3]/RC[-1]) -> 0.88888888888888895 | L400: =IF(RC[-2]=0,0,RC[-3]/RC[-2]) -> 0.11111111111111112 | M400: =IF(R[23]C[-3]=0,0,RC[-3]/R[23]C[-3]) -> 0.25714285714285712
A401: P-8 | B401: 527 | C401: 14A4D | D401: Arrival | E401: 14 | F401: Based | G401: P3 P8 C9 VFR non breaks | H401: 1 | I401: 0 | J401: =SUM(RC[-2]:RC[-1]) -> 1 | K401: =IF(RC[-1]=0,0,RC[-3]/RC[-1]) -> 1 | L401: =IF(RC[-2]=0,0,RC[-3]/RC[-2]) -> 0 | M401: =IF(R[22]C[-3]=0,0,RC[-3]/R[22]C[-3]) -> 0.2
A402: P-8 | B402: 528 | C402: 25A3D | D402: Arrival | E402: 25 | F402: Based | G402: P3 P8 C9 VFR non breaks | H402: 0.14285714285714285 | I402: 0 | J402: =SUM(RC[-2]:RC[-1]) -> 0.14285714285714285 | K402: =IF(RC[-1]=0,0,RC[-3]/RC[-1]) -> 1 | L402: =IF(RC[-2]=0,0,RC[-3]/RC[-2]) -> 0 | M402: =IF(R[21]C[-3]=0,0,RC[-3]/R[21]C[-3]) -> 2.8571428571428571E-2
A403: P-8 | B403: 529 | C403: 25A4B | D403: Arrival | E403: 25 | F403: Based | G403: P3 P8 C9 VFR non breaks | H403: 0.14285714285714285 | I403: 0 | J403: =SUM(RC[-2]:RC[-1]) -> 0.14285714285714285 | K403: =IF(RC[-1]=0,0,RC[-3]/RC[-1]) -> 1 | L403: =IF(RC[-2]=0,0,RC[-3]/RC[-2]) -> 0 | M403: =IF(R[20]C[-3]=0,0,RC[-3]/R[20]C[-3]) -> 2.8571428571428571E-2
A404: P-8 | B404: 530 | C404: 25A4C | D404: Arrival | E404: 25 | F404: Based | G404: P3 P8 C9 VFR non breaks | H404: 0 | I404: 0 | J404: =SUM(RC[-2]:RC[-1]) -> 0 | K404: =IF(RC[-1]=0,0,RC[-3]/RC[-1]) -> 0 | L404: =IF(RC[-2]=0,0,RC[-3]/RC[-2]) -> 0 | M404: =IF(R[19]C[-3]=0,0,RC[-3]/R[19]C[-3]) -> 0
A405: P-8 | B405: 532 | C405: 32A3D | D405: Arrival | E405: 32 | F405: Based | G405: P3 P8 C9 VFR non breaks | H405: 0 | I405: 0 | J405: =SUM(RC[-2]:RC[-1]) -> 0 | K405: =IF(RC[-1]=0,0,RC[-3]/RC[-1]) -> 0 | L405: =IF(RC[-2]=0,0,RC[-3]/RC[-2]) -> 0 | M405: =IF(R[18]C[-3]=0,0,RC[-3]/R[18]C[-3]) -> 0
A406: P-8 | B406: 534 | C406: 32A4D | D406: Arrival | E406: 32 | F406: Based | G406: P3 P8 C9 VFR non breaks | H406: 0 | I406: 0 | J406: =SUM(RC[-2]:RC[-1]) -> 0 | K406: =IF(RC[-1]=0,0,RC[-3]/RC[-1]) -> 0 | L406: =IF(RC[-2]=0,0,RC[-3]/RC[-2]) -> 0 | M406: =IF(R[17]C[-3]=0,0,RC[-3]/R[17]C[-3]) -> 0
A407: P-8 | B407: 536B_mod | C407: 07A2B | D407: Arrival | E407: 07 | F407: Based | G407: P3 P8 IFR and Growler VFR non breaks | H407: 0.14285714285714285 | I407: 0 | J407: =SUM(RC[-2]:RC[-1]) -> 0.14285714285714285 | K407: =IF(RC[-1]=0,0,RC[-3]/RC[-1]) -> 1 | L407: =IF(RC[-2]=0,0,RC[-3]/RC[-2]) -> 0 | M407: =IF(R[16]C[-3]=0,0,RC[-3]/R[16]C[-3]) -> 2.8571428571428571E-2
A408: P-8 | B408: 536C_mod | C408: 07A2C | D408: Arrival | E408: 07 | F408: Based | G408: P3 P8 IFR and Growler VFR non breaks | H408: 0 | I408: 0 | J408: =SUM(RC[-2]:RC[-1]) -> 0 | K408: =IF(RC[-1]=0,0,RC[-3]/RC[-1]) -> 0 | L408: =IF(RC[-2]=0,0,RC[-3]/RC[-2]) -> 0 | M408: =IF(R[15]C[-3]=0,0,RC[-3]/R[15]C[-3]) -> 0
A409: P-8 | B409: 537B_mod | C409: 14A1B | D409: Arrival | E409: 14 | F409: Based | G409: P3 P8 IFR and Growler VFR non breaks | H409: 0.7142857142857143 | I409: 0 | J409: =SUM(RC[-2]:RC[-1]) -> 0.7142857142857143 | K409: =IF(RC[-1]=0,0,RC[-3]/RC[-1]) -> 1 | L409: =IF(RC[-2]=0,0,RC[-3]/RC[-2]) -> 0 | M409: =IF(R[14]C[-3]=0,0,RC[-3]/R[14]C[-3]) -> 0.14285714285714285
A410: P-8 | B410: 537C_mod | C410: 14A1C | D410: Arrival | E410: 14 | F410: Based | G410: P3 P8 IFR and Growler VFR non breaks | H410: 0.2857142857142857 | I410: 0 | J410: =SUM(RC[-2]:RC[-1]) -> 0.2857142857142857 | K410: =IF(RC[-1]=0,0,RC[-3]/RC[-1]) -> 1 | L410: =IF(RC[-2]=0,0,RC[-3]/RC[-2]) -> 0 | M410: =IF(R[13]C[-3]=0,0,RC[-3]/R[13]C[-3]) -> 5.7142857142857141E-2
A411: P-8 | B411: 538B_mod | C411: 14A2B | D411: Arrival | E411: 14 | F411: Based | G411: P3 P8 IFR and Growler VFR non breaks | H411: 0.5714285714285714 | I411: 0 | J411: =SUM(RC[-2]:RC[-1]) -> 0.5714285714285714 | K411: =IF(RC[-1]=0,0,RC[-3]/RC[-1]) -> 1 | L411: =IF(RC[-2]=0,0,RC[-3]/RC[-2]) -> 0 | M411: =IF(R[12]C[-3]=0,0,RC[-3]/R[12]C[-3]) -> 0.11428571428571428
A412: P-8 | B412: 538C_mod | C412: 14A2C | D412: Arrival | E412: 14 | F412: Based | G412: P3 P8 IFR and Growler VFR non breaks | H412: 0 | I412: 0 | J412: =SUM(RC[-2]:RC[-1]) -> 0 | K412: =IF(RC[-1]=0,0,RC[-3]/RC[-1]) -> 0 | L412: =IF(RC[-2]=0,0,RC[-3]/RC[-2]) -> 0 | M412: =IF(R[11]C[-3]=0,0,RC[-3]/R[11]C[-3]) -> 0
A413: P-8 | B413: 539D | C413: 25A1D | D413: Arrival | E413: 25 | F413: Based | G413: P3 P8 IFR and Growler VFR non breaks | H413: 0.5714285714285714 | I413: 0 | J413: =SUM(RC[-2]:RC[-1]) -> 0.5714285714285714 | K413: =IF(RC[-1]=0,0,RC[-3]/RC[-1]) -> 1 | L413: =IF(RC[-2]=0,0,RC[-3]/RC[-2]) -> 0 | M413: =IF(R[11]C[-3]=0,0,RC[-3]/R[11]C[-3]) -> 0
A414: P-8 | B414: 540B_mod | C414: 25A2B | D414: Arrival | E414: 25 | F414: Based | G414: P3 P8 IFR and Growler VFR non breaks | H414: 0.14285714285714285 | I414: 0 | J414: =SUM(RC[-2]:RC[-1]) -> 0.14285714285714285 | K414: =IF(RC[-1]=0,0,RC[-3]/RC[-1]) -> 1 | L414: =IF(RC[-2]=0,0,RC[-3]/RC[-2]) -> 0 | M414: =IF(R[9]C[-3]=0,0,RC[-3]/R[9]C[-3]) -> 2.8571428571428571E-2
A415: P-8 | B415: 540C_mod | C415: 25A2C | D415: Arrival | E415: 25 | F415: Based | G415: P3 P8 IFR and Growler VFR non breaks | H415: 0 | I415: 0 | J415: =SUM(RC[-2]:RC[-1]) -> 0 | K415: =IF(RC[-1]=0,0,RC[-3]/RC[-1]) -> 0 | L415: =IF(RC[-2]=0,0,RC[-3]/RC[-2]) -> 0 | M415: =IF(R[8]C[-3]=0,0,RC[-3]/R[8]C[-3]) -> 0
A416: P-8 | B416: 541C_mod | C416: 32A1C | D416: Arrival | E416: 32 | F416: Based | G416: P3 P8 IFR and Growler VFR non breaks | H416: 0 | I416: 0 | J416: =SUM(RC[-2]:RC[-1]) -> 0 | K416: =IF(RC[-1]=0,0,RC[-3]/RC[-1]) -> 0 | L416: =IF(RC[-2]=0,0,RC[-3]/RC[-2]) -> 0 | M416: =IF(R[7]C[-3]=0,0,RC[-3]/R[7]C[-3]) -> 0
A417: P-8 | B417: 542B_mod | C417: 32A2B | D417: Arrival | E417: 32 | F417: Based | G417: P3 P8 IFR and Growler VFR non breaks | H417: 0 | I417: 0 | J417: =SUM(RC[-2]:RC[-1]) -> 0 | K417: =IF(RC[-1]=0,0,RC[-3]/RC[-1]) -> 0 | L417: =IF(RC[-2]=0,0,RC[-3]/RC[-2]) -> 0 | M417: =IF(R[6]C[-3]=0,0,RC[-3]/R[6]C[-3]) -> 0
A418: P-8 | B418: 542C_mod | C418: 32A2C | D418: Arrival | E418: 32 | F418: Based | G418: P3 P8 IFR and Growler VFR non breaks | H418: 0 | I418: 0 | J418: =SUM(RC[-2]:RC[-1]) -> 0 | K418: =IF(RC[-1]=0,0,RC[-3]/RC[-1]) -> 0 | L418: =IF(RC[-2]=0,0,RC[-3]/RC[-2]) -> 0 | M418: =IF(R[5]C[-3]=0,0,RC[-3]/R[5]C[-3]) -> 0
A419: P-8 | B419: 543 | C419: 07ALT | D419: Arrival | E419: 07 | F419: Based | G419: HI TACAN Arrival | H419: 0 | I419: 0 | J419: =SUM(RC[-2]:RC[-1]) -> 0 | K419: =IF(RC[-1]=0,0,RC[-3]/RC[-1]) -> 0 | L419: =IF(RC[-2]=0,0,RC[-3]/RC[-2]) -> 0 | M419: =IF(R[4]C[-3]=0,0,RC[-3]/R[4]C[-3]) -> 0
A420: P-8 | B420: 544 | C420: 14ALT | D420: Arrival | E420: 14 | F420: Based | G420: HI TACAN Arrival | H420: 0 | I420: 0 | J420: =SUM(RC[-2]:RC[-1]) -> 0 | K420: =IF(RC[-1]=0,0,RC[-3]/RC[-1]) -> 0 | L420: =IF(RC[-2]=0,0,RC[-3]/RC[-2]) -> 0 | M420: =IF(R[3]C[-3]=0,0,RC[-3]/R[3]C[-3]) -> 0
A421: P-8 | B421: 545 | C421: 25ALT | D421: Arrival | E421: 25 | F421: Based | G421: HI TACAN Arrival | H421: 0 | I421: 0 | J421: =SUM(RC[-2]:RC[-1]) -> 0 | K421: =IF(RC[-1]=0,0,RC[-3]/RC[-1]) -> 0 | L421: =IF(RC[-2]=0,0,RC[-3]/RC[-2]) -> 0 | M421: =IF(R[2]C[-3]=0,0,RC[-3]/R[2]C[-3]) -> 0
A422: P-8 | B422: 546 | C422: 32ALT | D422: Arrival | E422: 32 | F422: Based | G422: HI TACAN Arrival | H422: 0 | I422: 0 | J422: =SUM(RC[-2]:RC[-1]) -> 0 | K422: =IF(RC[-1]=0,0,RC[-3]/RC[-1]) -> 0 | L422: =IF(RC[-2]=0,0,RC[-3]/RC[-2]) -> 0 | M422: =IF(R[1]C[-3]=0,0,RC[-3]/R[1]C[-3]) -> 0
G423: Subtotal | H423: 4.8571428571428568 | I423: 0.14285714285714285 | J423: =SUM(R[-26]C:R[-1]C) -> 5 | K423: =IF(RC[-1]=0,0,RC[-3]/RC[-1]) -> 0.97142857142857131 | L423: =IF(RC[-2]=0,0,RC[-3]/RC[-2]) -> 2.8571428571428571E-2
A425: P-8 | B425: 501_mod | C425: 07D1B | D425: Departure | E425: 07 | F425: Based | G425: Departure | H425: 0.2857142857142857 | I425: 0 | J425: =SUM(RC[-2]:RC[-1]) -> 0.2857142857142857 | K425: =IF(RC[-1]=0,0,RC[-3]/RC[-1]) -> 1 | L425: =IF(RC[-2]=0,0,RC[-3]/RC[-2]) -> 0 | M425: =IF(R[16]C[-3]=0,0,RC[-3]/R[16]C[-3]) -> 5.5555555555555559E-2
A426: P-8 | B426: 502_mod | C426: 07D1C | D426: Departure | E426: 07 | F426: Based | G426: Departure | H426: 0 | I426: 0 | J426: =SUM(RC[-2]:RC[-1]) -> 0 | K426: =IF(RC[-1]=0,0,RC[-3]/RC[-1]) -> 0 | L426: =IF(RC[-2]=0,0,RC[-3]/RC[-2]) -> 0 | M426: =IF(R[15]C[-3]=0,0,RC[-3]/R[15]C[-3]) -> 0
A427: P-8 | B427: 503_mod | C427: 07D2B | D427: Departure | E427: 07 | F427: Based | G427: Departure | H427: 0.42857142857142855 | I427: 0 | J427: =SUM(RC[-2]:RC[-1]) -> 0.42857142857142855 | K427: =IF(RC[-1]=0,0,RC[-3]/RC[-1]) -> 1 | L427: =IF(RC[-2]=0,0,RC[-3]/RC[-2]) -> 0 | M427: =IF(R[14]C[-3]=0,0,RC[-3]/R[14]C[-3]) -> 8.3333333333333343E-2
A428: P-8 | B428: 504_mod | C428: 07D2C | D428: Departure | E428: 07 | F428: Based | G428: Departure | H428: 0 | I428: 0 | J428: =SUM(RC[-2]:RC[-1]) -> 0 | K428: =IF(RC[-1]=0,0,RC[-3]/RC[-1]) -> 0 | L428: =IF(RC[-2]=0,0,RC[-3]/RC[-2]) -> 0 | M428: =IF(R[13]C[-3]=0,0,RC[-3]/R[13]C[-3]) -> 0
A429: P-8 | B429: 505_mod | C429: 14D1B | D429: Departure | E429: 14 | F429: Based | G429: Departure | H429: 0.7142857142857143 | I429: 0.14285714285714285 | J429: =SUM(RC[-2]:RC[-1]) -> 0.85714285714285721 | K429: =IF(RC[-1]=0,0,RC[-3]/RC[-1]) -> 0.83333333333333326 | L429: =IF(RC[-2]=0,0,RC[-3]/RC[-2]) -> 0.16666666666666666 | M429: =IF(R[12]C[-3]=0,0,RC[-3]/R[12]C[-3]) -> 0.16666666666666669
A430: P-8 | B430: 506_mod | C430: 14D1C | D430: Departure | E430: 14 | F430: Based | G430: Departure | H430: 0.2857142857142857 | I430: 0.2857142857142857 | J430: =SUM(RC[-2]:RC[-1]) -> 0.5714285714285714 | K430: =IF(RC[-1]=0,0,RC[-3]/RC[-1]) -> 0.5 | L430: =IF(RC[-2]=0,0,RC[-3]/RC[-2]) -> 0.5 | M430: =IF(R[11]C[-3]=0,0,RC[-3]/R[11]C[-3]) -> 0.11111111111111112
A431: P-8 | B431: 507_mod | C431: 14D2B | D431: Departure | E431: 14 | F431: Based | G431: Departure | H431: 1.1428571428571428 | I431: 0 | J431: =SUM(RC[-2]:RC[-1]) -> 1.1428571428571428 | K431: =IF(RC[-1]=0,0,RC[-3]/RC[-1]) -> 1 | L431: =IF(RC[-2]=0,0,RC[-3]/RC[-2]) -> 0 | M431: =IF(R[10]C[-3]=0,0,RC[-3]/R[10]C[-3]) -> 0.22222222222222224
A432: P-8 | B432: 508_mod | C432: 14D2C | D432: Departure | E432: 14 | F432: Based | G432: Departure | H432: 0.8571428571428571 | I432: 0 | J432: =SUM(RC[-2]:RC[-1]) -> 0.8571428571428571 | K432: =IF(RC[-1]=0,0,RC[-3]/RC[-1]) -> 1 | L432: =IF(RC[-2]=0,0,RC[-3]/RC[-2]) -> 0 | M432: =IF(R[9]C[-3]=0,0,RC[-3]/R[9]C[-3]) -> 0.16666666666666669
A433: P-8 | B433: 509_mod | C433: 25D1B | D433: Departure | E433: 25 | F433: Based | G433: Departure | H433: 0.2857142857142857 | I433: 0.14285714285714285 | J433: =SUM(RC[-2]:RC[-1]) -> 0.42857142857142855 | K433: =IF(RC[-1]=0,0,RC[-3]/RC[-1]) -> 0.66666666666666663 | L433: =IF(RC[-2]=0,0,RC[-3]/RC[-2]) -> 0.33333333333333331 | M433: =IF(R[8]C[-3]=0,0,RC[-3]/R[8]C[-3]) -> 8.3333333333333343E-2
A434: P-8 | B434: 510_mod | C434: 25D1C | D434: Departure | E434: 25 | F434: Based | G434: Departure | H434: 0 | I434: 0 | J434: =SUM(RC[-2]:RC[-1]) -> 0 | K434: =IF(RC[-1]=0,0,RC[-3]/RC[-1]) -> 0 | L434: =IF(RC[-2]=0,0,RC[-3]/RC[-2]) -> 0 | M434: =IF(R[7]C[-3]=0,0,RC[-3]/R[7]C[-3]) -> 0
A435: P-8 | B435: 511_mod | C435: 25D2B | D435: Departure | E435: 25 | F435: Based | G435: Departure | H435: 0.5714285714285714 | I435: 0 | J435: =SUM(RC[-2]:RC[-1]) -> 0.5714285714285714 | K435: =IF(RC[-1]=0,0,RC[-3]/RC[-1]) -> 1 | L435: =IF(RC[-2]=0,0,RC[-3]/RC[-2]) -> 0 | M435: =IF(R[6]C[-3]=0,0,RC[-3]/R[6]C[-3]) -> 0.11111111111111112
A436: P-8 | B436: 512_mod | C436: 25D2C | D436: Departure | E436: 25 | F436: Based | G436: Departure | H436: 0 | I436: 0 | J436: =SUM(RC[-2]:RC[-1]) -> 0 | K436: =IF(RC[-1]=0,0,RC[-3]/RC[-1]) -> 0 | L436: =IF(RC[-2]=0,0,RC[-3]/RC[-2]) -> 0 | M436: =IF(R[5]C[-3]=0,0,RC[-3]/R[5]C[-3]) -> 0
A437: P-8 | B437: 513_mod | C437: 32D1B | D437: Departure | E437: 32 | F437: Based | G437: Departure | H437: 0 | I437: 0 | J437: =SUM(RC[-2]:RC[-1]) -> 0 | K437: =IF(RC[-1]=0,0,RC[-3]/RC[-1]) -> 0 | L437: =IF(RC[-2]=0,0,RC[-3]/RC[-2]) -> 0 | M437: =IF(R[4]C[-3]=0,0,RC[-3]/R[4]C[-3]) -> 0
A438: P-8 | B438: 514_mod | C438: 32D1C | D438: Departure | E438: 32 | F438: Based | G438: Departure | H438: 0 | I438: 0 | J438: =SUM(RC[-2]:RC[-1]) -> 0 | K438: =IF(RC[-1]=0,0,RC[-3]/RC[-1]) -> 0 | L438: =IF(RC[-2]=0,0,RC[-3]/RC[-2]) -> 0 | M438: =IF(R[3]C[-3]=0,0,RC[-3]/R[3]C[-3]) -> 0
A439: P-8 | B439: 515_mod | C439: 32D2B | D439: Departure | E439: 32 | F439: Based | G439: Departure | H439: 0 | I439: 0 | J439: =SUM(RC[-2]:RC[-1]) -> 0 | K439: =IF(RC[-1]=0,0,RC[-3]/RC[-1]) -> 0 | L439: =IF(RC[-2]=0,0,RC[-3]/RC[-2]) -> 0 | M439: =IF(R[2]C[-3]=0,0,RC[-3]/R[2]C[-3]) -> 0
A440: P-8 | B440: 516_mod | C440: 32D2C | D440: Departure | E440: 32 | F440: Based | G440: Departure | H440: 0 | I440: 0 | J440: =SUM(RC[-2]:RC[-1]) -> 0 | K440: =IF(RC[-1]=0,0,RC[-3]/RC[-1]) -> 0 | L440: =IF(RC[-2]=0,0,RC[-3]/RC[-2]) -> 0 | M440: =IF(R[1]C[-3]=0,0,RC[-3]/R[1]C[-3]) -> 0
G441: Subtotal | H441: 4.5714285714285712 | I441: 0.5714285714285714 | J441: =SUM(R[-16]C:R[-1]C) -> 5.1428571428571423 | K441: =IF(RC[-1]=0,0,RC[-3]/RC[-1]) -> 0.88888888888888895 | L441: =IF(RC[-2]=0,0,RC[-3]/RC[-2]) -> 0.11111111111111112
A443: P-8 | B443: 547B_mod | C443: 07G1B | D443: Closed Pattern | E443: 07 | F443: Based | G443: GCA Pattern | H443: 0 | I443: 0 | J443: =SUM(RC[-2]:RC[-1]) -> 0 | K443: =IF(RC[-1]=0,0,RC[-3]/RC[-1]) -> 0 | L443: =IF(RC[-2]=0,0,RC[-3]/RC[-2]) -> 0 | M443: =IF(R[12]C[-3]=0,0,RC[-3]/R[12]C[-3]) -> 0
A444: P-8 | B444: 547C_mod | C444: 07G1C | D444: Closed Pattern | E444: 07 | F444: Based | G444: GCA Pattern | H444: 0 | I444: 0 | J444: =SUM(RC[-2]:RC[-1]) -> 0 | K444: =IF(RC[-1]=0,0,RC[-3]/RC[-1]) -> 0 | L444: =IF(RC[-2]=0,0,RC[-3]/RC[-2]) -> 0 | M444: =IF(R[11]C[-3]=0,0,RC[-3]/R[11]C[-3]) -> 0
A445: P-8 | B445: 548B_mod | C445: 14G1B | D445: Closed Pattern | E445: 14 | F445: Based | G445: GCA Pattern | H445: 0.2857142857142857 | I445: 0 | J445: =SUM(RC[-2]:RC[-1]) -> 0.2857142857142857 | K445: =IF(RC[-1]=0,0,RC[-3]/RC[-1]) -> 1 | L445: =IF(RC[-2]=0,0,RC[-3]/RC[-2]) -> 0 | M445: =IF(R[10]C[-3]=0,0,RC[-3]/R[10]C[-3]) -> 0.4
A446: P-8 | B446: 548C_mod | C446: 14G1C | D446: Closed Pattern | E446: 14 | F446: Based | G446: GCA Pattern | H446: 0 | I446: 0 | J446: =SUM(RC[-2]:RC[-1]) -> 0 | K446: =IF(RC[-1]=0,0,RC[-3]/RC[-1]) -> 0 | L446: =IF(RC[-2]=0,0,RC[-3]/RC[-2]) -> 0 | M446: =IF(R[9]C[-3]=0,0,RC[-3]/R[9]C[-3]) -> 0
A447: P-8 | B447: 549B_mod | C447: 25G1B | D447: Closed Pattern | E447: 25 | F447: Based | G447: GCA Pattern | H447: 0.14285714285714285 | I447: 0 | J447: =SUM(RC[-2]:RC[-1]) -> 0.14285714285714285 | K447: =IF(RC[-1]=0,0,RC[-3]/RC[-1]) -> 1 | L447: =IF(RC[-2]=0,0,RC[-3]/RC[-2]) -> 0 | M447: =IF(R[8]C[-3]=0,0,RC[-3]/R[8]C[-3]) -> 0.2
A448: P-8 | B448: 549C_mod | C448: 25G1C | D448: Closed Pattern | E448: 25 | F448: Based | G448: GCA Pattern | H448: 0 | I448: 0 | J448: =SUM(RC[-2]:RC[-1]) -> 0 | K448: =IF(RC[-1]=0,0,RC[-3]/RC[-1]) -> 0 | L448: =IF(RC[-2]=0,0,RC[-3]/RC[-2]) -> 0 | M448: =IF(R[7]C[-3]=0,0,RC[-3]/R[7]C[-3]) -> 0
A449: P-8 | B449: 550B_mod | C449: 32G1B | D449: Closed Pattern | E449: 32 | F449: Based | G449: GCA Pattern | H449: 0 | I449: 0 | J449: =SUM(RC[-2]:RC[-1]) -> 0 | K449: =IF(RC[-1]=0,0,RC[-3]/RC[-1]) -> 0 | L449: =IF(RC[-2]=0,0,RC[-3]/RC[-2]) -> 0 | M449: =IF(R[6]C[-3]=0,0,RC[-3]/R[6]C[-3]) -> 0
A450: P-8 | B450: 550C_mod | C450: 32G1C | D450: Closed Pattern | E450: 32 | F450: Based | G450: GCA Pattern | H450: 0 | I450: 0 | J450: =SUM(RC[-2]:RC[-1]) -> 0 | K450: =IF(RC[-1]=0,0,RC[-3]/RC[-1]) -> 0 | L450: =IF(RC[-2]=0,0,RC[-3]/RC[-2]) -> 0 | M450: =IF(R[5]C[-3]=0,0,RC[-3]/R[5]C[-3]) -> 0
A451: P-8 | B451: 551B_mod | C451: 07TU2C | D451: Closed Pattern | E451: 07 | F451: Based | G451: Touch and Go at Ault Field | H451: 0 | I451: 0 | J451: =SUM(RC[-2]:RC[-1]) -> 0 | K451: =IF(RC[-1]=0,0,RC[-3]/RC[-1]) -> 0 | L451: =IF(RC[-2]=0,0,RC[-3]/RC[-2]) -> 0 | M451: =IF(R[4]C[-3]=0,0,RC[-3]/R[4]C[-3]) -> 0
A452: P-8 | B452: 552B_mod | C452: 14TU2C | D452: Closed Pattern | E452: 14 | F452: Based | G452: Touch and Go at Ault Field | H452: 0.2857142857142857 | I452: 0 | J452: =SUM(RC[-2]:RC[-1]) -> 0.2857142857142857 | K452: =IF(RC[-1]=0,0,RC[-3]/RC[-1]) -> 1 | L452: =IF(RC[-2]=0,0,RC[-3]/RC[-2]) -> 0 | M452: =IF(R[3]C[-3]=0,0,RC[-3]/R[3]C[-3]) -> 0.4
A453: P-8 | B453: 553B_mod | C453: 25TU2C | D453: Closed Pattern | E453: 25 | F453: Based | G453: Touch and Go at Ault Field | H453: 0 | I453: 0 | J453: =SUM(RC[-2]:RC[-1]) -> 0 | K453: =IF(RC[-1]=0,0,RC[-3]/RC[-1]) -> 0 | L453: =IF(RC[-2]=0,0,RC[-3]/RC[-2]) -> 0 | M453: =IF(R[2]C[-3]=0,0,RC[-3]/R[2]C[-3]) -> 0
A454: P-8 | B454: 554B_mod | C454: 32TU2C | D454: Closed Pattern | E454: 32 | F454: Based | G454: Touch and Go at Ault Field | H454: 0 | I454: 0 | J454: =SUM(RC[-2]:RC[-1]) -> 0 | K454: =IF(RC[-1]=0,0,RC[-3]/RC[-1]) -> 0 | L454: =IF(RC[-2]=0,0,RC[-3]/RC[-2]) -> 0 | M454: =IF(R[1]C[-3]=0,0,RC[-3]/R[1]C[-3]) -> 0
G455: Subtotal | H455: 0.71428571428571419 | I455: 0 | J455: =SUM(R[-12]C:R[-1]C) -> 0.71428571428571419 | K455: =IF(RC[-1]=0,0,RC[-3]/RC[-1]) -> 1 | L455: =IF(RC[-2]=0,0,RC[-3]/RC[-2]) -> 0
A456: Aircraft | B456: Profile | C456: Track | D456: Track Type | E456: Runway | F456: A/C Category | G456: Track Group | H456: Num Day | I456: Num Night | J456: Num Total | K456: % Day | L456: % Night | M456: % Total
A457: Transient Jet | B457: 417 | C457: 07A1A | D457: Arrival | E457: 07 | F457: Transient | G457: P3 P8 IFR and Growler VFR non breaks | H457: 0 | I457: 0 | J457: =SUM(RC[-2]:RC[-1]) -> 0 | K457: =IF(RC[-1]=0,0,RC[-3]/RC[-1]) -> 0 | L457: =IF(RC[-2]=0,0,RC[-3]/RC[-2]) -> 0 | M457: =IF(R[22]C[-3]=0,0,RC[-3]/R[22]C[-3]) -> 0
A458: Transient Jet | B458: 418 | C458: 07A3B | D458: Arrival | E458: 07 | F458: Transient | G458: P3 P8 IFR and Growler VFR non breaks | H458: 0 | I458: 0 | J458: =SUM(RC[-2]:RC[-1]) -> 0 | K458: =IF(RC[-1]=0,0,RC[-3]/RC[-1]) -> 0 | L458: =IF(RC[-2]=0,0,RC[-3]/RC[-2]) -> 0 | M458: =IF(R[21]C[-3]=0,0,RC[-3]/R[21]C[-3]) -> 0
A459: Transient Jet | B459: 419 | C459: 07A4D | D459: Arrival | E459: 07 | F459: Transient | G459: P3 P8 IFR and Growler VFR non breaks | H459: 0 | I459: 0 | J459: =SUM(RC[-2]:RC[-1]) -> 0 | K459: =IF(RC[-1]=0,0,RC[-3]/RC[-1]) -> 0 | L459: =IF(RC[-2]=0,0,RC[-3]/RC[-2]) -> 0 | M459: =IF(R[20]C[-3]=0,0,RC[-3]/R[20]C[-3]) -> 0
A460: Transient Jet | B460: 421 | C460: 14A3D | D460: Arrival | E460: 14 | F460: Transient | G460: P3 P8 IFR and Growler VFR non breaks | H460: 0.14285714285714285 | I460: 0 | J460: =SUM(RC[-2]:RC[-1]) -> 0.14285714285714285 | K460: =IF(RC[-1]=0,0,RC[-3]/RC[-1]) -> 1 | L460: =IF(RC[-2]=0,0,RC[-3]/RC[-2]) -> 0 | M460: =IF(R[19]C[-3]=0,0,RC[-3]/R[19]C[-3]) -> 0.16666666666666669
A461: Transient Jet | B461: 423 | C461: 14A4D | D461: Arrival | E461: 14 | F461: Transient | G461: P3 P8 IFR and Growler VFR non breaks | H461: 0.2857142857142857 | I461: 0 | J461: =SUM(RC[-2]:RC[-1]) -> 0.2857142857142857 | K461: =IF(RC[-1]=0,0,RC[-3]/RC[-1]) -> 1 | L461: =IF(RC[-2]=0,0,RC[-3]/RC[-2]) -> 0 | M461: =IF(R[18]C[-3]=0,0,RC[-3]/R[18]C[-3]) -> 0.33333333333333337
A462: Transient Jet | B462: 424 | C462: 25A3D | D462: Arrival | E462: 25 | F462: Transient | G462: P3 P8 IFR and Growler VFR non breaks | H462: 0 | I462: 0 | J462: =SUM(RC[-2]:RC[-1]) -> 0 | K462: =IF(RC[-1]=0,0,RC[-3]/RC[-1]) -> 0 | L462: =IF(RC[-2]=0,0,RC[-3]/RC[-2]) -> 0 | M462: =IF(R[17]C[-3]=0,0,RC[-3]/R[17]C[-3]) -> 0
A463: Transient Jet | B463: 425 | C463: 25A4B | D463: Arrival | E463: 25 | F463: Transient | G463: P3 P8 IFR and Growler VFR non breaks | H463: 0 | I463: 0 | J463: =SUM(RC[-2]:RC[-1]) -> 0 | K463: =IF(RC[-1]=0,0,RC[-3]/RC[-1]) -> 0 | L463: =IF(RC[-2]=0,0,RC[-3]/RC[-2]) -> 0 | M463: =IF(R[16]C[-3]=0,0,RC[-3]/R[16]C[-3]) -> 0
A464: Transient Jet | B464: 426 | C464: 25A4C | D464: Arrival | E464: 25 | F464: Transient | G464: P3 P8 IFR and Growler VFR non breaks | H464: 0 | I464: 0 | J464: =SUM(RC[-2]:RC[-1]) -> 0 | K464: =IF(RC[-1]=0,0,RC[-3]/RC[-1]) -> 0 | L464: =IF(RC[-2]=0,0,RC[-3]/RC[-2]) -> 0 | M464: =IF(R[15]C[-3]=0,0,RC[-3]/R[15]C[-3]) -> 0
A465: Transient Jet | B465: 428 | C465: 32A3D | D465: Arrival | E465: 32 | F465: Transient | G465: P3 P8 IFR and Growler VFR non breaks | H465: 0 | I465: 0 | J465: =SUM(RC[-2]:RC[-1]) -> 0 | K465: =IF(RC[-1]=0,0,RC[-3]/RC[-1]) -> 0 | L465: =IF(RC[-2]=0,0,RC[-3]/RC[-2]) -> 0 | M465: =IF(R[14]C[-3]=0,0,RC[-3]/R[14]C[-3]) -> 0
A466: Transient Jet | B466: 430 | C466: 32A4D | D466: Arrival | E466: 32 | F466: Transient | G466: P3 P8 IFR and Growler VFR non breaks | H466: 0 | I466: 0 | J466: =SUM(RC[-2]:RC[-1]) -> 0 | K466: =IF(RC[-1]=0,0,RC[-3]/RC[-1]) -> 0 | L466: =IF(RC[-2]=0,0,RC[-3]/RC[-2]) -> 0 | M466: =IF(R[13]C[-3]=0,0,RC[-3]/R[13]C[-3]) -> 0
A467: Transient Jet | B467: 436B | C467: 07A2B | D467: Arrival | E467: 07 | F467: Transient | G467: P3 P8 C9 VFR non breaks | H467: 0 | I467: 0 | J467: =SUM(RC[-2]:RC[-1]) -> 0 | K467: =IF(RC[-1]=0,0,RC[-3]/RC[-1]) -> 0 | L467: =IF(RC[-2]=0,0,RC[-3]/RC[-2]) -> 0 | M467: =IF(R[12]C[-3]=0,0,RC[-3]/R[12]C[-3]) -> 0
A468: Transient Jet | B468: 436C | C468: 07A2C | D468: Arrival | E468: 07 | F468: Transient | G468: P3 P8 C9 VFR non breaks | H468: 0 | I468: 0 | J468: =SUM(RC[-2]:RC[-1]) -> 0 | K468: =IF(RC[-1]=0,0,RC[-3]/RC[-1]) -> 0 | L468: =IF(RC[-2]=0,0,RC[-3]/RC[-2]) -> 0 | M468: =IF(R[11]C[-3]=0,0,RC[-3]/R[11]C[-3]) -> 0
A469: Transient Jet | B469: 437B | C469: 14A1B | D469: Arrival | E469: 14 | F469: Transient | G469: P3 P8 C9 VFR non breaks | H469: 0.14285714285714285 | I469: 0 | J469: =SUM(RC[-2]:RC[-1]) -> 0.14285714285714285 | K469: =IF(RC[-1]=0,0,RC[-3]/RC[-1]) -> 1 | L469: =IF(RC[-2]=0,0,RC[-3]/RC[-2]) -> 0 | M469: =IF(R[10]C[-3]=0,0,RC[-3]/R[10]C[-3]) -> 0.16666666666666669
A470: Transient Jet | B470: 437C | C470: 14A1C | D470: Arrival | E470: 14 | F470: Transient | G470: P3 P8 C9 VFR non breaks | H470: 0.14285714285714285 | I470: 0 | J470: =SUM(RC[-2]:RC[-1]) -> 0.14285714285714285 | K470: =IF(RC[-1]=0,0,RC[-3]/RC[-1]) -> 1 | L470: =IF(RC[-2]=0,0,RC[-3]/RC[-2]) -> 0 | M470: =IF(R[9]C[-3]=0,0,RC[-3]/R[9]C[-3]) -> 0.16666666666666669
A471: Transient Jet | B471: 438B | C471: 14A2B | D471: Arrival | E471: 14 | F471: Transient | G471: P3 P8 C9 VFR non breaks | H471: 0.14285714285714285 | I471: 0 | J471: =SUM(RC[-2]:RC[-1]) -> 0.14285714285714285 | K471: =IF(RC[-1]=0,0,RC[-3]/RC[-1]) -> 1 | L471: =IF(RC[-2]=0,0,RC[-3]/RC[-2]) -> 0 | M471: =IF(R[8]C[-3]=0,0,RC[-3]/R[8]C[-3]) -> 0.16666666666666669
A472: Transient Jet | B472: 438C | C472: 14A2C | D472: Arrival | E472: 14 | F472: Transient | G472: P3 P8 C9 VFR non breaks | H472: 0 | I472: 0 | J472: =SUM(RC[-2]:RC[-1]) -> 0 | K472: =IF(RC[-1]=0,0,RC[-3]/RC[-1]) -> 0 | L472: =IF(RC[-2]=0,0,RC[-3]/RC[-2]) -> 0 | M472: =IF(R[7]C[-3]=0,0,RC[-3]/R[7]C[-3]) -> 0
A473: Transient Jet | B473: 439D | C473: 25A1D | D473: Arrival | E473: 25 | F473: Transient | G473: P3 P8 C9 VFR non breaks | H473: 0 | I473: 0 | J473: =SUM(RC[-2]:RC[-1]) -> 0 | K473: =IF(RC[-1]=0,0,RC[-3]/RC[-1]) -> 0 | L473: =IF(RC[-2]=0,0,RC[-3]/RC[-2]) -> 0 | M473: =IF(R[5]C[-3]=0,0,RC[-3]/R[5]C[-3]) -> 0
A474: Transient Jet | B474: 440B | C474: 25A2B | D474: Arrival | E474: 25 | F474: Transient | G474: P3 P8 C9 VFR non breaks | H474: 0 | I474: 0 | J474: =SUM(RC[-2]:RC[-1]) -> 0 | K474: =IF(RC[-1]=0,0,RC[-3]/RC[-1]) -> 0 | L474: =IF(RC[-2]=0,0,RC[-3]/RC[-2]) -> 0 | M474: =IF(R[5]C[-3]=0,0,RC[-3]/R[5]C[-3]) -> 0
A475: Transient Jet | B475: 440C | C475: 25A2C | D475: Arrival | E475: 25 | F475: Transient | G475: P3 P8 C9 VFR non breaks | H475: 0 | I475: 0 | J475: =SUM(RC[-2]:RC[-1]) -> 0 | K475: =IF(RC[-1]=0,0,RC[-3]/RC[-1]) -> 0 | L475: =IF(RC[-2]=0,0,RC[-3]/RC[-2]) -> 0 | M475: =IF(R[4]C[-3]=0,0,RC[-3]/R[4]C[-3]) -> 0
A476: Transient Jet | B476: 441C | C476: 32A1C | D476: Arrival | E476: 32 | F476: Transient | G476: P3 P8 C9 VFR non breaks | H476: 0 | I476: 0 | J476: =SUM(RC[-2]:RC[-1]) -> 0 | K476: =IF(RC[-1]=0,0,RC[-3]/RC[-1]) -> 0 | L476: =IF(RC[-2]=0,0,RC[-3]/RC[-2]) -> 0 | M476: =IF(R[3]C[-3]=0,0,RC[-3]/R[3]C[-3]) -> 0
A477: Transient Jet | B477: 442B | C477: 32A2B | D477: Arrival | E477: 32 | F477: Transient | G477: P3 P8 C9 VFR non breaks | H477: 0 | I477: 0 | J477: =SUM(RC[-2]:RC[-1]) -> 0 | K477: =IF(RC[-1]=0,0,RC[-3]/RC[-1]) -> 0 | L477: =IF(RC[-2]=0,0,RC[-3]/RC[-2]) -> 0 | M477: =IF(R[2]C[-3]=0,0,RC[-3]/R[2]C[-3]) -> 0
A478: Transient Jet | B478: 442C | C478: 32A2C | D478: Arrival | E478: 32 | F478: Transient | G478: P3 P8 C9 VFR non breaks | H478: 0 | I478: 0 | J478: =SUM(RC[-2]:RC[-1]) -> 0 | K478: =IF(RC[-1]=0,0,RC[-3]/RC[-1]) -> 0 | L478: =IF(RC[-2]=0,0,RC[-3]/RC[-2]) -> 0 | M478: =IF(R[1]C[-3]=0,0,RC[-3]/R[1]C[-3]) -> 0
G479: Subtotal | H479: 0.85714285714285698 | I479: 0 | J479: =SUM(R[-22]C:R[-1]C) -> 0.85714285714285698 | K479: =IF(RC[-1]=0,0,RC[-3]/RC[-1]) -> 1 | L479: =IF(RC[-2]=0,0,RC[-3]/RC[-2]) -> 0
A481: Transient Jet | B481: 401 | C481: 07D1B | D481: Departure | E481: 07 | F481: Transient | G481: Departure | H481: 0 | I481: 0 | J481: =SUM(RC[-2]:RC[-1]) -> 0 | K481: =IF(RC[-1]=0,0,RC[-3]/RC[-1]) -> 0 | L481: =IF(RC[-2]=0,0,RC[-3]/RC[-2]) -> 0 | M481: =IF(R[16]C[-3]=0,0,RC[-3]/R[16]C[-3]) -> 0
A482: Transient Jet | B482: 402 | C482: 07D1C | D482: Departure | E482: 07 | F482: Transient | G482: Departure | H482: 0 | I482: 0 | J482: =SUM(RC[-2]:RC[-1]) -> 0 | K482: =IF(RC[-1]=0,0,RC[-3]/RC[-1]) -> 0 | L482: =IF(RC[-2]=0,0,RC[-3]/RC[-2]) -> 0 | M482: =IF(R[15]C[-3]=0,0,RC[-3]/R[15]C[-3]) -> 0
A483: Transient Jet | B483: 403 | C483: 07D2B | D483: Departure | E483: 07 | F483: Transient | G483: Departure | H483: 0 | I483: 0 | J483: =SUM(RC[-2]:RC[-1]) -> 0 | K483: =IF(RC[-1]=0,0,RC[-3]/RC[-1]) -> 0 | L483: =IF(RC[-2]=0,0,RC[-3]/RC[-2]) -> 0 | M483: =IF(R[14]C[-3]=0,0,RC[-3]/R[14]C[-3]) -> 0
A484: Transient Jet | B484: 404 | C484: 07D2C | D484: Departure | E484: 07 | F484: Transient | G484: Departure | H484: 0 | I484: 0 | J484: =SUM(RC[-2]:RC[-1]) -> 0 | K484: =IF(RC[-1]=0,0,RC[-3]/RC[-1]) -> 0 | L484: =IF(RC[-2]=0,0,RC[-3]/RC[-2]) -> 0 | M484: =IF(R[13]C[-3]=0,0,RC[-3]/R[13]C[-3]) -> 0
A485: Transient Jet | B485: 405 | C485: 14D1B | D485: Departure | E485: 14 | F485: Transient | G485: Departure | H485: 0 | I485: 0 | J485: =SUM(RC[-2]:RC[-1]) -> 0 | K485: =IF(RC[-1]=0,0,RC[-3]/RC[-1]) -> 0 | L485: =IF(RC[-2]=0,0,RC[-3]/RC[-2]) -> 0 | M485: =IF(R[12]C[-3]=0,0,RC[-3]/R[12]C[-3]) -> 0
A486: Transient Jet | B486: 406 | C486: 14D1C | D486: Departure | E486: 14 | F486: Transient | G486: Departure | H486: 0 | I486: 0 | J486: =SUM(RC[-2]:RC[-1]) -> 0 | K486: =IF(RC[-1]=0,0,RC[-3]/RC[-1]) -> 0 | L486: =IF(RC[-2]=0,0,RC[-3]/RC[-2]) -> 0 | M486: =IF(R[11]C[-3]=0,0,RC[-3]/R[11]C[-3]) -> 0
A487: Transient Jet | B487: 407 | C487: 14D2B | D487: Departure | E487: 14 | F487: Transient | G487: Departure | H487: 0.7142857142857143 | I487: 0 | J487: =SUM(RC[-2]:RC[-1]) -> 0.7142857142857143 | K487: =IF(RC[-1]=0,0,RC[-3]/RC[-1]) -> 1 | L487: =IF(RC[-2]=0,0,RC[-3]/RC[-2]) -> 0 | M487: =IF(R[10]C[-3]=0,0,RC[-3]/R[10]C[-3]) -> 0.83333333333333326
A488: Transient Jet | B488: 408 | C488: 14D2C | D488: Departure | E488: 14 | F488: Transient | G488: Departure | H488: 0.14285714285714285 | I488: 0 | J488: =SUM(RC[-2]:RC[-1]) -> 0.14285714285714285 | K488: =IF(RC[-1]=0,0,RC[-3]/RC[-1]) -> 1 | L488: =IF(RC[-2]=0,0,RC[-3]/RC[-2]) -> 0 | M488: =IF(R[9]C[-3]=0,0,RC[-3]/R[9]C[-3]) -> 0.16666666666666666
A489: Transient Jet | B489: 409 | C489: 25D1B | D489: Departure | E489: 25 | F489: Transient | G489: Departure | H489: 0 | I489: 0 | J489: =SUM(RC[-2]:RC[-1]) -> 0 | K489: =IF(RC[-1]=0,0,RC[-3]/RC[-1]) -> 0 | L489: =IF(RC[-2]=0,0,RC[-3]/RC[-2]) -> 0 | M489: =IF(R[8]C[-3]=0,0,RC[-3]/R[8]C[-3]) -> 0
A490: Transient Jet | B490: 410 | C490: 25D1C | D490: Departure | E490: 25 | F490: Transient | G490: Departure | H490: 0 | I490: 0 | J490: =SUM(RC[-2]:RC[-1]) -> 0 | K490: =IF(RC[-1]=0,0,RC[-3]/RC[-1]) -> 0 | L490: =IF(RC[-2]=0,0,RC[-3]/RC[-2]) -> 0 | M490: =IF(R[7]C[-3]=0,0,RC[-3]/R[7]C[-3]) -> 0
A491: Transient Jet | B491: 411 | C491: 25D2B | D491: Departure | E491: 25 | F491: Transient | G491: Departure | H491: 0 | I491: 0 | J491: =SUM(RC[-2]:RC[-1]) -> 0 | K491: =IF(RC[-1]=0,0,RC[-3]/RC[-1]) -> 0 | L491: =IF(RC[-2]=0,0,RC[-3]/RC[-2]) -> 0 | M491: =IF(R[6]C[-3]=0,0,RC[-3]/R[6]C[-3]) -> 0
A492: Transient Jet | B492: 412 | C492: 25D2C | D492: Departure | E492: 25 | F492: Transient | G492: Departure | H492: 0 | I492: 0 | J492: =SUM(RC[-2]:RC[-1]) -> 0 | K492: =IF(RC[-1]=0,0,RC[-3]/RC[-1]) -> 0 | L492: =IF(RC[-2]=0,0,RC[-3]/RC[-2]) -> 0 | M492: =IF(R[5]C[-3]=0,0,RC[-3]/R[5]C[-3]) -> 0
A493: Transient Jet | B493: 413 | C493: 32D1B | D493: Departure | E493: 32 | F493: Transient | G493: Departure | H493: 0 | I493: 0 | J493: =SUM(RC[-2]:RC[-1]) -> 0 | K493: =IF(RC[-1]=0,0,RC[-3]/RC[-1]) -> 0 | L493: =IF(RC[-2]=0,0,RC[-3]/RC[-2]) -> 0 | M493: =IF(R[4]C[-3]=0,0,RC[-3]/R[4]C[-3]) -> 0
A494: Transient Jet | B494: 414 | C494: 32D1C | D494: Departure | E494: 32 | F494: Transient | G494: Departure | H494: 0 | I494: 0 | J494: =SUM(RC[-2]:RC[-1]) -> 0 | K494: =IF(RC[-1]=0,0,RC[-3]/RC[-1]) -> 0 | L494: =IF(RC[-2]=0,0,RC[-3]/RC[-2]) -> 0 | M494: =IF(R[3]C[-3]=0,0,RC[-3]/R[3]C[-3]) -> 0
A495: Transient Jet | B495: 415 | C495: 32D2B | D495: Departure | E495: 32 | F495: Transient | G495: Departure | H495: 0 | I495: 0 | J495: =SUM(RC[-2]:RC[-1]) -> 0 | K495: =IF(RC[-1]=0,0,RC[-3]/RC[-1]) -> 0 | L495: =IF(RC[-2]=0,0,RC[-3]/RC[-2]) -> 0 | M495: =IF(R[2]C[-3]=0,0,RC[-3]/R[2]C[-3]) -> 0
A496: Transient Jet | B496: 416 | C496: 32D2C | D496: Departure | E496: 32 | F496: Transient | G496: Departure | H496: 0 | I496: 0 | J496: =SUM(RC[-2]:RC[-1]) -> 0 | K496: =IF(RC[-1]=0,0,RC[-3]/RC[-1]) -> 0 | L496: =IF(RC[-2]=0,0,RC[-3]/RC[-2]) -> 0 | M496: =IF(R[1]C[-3]=0,0,RC[-3]/R[1]C[-3]) -> 0
G497: Subtotal | H497: 0.85714285714285721 | I497: 0 | J497: =SUM(R[-16]C:R[-1]C) -> 0.85714285714285721 | K497: =IF(RC[-1]=0,0,RC[-3]/RC[-1]) -> 1 | L497: =IF(RC[-2]=0,0,RC[-3]/RC[-2]) -> 0
A499: Transient Jet | B499: 447B | C499: 07G1B | D499: Closed Pattern | E499: 07 | F499: Transient | G499: GCA Pattern | H499: 0 | I499: 0 | J499: =SUM(RC[-2]:RC[-1]) -> 0 | K499: =IF(RC[-1]=0,0,RC[-3]/RC[-1]) -> 0 | L499: =IF(RC[-2]=0,0,RC[-3]/RC[-2]) -> 0 | M499: =IF(R[12]C[-3]=0,0,RC[-3]/R[12]C[-3]) -> 0
A500: Transient Jet | B500: 447C | C500: 07G1C | D500: Closed Pattern | E500: 07 | F500: Transient | G500: GCA Pattern | H500: 0 | I500: 0 | J500: =SUM(RC[-2]:RC[-1]) -> 0 | K500: =IF(RC[-1]=0,0,RC[-3]/RC[-1]) -> 0 | L500: =IF(RC[-2]=0,0,RC[-3]/RC[-2]) -> 0 | M500: =IF(R[11]C[-3]=0,0,RC[-3]/R[11]C[-3]) -> 0
A501: Transient Jet | B501: 448B | C501: 14G1B | D501: Closed Pattern | E501: 14 | F501: Transient | G501: GCA Pattern | H501: 0.14285714285714285 | I501: 0 | J501: =SUM(RC[-2]:RC[-1]) -> 0.14285714285714285 | K501: =IF(RC[-1]=0,0,RC[-3]/RC[-1]) -> 1 | L501: =IF(RC[-2]=0,0,RC[-3]/RC[-2]) -> 0 | M501: =IF(R[10]C[-3]=0,0,RC[-3]/R[10]C[-3]) -> 1
A502: Transient Jet | B502: 448C | C502: 14G1C | D502: Closed Pattern | E502: 14 | F502: Transient | G502: GCA Pattern | H502: 0 | I502: 0 | J502: =SUM(RC[-2]:RC[-1]) -> 0 | K502: =IF(RC[-1]=0,0,RC[-3]/RC[-1]) -> 0 | L502: =IF(RC[-2]=0,0,RC[-3]/RC[-2]) -> 0 | M502: =IF(R[9]C[-3]=0,0,RC[-3]/R[9]C[-3]) -> 0
A503: Transient Jet | B503: 449B | C503: 25G1B | D503: Closed Pattern | E503: 25 | F503: Transient | G503: GCA Pattern | H503: 0 | I503: 0 | J503: =SUM(RC[-2]:RC[-1]) -> 0 | K503: =IF(RC[-1]=0,0,RC[-3]/RC[-1]) -> 0 | L503: =IF(RC[-2]=0,0,RC[-3]/RC[-2]) -> 0 | M503: =IF(R[8]C[-3]=0,0,RC[-3]/R[8]C[-3]) -> 0
A504: Transient Jet | B504: 449C | C504: 25G1C | D504: Closed Pattern | E504: 25 | F504: Transient | G504: GCA Pattern | H504: 0 | I504: 0 | J504: =SUM(RC[-2]:RC[-1]) -> 0 | K504: =IF(RC[-1]=0,0,RC[-3]/RC[-1]) -> 0 | L504: =IF(RC[-2]=0,0,RC[-3]/RC[-2]) -> 0 | M504: =IF(R[7]C[-3]=0,0,RC[-3]/R[7]C[-3]) -> 0
A505: Transient Jet | B505: 450B | C505: 32G1B | D505: Closed Pattern | E505: 32 | F505: Transient | G505: GCA Pattern | H505: 0 | I505: 0 | J505: =SUM(RC[-2]:RC[-1]) -> 0 | K505: =IF(RC[-1]=0,0,RC[-3]/RC[-1]) -> 0 | L505: =IF(RC[-2]=0,0,RC[-3]/RC[-2]) -> 0 | M505: =IF(R[6]C[-3]=0,0,RC[-3]/R[6]C[-3]) -> 0
A506: Transient Jet | B506: 450C | C506: 32G1C | D506: Closed Pattern | E506: 32 | F506: Transient | G506: GCA Pattern | H506: 0 | I506: 0 | J506: =SUM(RC[-2]:RC[-1]) -> 0 | K506: =IF(RC[-1]=0,0,RC[-3]/RC[-1]) -> 0 | L506: =IF(RC[-2]=0,0,RC[-3]/RC[-2]) -> 0 | M506: =IF(R[5]C[-3]=0,0,RC[-3]/R[5]C[-3]) -> 0
A507: Transient Jet | B507: 451B | C507: 07TU2C | D507: Closed Pattern | E507: 07 | F507: Transient | G507: Touch and Go at Ault Field | H507: 0 | I507: 0 | J507: =SUM(RC[-2]:RC[-1]) -> 0 | K507: =IF(RC[-1]=0,0,RC[-3]/RC[-1]) -> 0 | L507: =IF(RC[-2]=0,0,RC[-3]/RC[-2]) -> 0 | M507: =IF(R[4]C[-3]=0,0,RC[-3]/R[4]C[-3]) -> 0
A508: Transient Jet | B508: 452B | C508: 14TU2C | D508: Closed Pattern | E508: 14 | F508: Transient | G508: Touch and Go at Ault Field | H508: 0 | I508: 0 | J508: =SUM(RC[-2]:RC[-1]) -> 0 | K508: =IF(RC[-1]=0,0,RC[-3]/RC[-1]) -> 0 | L508: =IF(RC[-2]=0,0,RC[-3]/RC[-2]) -> 0 | M508: =IF(R[3]C[-3]=0,0,RC[-3]/R[3]C[-3]) -> 0
A509: Transient Jet | B509: 453B | C509: 25TU2C | D509: Closed Pattern | E509: 25 | F509: Transient | G509: Touch and Go at Ault Field | H509: 0 | I509: 0 | J509: =SUM(RC[-2]:RC[-1]) -> 0 | K509: =IF(RC[-1]=0,0,RC[-3]/RC[-1]) -> 0 | L509: =IF(RC[-2]=0,0,RC[-3]/RC[-2]) -> 0 | M509: =IF(R[2]C[-3]=0,0,RC[-3]/R[2]C[-3]) -> 0
A510: Transient Jet | B510: 454B | C510: 32TU2C | D510: Closed Pattern | E510: 32 | F510: Transient | G510: Touch and Go at Ault Field | H510: 0 | I510: 0 | J510: =SUM(RC[-2]:RC[-1]) -> 0 | K510: =IF(RC[-1]=0,0,RC[-3]/RC[-1]) -> 0 | L510: =IF(RC[-2]=0,0,RC[-3]/RC[-2]) -> 0 | M510: =IF(R[1]C[-3]=0,0,RC[-3]/R[1]C[-3]) -> 0
G511: Subtotal | H511: 0.14285714285714285 | I511: 0 | J511: =SUM(R[-12]C:R[-1]C) -> 0.14285714285714285 | K511: =IF(RC[-1]=0,0,RC[-3]/RC[-1]) -> 1 | L511: =IF(RC[-2]=0,0,RC[-3]/RC[-2]) -> 0