Sheet: Sheet1
A1: Aircraft | B1: Engine | C1: Profile | D1: Long Name | E1: Track | F1: Track Type | G1: Runway | H1: Noise Model | I1: A/C Category | J1: Rep | K1: Track Group | L1: Num Day | M1: Num Night | N1: Num Total | O1: % Day | P1: % Night | Q1: % Total
A2: EA-18G | B2: F414-GE-400 | C2: 226A_EXP | D2: Straight-In Arrival Runway 07 - South Short | E2: 07A2A | F2: Arrival | G2: 07 | H2: NMap | I2: Based | J2: No | K2: P3 P8 IFR and Growler VFR non breaks | L2: 0 | M2: 0 | N2: =SUM(RC[-2]:RC[-1]) -> -999 | O2: =IF(RC[-1]=0,0,RC[-3]/RC[-1]) -> -999 | P2: =IF(RC[-2]=0,0,RC[-3]/RC[-2]) -> -999 | Q2: =IF(R[+147]C[-3]=0,0,RC[-3]/R[+147]C[-3]) -> -999
A3: EA-18G | B3: F414-GE-400 | C3: 226A_FLT | D3: Straight-In Arrival Runway 07 - South Short | E3: 07A2A | F3: Arrival | G3: 07 | H3: NMap | I3: Based | J3: No | K3: P3 P8 IFR and Growler VFR non breaks | L3: 0 | M3: 0 | N3: =SUM(RC[-2]:RC[-1]) -> -999 | O3: =IF(RC[-1]=0,0,RC[-3]/RC[-1]) -> -999 | P3: =IF(RC[-2]=0,0,RC[-3]/RC[-2]) -> -999 | Q3: =IF(R[+146]C[-3]=0,0,RC[-3]/R[+146]C[-3]) -> -999
A4: EA-18G | B4: F414-GE-400 | C4: 226A_FRS | D4: Straight-In Arrival Runway 07 - South Short | E4: 07A2A | F4: Arrival | G4: 07 | H4: NMap | I4: Based | J4: No | K4: P3 P8 IFR and Growler VFR non breaks | L4: 0 | M4: 0 | N4: =SUM(RC[-2]:RC[-1]) -> -999 | O4: =IF(RC[-1]=0,0,RC[-3]/RC[-1]) -> -999 | P4: =IF(RC[-2]=0,0,RC[-3]/RC[-2]) -> -999 | Q4: =IF(R[+145]C[-3]=0,0,RC[-3]/R[+145]C[-3]) -> -999
A5: EA-18G | B5: F414-GE-400 | C5: 226B_EXP | D5: Straight-In Arrival Runway 07 - South Center | E5: 07A2B | F5: Arrival | G5: 07 | H5: NMap | I5: Based | J5: No | K5: P3 P8 IFR and Growler VFR non breaks | L5: 0 | M5: 0 | N5: =SUM(RC[-2]:RC[-1]) -> -999 | O5: =IF(RC[-1]=0,0,RC[-3]/RC[-1]) -> -999 | P5: =IF(RC[-2]=0,0,RC[-3]/RC[-2]) -> -999 | Q5: =IF(R[+144]C[-3]=0,0,RC[-3]/R[+144]C[-3]) -> -999
A6: EA-18G | B6: F414-GE-400 | C6: 226B_FLT | D6: Straight-In Arrival Runway 07 - South Center | E6: 07A2B | F6: Arrival | G6: 07 | H6: NMap | I6: Based | J6: No | K6: P3 P8 IFR and Growler VFR non breaks | L6: 0 | M6: 0 | N6: =SUM(RC[-2]:RC[-1]) -> -999 | O6: =IF(RC[-1]=0,0,RC[-3]/RC[-1]) -> -999 | P6: =IF(RC[-2]=0,0,RC[-3]/RC[-2]) -> -999 | Q6: =IF(R[+143]C[-3]=0,0,RC[-3]/R[+143]C[-3]) -> -999
A7: EA-18G | B7: F414-GE-400 | C7: 226B_FRS | D7: Straight-In Arrival Runway 07 - South Center | E7: 07A2B | F7: Arrival | G7: 07 | H7: NMap | I7: Based | J7: No | K7: P3 P8 IFR and Growler VFR non breaks | L7: 0 | M7: 0 | N7: =SUM(RC[-2]:RC[-1]) -> -999 | O7: =IF(RC[-1]=0,0,RC[-3]/RC[-1]) -> -999 | P7: =IF(RC[-2]=0,0,RC[-3]/RC[-2]) -> -999 | Q7: =IF(R[+142]C[-3]=0,0,RC[-3]/R[+142]C[-3]) -> -999
A8: EA-18G | B8: F414-GE-400 | C8: 226C_EXP | D8: Straight-In Arrival Runway 07 - South Long | E8: 07A2C | F8: Arrival | G8: 07 | H8: NMap | I8: Based | J8: No | K8: P3 P8 IFR and Growler VFR non breaks | L8: 0 | M8: 0 | N8: =SUM(RC[-2]:RC[-1]) -> -999 | O8: =IF(RC[-1]=0,0,RC[-3]/RC[-1]) -> -999 | P8: =IF(RC[-2]=0,0,RC[-3]/RC[-2]) -> -999 | Q8: =IF(R[+141]C[-3]=0,0,RC[-3]/R[+141]C[-3]) -> -999
A9: EA-18G | B9: F414-GE-400 | C9: 226C_FLT | D9: Straight-In Arrival Runway 07 - South Long | E9: 07A2C | F9: Arrival | G9: 07 | H9: NMap | I9: Based | J9: No | K9: P3 P8 IFR and Growler VFR non breaks | L9: 0 | M9: 0 | N9: =SUM(RC[-2]:RC[-1]) -> -999 | O9: =IF(RC[-1]=0,0,RC[-3]/RC[-1]) -> -999 | P9: =IF(RC[-2]=0,0,RC[-3]/RC[-2]) -> -999 | Q9: =IF(R[+140]C[-3]=0,0,RC[-3]/R[+140]C[-3]) -> -999
A10: EA-18G | B10: F414-GE-400 | C10: 226C_FRS | D10: Straight-In Arrival Runway 07 - South Long | E10: 07A2C | F10: Arrival | G10: 07 | H10: NMap | I10: Based | J10: No | K10: P3 P8 IFR and Growler VFR non breaks | L10: 0 | M10: 0 | N10: =SUM(RC[-2]:RC[-1]) -> -999 | O10: =IF(RC[-1]=0,0,RC[-3]/RC[-1]) -> -999 | P10: =IF(RC[-2]=0,0,RC[-3]/RC[-2]) -> -999 | Q10: =IF(R[+139]C[-3]=0,0,RC[-3]/R[+139]C[-3]) -> -999
A11: EA-18G | B11: F414-GE-400 | C11: 227A_EXP | D11: Straight-In Arrival Runway 07 - South Short | E11: 07A1A | F11: Arrival | G11: 07 | H11: NMap | I11: Based | J11: No | K11: P3 P8 IFR and Growler VFR non breaks | L11: 0 | M11: 0 | N11: =SUM(RC[-2]:RC[-1]) -> -999 | O11: =IF(RC[-1]=0,0,RC[-3]/RC[-1]) -> -999 | P11: =IF(RC[-2]=0,0,RC[-3]/RC[-2]) -> -999 | Q11: =IF(R[+138]C[-3]=0,0,RC[-3]/R[+138]C[-3]) -> -999
A12: EA-18G | B12: F414-GE-400 | C12: 227A_FLT | D12: Straight-In Arrival Runway 07 - South Short | E12: 07A1A | F12: Arrival | G12: 07 | H12: NMap | I12: Based | J12: No | K12: P3 P8 IFR and Growler VFR non breaks | L12: 0 | M12: 0 | N12: =SUM(RC[-2]:RC[-1]) -> -999 | O12: =IF(RC[-1]=0,0,RC[-3]/RC[-1]) -> -999 | P12: =IF(RC[-2]=0,0,RC[-3]/RC[-2]) -> -999 | Q12: =IF(R[+137]C[-3]=0,0,RC[-3]/R[+137]C[-3]) -> -999
A13: EA-18G | B13: F414-GE-400 | C13: 227A_FRS | D13: Straight-In Arrival Runway 07 - South Short | E13: 07A1A | F13: Arrival | G13: 07 | H13: NMap | I13: Based | J13: No | K13: P3 P8 IFR and Growler VFR non breaks | L13: 0 | M13: 0 | N13: =SUM(RC[-2]:RC[-1]) -> -999 | O13: =IF(RC[-1]=0,0,RC[-3]/RC[-1]) -> -999 | P13: =IF(RC[-2]=0,0,RC[-3]/RC[-2]) -> -999 | Q13: =IF(R[+136]C[-3]=0,0,RC[-3]/R[+136]C[-3]) -> -999
A14: EA-18G | B14: F414-GE-400 | C14: 227B_EXP | D14: Straight-In Arrival Runway 07 - South Center | E14: 07A3B | F14: Arrival | G14: 07 | H14: NMap | I14: Based | J14: No | K14: P3 P8 IFR and Growler VFR non breaks | L14: 0 | M14: 0 | N14: =SUM(RC[-2]:RC[-1]) -> -999 | O14: =IF(RC[-1]=0,0,RC[-3]/RC[-1]) -> -999 | P14: =IF(RC[-2]=0,0,RC[-3]/RC[-2]) -> -999 | Q14: =IF(R[+135]C[-3]=0,0,RC[-3]/R[+135]C[-3]) -> -999
A15: EA-18G | B15: F414-GE-400 | C15: 227B_FLT | D15: Straight-In Arrival Runway 07 - South Center | E15: 07A3B | F15: Arrival | G15: 07 | H15: NMap | I15: Based | J15: No | K15: P3 P8 IFR and Growler VFR non breaks | L15: 0 | M15: 0 | N15: =SUM(RC[-2]:RC[-1]) -> -999 | O15: =IF(RC[-1]=0,0,RC[-3]/RC[-1]) -> -999 | P15: =IF(RC[-2]=0,0,RC[-3]/RC[-2]) -> -999 | Q15: =IF(R[+134]C[-3]=0,0,RC[-3]/R[+134]C[-3]) -> -999
A16: EA-18G | B16: F414-GE-400 | C16: 227B_FRS | D16: Straight-In Arrival Runway 07 - South Center | E16: 07A3B | F16: Arrival | G16: 07 | H16: NMap | I16: Based | J16: No | K16: P3 P8 IFR and Growler VFR non breaks | L16: 0 | M16: 0 | N16: =SUM(RC[-2]:RC[-1]) -> -999 | O16: =IF(RC[-1]=0,0,RC[-3]/RC[-1]) -> -999 | P16: =IF(RC[-2]=0,0,RC[-3]/RC[-2]) -> -999 | Q16: =IF(R[+133]C[-3]=0,0,RC[-3]/R[+133]C[-3]) -> -999
A17: EA-18G | B17: F414-GE-400 | C17: 227C_EXP | D17: Straight-In Arrival Runway 07 - South Long | E17: 07A3C | F17: Arrival | G17: 07 | H17: NMap | I17: Based | J17: No | K17: P3 P8 IFR and Growler VFR non breaks | L17: 0 | M17: 0 | N17: =SUM(RC[-2]:RC[-1]) -> -999 | O17: =IF(RC[-1]=0,0,RC[-3]/RC[-1]) -> -999 | P17: =IF(RC[-2]=0,0,RC[-3]/RC[-2]) -> -999 | Q17: =IF(R[+132]C[-3]=0,0,RC[-3]/R[+132]C[-3]) -> -999
A18: EA-18G | B18: F414-GE-400 | C18: 227C_FLT | D18: Straight-In Arrival Runway 07 - South Long | E18: 07A3C | F18: Arrival | G18: 07 | H18: NMap | I18: Based | J18: No | K18: P3 P8 IFR and Growler VFR non breaks | L18: 0 | M18: 0 | N18: =SUM(RC[-2]:RC[-1]) -> -999 | O18: =IF(RC[-1]=0,0,RC[-3]/RC[-1]) -> -999 | P18: =IF(RC[-2]=0,0,RC[-3]/RC[-2]) -> -999 | Q18: =IF(R[+131]C[-3]=0,0,RC[-3]/R[+131]C[-3]) -> -999
A19: EA-18G | B19: F414-GE-400 | C19: 227C_FRS | D19: Straight-In Arrival Runway 07 - South Long | E19: 07A3C | F19: Arrival | G19: 07 | H19: NMap | I19: Based | J19: No | K19: P3 P8 IFR and Growler VFR non breaks | L19: 0 | M19: 0 | N19: =SUM(RC[-2]:RC[-1]) -> -999 | O19: =IF(RC[-1]=0,0,RC[-3]/RC[-1]) -> -999 | P19: =IF(RC[-2]=0,0,RC[-3]/RC[-2]) -> -999 | Q19: =IF(R[+130]C[-3]=0,0,RC[-3]/R[+130]C[-3]) -> -999
A20: EA-18G | B20: F414-GE-400 | C20: 228A_EXP | D20: Rep - Straight-In Arrival Runway 14 - East Short | E20: 14A1A | F20: Arrival | G20: 14 | H20: NMap | I20: Based | J20: Yes | K20: P3 P8 IFR and Growler VFR non breaks | L20: 0 | M20: 0 | N20: =SUM(RC[-2]:RC[-1]) -> -999 | O20: =IF(RC[-1]=0,0,RC[-3]/RC[-1]) -> -999 | P20: =IF(RC[-2]=0,0,RC[-3]/RC[-2]) -> -999 | Q20: =IF(R[+129]C[-3]=0,0,RC[-3]/R[+129]C[-3]) -> -999
A21: EA-18G | B21: F414-GE-400 | C21: 228A_FLT | D21: Straight-In Arrival | E21: 14A1A | F21: Arrival | G21: 14 | H21: NMap | I21: Based | J21: Yes | K21: P3 P8 IFR and Growler VFR non breaks | L21: 0 | M21: 0 | N21: =SUM(RC[-2]:RC[-1]) -> -999 | O21: =IF(RC[-1]=0,0,RC[-3]/RC[-1]) -> -999 | P21: =IF(RC[-2]=0,0,RC[-3]/RC[-2]) -> -999 | Q21: =IF(R[+128]C[-3]=0,0,RC[-3]/R[+128]C[-3]) -> -999
A22: EA-18G | B22: F414-GE-400 | C22: 228A_FRS | D22: Straight-In Arrival Runway 14 - East Short | E22: 14A1A | F22: Arrival | G22: 14 | H22: NMap | I22: Based | J22: Yes | K22: P3 P8 IFR and Growler VFR non breaks | L22: 0 | M22: 0 | N22: =SUM(RC[-2]:RC[-1]) -> -999 | O22: =IF(RC[-1]=0,0,RC[-3]/RC[-1]) -> -999 | P22: =IF(RC[-2]=0,0,RC[-3]/RC[-2]) -> -999 | Q22: =IF(R[+127]C[-3]=0,0,RC[-3]/R[+127]C[-3]) -> -999
A23: EA-18G | B23: F414-GE-400 | C23: 228B_EXP | D23: Straight-In Arrival Runway 14 - East Center | E23: 14A1B | F23: Arrival | G23: 14 | H23: NMap | I23: Based | J23: No | K23: P3 P8 IFR and Growler VFR non breaks | L23: 0 | M23: 0 | N23: =SUM(RC[-2]:RC[-1]) -> -999 | O23: =IF(RC[-1]=0,0,RC[-3]/RC[-1]) -> -999 | P23: =IF(RC[-2]=0,0,RC[-3]/RC[-2]) -> -999 | Q23: =IF(R[+126]C[-3]=0,0,RC[-3]/R[+126]C[-3]) -> -999
A24: EA-18G | B24: F414-GE-400 | C24: 228B_FLT | D24: Straight-In Arrival Runway 14 - East Center | E24: 14A1B | F24: Arrival | G24: 14 | H24: NMap | I24: Based | J24: No | K24: P3 P8 IFR and Growler VFR non breaks | L24: 0 | M24: 0 | N24: =SUM(RC[-2]:RC[-1]) -> -999 | O24: =IF(RC[-1]=0,0,RC[-3]/RC[-1]) -> -999 | P24: =IF(RC[-2]=0,0,RC[-3]/RC[-2]) -> -999 | Q24: =IF(R[+125]C[-3]=0,0,RC[-3]/R[+125]C[-3]) -> -999
A25: EA-18G | B25: F414-GE-400 | C25: 228B_FRS | D25: Straight-In Arrival Runway 14 - East Center | E25: 14A1B | F25: Arrival | G25: 14 | H25: NMap | I25: Based | J25: No | K25: P3 P8 IFR and Growler VFR non breaks | L25: 0 | M25: 0 | N25: =SUM(RC[-2]:RC[-1]) -> -999 | O25: =IF(RC[-1]=0,0,RC[-3]/RC[-1]) -> -999 | P25: =IF(RC[-2]=0,0,RC[-3]/RC[-2]) -> -999 | Q25: =IF(R[+124]C[-3]=0,0,RC[-3]/R[+124]C[-3]) -> -999
A26: EA-18G | B26: F414-GE-400 | C26: 228C_EXP | D26: Straight-In Arrival Runway 14 - East Long | E26: 14A1C | F26: Arrival | G26: 14 | H26: NMap | I26: Based | J26: No | K26: P3 P8 IFR and Growler VFR non breaks | L26: 0 | M26: 0 | N26: =SUM(RC[-2]:RC[-1]) -> -999 | O26: =IF(RC[-1]=0,0,RC[-3]/RC[-1]) -> -999 | P26: =IF(RC[-2]=0,0,RC[-3]/RC[-2]) -> -999 | Q26: =IF(R[+123]C[-3]=0,0,RC[-3]/R[+123]C[-3]) -> -999
A27: EA-18G | B27: F414-GE-400 | C27: 228C_FLT | D27: Straight-In Arrival Runway 14 - East Long | E27: 14A1C | F27: Arrival | G27: 14 | H27: NMap | I27: Based | J27: No | K27: P3 P8 IFR and Growler VFR non breaks | L27: 0 | M27: 0 | N27: =SUM(RC[-2]:RC[-1]) -> -999 | O27: =IF(RC[-1]=0,0,RC[-3]/RC[-1]) -> -999 | P27: =IF(RC[-2]=0,0,RC[-3]/RC[-2]) -> -999 | Q27: =IF(R[+122]C[-3]=0,0,RC[-3]/R[+122]C[-3]) -> -999
A28: EA-18G | B28: F414-GE-400 | C28: 228C_FRS | D28: Straight-In Arrival Runway 14 - East Long | E28: 14A1C | F28: Arrival | G28: 14 | H28: NMap | I28: Based | J28: No | K28: P3 P8 IFR and Growler VFR non breaks | L28: 0.14285714 | M28: 0 | N28: =SUM(RC[-2]:RC[-1]) -> -999 | O28: =IF(RC[-1]=0,0,RC[-3]/RC[-1]) -> -999 | P28: =IF(RC[-2]=0,0,RC[-3]/RC[-2]) -> -999 | Q28: =IF(R[+121]C[-3]=0,0,RC[-3]/R[+121]C[-3]) -> -999
A29: EA-18G | B29: F414-GE-400 | C29: 229A_EXP | D29: Straight-In Arrival Runway 14 - South Short | E29: 14A2A | F29: Arrival | G29: 14 | H29: NMap | I29: Based | J29: No | K29: P3 P8 IFR and Growler VFR non breaks | L29: 0 | M29: 0 | N29: =SUM(RC[-2]:RC[-1]) -> -999 | O29: =IF(RC[-1]=0,0,RC[-3]/RC[-1]) -> -999 | P29: =IF(RC[-2]=0,0,RC[-3]/RC[-2]) -> -999 | Q29: =IF(R[+120]C[-3]=0,0,RC[-3]/R[+120]C[-3]) -> -999
A30: EA-18G | B30: F414-GE-400 | C30: 229A_FLT | D30: Straight-In Arrival Runway 14 - South Short | E30: 14A2A | F30: Arrival | G30: 14 | H30: NMap | I30: Based | J30: No | K30: P3 P8 IFR and Growler VFR non breaks | L30: 0 | M30: 0 | N30: =SUM(RC[-2]:RC[-1]) -> -999 | O30: =IF(RC[-1]=0,0,RC[-3]/RC[-1]) -> -999 | P30: =IF(RC[-2]=0,0,RC[-3]/RC[-2]) -> -999 | Q30: =IF(R[+119]C[-3]=0,0,RC[-3]/R[+119]C[-3]) -> -999
A31: EA-18G | B31: F414-GE-400 | C31: 229A_FRS | D31: Straight-In Arrival Runway 14 - South Short | E31: 14A2A | F31: Arrival | G31: 14 | H31: NMap | I31: Based | J31: No | K31: P3 P8 IFR and Growler VFR non breaks | L31: 0 | M31: 0 | N31: =SUM(RC[-2]:RC[-1]) -> -999 | O31: =IF(RC[-1]=0,0,RC[-3]/RC[-1]) -> -999 | P31: =IF(RC[-2]=0,0,RC[-3]/RC[-2]) -> -999 | Q31: =IF(R[+118]C[-3]=0,0,RC[-3]/R[+118]C[-3]) -> -999
A32: EA-18G | B32: F414-GE-400 | C32: 229B_EXP | D32: Straight-In Arrival Runway 14 - South Center | E32: 14A2B | F32: Arrival | G32: 14 | H32: NMap | I32: Based | J32: No | K32: P3 P8 IFR and Growler VFR non breaks | L32: 0 | M32: 0 | N32: =SUM(RC[-2]:RC[-1]) -> -999 | O32: =IF(RC[-1]=0,0,RC[-3]/RC[-1]) -> -999 | P32: =IF(RC[-2]=0,0,RC[-3]/RC[-2]) -> -999 | Q32: =IF(R[+117]C[-3]=0,0,RC[-3]/R[+117]C[-3]) -> -999
A33: EA-18G | B33: F414-GE-400 | C33: 229B_FLT | D33: Straight-In Arrival Runway 14 - South Center | E33: 14A2B | F33: Arrival | G33: 14 | H33: NMap | I33: Based | J33: No | K33: P3 P8 IFR and Growler VFR non breaks | L33: 0 | M33: 0 | N33: =SUM(RC[-2]:RC[-1]) -> -999 | O33: =IF(RC[-1]=0,0,RC[-3]/RC[-1]) -> -999 | P33: =IF(RC[-2]=0,0,RC[-3]/RC[-2]) -> -999 | Q33: =IF(R[+116]C[-3]=0,0,RC[-3]/R[+116]C[-3]) -> -999
A34: EA-18G | B34: F414-GE-400 | C34: 229B_FRS | D34: Straight-In Arrival Runway 14 - South Center | E34: 14A2B | F34: Arrival | G34: 14 | H34: NMap | I34: Based | J34: No | K34: P3 P8 IFR and Growler VFR non breaks | L34: 0 | M34: 0 | N34: =SUM(RC[-2]:RC[-1]) -> -999 | O34: =IF(RC[-1]=0,0,RC[-3]/RC[-1]) -> -999 | P34: =IF(RC[-2]=0,0,RC[-3]/RC[-2]) -> -999 | Q34: =IF(R[+115]C[-3]=0,0,RC[-3]/R[+115]C[-3]) -> -999
A35: EA-18G | B35: F414-GE-400 | C35: 229C_EXP | D35: Straight-In Arrival Runway 14 - South Long | E35: 14A2C | F35: Arrival | G35: 14 | H35: NMap | I35: Based | J35: No | K35: P3 P8 IFR and Growler VFR non breaks | L35: 0 | M35: 0 | N35: =SUM(RC[-2]:RC[-1]) -> -999 | O35: =IF(RC[-1]=0,0,RC[-3]/RC[-1]) -> -999 | P35: =IF(RC[-2]=0,0,RC[-3]/RC[-2]) -> -999 | Q35: =IF(R[+114]C[-3]=0,0,RC[-3]/R[+114]C[-3]) -> -999
A36: EA-18G | B36: F414-GE-400 | C36: 229C_FLT | D36: Straight-In Arrival Runway 14 - South Long | E36: 14A2C | F36: Arrival | G36: 14 | H36: NMap | I36: Based | J36: No | K36: P3 P8 IFR and Growler VFR non breaks | L36: 0 | M36: 0 | N36: =SUM(RC[-2]:RC[-1]) -> -999 | O36: =IF(RC[-1]=0,0,RC[-3]/RC[-1]) -> -999 | P36: =IF(RC[-2]=0,0,RC[-3]/RC[-2]) -> -999 | Q36: =IF(R[+113]C[-3]=0,0,RC[-3]/R[+113]C[-3]) -> -999
A37: EA-18G | B37: F414-GE-400 | C37: 229C_FRS | D37: Straight-In Arrival Runway 14 - South Long | E37: 14A2C | F37: Arrival | G37: 14 | H37: NMap | I37: Based | J37: No | K37: P3 P8 IFR and Growler VFR non breaks | L37: 0 | M37: 0 | N37: =SUM(RC[-2]:RC[-1]) -> -999 | O37: =IF(RC[-1]=0,0,RC[-3]/RC[-1]) -> -999 | P37: =IF(RC[-2]=0,0,RC[-3]/RC[-2]) -> -999 | Q37: =IF(R[+112]C[-3]=0,0,RC[-3]/R[+112]C[-3]) -> -999
A38: EA-18G | B38: F414-GE-400 | C38: 230A_EXP | D38: Straight-In Arrival Runway 25 -- East | E38: 25A1D | F38: Arrival | G38: 25 | H38: NMap | I38: Based | J38: No | K38: P3 P8 IFR and Growler VFR non breaks | L38: 0.42857143 | M38: 0 | N38: =SUM(RC[-2]:RC[-1]) -> -999 | O38: =IF(RC[-1]=0,0,RC[-3]/RC[-1]) -> -999 | P38: =IF(RC[-2]=0,0,RC[-3]/RC[-2]) -> -999 | Q38: =IF(R[+111]C[-3]=0,0,RC[-3]/R[+111]C[-3]) -> -999
A39: EA-18G | B39: F414-GE-400 | C39: 230A_FLT | D39: Straight-In Arrival Runway 25 -- East | E39: 25A1D | F39: Arrival | G39: 25 | H39: NMap | I39: Based | J39: No | K39: P3 P8 IFR and Growler VFR non breaks | L39: 0.57142857 | M39: 0 | N39: =SUM(RC[-2]:RC[-1]) -> -999 | O39: =IF(RC[-1]=0,0,RC[-3]/RC[-1]) -> -999 | P39: =IF(RC[-2]=0,0,RC[-3]/RC[-2]) -> -999 | Q39: =IF(R[+110]C[-3]=0,0,RC[-3]/R[+110]C[-3]) -> -999
A40: EA-18G | B40: F414-GE-400 | C40: 230A_FRS | D40: Straight-In Arrival Runway 25 -- East | E40: 25A1D | F40: Arrival | G40: 25 | H40: NMap | I40: Based | J40: No | K40: P3 P8 IFR and Growler VFR non breaks | L40: 0.85714286 | M40: 0 | N40: =SUM(RC[-2]:RC[-1]) -> -999 | O40: =IF(RC[-1]=0,0,RC[-3]/RC[-1]) -> -999 | P40: =IF(RC[-2]=0,0,RC[-3]/RC[-2]) -> -999 | Q40: =IF(R[+109]C[-3]=0,0,RC[-3]/R[+109]C[-3]) -> -999
A41: EA-18G | B41: F414-GE-400 | C41: 231A_EXP | D41: Rep - Straight-In Arrival Runway 25 - South Short | E41: 25A2A | F41: Arrival | G41: 25 | H41: NMap | I41: Based | J41: Yes | K41: P3 P8 IFR and Growler VFR non breaks | L41: 0 | M41: 0 | N41: =SUM(RC[-2]:RC[-1]) -> -999 | O41: =IF(RC[-1]=0,0,RC[-3]/RC[-1]) -> -999 | P41: =IF(RC[-2]=0,0,RC[-3]/RC[-2]) -> -999 | Q41: =IF(R[+108]C[-3]=0,0,RC[-3]/R[+108]C[-3]) -> -999
A42: EA-18G | B42: F414-GE-400 | C42: 231A_FLT | D42: Rep - Straight-In Arrival Runway 25 - South Short | E42: 25A2A | F42: Arrival | G42: 25 | H42: NMap | I42: Based | J42: Yes | K42: P3 P8 IFR and Growler VFR non breaks | L42: 0 | M42: 0 | N42: =SUM(RC[-2]:RC[-1]) -> -999 | O42: =IF(RC[-1]=0,0,RC[-3]/RC[-1]) -> -999 | P42: =IF(RC[-2]=0,0,RC[-3]/RC[-2]) -> -999 | Q42: =IF(R[+107]C[-3]=0,0,RC[-3]/R[+107]C[-3]) -> -999
A43: EA-18G | B43: F414-GE-400 | C43: 231A_FRS | D43: Rep - Straight-In Arrival Runway 25 - South Short | E43: 25A2A | F43: Arrival | G43: 25 | H43: NMap | I43: Based | J43: Yes | K43: P3 P8 IFR and Growler VFR non breaks | L43: 0 | M43: 0 | N43: =SUM(RC[-2]:RC[-1]) -> -999 | O43: =IF(RC[-1]=0,0,RC[-3]/RC[-1]) -> -999 | P43: =IF(RC[-2]=0,0,RC[-3]/RC[-2]) -> -999 | Q43: =IF(R[+106]C[-3]=0,0,RC[-3]/R[+106]C[-3]) -> -999
A44: EA-18G | B44: F414-GE-400 | C44: 231B_EXP | D44: Straight-In Arrival Runway 25 - South Center | E44: 25A2B | F44: Arrival | G44: 25 | H44: NMap | I44: Based | J44: No | K44: P3 P8 IFR and Growler VFR non breaks | L44: 0.14285714 | M44: 0 | N44: =SUM(RC[-2]:RC[-1]) -> -999 | O44: =IF(RC[-1]=0,0,RC[-3]/RC[-1]) -> -999 | P44: =IF(RC[-2]=0,0,RC[-3]/RC[-2]) -> -999 | Q44: =IF(R[+105]C[-3]=0,0,RC[-3]/R[+105]C[-3]) -> -999
A45: EA-18G | B45: F414-GE-400 | C45: 231B_FLT | D45: Straight-In Arrival Runway 25 - South Center | E45: 25A2B | F45: Arrival | G45: 25 | H45: NMap | I45: Based | J45: No | K45: P3 P8 IFR and Growler VFR non breaks | L45: 0 | M45: 0 | N45: =SUM(RC[-2]:RC[-1]) -> -999 | O45: =IF(RC[-1]=0,0,RC[-3]/RC[-1]) -> -999 | P45: =IF(RC[-2]=0,0,RC[-3]/RC[-2]) -> -999 | Q45: =IF(R[+104]C[-3]=0,0,RC[-3]/R[+104]C[-3]) -> -999
A46: EA-18G | B46: F414-GE-400 | C46: 231B_FRS | D46: Straight-In Arrival Runway 25 - South Center | E46: 25A2B | F46: Arrival | G46: 25 | H46: NMap | I46: Based | J46: No | K46: P3 P8 IFR and Growler VFR non breaks | L46: 0.42857143 | M46: 0 | N46: =SUM(RC[-2]:RC[-1]) -> -999 | O46: =IF(RC[-1]=0,0,RC[-3]/RC[-1]) -> -999 | P46: =IF(RC[-2]=0,0,RC[-3]/RC[-2]) -> -999 | Q46: =IF(R[+103]C[-3]=0,0,RC[-3]/R[+103]C[-3]) -> -999
A47: EA-18G | B47: F414-GE-400 | C47: 231C_EXP | D47: Straight-In Arrival Runway 25 - South Long | E47: 25A2C | F47: Arrival | G47: 25 | H47: NMap | I47: Based | J47: No | K47: P3 P8 IFR and Growler VFR non breaks | L47: 0 | M47: 0 | N47: =SUM(RC[-2]:RC[-1]) -> -999 | O47: =IF(RC[-1]=0,0,RC[-3]/RC[-1]) -> -999 | P47: =IF(RC[-2]=0,0,RC[-3]/RC[-2]) -> -999 | Q47: =IF(R[+102]C[-3]=0,0,RC[-3]/R[+102]C[-3]) -> -999
A48: EA-18G | B48: F414-GE-400 | C48: 231C_FLT | D48: Straight-In Arrival Runway 25 - South Long | E48: 25A2C | F48: Arrival | G48: 25 | H48: NMap | I48: Based | J48: No | K48: P3 P8 IFR and Growler VFR non breaks | L48: 0 | M48: 0 | N48: =SUM(RC[-2]:RC[-1]) -> -999 | O48: =IF(RC[-1]=0,0,RC[-3]/RC[-1]) -> -999 | P48: =IF(RC[-2]=0,0,RC[-3]/RC[-2]) -> -999 | Q48: =IF(R[+101]C[-3]=0,0,RC[-3]/R[+101]C[-3]) -> -999
A49: EA-18G | B49: F414-GE-400 | C49: 231C_FRS | D49: Straight-In Arrival Runway 25 - South Long | E49: 25A2C | F49: Arrival | G49: 25 | H49: NMap | I49: Based | J49: No | K49: P3 P8 IFR and Growler VFR non breaks | L49: 0 | M49: 0 | N49: =SUM(RC[-2]:RC[-1]) -> -999 | O49: =IF(RC[-1]=0,0,RC[-3]/RC[-1]) -> -999 | P49: =IF(RC[-2]=0,0,RC[-3]/RC[-2]) -> -999 | Q49: =IF(R[+100]C[-3]=0,0,RC[-3]/R[+100]C[-3]) -> -999
A50: EA-18G | B50: F414-GE-400 | C50: 232A_EXP | D50: Straight-In Arrival Runway 25 - South Short | E50: 25A2NA | F50: Arrival | G50: 25 | H50: NMap | I50: Based | J50: No | K50: P3 P8 IFR and Growler VFR non breaks | L50: 0 | M50: 0 | N50: =SUM(RC[-2]:RC[-1]) -> -999 | O50: =IF(RC[-1]=0,0,RC[-3]/RC[-1]) -> -999 | P50: =IF(RC[-2]=0,0,RC[-3]/RC[-2]) -> -999 | Q50: =IF(R[+99]C[-3]=0,0,RC[-3]/R[+99]C[-3]) -> -999
A51: EA-18G | B51: F414-GE-400 | C51: 232A_FLT | D51: Straight-In Arrival Runway 25 - South Short | E51: 25A2NA | F51: Arrival | G51: 25 | H51: NMap | I51: Based | J51: No | K51: P3 P8 IFR and Growler VFR non breaks | L51: 0 | M51: 0 | N51: =SUM(RC[-2]:RC[-1]) -> -999 | O51: =IF(RC[-1]=0,0,RC[-3]/RC[-1]) -> -999 | P51: =IF(RC[-2]=0,0,RC[-3]/RC[-2]) -> -999 | Q51: =IF(R[+98]C[-3]=0,0,RC[-3]/R[+98]C[-3]) -> -999
A52: EA-18G | B52: F414-GE-400 | C52: 232A_FRS | D52: Straight-In Arrival Runway 25 - South Short | E52: 25A2NA | F52: Arrival | G52: 25 | H52: NMap | I52: Based | J52: No | K52: P3 P8 IFR and Growler VFR non breaks | L52: 0 | M52: 0 | N52: =SUM(RC[-2]:RC[-1]) -> -999 | O52: =IF(RC[-1]=0,0,RC[-3]/RC[-1]) -> -999 | P52: =IF(RC[-2]=0,0,RC[-3]/RC[-2]) -> -999 | Q52: =IF(R[+97]C[-3]=0,0,RC[-3]/R[+97]C[-3]) -> -999
A53: EA-18G | B53: F414-GE-400 | C53: 232B_EXP | D53: Straight-In Arrival Runway 25 - South Center | E53: 25A2NB | F53: Arrival | G53: 25 | H53: NMap | I53: Based | J53: No | K53: P3 P8 IFR and Growler VFR non breaks | L53: 0.14285714 | M53: 0 | N53: =SUM(RC[-2]:RC[-1]) -> -999 | O53: =IF(RC[-1]=0,0,RC[-3]/RC[-1]) -> -999 | P53: =IF(RC[-2]=0,0,RC[-3]/RC[-2]) -> -999 | Q53: =IF(R[+96]C[-3]=0,0,RC[-3]/R[+96]C[-3]) -> -999
A54: EA-18G | B54: F414-GE-400 | C54: 232B_FLT | D54: Straight-In Arrival Runway 25 - South Center | E54: 25A2NB | F54: Arrival | G54: 25 | H54: NMap | I54: Based | J54: No | K54: P3 P8 IFR and Growler VFR non breaks | L54: 0 | M54: 0 | N54: =SUM(RC[-2]:RC[-1]) -> -999 | O54: =IF(RC[-1]=0,0,RC[-3]/RC[-1]) -> -999 | P54: =IF(RC[-2]=0,0,RC[-3]/RC[-2]) -> -999 | Q54: =IF(R[+95]C[-3]=0,0,RC[-3]/R[+95]C[-3]) -> -999
A55: EA-18G | B55: F414-GE-400 | C55: 232B_FRS | D55: Straight-In Arrival Runway 25 - South Center | E55: 25A2NB | F55: Arrival | G55: 25 | H55: NMap | I55: Based | J55: No | K55: P3 P8 IFR and Growler VFR non breaks | L55: 0 | M55: 0 | N55: =SUM(RC[-2]:RC[-1]) -> -999 | O55: =IF(RC[-1]=0,0,RC[-3]/RC[-1]) -> -999 | P55: =IF(RC[-2]=0,0,RC[-3]/RC[-2]) -> -999 | Q55: =IF(R[+94]C[-3]=0,0,RC[-3]/R[+94]C[-3]) -> -999
A56: EA-18G | B56: F414-GE-400 | C56: 232C_EXP | D56: Straight-In Arrival Runway 25 - South Long | E56: 25A2NC | F56: Arrival | G56: 25 | H56: NMap | I56: Based | J56: No | K56: P3 P8 IFR and Growler VFR non breaks | L56: 0 | M56: 0 | N56: =SUM(RC[-2]:RC[-1]) -> -999 | O56: =IF(RC[-1]=0,0,RC[-3]/RC[-1]) -> -999 | P56: =IF(RC[-2]=0,0,RC[-3]/RC[-2]) -> -999 | Q56: =IF(R[+93]C[-3]=0,0,RC[-3]/R[+93]C[-3]) -> -999
A57: EA-18G | B57: F414-GE-400 | C57: 232C_FLT | D57: Straight-In Arrival Runway 25 - South Long | E57: 25A2NC | F57: Arrival | G57: 25 | H57: NMap | I57: Based | J57: No | K57: P3 P8 IFR and Growler VFR non breaks | L57: 0 | M57: 0 | N57: =SUM(RC[-2]:RC[-1]) -> -999 | O57: =IF(RC[-1]=0,0,RC[-3]/RC[-1]) -> -999 | P57: =IF(RC[-2]=0,0,RC[-3]/RC[-2]) -> -999 | Q57: =IF(R[+92]C[-3]=0,0,RC[-3]/R[+92]C[-3]) -> -999
A58: EA-18G | B58: F414-GE-400 | C58: 232C_FRS | D58: Straight-In Arrival Runway 25 - South Long | E58: 25A2NC | F58: Arrival | G58: 25 | H58: NMap | I58: Based | J58: No | K58: P3 P8 IFR and Growler VFR non breaks | L58: 0 | M58: 0 | N58: =SUM(RC[-2]:RC[-1]) -> -999 | O58: =IF(RC[-1]=0,0,RC[-3]/RC[-1]) -> -999 | P58: =IF(RC[-2]=0,0,RC[-3]/RC[-2]) -> -999 | Q58: =IF(R[+91]C[-3]=0,0,RC[-3]/R[+91]C[-3]) -> -999
A59: EA-18G | B59: F414-GE-400 | C59: 233A_EXP | D59: Straight-In Arrival Runway 32 - East Short | E59: 32A1A | F59: Arrival | G59: 32 | H59: NMap | I59: Based | J59: No | K59: P3 P8 IFR and Growler VFR non breaks | L59: 0 | M59: 0 | N59: =SUM(RC[-2]:RC[-1]) -> -999 | O59: =IF(RC[-1]=0,0,RC[-3]/RC[-1]) -> -999 | P59: =IF(RC[-2]=0,0,RC[-3]/RC[-2]) -> -999 | Q59: =IF(R[+90]C[-3]=0,0,RC[-3]/R[+90]C[-3]) -> -999
A60: EA-18G | B60: F414-GE-400 | C60: 233A_FLT | D60: Straight-In Arrival Runway 32 - East Short | E60: 32A1A | F60: Arrival | G60: 32 | H60: NMap | I60: Based | J60: No | K60: P3 P8 IFR and Growler VFR non breaks | L60: 0 | M60: 0 | N60: =SUM(RC[-2]:RC[-1]) -> -999 | O60: =IF(RC[-1]=0,0,RC[-3]/RC[-1]) -> -999 | P60: =IF(RC[-2]=0,0,RC[-3]/RC[-2]) -> -999 | Q60: =IF(R[+89]C[-3]=0,0,RC[-3]/R[+89]C[-3]) -> -999
A61: EA-18G | B61: F414-GE-400 | C61: 233A_FRS | D61: Straight-In Arrival Runway 32 - East Short | E61: 32A1A | F61: Arrival | G61: 32 | H61: NMap | I61: Based | J61: No | K61: P3 P8 IFR and Growler VFR non breaks | L61: 0 | M61: 0 | N61: =SUM(RC[-2]:RC[-1]) -> -999 | O61: =IF(RC[-1]=0,0,RC[-3]/RC[-1]) -> -999 | P61: =IF(RC[-2]=0,0,RC[-3]/RC[-2]) -> -999 | Q61: =IF(R[+88]C[-3]=0,0,RC[-3]/R[+88]C[-3]) -> -999
A62: EA-18G | B62: F414-GE-400 | C62: 233B_EXP | D62: Straight-In Arrival Runway 32 - East Center | E62: 32A1B | F62: Arrival | G62: 32 | H62: NMap | I62: Based | J62: No | K62: P3 P8 IFR and Growler VFR non breaks | L62: 0 | M62: 0 | N62: =SUM(RC[-2]:RC[-1]) -> -999 | O62: =IF(RC[-1]=0,0,RC[-3]/RC[-1]) -> -999 | P62: =IF(RC[-2]=0,0,RC[-3]/RC[-2]) -> -999 | Q62: =IF(R[+87]C[-3]=0,0,RC[-3]/R[+87]C[-3]) -> -999
A63: EA-18G | B63: F414-GE-400 | C63: 233B_FLT | D63: Straight-In Arrival Runway 32 - East Center | E63: 32A1B | F63: Arrival | G63: 32 | H63: NMap | I63: Based | J63: No | K63: P3 P8 IFR and Growler VFR non breaks | L63: 0 | M63: 0 | N63: =SUM(RC[-2]:RC[-1]) -> -999 | O63: =IF(RC[-1]=0,0,RC[-3]/RC[-1]) -> -999 | P63: =IF(RC[-2]=0,0,RC[-3]/RC[-2]) -> -999 | Q63: =IF(R[+86]C[-3]=0,0,RC[-3]/R[+86]C[-3]) -> -999
A64: EA-18G | B64: F414-GE-400 | C64: 233B_FRS | D64: Straight-In Arrival Runway 32 - East Center | E64: 32A1B | F64: Arrival | G64: 32 | H64: NMap | I64: Based | J64: No | K64: P3 P8 IFR and Growler VFR non breaks | L64: 0 | M64: 0 | N64: =SUM(RC[-2]:RC[-1]) -> -999 | O64: =IF(RC[-1]=0,0,RC[-3]/RC[-1]) -> -999 | P64: =IF(RC[-2]=0,0,RC[-3]/RC[-2]) -> -999 | Q64: =IF(R[+85]C[-3]=0,0,RC[-3]/R[+85]C[-3]) -> -999
A65: EA-18G | B65: F414-GE-400 | C65: 233C_EXP | D65: Straight-In Arrival Runway 32 - East Long | E65: 32A1C | F65: Arrival | G65: 32 | H65: NMap | I65: Based | J65: No | K65: P3 P8 IFR and Growler VFR non breaks | L65: 0 | M65: 0 | N65: =SUM(RC[-2]:RC[-1]) -> -999 | O65: =IF(RC[-1]=0,0,RC[-3]/RC[-1]) -> -999 | P65: =IF(RC[-2]=0,0,RC[-3]/RC[-2]) -> -999 | Q65: =IF(R[+84]C[-3]=0,0,RC[-3]/R[+84]C[-3]) -> -999
A66: EA-18G | B66: F414-GE-400 | C66: 233C_FLT | D66: Straight-In Arrival Runway 32 - East Long | E66: 32A1C | F66: Arrival | G66: 32 | H66: NMap | I66: Based | J66: No | K66: P3 P8 IFR and Growler VFR non breaks | L66: 0 | M66: 0 | N66: =SUM(RC[-2]:RC[-1]) -> -999 | O66: =IF(RC[-1]=0,0,RC[-3]/RC[-1]) -> -999 | P66: =IF(RC[-2]=0,0,RC[-3]/RC[-2]) -> -999 | Q66: =IF(R[+83]C[-3]=0,0,RC[-3]/R[+83]C[-3]) -> -999
A67: EA-18G | B67: F414-GE-400 | C67: 233C_FRS | D67: Straight-In Arrival Runway 32 - East Long | E67: 32A1C | F67: Arrival | G67: 32 | H67: NMap | I67: Based | J67: No | K67: P3 P8 IFR and Growler VFR non breaks | L67: 0.14285714 | M67: 0 | N67: =SUM(RC[-2]:RC[-1]) -> -999 | O67: =IF(RC[-1]=0,0,RC[-3]/RC[-1]) -> -999 | P67: =IF(RC[-2]=0,0,RC[-3]/RC[-2]) -> -999 | Q67: =IF(R[+82]C[-3]=0,0,RC[-3]/R[+82]C[-3]) -> -999
A68: EA-18G | B68: F414-GE-400 | C68: 234A_EXP | D68: Straight-In Arrival Runway 32 - South Short | E68: 32A2A | F68: Arrival | G68: 32 | H68: NMap | I68: Based | J68: No | K68: P3 P8 IFR and Growler VFR non breaks | L68: 0 | M68: 0 | N68: =SUM(RC[-2]:RC[-1]) -> -999 | O68: =IF(RC[-1]=0,0,RC[-3]/RC[-1]) -> -999 | P68: =IF(RC[-2]=0,0,RC[-3]/RC[-2]) -> -999 | Q68: =IF(R[+81]C[-3]=0,0,RC[-3]/R[+81]C[-3]) -> -999
A69: EA-18G | B69: F414-GE-400 | C69: 234A_FLT | D69: Straight-In Arrival Runway 32 - South Short | E69: 32A2A | F69: Arrival | G69: 32 | H69: NMap | I69: Based | J69: No | K69: P3 P8 IFR and Growler VFR non breaks | L69: 0 | M69: 0 | N69: =SUM(RC[-2]:RC[-1]) -> -999 | O69: =IF(RC[-1]=0,0,RC[-3]/RC[-1]) -> -999 | P69: =IF(RC[-2]=0,0,RC[-3]/RC[-2]) -> -999 | Q69: =IF(R[+80]C[-3]=0,0,RC[-3]/R[+80]C[-3]) -> -999
A70: EA-18G | B70: F414-GE-400 | C70: 234A_FRS | D70: Straight-In Arrival Runway 32 - South Short | E70: 32A2A | F70: Arrival | G70: 32 | H70: NMap | I70: Based | J70: No | K70: P3 P8 IFR and Growler VFR non breaks | L70: 0 | M70: 0 | N70: =SUM(RC[-2]:RC[-1]) -> -999 | O70: =IF(RC[-1]=0,0,RC[-3]/RC[-1]) -> -999 | P70: =IF(RC[-2]=0,0,RC[-3]/RC[-2]) -> -999 | Q70: =IF(R[+79]C[-3]=0,0,RC[-3]/R[+79]C[-3]) -> -999
A71: EA-18G | B71: F414-GE-400 | C71: 234B_EXP | D71: Straight-In Arrival Runway 32 - South Center | E71: 32A2B | F71: Arrival | G71: 32 | H71: NMap | I71: Based | J71: No | K71: P3 P8 IFR and Growler VFR non breaks | L71: 0 | M71: 0 | N71: =SUM(RC[-2]:RC[-1]) -> -999 | O71: =IF(RC[-1]=0,0,RC[-3]/RC[-1]) -> -999 | P71: =IF(RC[-2]=0,0,RC[-3]/RC[-2]) -> -999 | Q71: =IF(R[+78]C[-3]=0,0,RC[-3]/R[+78]C[-3]) -> -999
A72: EA-18G | B72: F414-GE-400 | C72: 234B_FLT | D72: Straight-In Arrival Runway 32 - South Center | E72: 32A2B | F72: Arrival | G72: 32 | H72: NMap | I72: Based | J72: No | K72: P3 P8 IFR and Growler VFR non breaks | L72: 0 | M72: 0 | N72: =SUM(RC[-2]:RC[-1]) -> -999 | O72: =IF(RC[-1]=0,0,RC[-3]/RC[-1]) -> -999 | P72: =IF(RC[-2]=0,0,RC[-3]/RC[-2]) -> -999 | Q72: =IF(R[+77]C[-3]=0,0,RC[-3]/R[+77]C[-3]) -> -999
A73: EA-18G | B73: F414-GE-400 | C73: 234B_FRS | D73: Straight-In Arrival Runway 32 - South Center | E73: 32A2B | F73: Arrival | G73: 32 | H73: NMap | I73: Based | J73: No | K73: P3 P8 IFR and Growler VFR non breaks | L73: 0 | M73: 0 | N73: =SUM(RC[-2]:RC[-1]) -> -999 | O73: =IF(RC[-1]=0,0,RC[-3]/RC[-1]) -> -999 | P73: =IF(RC[-2]=0,0,RC[-3]/RC[-2]) -> -999 | Q73: =IF(R[+76]C[-3]=0,0,RC[-3]/R[+76]C[-3]) -> -999
A74: EA-18G | B74: F414-GE-400 | C74: 234C_EXP | D74: Straight-In Arrival Runway 32 - South Long | E74: 32A2C | F74: Arrival | G74: 32 | H74: NMap | I74: Based | J74: No | K74: P3 P8 IFR and Growler VFR non breaks | L74: 0 | M74: 0 | N74: =SUM(RC[-2]:RC[-1]) -> -999 | O74: =IF(RC[-1]=0,0,RC[-3]/RC[-1]) -> -999 | P74: =IF(RC[-2]=0,0,RC[-3]/RC[-2]) -> -999 | Q74: =IF(R[+75]C[-3]=0,0,RC[-3]/R[+75]C[-3]) -> -999
A75: EA-18G | B75: F414-GE-400 | C75: 234C_FLT | D75: Straight-In Arrival Runway 32 - South Long | E75: 32A2C | F75: Arrival | G75: 32 | H75: NMap | I75: Based | J75: No | K75: P3 P8 IFR and Growler VFR non breaks | L75: 0 | M75: 0 | N75: =SUM(RC[-2]:RC[-1]) -> -999 | O75: =IF(RC[-1]=0,0,RC[-3]/RC[-1]) -> -999 | P75: =IF(RC[-2]=0,0,RC[-3]/RC[-2]) -> -999 | Q75: =IF(R[+74]C[-3]=0,0,RC[-3]/R[+74]C[-3]) -> -999
A76: EA-18G | B76: F414-GE-400 | C76: 234C_FRS | D76: Straight-In Arrival Runway 32 - South Long | E76: 32A2C | F76: Arrival | G76: 32 | H76: NMap | I76: Based | J76: No | K76: P3 P8 IFR and Growler VFR non breaks | L76: 0 | M76: 0 | N76: =SUM(RC[-2]:RC[-1]) -> -999 | O76: =IF(RC[-1]=0,0,RC[-3]/RC[-1]) -> -999 | P76: =IF(RC[-2]=0,0,RC[-3]/RC[-2]) -> -999 | Q76: =IF(R[+73]C[-3]=0,0,RC[-3]/R[+73]C[-3]) -> -999
A77: EA-18G | B77: F414-GE-400 | C77: 235A_EXP | D77: From East; Numbers break | E77: 07O1A_FRS | F77: Arrival | G77: 07 | H77: NMap | I77: Based | J77: No | K77: Overhead Break Arrival | L77: 0 | M77: 0 | N77: =SUM(RC[-2]:RC[-1]) -> -999 | O77: =IF(RC[-1]=0,0,RC[-3]/RC[-1]) -> -999 | P77: =IF(RC[-2]=0,0,RC[-3]/RC[-2]) -> -999 | Q77: =IF(R[+72]C[-3]=0,0,RC[-3]/R[+72]C[-3]) -> -999
A78: EA-18G | B78: F414-GE-400 | C78: 235A_FLT | D78: Numbers break | E78: 07O1A_FLT | F78: Arrival | G78: 07 | H78: NMap | I78: Based | J78: No | K78: Overhead Break Arrival | L78: 0.28571429 | M78: 0 | N78: =SUM(RC[-2]:RC[-1]) -> -999 | O78: =IF(RC[-1]=0,0,RC[-3]/RC[-1]) -> -999 | P78: =IF(RC[-2]=0,0,RC[-3]/RC[-2]) -> -999 | Q78: =IF(R[+71]C[-3]=0,0,RC[-3]/R[+71]C[-3]) -> -999
A79: EA-18G | B79: F414-GE-400 | C79: 235A_FRS | D79: Numbers break | E79: 07O1A_FRS | F79: Arrival | G79: 07 | H79: NMap | I79: Based | J79: No | K79: Overhead Break Arrival | L79: 0 | M79: 0 | N79: =SUM(RC[-2]:RC[-1]) -> -999 | O79: =IF(RC[-1]=0,0,RC[-3]/RC[-1]) -> -999 | P79: =IF(RC[-2]=0,0,RC[-3]/RC[-2]) -> -999 | Q79: =IF(R[+70]C[-3]=0,0,RC[-3]/R[+70]C[-3]) -> -999
A80: EA-18G | B80: F414-GE-400 | C80: 235B_EXP | D80: From East; Midfield break | E80: 07O1B_FRS | F80: Arrival | G80: 07 | H80: NMap | I80: Based | J80: No | K80: Overhead Break Arrival | L80: 0 | M80: 0 | N80: =SUM(RC[-2]:RC[-1]) -> -999 | O80: =IF(RC[-1]=0,0,RC[-3]/RC[-1]) -> -999 | P80: =IF(RC[-2]=0,0,RC[-3]/RC[-2]) -> -999 | Q80: =IF(R[+69]C[-3]=0,0,RC[-3]/R[+69]C[-3]) -> -999
A81: EA-18G | B81: F414-GE-400 | C81: 235B_FLT | D81: Midfield break | E81: 07O1B_FLT | F81: Arrival | G81: 07 | H81: NMap | I81: Based | J81: No | K81: Overhead Break Arrival | L81: 0.14285714 | M81: 0 | N81: =SUM(RC[-2]:RC[-1]) -> -999 | O81: =IF(RC[-1]=0,0,RC[-3]/RC[-1]) -> -999 | P81: =IF(RC[-2]=0,0,RC[-3]/RC[-2]) -> -999 | Q81: =IF(R[+68]C[-3]=0,0,RC[-3]/R[+68]C[-3]) -> -999
A82: EA-18G | B82: F414-GE-400 | C82: 235B_FRS | D82: Midfield break | E82: 07O1B_FRS | F82: Arrival | G82: 07 | H82: NMap | I82: Based | J82: No | K82: Overhead Break Arrival | L82: 0 | M82: 0 | N82: =SUM(RC[-2]:RC[-1]) -> -999 | O82: =IF(RC[-1]=0,0,RC[-3]/RC[-1]) -> -999 | P82: =IF(RC[-2]=0,0,RC[-3]/RC[-2]) -> -999 | Q82: =IF(R[+67]C[-3]=0,0,RC[-3]/R[+67]C[-3]) -> -999
A83: EA-18G | B83: F414-GE-400 | C83: 235C_EXP | D83: Upwind# break | E83: 07O1C_FRS | F83: Arrival | G83: 07 | H83: NMap | I83: Based | J83: No | K83: Overhead Break Arrival | L83: 0 | M83: 0 | N83: =SUM(RC[-2]:RC[-1]) -> -999 | O83: =IF(RC[-1]=0,0,RC[-3]/RC[-1]) -> -999 | P83: =IF(RC[-2]=0,0,RC[-3]/RC[-2]) -> -999 | Q83: =IF(R[+66]C[-3]=0,0,RC[-3]/R[+66]C[-3]) -> -999
A84: EA-18G | B84: F414-GE-400 | C84: 235C_FLT | D84: Upwind# break | E84: 07O1C_FLT | F84: Arrival | G84: 07 | H84: NMap | I84: Based | J84: No | K84: Overhead Break Arrival | L84: 0.14285714 | M84: 0 | N84: =SUM(RC[-2]:RC[-1]) -> -999 | O84: =IF(RC[-1]=0,0,RC[-3]/RC[-1]) -> -999 | P84: =IF(RC[-2]=0,0,RC[-3]/RC[-2]) -> -999 | Q84: =IF(R[+65]C[-3]=0,0,RC[-3]/R[+65]C[-3]) -> -999
A85: EA-18G | B85: F414-GE-400 | C85: 235C_FRS | D85: Upwind# break | E85: 07O1C_FRS | F85: Arrival | G85: 07 | H85: NMap | I85: Based | J85: No | K85: Overhead Break Arrival | L85: 0 | M85: 0 | N85: =SUM(RC[-2]:RC[-1]) -> -999 | O85: =IF(RC[-1]=0,0,RC[-3]/RC[-1]) -> -999 | P85: =IF(RC[-2]=0,0,RC[-3]/RC[-2]) -> -999 | Q85: =IF(R[+64]C[-3]=0,0,RC[-3]/R[+64]C[-3]) -> -999
A86: EA-18G | B86: F414-GE-400 | C86: 236A_EXP | D86: Numbers break | E86: 07O2A_FRS | F86: Arrival | G86: 07 | H86: NMap | I86: Based | J86: No | K86: Overhead Break Arrival | L86: 0 | M86: 0 | N86: =SUM(RC[-2]:RC[-1]) -> -999 | O86: =IF(RC[-1]=0,0,RC[-3]/RC[-1]) -> -999 | P86: =IF(RC[-2]=0,0,RC[-3]/RC[-2]) -> -999 | Q86: =IF(R[+63]C[-3]=0,0,RC[-3]/R[+63]C[-3]) -> -999
A87: EA-18G | B87: F414-GE-400 | C87: 236A_FLT | D87: Numbers break | E87: 07O2A_FLT | F87: Arrival | G87: 07 | H87: NMap | I87: Based | J87: No | K87: Overhead Break Arrival | L87: 0 | M87: 0 | N87: =SUM(RC[-2]:RC[-1]) -> -999 | O87: =IF(RC[-1]=0,0,RC[-3]/RC[-1]) -> -999 | P87: =IF(RC[-2]=0,0,RC[-3]/RC[-2]) -> -999 | Q87: =IF(R[+62]C[-3]=0,0,RC[-3]/R[+62]C[-3]) -> -999
A88: EA-18G | B88: F414-GE-400 | C88: 236A_FRS | D88: Numbers break | E88: 07O2A_FRS | F88: Arrival | G88: 07 | H88: NMap | I88: Based | J88: No | K88: Overhead Break Arrival | L88: 0 | M88: 0 | N88: =SUM(RC[-2]:RC[-1]) -> -999 | O88: =IF(RC[-1]=0,0,RC[-3]/RC[-1]) -> -999 | P88: =IF(RC[-2]=0,0,RC[-3]/RC[-2]) -> -999 | Q88: =IF(R[+61]C[-3]=0,0,RC[-3]/R[+61]C[-3]) -> -999
A89: EA-18G | B89: F414-GE-400 | C89: 236B_EXP | D89: Midfield break | E89: 07O2B_FRS | F89: Arrival | G89: 07 | H89: NMap | I89: Based | J89: No | K89: Overhead Break Arrival | L89: 0 | M89: 0 | N89: =SUM(RC[-2]:RC[-1]) -> -999 | O89: =IF(RC[-1]=0,0,RC[-3]/RC[-1]) -> -999 | P89: =IF(RC[-2]=0,0,RC[-3]/RC[-2]) -> -999 | Q89: =IF(R[+60]C[-3]=0,0,RC[-3]/R[+60]C[-3]) -> -999
A90: EA-18G | B90: F414-GE-400 | C90: 236B_FLT | D90: Midfield break | E90: 07O2B_FLT | F90: Arrival | G90: 07 | H90: NMap | I90: Based | J90: No | K90: Overhead Break Arrival | L90: 0.14285714 | M90: 0 | N90: =SUM(RC[-2]:RC[-1]) -> -999 | O90: =IF(RC[-1]=0,0,RC[-3]/RC[-1]) -> -999 | P90: =IF(RC[-2]=0,0,RC[-3]/RC[-2]) -> -999 | Q90: =IF(R[+59]C[-3]=0,0,RC[-3]/R[+59]C[-3]) -> -999
A91: EA-18G | B91: F414-GE-400 | C91: 236B_FRS | D91: Midfield break | E91: 07O2B_FRS | F91: Arrival | G91: 07 | H91: NMap | I91: Based | J91: No | K91: Overhead Break Arrival | L91: 0 | M91: 0 | N91: =SUM(RC[-2]:RC[-1]) -> -999 | O91: =IF(RC[-1]=0,0,RC[-3]/RC[-1]) -> -999 | P91: =IF(RC[-2]=0,0,RC[-3]/RC[-2]) -> -999 | Q91: =IF(R[+58]C[-3]=0,0,RC[-3]/R[+58]C[-3]) -> -999
A92: EA-18G | B92: F414-GE-400 | C92: 236C_EXP | D92: Upwind# break | E92: 07O2C_FRS | F92: Arrival | G92: 07 | H92: NMap | I92: Based | J92: No | K92: Overhead Break Arrival | L92: 0 | M92: 0 | N92: =SUM(RC[-2]:RC[-1]) -> -999 | O92: =IF(RC[-1]=0,0,RC[-3]/RC[-1]) -> -999 | P92: =IF(RC[-2]=0,0,RC[-3]/RC[-2]) -> -999 | Q92: =IF(R[+57]C[-3]=0,0,RC[-3]/R[+57]C[-3]) -> -999
A93: EA-18G | B93: F414-GE-400 | C93: 236C_FLT | D93: Upwind# break | E93: 07O2C_FLT | F93: Arrival | G93: 07 | H93: NMap | I93: Based | J93: No | K93: Overhead Break Arrival | L93: 0.14285714 | M93: 0 | N93: =SUM(RC[-2]:RC[-1]) -> -999 | O93: =IF(RC[-1]=0,0,RC[-3]/RC[-1]) -> -999 | P93: =IF(RC[-2]=0,0,RC[-3]/RC[-2]) -> -999 | Q93: =IF(R[+56]C[-3]=0,0,RC[-3]/R[+56]C[-3]) -> -999
A94: EA-18G | B94: F414-GE-400 | C94: 236C_FRS | D94: Upwind# break | E94: 07O2C_FRS | F94: Arrival | G94: 07 | H94: NMap | I94: Based | J94: No | K94: Overhead Break Arrival | L94: 0 | M94: 0 | N94: =SUM(RC[-2]:RC[-1]) -> -999 | O94: =IF(RC[-1]=0,0,RC[-3]/RC[-1]) -> -999 | P94: =IF(RC[-2]=0,0,RC[-3]/RC[-2]) -> -999 | Q94: =IF(R[+55]C[-3]=0,0,RC[-3]/R[+55]C[-3]) -> -999
A95: EA-18G | B95: F414-GE-400 | C95: 237A_EXP | D95: From East; Numbers break | E95: 14O1A_FRS | F95: Arrival | G95: 14 | H95: NMap | I95: Based | J95: No | K95: Overhead Break Arrival | L95: 0.28571429 | M95: 0 | N95: =SUM(RC[-2]:RC[-1]) -> -999 | O95: =IF(RC[-1]=0,0,RC[-3]/RC[-1]) -> -999 | P95: =IF(RC[-2]=0,0,RC[-3]/RC[-2]) -> -999 | Q95: =IF(R[+54]C[-3]=0,0,RC[-3]/R[+54]C[-3]) -> -999
A96: EA-18G | B96: F414-GE-400 | C96: 237A_FLT | D96: Numbers break | E96: 14O1A_FLT | F96: Arrival | G96: 14 | H96: NMap | I96: Based | J96: No | K96: Overhead Break Arrival | L96: 0.14285714 | M96: 0 | N96: =SUM(RC[-2]:RC[-1]) -> -999 | O96: =IF(RC[-1]=0,0,RC[-3]/RC[-1]) -> -999 | P96: =IF(RC[-2]=0,0,RC[-3]/RC[-2]) -> -999 | Q96: =IF(R[+53]C[-3]=0,0,RC[-3]/R[+53]C[-3]) -> -999
A97: EA-18G | B97: F414-GE-400 | C97: 237A_FRS | D97: Numbers break | E97: 14O1A_FRS | F97: Arrival | G97: 14 | H97: NMap | I97: Based | J97: No | K97: Overhead Break Arrival | L97: 0.14285714 | M97: 0 | N97: =SUM(RC[-2]:RC[-1]) -> -999 | O97: =IF(RC[-1]=0,0,RC[-3]/RC[-1]) -> -999 | P97: =IF(RC[-2]=0,0,RC[-3]/RC[-2]) -> -999 | Q97: =IF(R[+52]C[-3]=0,0,RC[-3]/R[+52]C[-3]) -> -999
A98: EA-18G | B98: F414-GE-400 | C98: 237B_EXP | D98: Rep - From East; Midfield break | E98: 14O1B_FRS | F98: Arrival | G98: 14 | H98: NMap | I98: Based | J98: Yes | K98: Overhead Break Arrival | L98: 0.14285714 | M98: 0 | N98: =SUM(RC[-2]:RC[-1]) -> -999 | O98: =IF(RC[-1]=0,0,RC[-3]/RC[-1]) -> -999 | P98: =IF(RC[-2]=0,0,RC[-3]/RC[-2]) -> -999 | Q98: =IF(R[+51]C[-3]=0,0,RC[-3]/R[+51]C[-3]) -> -999
A99: EA-18G | B99: F414-GE-400 | C99: 237B_FLT | D99: Rep - From East; Midfield break | E99: 14O1B_FLT | F99: Arrival | G99: 14 | H99: NMap | I99: Based | J99: Yes | K99: Overhead Break Arrival | L99: 0.14285714 | M99: 0 | N99: =SUM(RC[-2]:RC[-1]) -> -999 | O99: =IF(RC[-1]=0,0,RC[-3]/RC[-1]) -> -999 | P99: =IF(RC[-2]=0,0,RC[-3]/RC[-2]) -> -999 | Q99: =IF(R[+50]C[-3]=0,0,RC[-3]/R[+50]C[-3]) -> -999
A100: EA-18G | B100: F414-GE-400 | C100: 237B_FRS | D100: Rep - From East; Midfield break | E100: 14O1B_FRS | F100: Arrival | G100: 14 | H100: NMap | I100: Based | J100: Yes | K100: Overhead Break Arrival | L100: 0.14285714 | M100: 0 | N100: =SUM(RC[-2]:RC[-1]) -> -999 | O100: =IF(RC[-1]=0,0,RC[-3]/RC[-1]) -> -999 | P100: =IF(RC[-2]=0,0,RC[-3]/RC[-2]) -> -999 | Q100: =IF(R[+49]C[-3]=0,0,RC[-3]/R[+49]C[-3]) -> -999
A101: EA-18G | B101: F414-GE-400 | C101: 237C_EXP | D101: Upwind# break | E101: 14O1C_FRS | F101: Arrival | G101: 14 | H101: NMap | I101: Based | J101: No | K101: Overhead Break Arrival | L101: 0 | M101: 0 | N101: =SUM(RC[-2]:RC[-1]) -> -999 | O101: =IF(RC[-1]=0,0,RC[-3]/RC[-1]) -> -999 | P101: =IF(RC[-2]=0,0,RC[-3]/RC[-2]) -> -999 | Q101: =IF(R[+48]C[-3]=0,0,RC[-3]/R[+48]C[-3]) -> -999
A102: EA-18G | B102: F414-GE-400 | C102: 237C_FLT | D102: Upwind# break | E102: 14O1C_FLT | F102: Arrival | G102: 14 | H102: NMap | I102: Based | J102: No | K102: Overhead Break Arrival | L102: 0 | M102: 0 | N102: =SUM(RC[-2]:RC[-1]) -> -999 | O102: =IF(RC[-1]=0,0,RC[-3]/RC[-1]) -> -999 | P102: =IF(RC[-2]=0,0,RC[-3]/RC[-2]) -> -999 | Q102: =IF(R[+47]C[-3]=0,0,RC[-3]/R[+47]C[-3]) -> -999
A103: EA-18G | B103: F414-GE-400 | C103: 237C_FRS | D103: Upwind# Break | E103: 14O1C_FRS | F103: Arrival | G103: 14 | H103: NMap | I103: Based | J103: No | K103: Overhead Break Arrival | L103: 0 | M103: 0 | N103: =SUM(RC[-2]:RC[-1]) -> -999 | O103: =IF(RC[-1]=0,0,RC[-3]/RC[-1]) -> -999 | P103: =IF(RC[-2]=0,0,RC[-3]/RC[-2]) -> -999 | Q103: =IF(R[+46]C[-3]=0,0,RC[-3]/R[+46]C[-3]) -> -999
A104: EA-18G | B104: F414-GE-400 | C104: 238A_EXP | D104: From East; Numbers break | E104: 14O2A_FRS | F104: Arrival | G104: 14 | H104: NMap | I104: Based | J104: No | K104: Overhead Break Arrival | L104: 0 | M104: 0 | N104: =SUM(RC[-2]:RC[-1]) -> -999 | O104: =IF(RC[-1]=0,0,RC[-3]/RC[-1]) -> -999 | P104: =IF(RC[-2]=0,0,RC[-3]/RC[-2]) -> -999 | Q104: =IF(R[+45]C[-3]=0,0,RC[-3]/R[+45]C[-3]) -> -999
A105: EA-18G | B105: F414-GE-400 | C105: 238A_FLT | D105: Numbers break | E105: 14O2A_FLT | F105: Arrival | G105: 14 | H105: NMap | I105: Based | J105: No | K105: Overhead Break Arrival | L105: 0.28571429 | M105: 0 | N105: =SUM(RC[-2]:RC[-1]) -> -999 | O105: =IF(RC[-1]=0,0,RC[-3]/RC[-1]) -> -999 | P105: =IF(RC[-2]=0,0,RC[-3]/RC[-2]) -> -999 | Q105: =IF(R[+44]C[-3]=0,0,RC[-3]/R[+44]C[-3]) -> -999
A106: EA-18G | B106: F414-GE-400 | C106: 238A_FRS | D106: Numbers break | E106: 14O2A_FRS | F106: Arrival | G106: 14 | H106: NMap | I106: Based | J106: No | K106: Overhead Break Arrival | L106: 0 | M106: 0 | N106: =SUM(RC[-2]:RC[-1]) -> -999 | O106: =IF(RC[-1]=0,0,RC[-3]/RC[-1]) -> -999 | P106: =IF(RC[-2]=0,0,RC[-3]/RC[-2]) -> -999 | Q106: =IF(R[+43]C[-3]=0,0,RC[-3]/R[+43]C[-3]) -> -999
A107: EA-18G | B107: F414-GE-400 | C107: 238B_EXP | D107: Midfield break | E107: 14O2B_FRS | F107: Arrival | G107: 14 | H107: NMap | I107: Based | J107: No | K107: Overhead Break Arrival | L107: 0 | M107: 0 | N107: =SUM(RC[-2]:RC[-1]) -> -999 | O107: =IF(RC[-1]=0,0,RC[-3]/RC[-1]) -> -999 | P107: =IF(RC[-2]=0,0,RC[-3]/RC[-2]) -> -999 | Q107: =IF(R[+42]C[-3]=0,0,RC[-3]/R[+42]C[-3]) -> -999
A108: EA-18G | B108: F414-GE-400 | C108: 238B_FLT | D108: Midfield break | E108: 14O2B_FLT | F108: Arrival | G108: 14 | H108: NMap | I108: Based | J108: No | K108: Overhead Break Arrival | L108: 0 | M108: 0 | N108: =SUM(RC[-2]:RC[-1]) -> -999 | O108: =IF(RC[-1]=0,0,RC[-3]/RC[-1]) -> -999 | P108: =IF(RC[-2]=0,0,RC[-3]/RC[-2]) -> -999 | Q108: =IF(R[+41]C[-3]=0,0,RC[-3]/R[+41]C[-3]) -> -999
A109: EA-18G | B109: F414-GE-400 | C109: 238B_FRS | D109: Midfield break | E109: 14O2B_FRS | F109: Arrival | G109: 14 | H109: NMap | I109: Based | J109: No | K109: Overhead Break Arrival | L109: 0 | M109: 0 | N109: =SUM(RC[-2]:RC[-1]) -> -999 | O109: =IF(RC[-1]=0,0,RC[-3]/RC[-1]) -> -999 | P109: =IF(RC[-2]=0,0,RC[-3]/RC[-2]) -> -999 | Q109: =IF(R[+40]C[-3]=0,0,RC[-3]/R[+40]C[-3]) -> -999
A110: EA-18G | B110: F414-GE-400 | C110: 238C_EXP | D110: Upwind# break | E110: 14O2C_FRS | F110: Arrival | G110: 14 | H110: NMap | I110: Based | J110: No | K110: Overhead Break Arrival | L110: 0 | M110: 0 | N110: =SUM(RC[-2]:RC[-1]) -> -999 | O110: =IF(RC[-1]=0,0,RC[-3]/RC[-1]) -> -999 | P110: =IF(RC[-2]=0,0,RC[-3]/RC[-2]) -> -999 | Q110: =IF(R[+39]C[-3]=0,0,RC[-3]/R[+39]C[-3]) -> -999
A111: EA-18G | B111: F414-GE-400 | C111: 238C_FLT | D111: Upwind# break | E111: 14O2C_FLT | F111: Arrival | G111: 14 | H111: NMap | I111: Based | J111: No | K111: Overhead Break Arrival | L111: 0 | M111: 0 | N111: =SUM(RC[-2]:RC[-1]) -> -999 | O111: =IF(RC[-1]=0,0,RC[-3]/RC[-1]) -> -999 | P111: =IF(RC[-2]=0,0,RC[-3]/RC[-2]) -> -999 | Q111: =IF(R[+38]C[-3]=0,0,RC[-3]/R[+38]C[-3]) -> -999
A112: EA-18G | B112: F414-GE-400 | C112: 238C_FRS | D112: Upwind# Break | E112: 14O2C_FRS | F112: Arrival | G112: 14 | H112: NMap | I112: Based | J112: No | K112: Overhead Break Arrival | L112: 0 | M112: 0 | N112: =SUM(RC[-2]:RC[-1]) -> -999 | O112: =IF(RC[-1]=0,0,RC[-3]/RC[-1]) -> -999 | P112: =IF(RC[-2]=0,0,RC[-3]/RC[-2]) -> -999 | Q112: =IF(R[+37]C[-3]=0,0,RC[-3]/R[+37]C[-3]) -> -999
A113: EA-18G | B113: F414-GE-400 | C113: 239B_EXP | D113: Rep - From East; Midfield break | E113: 25O1B_FRS | F113: Arrival | G113: 25 | H113: NMap | I113: Based | J113: Yes | K113: Overhead Break Arrival | L113: 3.2857143 | M113: 0 | N113: =SUM(RC[-2]:RC[-1]) -> -999 | O113: =IF(RC[-1]=0,0,RC[-3]/RC[-1]) -> -999 | P113: =IF(RC[-2]=0,0,RC[-3]/RC[-2]) -> -999 | Q113: =IF(R[+36]C[-3]=0,0,RC[-3]/R[+36]C[-3]) -> -999
A114: EA-18G | B114: F414-GE-400 | C114: 239B_FLT | D114: Midfield break | E114: 25O1B_FLT | F114: Arrival | G114: 25 | H114: NMap | I114: Based | J114: Yes | K114: Overhead Break Arrival | L114: 2.8571429 | M114: 0 | N114: =SUM(RC[-2]:RC[-1]) -> -999 | O114: =IF(RC[-1]=0,0,RC[-3]/RC[-1]) -> -999 | P114: =IF(RC[-2]=0,0,RC[-3]/RC[-2]) -> -999 | Q114: =IF(R[+35]C[-3]=0,0,RC[-3]/R[+35]C[-3]) -> -999
A115: EA-18G | B115: F414-GE-400 | C115: 239B_FRS | D115: Midfield break | E115: 25O1B_FRS | F115: Arrival | G115: 25 | H115: NMap | I115: Based | J115: Yes | K115: Overhead Break Arrival | L115: 0.14285714 | M115: 0 | N115: =SUM(RC[-2]:RC[-1]) -> -999 | O115: =IF(RC[-1]=0,0,RC[-3]/RC[-1]) -> -999 | P115: =IF(RC[-2]=0,0,RC[-3]/RC[-2]) -> -999 | Q115: =IF(R[+34]C[-3]=0,0,RC[-3]/R[+34]C[-3]) -> -999
A116: EA-18G | B116: F414-GE-400 | C116: 239C_EXP | D116: Upwind# break | E116: 25O1C_FRS | F116: Arrival | G116: 25 | H116: NMap | I116: Based | J116: Yes | K116: Overhead Break Arrival | L116: 0.71428571 | M116: 0 | N116: =SUM(RC[-2]:RC[-1]) -> -999 | O116: =IF(RC[-1]=0,0,RC[-3]/RC[-1]) -> -999 | P116: =IF(RC[-2]=0,0,RC[-3]/RC[-2]) -> -999 | Q116: =IF(R[+33]C[-3]=0,0,RC[-3]/R[+33]C[-3]) -> -999
A117: EA-18G | B117: F414-GE-400 | C117: 239C_FLT | D117: Upwind# break | E117: 25O1C_FLT | F117: Arrival | G117: 25 | H117: NMap | I117: Based | J117: Yes | K117: Overhead Break Arrival | L117: 1.4285714 | M117: 0 | N117: =SUM(RC[-2]:RC[-1]) -> -999 | O117: =IF(RC[-1]=0,0,RC[-3]/RC[-1]) -> -999 | P117: =IF(RC[-2]=0,0,RC[-3]/RC[-2]) -> -999 | Q117: =IF(R[+32]C[-3]=0,0,RC[-3]/R[+32]C[-3]) -> -999
A118: EA-18G | B118: F414-GE-400 | C118: 239C_FRS | D118: Upwind# Break | E118: 25O1C_FRS | F118: Arrival | G118: 25 | H118: NMap | I118: Based | J118: Yes | K118: Overhead Break Arrival | L118: 0.28571429 | M118: 0 | N118: =SUM(RC[-2]:RC[-1]) -> -999 | O118: =IF(RC[-1]=0,0,RC[-3]/RC[-1]) -> -999 | P118: =IF(RC[-2]=0,0,RC[-3]/RC[-2]) -> -999 | Q118: =IF(R[+31]C[-3]=0,0,RC[-3]/R[+31]C[-3]) -> -999
A119: EA-18G | B119: F414-GE-400 | C119: 240B_EXP | D119: Midfield break | E119: 25O2B_FRS | F119: Arrival | G119: 25 | H119: NMap | I119: Based | J119: No | K119: Overhead Break Arrival | L119: 0.71428571 | M119: 0 | N119: =SUM(RC[-2]:RC[-1]) -> -999 | O119: =IF(RC[-1]=0,0,RC[-3]/RC[-1]) -> -999 | P119: =IF(RC[-2]=0,0,RC[-3]/RC[-2]) -> -999 | Q119: =IF(R[+30]C[-3]=0,0,RC[-3]/R[+30]C[-3]) -> -999
A120: EA-18G | B120: F414-GE-400 | C120: 240B_FLT | D120: Midfield break | E120: 25O2B_FLT | F120: Arrival | G120: 25 | H120: NMap | I120: Based | J120: No | K120: Overhead Break Arrival | L120: 1.5714286 | M120: 0 | N120: =SUM(RC[-2]:RC[-1]) -> -999 | O120: =IF(RC[-1]=0,0,RC[-3]/RC[-1]) -> -999 | P120: =IF(RC[-2]=0,0,RC[-3]/RC[-2]) -> -999 | Q120: =IF(R[+29]C[-3]=0,0,RC[-3]/R[+29]C[-3]) -> -999
A121: EA-18G | B121: F414-GE-400 | C121: 240B_FRS | D121: Midfield break | E121: 25O2B_FRS | F121: Arrival | G121: 25 | H121: NMap | I121: Based | J121: No | K121: Overhead Break Arrival | L121: 1.1428571 | M121: 0 | N121: =SUM(RC[-2]:RC[-1]) -> -999 | O121: =IF(RC[-1]=0,0,RC[-3]/RC[-1]) -> -999 | P121: =IF(RC[-2]=0,0,RC[-3]/RC[-2]) -> -999 | Q121: =IF(R[+28]C[-3]=0,0,RC[-3]/R[+28]C[-3]) -> -999
A122: EA-18G | B122: F414-GE-400 | C122: 240C_EXP | D122: Upwind# break | E122: 25O2C_FRS | F122: Arrival | G122: 25 | H122: NMap | I122: Based | J122: Yes | K122: Overhead Break Arrival | L122: 0 | M122: 0 | N122: =SUM(RC[-2]:RC[-1]) -> -999 | O122: =IF(RC[-1]=0,0,RC[-3]/RC[-1]) -> -999 | P122: =IF(RC[-2]=0,0,RC[-3]/RC[-2]) -> -999 | Q122: =IF(R[+27]C[-3]=0,0,RC[-3]/R[+27]C[-3]) -> -999
A123: EA-18G | B123: F414-GE-400 | C123: 240C_FLT | D123: Upwind# break | E123: 25O2C_FLT | F123: Arrival | G123: 25 | H123: NMap | I123: Based | J123: Yes | K123: Overhead Break Arrival | L123: 0.14285714 | M123: 0 | N123: =SUM(RC[-2]:RC[-1]) -> -999 | O123: =IF(RC[-1]=0,0,RC[-3]/RC[-1]) -> -999 | P123: =IF(RC[-2]=0,0,RC[-3]/RC[-2]) -> -999 | Q123: =IF(R[+26]C[-3]=0,0,RC[-3]/R[+26]C[-3]) -> -999
A124: EA-18G | B124: F414-GE-400 | C124: 240C_FRS | D124: Upwind# Break | E124: 25O2C_FRS | F124: Arrival | G124: 25 | H124: NMap | I124: Based | J124: Yes | K124: Overhead Break Arrival | L124: 0.57142857 | M124: 0 | N124: =SUM(RC[-2]:RC[-1]) -> -999 | O124: =IF(RC[-1]=0,0,RC[-3]/RC[-1]) -> -999 | P124: =IF(RC[-2]=0,0,RC[-3]/RC[-2]) -> -999 | Q124: =IF(R[+25]C[-3]=0,0,RC[-3]/R[+25]C[-3]) -> -999
A125: EA-18G | B125: F414-GE-400 | C125: 241B_EXP | D125: Midfield break | E125: 32O1B_FRS | F125: Arrival | G125: 32 | H125: NMap | I125: Based | J125: No | K125: Overhead Break Arrival | L125: 0.57142857 | M125: 0 | N125: =SUM(RC[-2]:RC[-1]) -> -999 | O125: =IF(RC[-1]=0,0,RC[-3]/RC[-1]) -> -999 | P125: =IF(RC[-2]=0,0,RC[-3]/RC[-2]) -> -999 | Q125: =IF(R[+24]C[-3]=0,0,RC[-3]/R[+24]C[-3]) -> -999
A126: EA-18G | B126: F414-GE-400 | C126: 241B_FLT | D126: Midfield break | E126: 32O1B_FLT | F126: Arrival | G126: 32 | H126: NMap | I126: Based | J126: No | K126: Overhead Break Arrival | L126: 0.28571429 | M126: 0 | N126: =SUM(RC[-2]:RC[-1]) -> -999 | O126: =IF(RC[-1]=0,0,RC[-3]/RC[-1]) -> -999 | P126: =IF(RC[-2]=0,0,RC[-3]/RC[-2]) -> -999 | Q126: =IF(R[+23]C[-3]=0,0,RC[-3]/R[+23]C[-3]) -> -999
A127: EA-18G | B127: F414-GE-400 | C127: 241B_FRS | D127: Midfield break | E127: 32O1B_FRS | F127: Arrival | G127: 32 | H127: NMap | I127: Based | J127: No | K127: Overhead Break Arrival | L127: 0.42857143 | M127: 0 | N127: =SUM(RC[-2]:RC[-1]) -> -999 | O127: =IF(RC[-1]=0,0,RC[-3]/RC[-1]) -> -999 | P127: =IF(RC[-2]=0,0,RC[-3]/RC[-2]) -> -999 | Q127: =IF(R[+22]C[-3]=0,0,RC[-3]/R[+22]C[-3]) -> -999
A128: EA-18G | B128: F414-GE-400 | C128: 241C_EXP | D128: Upwind# break | E128: 32O1C_FRS | F128: Arrival | G128: 32 | H128: NMap | I128: Based | J128: No | K128: Overhead Break Arrival | L128: 0.14285714 | M128: 0 | N128: =SUM(RC[-2]:RC[-1]) -> -999 | O128: =IF(RC[-1]=0,0,RC[-3]/RC[-1]) -> -999 | P128: =IF(RC[-2]=0,0,RC[-3]/RC[-2]) -> -999 | Q128: =IF(R[+21]C[-3]=0,0,RC[-3]/R[+21]C[-3]) -> -999
A129: EA-18G | B129: F414-GE-400 | C129: 241C_FLT | D129: Upwind# break | E129: 32O1C_FLT | F129: Arrival | G129: 32 | H129: NMap | I129: Based | J129: No | K129: Overhead Break Arrival | L129: 0 | M129: 0 | N129: =SUM(RC[-2]:RC[-1]) -> -999 | O129: =IF(RC[-1]=0,0,RC[-3]/RC[-1]) -> -999 | P129: =IF(RC[-2]=0,0,RC[-3]/RC[-2]) -> -999 | Q129: =IF(R[+20]C[-3]=0,0,RC[-3]/R[+20]C[-3]) -> -999
A130: EA-18G | B130: F414-GE-400 | C130: 241C_FRS | D130: Upwind# Break | E130: 32O1C_FRS | F130: Arrival | G130: 32 | H130: NMap | I130: Based | J130: No | K130: Overhead Break Arrival | L130: 0.28571429 | M130: 0 | N130: =SUM(RC[-2]:RC[-1]) -> -999 | O130: =IF(RC[-1]=0,0,RC[-3]/RC[-1]) -> -999 | P130: =IF(RC[-2]=0,0,RC[-3]/RC[-2]) -> -999 | Q130: =IF(R[+19]C[-3]=0,0,RC[-3]/R[+19]C[-3]) -> -999
A131: EA-18G | B131: F414-GE-400 | C131: 242B_EXP | D131: Midfield break | E131: 32O2B_FRS | F131: Arrival | G131: 32 | H131: NMap | I131: Based | J131: No | K131: Overhead Break Arrival | L131: 0 | M131: 0 | N131: =SUM(RC[-2]:RC[-1]) -> -999 | O131: =IF(RC[-1]=0,0,RC[-3]/RC[-1]) -> -999 | P131: =IF(RC[-2]=0,0,RC[-3]/RC[-2]) -> -999 | Q131: =IF(R[+18]C[-3]=0,0,RC[-3]/R[+18]C[-3]) -> -999
A132: EA-18G | B132: F414-GE-400 | C132: 242B_FLT | D132: Midfield break | E132: 32O2B_FLT | F132: Arrival | G132: 32 | H132: NMap | I132: Based | J132: No | K132: Overhead Break Arrival | L132: 0.14285714 | M132: 0 | N132: =SUM(RC[-2]:RC[-1]) -> -999 | O132: =IF(RC[-1]=0,0,RC[-3]/RC[-1]) -> -999 | P132: =IF(RC[-2]=0,0,RC[-3]/RC[-2]) -> -999 | Q132: =IF(R[+17]C[-3]=0,0,RC[-3]/R[+17]C[-3]) -> -999
A133: EA-18G | B133: F414-GE-400 | C133: 242B_FRS | D133: Midfield break | E133: 32O2B_FRS | F133: Arrival | G133: 32 | H133: NMap | I133: Based | J133: No | K133: Overhead Break Arrival | L133: 0 | M133: 0 | N133: =SUM(RC[-2]:RC[-1]) -> -999 | O133: =IF(RC[-1]=0,0,RC[-3]/RC[-1]) -> -999 | P133: =IF(RC[-2]=0,0,RC[-3]/RC[-2]) -> -999 | Q133: =IF(R[+16]C[-3]=0,0,RC[-3]/R[+16]C[-3]) -> -999
A134: EA-18G | B134: F414-GE-400 | C134: 242C_EXP | D134: Upwind# break | E134: 32O2C_FRS | F134: Arrival | G134: 32 | H134: NMap | I134: Based | J134: No | K134: Overhead Break Arrival | L134: 0 | M134: 0 | N134: =SUM(RC[-2]:RC[-1]) -> -999 | O134: =IF(RC[-1]=0,0,RC[-3]/RC[-1]) -> -999 | P134: =IF(RC[-2]=0,0,RC[-3]/RC[-2]) -> -999 | Q134: =IF(R[+15]C[-3]=0,0,RC[-3]/R[+15]C[-3]) -> -999
A135: EA-18G | B135: F414-GE-400 | C135: 242C_FLT | D135: Upwind# break | E135: 32O2C_FLT | F135: Arrival | G135: 32 | H135: NMap | I135: Based | J135: No | K135: Overhead Break Arrival | L135: 0 | M135: 0 | N135: =SUM(RC[-2]:RC[-1]) -> -999 | O135: =IF(RC[-1]=0,0,RC[-3]/RC[-1]) -> -999 | P135: =IF(RC[-2]=0,0,RC[-3]/RC[-2]) -> -999 | Q135: =IF(R[+14]C[-3]=0,0,RC[-3]/R[+14]C[-3]) -> -999
A136: EA-18G | B136: F414-GE-400 | C136: 242C_FRS | D136: Upwind# Break | E136: 32O2C_FRS | F136: Arrival | G136: 32 | H136: NMap | I136: Based | J136: No | K136: Overhead Break Arrival | L136: 0 | M136: 0 | N136: =SUM(RC[-2]:RC[-1]) -> -999 | O136: =IF(RC[-1]=0,0,RC[-3]/RC[-1]) -> -999 | P136: =IF(RC[-2]=0,0,RC[-3]/RC[-2]) -> -999 | Q136: =IF(R[+13]C[-3]=0,0,RC[-3]/R[+13]C[-3]) -> -999
A137: EA-18G | B137: F414-GE-400 | C137: 243_EXP | E137: 07AHT | F137: Arrival | G137: 07 | H137: NMap | I137: Based | J137: No | K137: HI TACAN Arrival | L137: 0 | M137: 0 | N137: =SUM(RC[-2]:RC[-1]) -> -999 | O137: =IF(RC[-1]=0,0,RC[-3]/RC[-1]) -> -999 | P137: =IF(RC[-2]=0,0,RC[-3]/RC[-2]) -> -999 | Q137: =IF(R[+12]C[-3]=0,0,RC[-3]/R[+12]C[-3]) -> -999
A138: EA-18G | B138: F414-GE-400 | C138: 243_FLT | E138: 07AHT | F138: Arrival | G138: 07 | H138: NMap | I138: Based | J138: No | K138: HI TACAN Arrival | L138: 0 | M138: 0 | N138: =SUM(RC[-2]:RC[-1]) -> -999 | O138: =IF(RC[-1]=0,0,RC[-3]/RC[-1]) -> -999 | P138: =IF(RC[-2]=0,0,RC[-3]/RC[-2]) -> -999 | Q138: =IF(R[+11]C[-3]=0,0,RC[-3]/R[+11]C[-3]) -> -999
A139: EA-18G | B139: F414-GE-400 | C139: 243_FRS | E139: 07AHT | F139: Arrival | G139: 07 | H139: NMap | I139: Based | J139: No | K139: HI TACAN Arrival | L139: 0 | M139: 0 | N139: =SUM(RC[-2]:RC[-1]) -> -999 | O139: =IF(RC[-1]=0,0,RC[-3]/RC[-1]) -> -999 | P139: =IF(RC[-2]=0,0,RC[-3]/RC[-2]) -> -999 | Q139: =IF(R[+10]C[-3]=0,0,RC[-3]/R[+10]C[-3]) -> -999
A140: EA-18G | B140: F414-GE-400 | C140: 244_EXP | D140: rep - High-TACAN Arrival Runway 14 | E140: 14AHT | F140: Arrival | G140: 14 | H140: NMap | I140: Based | J140: Yes | K140: HI TACAN Arrival | L140: 0 | M140: 0 | N140: =SUM(RC[-2]:RC[-1]) -> -999 | O140: =IF(RC[-1]=0,0,RC[-3]/RC[-1]) -> -999 | P140: =IF(RC[-2]=0,0,RC[-3]/RC[-2]) -> -999 | Q140: =IF(R[+9]C[-3]=0,0,RC[-3]/R[+9]C[-3]) -> -999
A141: EA-18G | B141: F414-GE-400 | C141: 244_FLT | D141: rep - High-TACAN Arrival Runway 14 | E141: 14AHT | F141: Arrival | G141: 14 | H141: NMap | I141: Based | J141: Yes | K141: HI TACAN Arrival | L141: 0 | M141: 0 | N141: =SUM(RC[-2]:RC[-1]) -> -999 | O141: =IF(RC[-1]=0,0,RC[-3]/RC[-1]) -> -999 | P141: =IF(RC[-2]=0,0,RC[-3]/RC[-2]) -> -999 | Q141: =IF(R[+8]C[-3]=0,0,RC[-3]/R[+8]C[-3]) -> -999
A142: EA-18G | B142: F414-GE-400 | C142: 244_FRS | D142: rep - High-TACAN Arrival Runway 14 | E142: 14AHT | F142: Arrival | G142: 14 | H142: NMap | I142: Based | J142: Yes | K142: HI TACAN Arrival | L142: 0 | M142: 0 | N142: =SUM(RC[-2]:RC[-1]) -> -999 | O142: =IF(RC[-1]=0,0,RC[-3]/RC[-1]) -> -999 | P142: =IF(RC[-2]=0,0,RC[-3]/RC[-2]) -> -999 | Q142: =IF(R[+7]C[-3]=0,0,RC[-3]/R[+7]C[-3]) -> -999
A143: EA-18G | B143: F414-GE-400 | C143: 245_EXP | E143: 25AHT | F143: Arrival | G143: 25 | H143: NMap | I143: Based | J143: No | K143: HI TACAN Arrival | L143: 0.28571429 | M143: 0 | N143: =SUM(RC[-2]:RC[-1]) -> -999 | O143: =IF(RC[-1]=0,0,RC[-3]/RC[-1]) -> -999 | P143: =IF(RC[-2]=0,0,RC[-3]/RC[-2]) -> -999 | Q143: =IF(R[+6]C[-3]=0,0,RC[-3]/R[+6]C[-3]) -> -999
A144: EA-18G | B144: F414-GE-400 | C144: 245_FLT | E144: 25AHT | F144: Arrival | G144: 25 | H144: NMap | I144: Based | J144: No | K144: HI TACAN Arrival | L144: 0.14285714 | M144: 0 | N144: =SUM(RC[-2]:RC[-1]) -> -999 | O144: =IF(RC[-1]=0,0,RC[-3]/RC[-1]) -> -999 | P144: =IF(RC[-2]=0,0,RC[-3]/RC[-2]) -> -999 | Q144: =IF(R[+5]C[-3]=0,0,RC[-3]/R[+5]C[-3]) -> -999
A145: EA-18G | B145: F414-GE-400 | C145: 245_FRS | E145: 25AHT | F145: Arrival | G145: 25 | H145: NMap | I145: Based | J145: No | K145: HI TACAN Arrival | L145: 0.14285714 | M145: 0 | N145: =SUM(RC[-2]:RC[-1]) -> -999 | O145: =IF(RC[-1]=0,0,RC[-3]/RC[-1]) -> -999 | P145: =IF(RC[-2]=0,0,RC[-3]/RC[-2]) -> -999 | Q145: =IF(R[+4]C[-3]=0,0,RC[-3]/R[+4]C[-3]) -> -999
A146: EA-18G | B146: F414-GE-400 | C146: 246_EXP | E146: 32AHT | F146: Arrival | G146: 32 | H146: NMap | I146: Based | J146: No | K146: HI TACAN Arrival | L146: 0 | M146: 0 | N146: =SUM(RC[-2]:RC[-1]) -> -999 | O146: =IF(RC[-1]=0,0,RC[-3]/RC[-1]) -> -999 | P146: =IF(RC[-2]=0,0,RC[-3]/RC[-2]) -> -999 | Q146: =IF(R[+3]C[-3]=0,0,RC[-3]/R[+3]C[-3]) -> -999
A147: EA-18G | B147: F414-GE-400 | C147: 246_FLT | E147: 32AHT | F147: Arrival | G147: 32 | H147: NMap | I147: Based | J147: No | K147: HI TACAN Arrival | L147: 0 | M147: 0 | N147: =SUM(RC[-2]:RC[-1]) -> -999 | O147: =IF(RC[-1]=0,0,RC[-3]/RC[-1]) -> -999 | P147: =IF(RC[-2]=0,0,RC[-3]/RC[-2]) -> -999 | Q147: =IF(R[+2]C[-3]=0,0,RC[-3]/R[+2]C[-3]) -> -999
A148: EA-18G | B148: F414-GE-400 | C148: 246_FRS | E148: 32AHT | F148: Arrival | G148: 32 | H148: NMap | I148: Based | J148: No | K148: HI TACAN Arrival | L148: 0 | M148: 0 | N148: =SUM(RC[-2]:RC[-1]) -> -999 | O148: =IF(RC[-1]=0,0,RC[-3]/RC[-1]) -> -999 | P148: =IF(RC[-2]=0,0,RC[-3]/RC[-2]) -> -999 | Q148: =IF(R[+1]C[-3]=0,0,RC[-3]/R[+1]C[-3]) -> -999
K149: Subtotal | L149: =SUM(R[-147]C:R[-1]C) -> -999 | M149: =SUM(R[-147]C:R[-1]C) -> -999 | N149: =SUM(R[-147]C:R[-1]C) -> -999 | O149: =IF(RC[-1]=0,0,RC[-3]/RC[-1]) -> -999 | P149: =IF(RC[-2]=0,0,RC[-3]/RC[-2]) -> -999
A151: EA-18G | B151: F414-GE-400 | C151: 201A_EXP | D151: Departure A/B Runway 07 - East Short | E151: 07D1A | F151: Departure | G151: 07 | H151: NMap | I151: Based | J151: No | K151: Departure | L151: 0 | M151: 0 | N151: =SUM(RC[-2]:RC[-1]) -> -999 | O151: =IF(RC[-1]=0,0,RC[-3]/RC[-1]) -> -999 | P151: =IF(RC[-2]=0,0,RC[-3]/RC[-2]) -> -999 | Q151: =IF(R[+96]C[-3]=0,0,RC[-3]/R[+96]C[-3]) -> -999
A152: EA-18G | B152: F414-GE-400 | C152: 201A_FLT | D152: Departure A/B Runway 07 - East Short | E152: 07D1A | F152: Departure | G152: 07 | H152: NMap | I152: Based | J152: No | K152: Departure | L152: 0 | M152: 0 | N152: =SUM(RC[-2]:RC[-1]) -> -999 | O152: =IF(RC[-1]=0,0,RC[-3]/RC[-1]) -> -999 | P152: =IF(RC[-2]=0,0,RC[-3]/RC[-2]) -> -999 | Q152: =IF(R[+95]C[-3]=0,0,RC[-3]/R[+95]C[-3]) -> -999
A153: EA-18G | B153: F414-GE-400 | C153: 201A_FRS | D153: Departure A/B Runway 07 - East Short | E153: 07D1A | F153: Departure | G153: 07 | H153: NMap | I153: Based | J153: No | K153: Departure | L153: 0 | M153: 0 | N153: =SUM(RC[-2]:RC[-1]) -> -999 | O153: =IF(RC[-1]=0,0,RC[-3]/RC[-1]) -> -999 | P153: =IF(RC[-2]=0,0,RC[-3]/RC[-2]) -> -999 | Q153: =IF(R[+94]C[-3]=0,0,RC[-3]/R[+94]C[-3]) -> -999
A154: EA-18G | B154: F414-GE-400 | C154: 202A_EXP | D154: Departure A/B Runway 07 - East Center | E154: 07D1B | F154: Departure | G154: 07 | H154: NMap | I154: Based | J154: No | K154: Departure | L154: 0.71428571 | M154: 0 | N154: =SUM(RC[-2]:RC[-1]) -> -999 | O154: =IF(RC[-1]=0,0,RC[-3]/RC[-1]) -> -999 | P154: =IF(RC[-2]=0,0,RC[-3]/RC[-2]) -> -999 | Q154: =IF(R[+93]C[-3]=0,0,RC[-3]/R[+93]C[-3]) -> -999
A155: EA-18G | B155: F414-GE-400 | C155: 202A_FLT | D155: Departure A/B Runway 07 - East Center | E155: 07D1B | F155: Departure | G155: 07 | H155: NMap | I155: Based | J155: No | K155: Departure | L155: 1.2857143 | M155: 0 | N155: =SUM(RC[-2]:RC[-1]) -> -999 | O155: =IF(RC[-1]=0,0,RC[-3]/RC[-1]) -> -999 | P155: =IF(RC[-2]=0,0,RC[-3]/RC[-2]) -> -999 | Q155: =IF(R[+92]C[-3]=0,0,RC[-3]/R[+92]C[-3]) -> -999
A156: EA-18G | B156: F414-GE-400 | C156: 202A_FRS | D156: Departure A/B Runway 07 - East Center | E156: 07D1B | F156: Departure | G156: 07 | H156: NMap | I156: Based | J156: No | K156: Departure | L156: 0.14285714 | M156: 0 | N156: =SUM(RC[-2]:RC[-1]) -> -999 | O156: =IF(RC[-1]=0,0,RC[-3]/RC[-1]) -> -999 | P156: =IF(RC[-2]=0,0,RC[-3]/RC[-2]) -> -999 | Q156: =IF(R[+91]C[-3]=0,0,RC[-3]/R[+91]C[-3]) -> -999
A157: EA-18G | B157: F414-GE-400 | C157: 203A_EXP | D157: Departure A/B Runway 07 - East Long | E157: 07D1C | F157: Departure | G157: 07 | H157: NMap | I157: Based | J157: No | K157: Departure | L157: 0.14285714 | M157: 0 | N157: =SUM(RC[-2]:RC[-1]) -> -999 | O157: =IF(RC[-1]=0,0,RC[-3]/RC[-1]) -> -999 | P157: =IF(RC[-2]=0,0,RC[-3]/RC[-2]) -> -999 | Q157: =IF(R[+90]C[-3]=0,0,RC[-3]/R[+90]C[-3]) -> -999
A158: EA-18G | B158: F414-GE-400 | C158: 203A_FLT | D158: Departure A/B Runway 07 - East Long | E158: 07D1C | F158: Departure | G158: 07 | H158: NMap | I158: Based | J158: No | K158: Departure | L158: 0.57142857 | M158: 0 | N158: =SUM(RC[-2]:RC[-1]) -> -999 | O158: =IF(RC[-1]=0,0,RC[-3]/RC[-1]) -> -999 | P158: =IF(RC[-2]=0,0,RC[-3]/RC[-2]) -> -999 | Q158: =IF(R[+89]C[-3]=0,0,RC[-3]/R[+89]C[-3]) -> -999
A159: EA-18G | B159: F414-GE-400 | C159: 203A_FRS | D159: Departure A/B Runway 07 - East Long | E159: 07D1C | F159: Departure | G159: 07 | H159: NMap | I159: Based | J159: No | K159: Departure | L159: 0 | M159: 0 | N159: =SUM(RC[-2]:RC[-1]) -> -999 | O159: =IF(RC[-1]=0,0,RC[-3]/RC[-1]) -> -999 | P159: =IF(RC[-2]=0,0,RC[-3]/RC[-2]) -> -999 | Q159: =IF(R[+88]C[-3]=0,0,RC[-3]/R[+88]C[-3]) -> -999
A160: EA-18G | B160: F414-GE-400 | C160: 204A_EXP | D160: Departure A/B Runway 07 - South Short | E160: 07D2A | F160: Departure | G160: 07 | H160: NMap | I160: Based | J160: No | K160: Departure | L160: 0 | M160: 0 | N160: =SUM(RC[-2]:RC[-1]) -> -999 | O160: =IF(RC[-1]=0,0,RC[-3]/RC[-1]) -> -999 | P160: =IF(RC[-2]=0,0,RC[-3]/RC[-2]) -> -999 | Q160: =IF(R[+87]C[-3]=0,0,RC[-3]/R[+87]C[-3]) -> -999
A161: EA-18G | B161: F414-GE-400 | C161: 204A_FLT | D161: Departure A/B Runway 07 - South Short | E161: 07D2A | F161: Departure | G161: 07 | H161: NMap | I161: Based | J161: No | K161: Departure | L161: 0 | M161: 0 | N161: =SUM(RC[-2]:RC[-1]) -> -999 | O161: =IF(RC[-1]=0,0,RC[-3]/RC[-1]) -> -999 | P161: =IF(RC[-2]=0,0,RC[-3]/RC[-2]) -> -999 | Q161: =IF(R[+86]C[-3]=0,0,RC[-3]/R[+86]C[-3]) -> -999
A162: EA-18G | B162: F414-GE-400 | C162: 204A_FRS | D162: Departure A/B Runway 07 - South Short | E162: 07D2A | F162: Departure | G162: 07 | H162: NMap | I162: Based | J162: No | K162: Departure | L162: 0 | M162: 0 | N162: =SUM(RC[-2]:RC[-1]) -> -999 | O162: =IF(RC[-1]=0,0,RC[-3]/RC[-1]) -> -999 | P162: =IF(RC[-2]=0,0,RC[-3]/RC[-2]) -> -999 | Q162: =IF(R[+85]C[-3]=0,0,RC[-3]/R[+85]C[-3]) -> -999
A163: EA-18G | B163: F414-GE-400 | C163: 205A_EXP | D163: Departure A/B Runway 07 - South Center | E163: 07D2B | F163: Departure | G163: 07 | H163: NMap | I163: Based | J163: No | K163: Departure | L163: 0 | M163: 0 | N163: =SUM(RC[-2]:RC[-1]) -> -999 | O163: =IF(RC[-1]=0,0,RC[-3]/RC[-1]) -> -999 | P163: =IF(RC[-2]=0,0,RC[-3]/RC[-2]) -> -999 | Q163: =IF(R[+84]C[-3]=0,0,RC[-3]/R[+84]C[-3]) -> -999
A164: EA-18G | B164: F414-GE-400 | C164: 205A_FLT | D164: Departure A/B Runway 07 - South Center | E164: 07D2B | F164: Departure | G164: 07 | H164: NMap | I164: Based | J164: No | K164: Departure | L164: 0.42857143 | M164: 0 | N164: =SUM(RC[-2]:RC[-1]) -> -999 | O164: =IF(RC[-1]=0,0,RC[-3]/RC[-1]) -> -999 | P164: =IF(RC[-2]=0,0,RC[-3]/RC[-2]) -> -999 | Q164: =IF(R[+83]C[-3]=0,0,RC[-3]/R[+83]C[-3]) -> -999
A165: EA-18G | B165: F414-GE-400 | C165: 205A_FRS | D165: Departure A/B Runway 07 - South Center | E165: 07D2B | F165: Departure | G165: 07 | H165: NMap | I165: Based | J165: No | K165: Departure | L165: 0.28571429 | M165: 0 | N165: =SUM(RC[-2]:RC[-1]) -> -999 | O165: =IF(RC[-1]=0,0,RC[-3]/RC[-1]) -> -999 | P165: =IF(RC[-2]=0,0,RC[-3]/RC[-2]) -> -999 | Q165: =IF(R[+82]C[-3]=0,0,RC[-3]/R[+82]C[-3]) -> -999
A166: EA-18G | B166: F414-GE-400 | C166: 206A_EXP | D166: Departure A/B Runway 07 - South Long | E166: 07D2C | F166: Departure | G166: 07 | H166: NMap | I166: Based | J166: No | K166: Departure | L166: 0 | M166: 0 | N166: =SUM(RC[-2]:RC[-1]) -> -999 | O166: =IF(RC[-1]=0,0,RC[-3]/RC[-1]) -> -999 | P166: =IF(RC[-2]=0,0,RC[-3]/RC[-2]) -> -999 | Q166: =IF(R[+81]C[-3]=0,0,RC[-3]/R[+81]C[-3]) -> -999
A167: EA-18G | B167: F414-GE-400 | C167: 206A_FLT | D167: Departure A/B Runway 07 - South Long | E167: 07D2C | F167: Departure | G167: 07 | H167: NMap | I167: Based | J167: No | K167: Departure | L167: 0.42857143 | M167: 0 | N167: =SUM(RC[-2]:RC[-1]) -> -999 | O167: =IF(RC[-1]=0,0,RC[-3]/RC[-1]) -> -999 | P167: =IF(RC[-2]=0,0,RC[-3]/RC[-2]) -> -999 | Q167: =IF(R[+80]C[-3]=0,0,RC[-3]/R[+80]C[-3]) -> -999
A168: EA-18G | B168: F414-GE-400 | C168: 206A_FRS | D168: Departure A/B Runway 07 - South Long | E168: 07D2C | F168: Departure | G168: 07 | H168: NMap | I168: Based | J168: No | K168: Departure | L168: 0.14285714 | M168: 0 | N168: =SUM(RC[-2]:RC[-1]) -> -999 | O168: =IF(RC[-1]=0,0,RC[-3]/RC[-1]) -> -999 | P168: =IF(RC[-2]=0,0,RC[-3]/RC[-2]) -> -999 | Q168: =IF(R[+79]C[-3]=0,0,RC[-3]/R[+79]C[-3]) -> -999
A169: EA-18G | B169: F414-GE-400 | C169: 207A_EXP | D169: Departure A/B Runway 14 - East Short | E169: 14D1A | F169: Departure | G169: 14 | H169: NMap | I169: Based | J169: Yes | K169: Departure | L169: 0 | M169: 0 | N169: =SUM(RC[-2]:RC[-1]) -> -999 | O169: =IF(RC[-1]=0,0,RC[-3]/RC[-1]) -> -999 | P169: =IF(RC[-2]=0,0,RC[-3]/RC[-2]) -> -999 | Q169: =IF(R[+78]C[-3]=0,0,RC[-3]/R[+78]C[-3]) -> -999
A170: EA-18G | B170: F414-GE-400 | C170: 207A_FLT | D170: Departure A/B Runway 14 - East Short | E170: 14D1A | F170: Departure | G170: 14 | H170: NMap | I170: Based | J170: Yes | K170: Departure | L170: 0 | M170: 0 | N170: =SUM(RC[-2]:RC[-1]) -> -999 | O170: =IF(RC[-1]=0,0,RC[-3]/RC[-1]) -> -999 | P170: =IF(RC[-2]=0,0,RC[-3]/RC[-2]) -> -999 | Q170: =IF(R[+77]C[-3]=0,0,RC[-3]/R[+77]C[-3]) -> -999
A171: EA-18G | B171: F414-GE-400 | C171: 207A_FRS | D171: Departure A/B Runway 14 - East Short | E171: 14D1A | F171: Departure | G171: 14 | H171: NMap | I171: Based | J171: Yes | K171: Departure | L171: 0 | M171: 0 | N171: =SUM(RC[-2]:RC[-1]) -> -999 | O171: =IF(RC[-1]=0,0,RC[-3]/RC[-1]) -> -999 | P171: =IF(RC[-2]=0,0,RC[-3]/RC[-2]) -> -999 | Q171: =IF(R[+76]C[-3]=0,0,RC[-3]/R[+76]C[-3]) -> -999
A172: EA-18G | B172: F414-GE-400 | C172: 208A_EXP | D172: Departure A/B Runway 14 - East Center | E172: 14D1B | F172: Departure | G172: 14 | H172: NMap | I172: Based | J172: No | K172: Departure | L172: 0.14285714 | M172: 0 | N172: =SUM(RC[-2]:RC[-1]) -> -999 | O172: =IF(RC[-1]=0,0,RC[-3]/RC[-1]) -> -999 | P172: =IF(RC[-2]=0,0,RC[-3]/RC[-2]) -> -999 | Q172: =IF(R[+75]C[-3]=0,0,RC[-3]/R[+75]C[-3]) -> -999
A173: EA-18G | B173: F414-GE-400 | C173: 208A_FLT | D173: Departure A/B Runway 14 - East Center | E173: 14D1B | F173: Departure | G173: 14 | H173: NMap | I173: Based | J173: No | K173: Departure | L173: 0.42857143 | M173: 0 | N173: =SUM(RC[-2]:RC[-1]) -> -999 | O173: =IF(RC[-1]=0,0,RC[-3]/RC[-1]) -> -999 | P173: =IF(RC[-2]=0,0,RC[-3]/RC[-2]) -> -999 | Q173: =IF(R[+74]C[-3]=0,0,RC[-3]/R[+74]C[-3]) -> -999
A174: EA-18G | B174: F414-GE-400 | C174: 208A_FRS | D174: Departure A/B Runway 14 - East Center | E174: 14D1B | F174: Departure | G174: 14 | H174: NMap | I174: Based | J174: No | K174: Departure | L174: 0.28571429 | M174: 0 | N174: =SUM(RC[-2]:RC[-1]) -> -999 | O174: =IF(RC[-1]=0,0,RC[-3]/RC[-1]) -> -999 | P174: =IF(RC[-2]=0,0,RC[-3]/RC[-2]) -> -999 | Q174: =IF(R[+73]C[-3]=0,0,RC[-3]/R[+73]C[-3]) -> -999
A175: EA-18G | B175: F414-GE-400 | C175: 209A_EXP | D175: Departure A/B Runway 14 - East Long | E175: 14D1C | F175: Departure | G175: 14 | H175: NMap | I175: Based | J175: No | K175: Departure | L175: 0 | M175: 0 | N175: =SUM(RC[-2]:RC[-1]) -> -999 | O175: =IF(RC[-1]=0,0,RC[-3]/RC[-1]) -> -999 | P175: =IF(RC[-2]=0,0,RC[-3]/RC[-2]) -> -999 | Q175: =IF(R[+72]C[-3]=0,0,RC[-3]/R[+72]C[-3]) -> -999
A176: EA-18G | B176: F414-GE-400 | C176: 209A_FLT | D176: Departure A/B Runway 14 - East Long | E176: 14D1C | F176: Departure | G176: 14 | H176: NMap | I176: Based | J176: No | K176: Departure | L176: 0.14285714 | M176: 0 | N176: =SUM(RC[-2]:RC[-1]) -> -999 | O176: =IF(RC[-1]=0,0,RC[-3]/RC[-1]) -> -999 | P176: =IF(RC[-2]=0,0,RC[-3]/RC[-2]) -> -999 | Q176: =IF(R[+71]C[-3]=0,0,RC[-3]/R[+71]C[-3]) -> -999
A177: EA-18G | B177: F414-GE-400 | C177: 209A_FRS | D177: Departure A/B Runway 14 - East Long | E177: 14D1C | F177: Departure | G177: 14 | H177: NMap | I177: Based | J177: No | K177: Departure | L177: 0.14285714 | M177: 0 | N177: =SUM(RC[-2]:RC[-1]) -> -999 | O177: =IF(RC[-1]=0,0,RC[-3]/RC[-1]) -> -999 | P177: =IF(RC[-2]=0,0,RC[-3]/RC[-2]) -> -999 | Q177: =IF(R[+70]C[-3]=0,0,RC[-3]/R[+70]C[-3]) -> -999
A178: EA-18G | B178: F414-GE-400 | C178: 210A_EXP | D178: Departure A/B Runway 14 - South Short | E178: 14D2A | F178: Departure | G178: 14 | H178: NMap | I178: Based | J178: No | K178: Departure | L178: 0 | M178: 0 | N178: =SUM(RC[-2]:RC[-1]) -> -999 | O178: =IF(RC[-1]=0,0,RC[-3]/RC[-1]) -> -999 | P178: =IF(RC[-2]=0,0,RC[-3]/RC[-2]) -> -999 | Q178: =IF(R[+69]C[-3]=0,0,RC[-3]/R[+69]C[-3]) -> -999
A179: EA-18G | B179: F414-GE-400 | C179: 210A_FLT | D179: Departure A/B Runway 14 - South Short | E179: 14D2A | F179: Departure | G179: 14 | H179: NMap | I179: Based | J179: No | K179: Departure | L179: 0 | M179: 0 | N179: =SUM(RC[-2]:RC[-1]) -> -999 | O179: =IF(RC[-1]=0,0,RC[-3]/RC[-1]) -> -999 | P179: =IF(RC[-2]=0,0,RC[-3]/RC[-2]) -> -999 | Q179: =IF(R[+68]C[-3]=0,0,RC[-3]/R[+68]C[-3]) -> -999
A180: EA-18G | B180: F414-GE-400 | C180: 210A_FRS | D180: Departure A/B Runway 14 - South Short | E180: 14D2A | F180: Departure | G180: 14 | H180: NMap | I180: Based | J180: No | K180: Departure | L180: 0 | M180: 0 | N180: =SUM(RC[-2]:RC[-1]) -> -999 | O180: =IF(RC[-1]=0,0,RC[-3]/RC[-1]) -> -999 | P180: =IF(RC[-2]=0,0,RC[-3]/RC[-2]) -> -999 | Q180: =IF(R[+67]C[-3]=0,0,RC[-3]/R[+67]C[-3]) -> -999
A181: EA-18G | B181: F414-GE-400 | C181: 211A_EXP | D181: Departure A/B Runway 14 - South Center | E181: 14D2B | F181: Departure | G181: 14 | H181: NMap | I181: Based | J181: No | K181: Departure | L181: 0.14285714 | M181: 0 | N181: =SUM(RC[-2]:RC[-1]) -> -999 | O181: =IF(RC[-1]=0,0,RC[-3]/RC[-1]) -> -999 | P181: =IF(RC[-2]=0,0,RC[-3]/RC[-2]) -> -999 | Q181: =IF(R[+66]C[-3]=0,0,RC[-3]/R[+66]C[-3]) -> -999
A182: EA-18G | B182: F414-GE-400 | C182: 211A_FLT | D182: Departure A/B Runway 14 - South Center | E182: 14D2B | F182: Departure | G182: 14 | H182: NMap | I182: Based | J182: No | K182: Departure | L182: 0.14285714 | M182: 0 | N182: =SUM(RC[-2]:RC[-1]) -> -999 | O182: =IF(RC[-1]=0,0,RC[-3]/RC[-1]) -> -999 | P182: =IF(RC[-2]=0,0,RC[-3]/RC[-2]) -> -999 | Q182: =IF(R[+65]C[-3]=0,0,RC[-3]/R[+65]C[-3]) -> -999
A183: EA-18G | B183: F414-GE-400 | C183: 211A_FRS | D183: Departure A/B Runway 14 - South Center | E183: 14D2B | F183: Departure | G183: 14 | H183: NMap | I183: Based | J183: No | K183: Departure | L183: 0.14285714 | M183: 0 | N183: =SUM(RC[-2]:RC[-1]) -> -999 | O183: =IF(RC[-1]=0,0,RC[-3]/RC[-1]) -> -999 | P183: =IF(RC[-2]=0,0,RC[-3]/RC[-2]) -> -999 | Q183: =IF(R[+64]C[-3]=0,0,RC[-3]/R[+64]C[-3]) -> -999
A184: EA-18G | B184: F414-GE-400 | C184: 212A_EXP | D184: Departure A/B Runway 14 - South Long | E184: 14D2C | F184: Departure | G184: 14 | H184: NMap | I184: Based | J184: No | K184: Departure | L184: 0.14285714 | M184: 0 | N184: =SUM(RC[-2]:RC[-1]) -> -999 | O184: =IF(RC[-1]=0,0,RC[-3]/RC[-1]) -> -999 | P184: =IF(RC[-2]=0,0,RC[-3]/RC[-2]) -> -999 | Q184: =IF(R[+63]C[-3]=0,0,RC[-3]/R[+63]C[-3]) -> -999
A185: EA-18G | B185: F414-GE-400 | C185: 212A_FLT | D185: Departure A/B Runway 14 - South Long | E185: 14D2C | F185: Departure | G185: 14 | H185: NMap | I185: Based | J185: No | K185: Departure | L185: 0.14285714 | M185: 0 | N185: =SUM(RC[-2]:RC[-1]) -> -999 | O185: =IF(RC[-1]=0,0,RC[-3]/RC[-1]) -> -999 | P185: =IF(RC[-2]=0,0,RC[-3]/RC[-2]) -> -999 | Q185: =IF(R[+62]C[-3]=0,0,RC[-3]/R[+62]C[-3]) -> -999
A186: EA-18G | B186: F414-GE-400 | C186: 212A_FRS | D186: Departure A/B Runway 14 - South Long | E186: 14D2C | F186: Departure | G186: 14 | H186: NMap | I186: Based | J186: No | K186: Departure | L186: 0 | M186: 0 | N186: =SUM(RC[-2]:RC[-1]) -> -999 | O186: =IF(RC[-1]=0,0,RC[-3]/RC[-1]) -> -999 | P186: =IF(RC[-2]=0,0,RC[-3]/RC[-2]) -> -999 | Q186: =IF(R[+61]C[-3]=0,0,RC[-3]/R[+61]C[-3]) -> -999
A187: EA-18G | B187: F414-GE-400 | C187: 213A_EXP | D187: Rep Departure A/B Runway 25 - East Short | E187: 25D1A | F187: Departure | G187: 25 | H187: NMap | I187: Based | J187: Yes | K187: Departure | L187: 0.28571429 | M187: 0 | N187: =SUM(RC[-2]:RC[-1]) -> -999 | O187: =IF(RC[-1]=0,0,RC[-3]/RC[-1]) -> -999 | P187: =IF(RC[-2]=0,0,RC[-3]/RC[-2]) -> -999 | Q187: =IF(R[+60]C[-3]=0,0,RC[-3]/R[+60]C[-3]) -> -999
A188: EA-18G | B188: F414-GE-400 | C188: 213A_FLT | D188: Rep Departure A/B Runway 25 - East Short | E188: 25D1A | F188: Departure | G188: 25 | H188: NMap | I188: Based | J188: Yes | K188: Departure | L188: 0.28571429 | M188: 0 | N188: =SUM(RC[-2]:RC[-1]) -> -999 | O188: =IF(RC[-1]=0,0,RC[-3]/RC[-1]) -> -999 | P188: =IF(RC[-2]=0,0,RC[-3]/RC[-2]) -> -999 | Q188: =IF(R[+59]C[-3]=0,0,RC[-3]/R[+59]C[-3]) -> -999
A189: EA-18G | B189: F414-GE-400 | C189: 213A_FRS | D189: Rep Departure A/B Runway 25 - East Short | E189: 25D1A | F189: Departure | G189: 25 | H189: NMap | I189: Based | J189: Yes | K189: Departure | L189: 0 | M189: 0 | N189: =SUM(RC[-2]:RC[-1]) -> -999 | O189: =IF(RC[-1]=0,0,RC[-3]/RC[-1]) -> -999 | P189: =IF(RC[-2]=0,0,RC[-3]/RC[-2]) -> -999 | Q189: =IF(R[+58]C[-3]=0,0,RC[-3]/R[+58]C[-3]) -> -999
A190: EA-18G | B190: F414-GE-400 | C190: 214A_EXP | D190: Departure A/B Runway 25 - East Center | E190: 25D1B | F190: Departure | G190: 25 | H190: NMap | I190: Based | J190: No | K190: Departure | L190: 2.1428571 | M190: 0 | N190: =SUM(RC[-2]:RC[-1]) -> -999 | O190: =IF(RC[-1]=0,0,RC[-3]/RC[-1]) -> -999 | P190: =IF(RC[-2]=0,0,RC[-3]/RC[-2]) -> -999 | Q190: =IF(R[+57]C[-3]=0,0,RC[-3]/R[+57]C[-3]) -> -999
A191: EA-18G | B191: F414-GE-400 | C191: 214A_FLT | D191: Departure A/B Runway 25 - East Center | E191: 25D1B | F191: Departure | G191: 25 | H191: NMap | I191: Based | J191: No | K191: Departure | L191: 2.2857143 | M191: 0 | N191: =SUM(RC[-2]:RC[-1]) -> -999 | O191: =IF(RC[-1]=0,0,RC[-3]/RC[-1]) -> -999 | P191: =IF(RC[-2]=0,0,RC[-3]/RC[-2]) -> -999 | Q191: =IF(R[+56]C[-3]=0,0,RC[-3]/R[+56]C[-3]) -> -999
A192: EA-18G | B192: F414-GE-400 | C192: 214A_FRS | D192: Departure A/B Runway 25 - East Center | E192: 25D1B | F192: Departure | G192: 25 | H192: NMap | I192: Based | J192: No | K192: Departure | L192: 0.42857143 | M192: 0 | N192: =SUM(RC[-2]:RC[-1]) -> -999 | O192: =IF(RC[-1]=0,0,RC[-3]/RC[-1]) -> -999 | P192: =IF(RC[-2]=0,0,RC[-3]/RC[-2]) -> -999 | Q192: =IF(R[+55]C[-3]=0,0,RC[-3]/R[+55]C[-3]) -> -999
A193: EA-18G | B193: F414-GE-400 | C193: 215A_EXP | D193: Departure A/B Runway 25 - East Long | E193: 25D1C | F193: Departure | G193: 25 | H193: NMap | I193: Based | J193: No | K193: Departure | L193: 0.85714286 | M193: 0 | N193: =SUM(RC[-2]:RC[-1]) -> -999 | O193: =IF(RC[-1]=0,0,RC[-3]/RC[-1]) -> -999 | P193: =IF(RC[-2]=0,0,RC[-3]/RC[-2]) -> -999 | Q193: =IF(R[+54]C[-3]=0,0,RC[-3]/R[+54]C[-3]) -> -999
A194: EA-18G | B194: F414-GE-400 | C194: 215A_FLT | D194: Departure A/B Runway 25 - East Long | E194: 25D1C | F194: Departure | G194: 25 | H194: NMap | I194: Based | J194: No | K194: Departure | L194: 1.2857143 | M194: 0 | N194: =SUM(RC[-2]:RC[-1]) -> -999 | O194: =IF(RC[-1]=0,0,RC[-3]/RC[-1]) -> -999 | P194: =IF(RC[-2]=0,0,RC[-3]/RC[-2]) -> -999 | Q194: =IF(R[+53]C[-3]=0,0,RC[-3]/R[+53]C[-3]) -> -999
A195: EA-18G | B195: F414-GE-400 | C195: 215A_FRS | D195: Departure A/B Runway 25 - East Long | E195: 25D1C | F195: Departure | G195: 25 | H195: NMap | I195: Based | J195: No | K195: Departure | L195: 0.28571429 | M195: 0 | N195: =SUM(RC[-2]:RC[-1]) -> -999 | O195: =IF(RC[-1]=0,0,RC[-3]/RC[-1]) -> -999 | P195: =IF(RC[-2]=0,0,RC[-3]/RC[-2]) -> -999 | Q195: =IF(R[+52]C[-3]=0,0,RC[-3]/R[+52]C[-3]) -> -999
A196: EA-18G | B196: F414-GE-400 | C196: 216A_EXP | D196: Departure A/B Runway 25 - South Short | E196: 25D2A | F196: Departure | G196: 25 | H196: NMap | I196: Based | J196: No | K196: Departure | L196: 0 | M196: 0 | N196: =SUM(RC[-2]:RC[-1]) -> -999 | O196: =IF(RC[-1]=0,0,RC[-3]/RC[-1]) -> -999 | P196: =IF(RC[-2]=0,0,RC[-3]/RC[-2]) -> -999 | Q196: =IF(R[+51]C[-3]=0,0,RC[-3]/R[+51]C[-3]) -> -999
A197: EA-18G | B197: F414-GE-400 | C197: 216A_FLT | D197: Departure A/B Runway 25 - South Short | E197: 25D2A | F197: Departure | G197: 25 | H197: NMap | I197: Based | J197: No | K197: Departure | L197: 0 | M197: 0 | N197: =SUM(RC[-2]:RC[-1]) -> -999 | O197: =IF(RC[-1]=0,0,RC[-3]/RC[-1]) -> -999 | P197: =IF(RC[-2]=0,0,RC[-3]/RC[-2]) -> -999 | Q197: =IF(R[+50]C[-3]=0,0,RC[-3]/R[+50]C[-3]) -> -999
A198: EA-18G | B198: F414-GE-400 | C198: 216A_FRS | D198: Departure A/B Runway 25 - South Short | E198: 25D2A | F198: Departure | G198: 25 | H198: NMap | I198: Based | J198: No | K198: Departure | L198: 0.42857143 | M198: 0 | N198: =SUM(RC[-2]:RC[-1]) -> -999 | O198: =IF(RC[-1]=0,0,RC[-3]/RC[-1]) -> -999 | P198: =IF(RC[-2]=0,0,RC[-3]/RC[-2]) -> -999 | Q198: =IF(R[+49]C[-3]=0,0,RC[-3]/R[+49]C[-3]) -> -999
A199: EA-18G | B199: F414-GE-400 | C199: 217A_EXP | D199: Departure A/B Runway 25 - South Center | E199: 25D2B | F199: Departure | G199: 25 | H199: NMap | I199: Based | J199: No | K199: Departure | L199: 0.28571429 | M199: 0 | N199: =SUM(RC[-2]:RC[-1]) -> -999 | O199: =IF(RC[-1]=0,0,RC[-3]/RC[-1]) -> -999 | P199: =IF(RC[-2]=0,0,RC[-3]/RC[-2]) -> -999 | Q199: =IF(R[+48]C[-3]=0,0,RC[-3]/R[+48]C[-3]) -> -999
A200: EA-18G | B200: F414-GE-400 | C200: 217A_FLT | D200: Departure A/B Runway 25 - South Center | E200: 25D2B | F200: Departure | G200: 25 | H200: NMap | I200: Based | J200: No | K200: Departure | L200: 1.2857143 | M200: 0 | N200: =SUM(RC[-2]:RC[-1]) -> -999 | O200: =IF(RC[-1]=0,0,RC[-3]/RC[-1]) -> -999 | P200: =IF(RC[-2]=0,0,RC[-3]/RC[-2]) -> -999 | Q200: =IF(R[+47]C[-3]=0,0,RC[-3]/R[+47]C[-3]) -> -999
A201: EA-18G | B201: F414-GE-400 | C201: 217A_FRS | D201: Departure A/B Runway 25 - South Center | E201: 25D2B | F201: Departure | G201: 25 | H201: NMap | I201: Based | J201: No | K201: Departure | L201: 1.2857143 | M201: 0 | N201: =SUM(RC[-2]:RC[-1]) -> -999 | O201: =IF(RC[-1]=0,0,RC[-3]/RC[-1]) -> -999 | P201: =IF(RC[-2]=0,0,RC[-3]/RC[-2]) -> -999 | Q201: =IF(R[+46]C[-3]=0,0,RC[-3]/R[+46]C[-3]) -> -999
A202: EA-18G | B202: F414-GE-400 | C202: 218A_EXP | D202: Departure A/B Runway 25 - South Long | E202: 25D2C | F202: Departure | G202: 25 | H202: NMap | I202: Based | J202: No | K202: Departure | L202: 0.14285714 | M202: 0 | N202: =SUM(RC[-2]:RC[-1]) -> -999 | O202: =IF(RC[-1]=0,0,RC[-3]/RC[-1]) -> -999 | P202: =IF(RC[-2]=0,0,RC[-3]/RC[-2]) -> -999 | Q202: =IF(R[+45]C[-3]=0,0,RC[-3]/R[+45]C[-3]) -> -999
A203: EA-18G | B203: F414-GE-400 | C203: 218A_FLT | D203: Departure A/B Runway 25 - South Long | E203: 25D2C | F203: Departure | G203: 25 | H203: NMap | I203: Based | J203: No | K203: Departure | L203: 0.14285714 | M203: 0 | N203: =SUM(RC[-2]:RC[-1]) -> -999 | O203: =IF(RC[-1]=0,0,RC[-3]/RC[-1]) -> -999 | P203: =IF(RC[-2]=0,0,RC[-3]/RC[-2]) -> -999 | Q203: =IF(R[+44]C[-3]=0,0,RC[-3]/R[+44]C[-3]) -> -999
A204: EA-18G | B204: F414-GE-400 | C204: 218A_FRS | D204: Departure A/B Runway 25 - South Long | E204: 25D2C | F204: Departure | G204: 25 | H204: NMap | I204: Based | J204: No | K204: Departure | L204: 0.42857143 | M204: 0 | N204: =SUM(RC[-2]:RC[-1]) -> -999 | O204: =IF(RC[-1]=0,0,RC[-3]/RC[-1]) -> -999 | P204: =IF(RC[-2]=0,0,RC[-3]/RC[-2]) -> -999 | Q204: =IF(R[+43]C[-3]=0,0,RC[-3]/R[+43]C[-3]) -> -999
A205: EA-18G | B205: F414-GE-400 | C205: 219A_EXP | D205: Departure A/B Runway 32 - East Short | E205: 32D1A | F205: Departure | G205: 32 | H205: NMap | I205: Based | J205: No | K205: Departure | L205: 0 | M205: 0 | N205: =SUM(RC[-2]:RC[-1]) -> -999 | O205: =IF(RC[-1]=0,0,RC[-3]/RC[-1]) -> -999 | P205: =IF(RC[-2]=0,0,RC[-3]/RC[-2]) -> -999 | Q205: =IF(R[+42]C[-3]=0,0,RC[-3]/R[+42]C[-3]) -> -999
A206: EA-18G | B206: F414-GE-400 | C206: 219A_FLT | D206: Departure A/B Runway 32 - East Short | E206: 32D1A | F206: Departure | G206: 32 | H206: NMap | I206: Based | J206: No | K206: Departure | L206: 0 | M206: 0 | N206: =SUM(RC[-2]:RC[-1]) -> -999 | O206: =IF(RC[-1]=0,0,RC[-3]/RC[-1]) -> -999 | P206: =IF(RC[-2]=0,0,RC[-3]/RC[-2]) -> -999 | Q206: =IF(R[+41]C[-3]=0,0,RC[-3]/R[+41]C[-3]) -> -999
A207: EA-18G | B207: F414-GE-400 | C207: 219A_FRS | D207: Departure A/B Runway 32 - East Short | E207: 32D1A | F207: Departure | G207: 32 | H207: NMap | I207: Based | J207: No | K207: Departure | L207: 0.28571429 | M207: 0 | N207: =SUM(RC[-2]:RC[-1]) -> -999 | O207: =IF(RC[-1]=0,0,RC[-3]/RC[-1]) -> -999 | P207: =IF(RC[-2]=0,0,RC[-3]/RC[-2]) -> -999 | Q207: =IF(R[+40]C[-3]=0,0,RC[-3]/R[+40]C[-3]) -> -999
A208: EA-18G | B208: F414-GE-400 | C208: 220A_EXP | D208: Departure A/B Runway 32 - East Center | E208: 32D1B | F208: Departure | G208: 32 | H208: NMap | I208: Based | J208: No | K208: Departure | L208: 0.57142857 | M208: 0 | N208: =SUM(RC[-2]:RC[-1]) -> -999 | O208: =IF(RC[-1]=0,0,RC[-3]/RC[-1]) -> -999 | P208: =IF(RC[-2]=0,0,RC[-3]/RC[-2]) -> -999 | Q208: =IF(R[+39]C[-3]=0,0,RC[-3]/R[+39]C[-3]) -> -999
A209: EA-18G | B209: F414-GE-400 | C209: 220A_FLT | D209: Departure A/B Runway 32 - East Center | E209: 32D1B | F209: Departure | G209: 32 | H209: NMap | I209: Based | J209: No | K209: Departure | L209: 0 | M209: 0 | N209: =SUM(RC[-2]:RC[-1]) -> -999 | O209: =IF(RC[-1]=0,0,RC[-3]/RC[-1]) -> -999 | P209: =IF(RC[-2]=0,0,RC[-3]/RC[-2]) -> -999 | Q209: =IF(R[+38]C[-3]=0,0,RC[-3]/R[+38]C[-3]) -> -999
A210: EA-18G | B210: F414-GE-400 | C210: 220A_FRS | D210: Departure A/B Runway 32 - East Center | E210: 32D1B | F210: Departure | G210: 32 | H210: NMap | I210: Based | J210: No | K210: Departure | L210: 0.85714286 | M210: 0 | N210: =SUM(RC[-2]:RC[-1]) -> -999 | O210: =IF(RC[-1]=0,0,RC[-3]/RC[-1]) -> -999 | P210: =IF(RC[-2]=0,0,RC[-3]/RC[-2]) -> -999 | Q210: =IF(R[+37]C[-3]=0,0,RC[-3]/R[+37]C[-3]) -> -999
A211: EA-18G | B211: F414-GE-400 | C211: 221A_EXP | D211: Departure A/B Runway 32 - East Long | E211: 32D1C | F211: Departure | G211: 32 | H211: NMap | I211: Based | J211: No | K211: Departure | L211: 0.14285714 | M211: 0 | N211: =SUM(RC[-2]:RC[-1]) -> -999 | O211: =IF(RC[-1]=0,0,RC[-3]/RC[-1]) -> -999 | P211: =IF(RC[-2]=0,0,RC[-3]/RC[-2]) -> -999 | Q211: =IF(R[+36]C[-3]=0,0,RC[-3]/R[+36]C[-3]) -> -999
A212: EA-18G | B212: F414-GE-400 | C212: 221A_FLT | D212: Departure A/B Runway 32 - East Long | E212: 32D1C | F212: Departure | G212: 32 | H212: NMap | I212: Based | J212: No | K212: Departure | L212: 0 | M212: 0 | N212: =SUM(RC[-2]:RC[-1]) -> -999 | O212: =IF(RC[-1]=0,0,RC[-3]/RC[-1]) -> -999 | P212: =IF(RC[-2]=0,0,RC[-3]/RC[-2]) -> -999 | Q212: =IF(R[+35]C[-3]=0,0,RC[-3]/R[+35]C[-3]) -> -999
A213: EA-18G | B213: F414-GE-400 | C213: 221A_FRS | D213: Departure A/B Runway 32 - East Long | E213: 32D1C | F213: Departure | G213: 32 | H213: NMap | I213: Based | J213: No | K213: Departure | L213: 0.28571429 | M213: 0 | N213: =SUM(RC[-2]:RC[-1]) -> -999 | O213: =IF(RC[-1]=0,0,RC[-3]/RC[-1]) -> -999 | P213: =IF(RC[-2]=0,0,RC[-3]/RC[-2]) -> -999 | Q213: =IF(R[+34]C[-3]=0,0,RC[-3]/R[+34]C[-3]) -> -999
A214: EA-18G | B214: F414-GE-400 | C214: 222A_EXP | D214: Departure A/B Runway 32 - South Short | E214: 32D2A | F214: Departure | G214: 32 | H214: NMap | I214: Based | J214: No | K214: Departure | L214: 0 | M214: 0 | N214: =SUM(RC[-2]:RC[-1]) -> -999 | O214: =IF(RC[-1]=0,0,RC[-3]/RC[-1]) -> -999 | P214: =IF(RC[-2]=0,0,RC[-3]/RC[-2]) -> -999 | Q214: =IF(R[+33]C[-3]=0,0,RC[-3]/R[+33]C[-3]) -> -999
A215: EA-18G | B215: F414-GE-400 | C215: 222A_FLT | D215: Departure A/B Runway 32 - South Short | E215: 32D2A | F215: Departure | G215: 32 | H215: NMap | I215: Based | J215: No | K215: Departure | L215: 0 | M215: 0 | N215: =SUM(RC[-2]:RC[-1]) -> -999 | O215: =IF(RC[-1]=0,0,RC[-3]/RC[-1]) -> -999 | P215: =IF(RC[-2]=0,0,RC[-3]/RC[-2]) -> -999 | Q215: =IF(R[+32]C[-3]=0,0,RC[-3]/R[+32]C[-3]) -> -999
A216: EA-18G | B216: F414-GE-400 | C216: 222A_FRS | D216: Departure A/B Runway 32 - South Short | E216: 32D2A | F216: Departure | G216: 32 | H216: NMap | I216: Based | J216: No | K216: Departure | L216: 0 | M216: 0 | N216: =SUM(RC[-2]:RC[-1]) -> -999 | O216: =IF(RC[-1]=0,0,RC[-3]/RC[-1]) -> -999 | P216: =IF(RC[-2]=0,0,RC[-3]/RC[-2]) -> -999 | Q216: =IF(R[+31]C[-3]=0,0,RC[-3]/R[+31]C[-3]) -> -999
A217: EA-18G | B217: F414-GE-400 | C217: 223A_EXP | D217: Departure A/B Runway 32 - South Center | E217: 32D2B | F217: Departure | G217: 32 | H217: NMap | I217: Based | J217: No | K217: Departure | L217: 0 | M217: 0 | N217: =SUM(RC[-2]:RC[-1]) -> -999 | O217: =IF(RC[-1]=0,0,RC[-3]/RC[-1]) -> -999 | P217: =IF(RC[-2]=0,0,RC[-3]/RC[-2]) -> -999 | Q217: =IF(R[+30]C[-3]=0,0,RC[-3]/R[+30]C[-3]) -> -999
A218: EA-18G | B218: F414-GE-400 | C218: 223A_FLT | D218: Departure A/B Runway 32 - South Center | E218: 32D2B | F218: Departure | G218: 32 | H218: NMap | I218: Based | J218: No | K218: Departure | L218: 0.14285714 | M218: 0 | N218: =SUM(RC[-2]:RC[-1]) -> -999 | O218: =IF(RC[-1]=0,0,RC[-3]/RC[-1]) -> -999 | P218: =IF(RC[-2]=0,0,RC[-3]/RC[-2]) -> -999 | Q218: =IF(R[+29]C[-3]=0,0,RC[-3]/R[+29]C[-3]) -> -999
A219: EA-18G | B219: F414-GE-400 | C219: 223A_FRS | D219: Departure A/B Runway 32 - South Center | E219: 32D2B | F219: Departure | G219: 32 | H219: NMap | I219: Based | J219: No | K219: Departure | L219: 0.28571429 | M219: 0 | N219: =SUM(RC[-2]:RC[-1]) -> -999 | O219: =IF(RC[-1]=0,0,RC[-3]/RC[-1]) -> -999 | P219: =IF(RC[-2]=0,0,RC[-3]/RC[-2]) -> -999 | Q219: =IF(R[+28]C[-3]=0,0,RC[-3]/R[+28]C[-3]) -> -999
A220: EA-18G | B220: F414-GE-400 | C220: 224A_EXP | D220: Departure A/B Runway 32 - South Long | E220: 32D2C | F220: Departure | G220: 32 | H220: NMap | I220: Based | J220: No | K220: Departure | L220: 0 | M220: 0 | N220: =SUM(RC[-2]:RC[-1]) -> -999 | O220: =IF(RC[-1]=0,0,RC[-3]/RC[-1]) -> -999 | P220: =IF(RC[-2]=0,0,RC[-3]/RC[-2]) -> -999 | Q220: =IF(R[+27]C[-3]=0,0,RC[-3]/R[+27]C[-3]) -> -999
A221: EA-18G | B221: F414-GE-400 | C221: 224A_FLT | D221: Departure A/B Runway 32 - South Long | E221: 32D2C | F221: Departure | G221: 32 | H221: NMap | I221: Based | J221: No | K221: Departure | L221: 0 | M221: 0 | N221: =SUM(RC[-2]:RC[-1]) -> -999 | O221: =IF(RC[-1]=0,0,RC[-3]/RC[-1]) -> -999 | P221: =IF(RC[-2]=0,0,RC[-3]/RC[-2]) -> -999 | Q221: =IF(R[+26]C[-3]=0,0,RC[-3]/R[+26]C[-3]) -> -999
A222: EA-18G | B222: F414-GE-400 | C222: 224A_FRS | D222: Departure A/B Runway 32 - South Long | E222: 32D2C | F222: Departure | G222: 32 | H222: NMap | I222: Based | J222: No | K222: Departure | L222: 0 | M222: 0 | N222: =SUM(RC[-2]:RC[-1]) -> -999 | O222: =IF(RC[-1]=0,0,RC[-3]/RC[-1]) -> -999 | P222: =IF(RC[-2]=0,0,RC[-3]/RC[-2]) -> -999 | Q222: =IF(R[+25]C[-3]=0,0,RC[-3]/R[+25]C[-3]) -> -999
A223: EA-18G | B223: F414-GE-400 | C223: 247P_FH | D223: FRS HIGH - Interfacility Whidbey Rwy 07 to OLF Rwy 14 | E223: 07WC14P | F223: Departure | G223: 07 | H223: NMap | I223: Based | J223: No | K223: Interfacility Ault Field to Coupeville | L223: 0 | M223: 0 | N223: =SUM(RC[-2]:RC[-1]) -> -999 | O223: =IF(RC[-1]=0,0,RC[-3]/RC[-1]) -> -999 | P223: =IF(RC[-2]=0,0,RC[-3]/RC[-2]) -> -999 | Q223: =IF(R[+24]C[-3]=0,0,RC[-3]/R[+24]C[-3]) -> -999
A224: EA-18G | B224: F414-GE-400 | C224: 247P_FL | D224: FLEET Rep - Interfacility Whidbey Rwy 07 to OLF Rwy 14 | E224: 07WC14P | F224: Departure | G224: 07 | H224: NMap | I224: Based | J224: No | K224: Interfacility Ault Field to Coupeville | L224: 0 | M224: 0 | N224: =SUM(RC[-2]:RC[-1]) -> -999 | O224: =IF(RC[-1]=0,0,RC[-3]/RC[-1]) -> -999 | P224: =IF(RC[-2]=0,0,RC[-3]/RC[-2]) -> -999 | Q224: =IF(R[+23]C[-3]=0,0,RC[-3]/R[+23]C[-3]) -> -999
A225: EA-18G | B225: F414-GE-400 | C225: 247P_FO | D225: FRS LOW - Interfacility Whidbey Rwy 07 to OLF Rwy 14 | E225: 07WC14P | F225: Departure | G225: 07 | H225: NMap | I225: Based | J225: No | K225: Interfacility Ault Field to Coupeville | L225: 0 | M225: 0 | N225: =SUM(RC[-2]:RC[-1]) -> -999 | O225: =IF(RC[-1]=0,0,RC[-3]/RC[-1]) -> -999 | P225: =IF(RC[-2]=0,0,RC[-3]/RC[-2]) -> -999 | Q225: =IF(R[+22]C[-3]=0,0,RC[-3]/R[+22]C[-3]) -> -999
A226: EA-18G | B226: F414-GE-400 | C226: 248P_FH | D226: Interfacility Whidbey Rwy 07 to OLF Rwy 32 | E226: 07WC32P | F226: Departure | G226: 07 | H226: NMap | I226: Based | J226: Yes | K226: Interfacility Ault Field to Coupeville | L226: 0 | M226: 0 | N226: =SUM(RC[-2]:RC[-1]) -> -999 | O226: =IF(RC[-1]=0,0,RC[-3]/RC[-1]) -> -999 | P226: =IF(RC[-2]=0,0,RC[-3]/RC[-2]) -> -999 | Q226: =IF(R[+21]C[-3]=0,0,RC[-3]/R[+21]C[-3]) -> -999
A227: EA-18G | B227: F414-GE-400 | C227: 248P_FL | D227: Interfacility Whidbey Rwy 07 to OLF Rwy 32 | E227: 07WC32P | F227: Departure | G227: 07 | H227: NMap | I227: Based | J227: Yes | K227: Interfacility Ault Field to Coupeville | L227: 0 | M227: 0 | N227: =SUM(RC[-2]:RC[-1]) -> -999 | O227: =IF(RC[-1]=0,0,RC[-3]/RC[-1]) -> -999 | P227: =IF(RC[-2]=0,0,RC[-3]/RC[-2]) -> -999 | Q227: =IF(R[+20]C[-3]=0,0,RC[-3]/R[+20]C[-3]) -> -999
A228: EA-18G | B228: F414-GE-400 | C228: 248P_FO | D228: Interfacility Whidbey Rwy 07 to OLF Rwy 32 | E228: 07WC32P | F228: Departure | G228: 07 | H228: NMap | I228: Based | J228: Yes | K228: Interfacility Ault Field to Coupeville | L228: 0.42857143 | M228: 0 | N228: =SUM(RC[-2]:RC[-1]) -> -999 | O228: =IF(RC[-1]=0,0,RC[-3]/RC[-1]) -> -999 | P228: =IF(RC[-2]=0,0,RC[-3]/RC[-2]) -> -999 | Q228: =IF(R[+19]C[-3]=0,0,RC[-3]/R[+19]C[-3]) -> -999
A229: EA-18G | B229: F414-GE-400 | C229: 249P_FH | D229: Interfacility Whidbey to C-Ville Runway 25 | E229: 14WC14P | F229: Departure | G229: 14 | H229: NMap | I229: Based | J229: No | K229: Interfacility Ault Field to Coupeville | L229: 0 | M229: 0 | N229: =SUM(RC[-2]:RC[-1]) -> -999 | O229: =IF(RC[-1]=0,0,RC[-3]/RC[-1]) -> -999 | P229: =IF(RC[-2]=0,0,RC[-3]/RC[-2]) -> -999 | Q229: =IF(R[+18]C[-3]=0,0,RC[-3]/R[+18]C[-3]) -> -999
A230: EA-18G | B230: F414-GE-400 | C230: 249P_FL | D230: Interfacility Whidbey to C-Ville Runway 25 | E230: 14WC14P | F230: Departure | G230: 14 | H230: NMap | I230: Based | J230: No | K230: Interfacility Ault Field to Coupeville | L230: 0 | M230: 0 | N230: =SUM(RC[-2]:RC[-1]) -> -999 | O230: =IF(RC[-1]=0,0,RC[-3]/RC[-1]) -> -999 | P230: =IF(RC[-2]=0,0,RC[-3]/RC[-2]) -> -999 | Q230: =IF(R[+17]C[-3]=0,0,RC[-3]/R[+17]C[-3]) -> -999
A231: EA-18G | B231: F414-GE-400 | C231: 249P_FO | D231: Interfacility Whidbey to C-Ville Runway 25 | E231: 14WC14P | F231: Departure | G231: 14 | H231: NMap | I231: Based | J231: No | K231: Interfacility Ault Field to Coupeville | L231: 0 | M231: 0 | N231: =SUM(RC[-2]:RC[-1]) -> -999 | O231: =IF(RC[-1]=0,0,RC[-3]/RC[-1]) -> -999 | P231: =IF(RC[-2]=0,0,RC[-3]/RC[-2]) -> -999 | Q231: =IF(R[+16]C[-3]=0,0,RC[-3]/R[+16]C[-3]) -> -999
A232: EA-18G | B232: F414-GE-400 | C232: 250P_FH | D232: Interfacility Whidbey to OLF Rwy 32 | E232: 14WC32P | F232: Departure | G232: 14 | H232: NMap | I232: Based | J232: No | K232: Interfacility Ault Field to Coupeville | L232: 0 | M232: 0 | N232: =SUM(RC[-2]:RC[-1]) -> -999 | O232: =IF(RC[-1]=0,0,RC[-3]/RC[-1]) -> -999 | P232: =IF(RC[-2]=0,0,RC[-3]/RC[-2]) -> -999 | Q232: =IF(R[+15]C[-3]=0,0,RC[-3]/R[+15]C[-3]) -> -999
A233: EA-18G | B233: F414-GE-400 | C233: 250P_FL | D233: Interfacility Whidbey to OLF Rwy 32 | E233: 14WC32P | F233: Departure | G233: 14 | H233: NMap | I233: Based | J233: No | K233: Interfacility Ault Field to Coupeville | L233: 0 | M233: 0 | N233: =SUM(RC[-2]:RC[-1]) -> -999 | O233: =IF(RC[-1]=0,0,RC[-3]/RC[-1]) -> -999 | P233: =IF(RC[-2]=0,0,RC[-3]/RC[-2]) -> -999 | Q233: =IF(R[+14]C[-3]=0,0,RC[-3]/R[+14]C[-3]) -> -999
A234: EA-18G | B234: F414-GE-400 | C234: 250P_FO | D234: Interfacility Whidbey to OLF Rwy 32 | E234: 14WC32P | F234: Departure | G234: 14 | H234: NMap | I234: Based | J234: No | K234: Interfacility Ault Field to Coupeville | L234: 0 | M234: 0 | N234: =SUM(RC[-2]:RC[-1]) -> -999 | O234: =IF(RC[-1]=0,0,RC[-3]/RC[-1]) -> -999 | P234: =IF(RC[-2]=0,0,RC[-3]/RC[-2]) -> -999 | Q234: =IF(R[+13]C[-3]=0,0,RC[-3]/R[+13]C[-3]) -> -999
A235: EA-18G | B235: F414-GE-400 | C235: 251P_FH | D235: Interfacility Whidbey to C-Ville Runway 14 | E235: 25WC14P | F235: Departure | G235: 25 | H235: NMap | I235: Based | J235: No | K235: Interfacility Ault Field to Coupeville | L235: 0 | M235: 0 | N235: =SUM(RC[-2]:RC[-1]) -> -999 | O235: =IF(RC[-1]=0,0,RC[-3]/RC[-1]) -> -999 | P235: =IF(RC[-2]=0,0,RC[-3]/RC[-2]) -> -999 | Q235: =IF(R[+12]C[-3]=0,0,RC[-3]/R[+12]C[-3]) -> -999
A236: EA-18G | B236: F414-GE-400 | C236: 251P_FL | D236: Interfacility Whidbey to C-Ville Runway 14 | E236: 25WC14P | F236: Departure | G236: 25 | H236: NMap | I236: Based | J236: No | K236: Interfacility Ault Field to Coupeville | L236: 0 | M236: 0 | N236: =SUM(RC[-2]:RC[-1]) -> -999 | O236: =IF(RC[-1]=0,0,RC[-3]/RC[-1]) -> -999 | P236: =IF(RC[-2]=0,0,RC[-3]/RC[-2]) -> -999 | Q236: =IF(R[+11]C[-3]=0,0,RC[-3]/R[+11]C[-3]) -> -999
A237: EA-18G | B237: F414-GE-400 | C237: 251P_FO | D237: Interfacility Whidbey to C-Ville Runway 14 | E237: 25WC14P | F237: Departure | G237: 25 | H237: NMap | I237: Based | J237: No | K237: Interfacility Ault Field to Coupeville | L237: 0 | M237: 0 | N237: =SUM(RC[-2]:RC[-1]) -> -999 | O237: =IF(RC[-1]=0,0,RC[-3]/RC[-1]) -> -999 | P237: =IF(RC[-2]=0,0,RC[-3]/RC[-2]) -> -999 | Q237: =IF(R[+10]C[-3]=0,0,RC[-3]/R[+10]C[-3]) -> -999
A238: EA-18G | B238: F414-GE-400 | C238: 252P_FH | D238: Interfacility Whidbey to OLF Rwy 32 | E238: 25WC32P | F238: Departure | G238: 25 | H238: NMap | I238: Based | J238: No | K238: Interfacility Ault Field to Coupeville | L238: 0 | M238: 0 | N238: =SUM(RC[-2]:RC[-1]) -> -999 | O238: =IF(RC[-1]=0,0,RC[-3]/RC[-1]) -> -999 | P238: =IF(RC[-2]=0,0,RC[-3]/RC[-2]) -> -999 | Q238: =IF(R[+9]C[-3]=0,0,RC[-3]/R[+9]C[-3]) -> -999
A239: EA-18G | B239: F414-GE-400 | C239: 252P_FL | D239: Interfacility Whidbey to OLF Rwy 32 | E239: 25WC32P | F239: Departure | G239: 25 | H239: NMap | I239: Based | J239: No | K239: Interfacility Ault Field to Coupeville | L239: 0 | M239: 0 | N239: =SUM(RC[-2]:RC[-1]) -> -999 | O239: =IF(RC[-1]=0,0,RC[-3]/RC[-1]) -> -999 | P239: =IF(RC[-2]=0,0,RC[-3]/RC[-2]) -> -999 | Q239: =IF(R[+8]C[-3]=0,0,RC[-3]/R[+8]C[-3]) -> -999
A240: EA-18G | B240: F414-GE-400 | C240: 252P_FO | D240: Interfacility Whidbey to OLF Rwy 32 | E240: 25WC32P | F240: Departure | G240: 25 | H240: NMap | I240: Based | J240: No | K240: Interfacility Ault Field to Coupeville | L240: 1.2857143 | M240: 0 | N240: =SUM(RC[-2]:RC[-1]) -> -999 | O240: =IF(RC[-1]=0,0,RC[-3]/RC[-1]) -> -999 | P240: =IF(RC[-2]=0,0,RC[-3]/RC[-2]) -> -999 | Q240: =IF(R[+7]C[-3]=0,0,RC[-3]/R[+7]C[-3]) -> -999
A241: EA-18G | B241: F414-GE-400 | C241: 253P_FH | D241: Interfacility Whidbey to C-Ville Runway 14 | E241: 32WC14P | F241: Departure | G241: 32 | H241: NMap | I241: Based | J241: No | K241: Interfacility Ault Field to Coupeville | L241: 0 | M241: 0 | N241: =SUM(RC[-2]:RC[-1]) -> -999 | O241: =IF(RC[-1]=0,0,RC[-3]/RC[-1]) -> -999 | P241: =IF(RC[-2]=0,0,RC[-3]/RC[-2]) -> -999 | Q241: =IF(R[+6]C[-3]=0,0,RC[-3]/R[+6]C[-3]) -> -999
A242: EA-18G | B242: F414-GE-400 | C242: 253P_FL | D242: Interfacility Whidbey to C-Ville Runway 14 | E242: 32WC14P | F242: Departure | G242: 32 | H242: NMap | I242: Based | J242: No | K242: Interfacility Ault Field to Coupeville | L242: 0 | M242: 0 | N242: =SUM(RC[-2]:RC[-1]) -> -999 | O242: =IF(RC[-1]=0,0,RC[-3]/RC[-1]) -> -999 | P242: =IF(RC[-2]=0,0,RC[-3]/RC[-2]) -> -999 | Q242: =IF(R[+5]C[-3]=0,0,RC[-3]/R[+5]C[-3]) -> -999
A243: EA-18G | B243: F414-GE-400 | C243: 253P_FO | D243: Interfacility Whidbey to C-Ville Runway 14 | E243: 32WC14P | F243: Departure | G243: 32 | H243: NMap | I243: Based | J243: No | K243: Interfacility Ault Field to Coupeville | L243: 0 | M243: 0 | N243: =SUM(RC[-2]:RC[-1]) -> -999 | O243: =IF(RC[-1]=0,0,RC[-3]/RC[-1]) -> -999 | P243: =IF(RC[-2]=0,0,RC[-3]/RC[-2]) -> -999 | Q243: =IF(R[+4]C[-3]=0,0,RC[-3]/R[+4]C[-3]) -> -999
A244: EA-18G | B244: F414-GE-400 | C244: 254P_FH | D244: Interfacility Whidbey to OLF Rwy 32 | E244: 32WC32P | F244: Departure | G244: 32 | H244: NMap | I244: Based | J244: No | K244: Interfacility Ault Field to Coupeville | L244: 0 | M244: 0 | N244: =SUM(RC[-2]:RC[-1]) -> -999 | O244: =IF(RC[-1]=0,0,RC[-3]/RC[-1]) -> -999 | P244: =IF(RC[-2]=0,0,RC[-3]/RC[-2]) -> -999 | Q244: =IF(R[+3]C[-3]=0,0,RC[-3]/R[+3]C[-3]) -> -999
A245: EA-18G | B245: F414-GE-400 | C245: 254P_FL | D245: Interfacility Whidbey to OLF Rwy 32 | E245: 32WC32P | F245: Departure | G245: 32 | H245: NMap | I245: Based | J245: No | K245: Interfacility Ault Field to Coupeville | L245: 0 | M245: 0 | N245: =SUM(RC[-2]:RC[-1]) -> -999 | O245: =IF(RC[-1]=0,0,RC[-3]/RC[-1]) -> -999 | P245: =IF(RC[-2]=0,0,RC[-3]/RC[-2]) -> -999 | Q245: =IF(R[+2]C[-3]=0,0,RC[-3]/R[+2]C[-3]) -> -999
A246: EA-18G | B246: F414-GE-400 | C246: 254P_FO | D246: Interfacility Whidbey to OLF Rwy 32 | E246: 32WC32P | F246: Departure | G246: 32 | H246: NMap | I246: Based | J246: No | K246: Interfacility Ault Field to Coupeville | L246: 0 | M246: 0 | N246: =SUM(RC[-2]:RC[-1]) -> -999 | O246: =IF(RC[-1]=0,0,RC[-3]/RC[-1]) -> -999 | P246: =IF(RC[-2]=0,0,RC[-3]/RC[-2]) -> -999 | Q246: =IF(R[+1]C[-3]=0,0,RC[-3]/R[+1]C[-3]) -> -999
K247: Subtotal | L247: =SUM(R[-96]C:R[-1]C) -> -999 | M247: =SUM(R[-96]C:R[-1]C) -> -999 | N247: =SUM(R[-96]C:R[-1]C) -> -999 | O247: =IF(RC[-1]=0,0,RC[-3]/RC[-1]) -> -999 | P247: =IF(RC[-2]=0,0,RC[-3]/RC[-2]) -> -999
A249: EA-18G | B249: F414-GE-400 | C249: 263L | D249: Depart and ReEnter Runway 07 | E249: 07PL | F249: Closed Pattern | G249: 07 | H249: NMap | I249: Based | J249: No | K249: Depart and Re-enter Pattern | L249: 0 | M249: 0 | N249: =SUM(RC[-2]:RC[-1]) -> -999 | O249: =IF(RC[-1]=0,0,RC[-3]/RC[-1]) -> -999 | P249: =IF(RC[-2]=0,0,RC[-3]/RC[-2]) -> -999 | Q249: =IF(R[+68]C[-3]=0,0,RC[-3]/R[+68]C[-3]) -> -999
A250: EA-18G | B250: F414-GE-400 | C250: 263R | D250: Depart and ReEnter Runway 07 | E250: 07PR | F250: Closed Pattern | G250: 07 | H250: NMap | I250: Based | J250: No | K250: Depart and Re-enter Pattern | L250: 0 | M250: 0 | N250: =SUM(RC[-2]:RC[-1]) -> -999 | O250: =IF(RC[-1]=0,0,RC[-3]/RC[-1]) -> -999 | P250: =IF(RC[-2]=0,0,RC[-3]/RC[-2]) -> -999 | Q250: =IF(R[+67]C[-3]=0,0,RC[-3]/R[+67]C[-3]) -> -999
A251: EA-18G | B251: F414-GE-400 | C251: 264L | D251: Depart and ReEnter Runway 14 | E251: 14PL | F251: Closed Pattern | G251: 14 | H251: NMap | I251: Based | J251: No | K251: Depart and Re-enter Pattern | L251: 0 | M251: 0 | N251: =SUM(RC[-2]:RC[-1]) -> -999 | O251: =IF(RC[-1]=0,0,RC[-3]/RC[-1]) -> -999 | P251: =IF(RC[-2]=0,0,RC[-3]/RC[-2]) -> -999 | Q251: =IF(R[+66]C[-3]=0,0,RC[-3]/R[+66]C[-3]) -> -999
A252: EA-18G | B252: F414-GE-400 | C252: 264R | D252: Rep - Depart and ReEnter Runway 14 | E252: 14PR | F252: Closed Pattern | G252: 14 | H252: NMap | I252: Based | J252: Yes | K252: Depart and Re-enter Pattern | L252: 0 | M252: 0 | N252: =SUM(RC[-2]:RC[-1]) -> -999 | O252: =IF(RC[-1]=0,0,RC[-3]/RC[-1]) -> -999 | P252: =IF(RC[-2]=0,0,RC[-3]/RC[-2]) -> -999 | Q252: =IF(R[+65]C[-3]=0,0,RC[-3]/R[+65]C[-3]) -> -999
A253: EA-18G | B253: F414-GE-400 | C253: 265L | D253: Depart and ReEnter Runway 25 | E253: 25PL | F253: Closed Pattern | G253: 25 | H253: NMap | I253: Based | J253: No | K253: Depart and Re-enter Pattern | L253: 0 | M253: 0 | N253: =SUM(RC[-2]:RC[-1]) -> -999 | O253: =IF(RC[-1]=0,0,RC[-3]/RC[-1]) -> -999 | P253: =IF(RC[-2]=0,0,RC[-3]/RC[-2]) -> -999 | Q253: =IF(R[+64]C[-3]=0,0,RC[-3]/R[+64]C[-3]) -> -999
A254: EA-18G | B254: F414-GE-400 | C254: 265R | D254: Depart and ReEnter Runway 25 | E254: 25PR | F254: Closed Pattern | G254: 25 | H254: NMap | I254: Based | J254: No | K254: Depart and Re-enter Pattern | L254: 0 | M254: 0 | N254: =SUM(RC[-2]:RC[-1]) -> -999 | O254: =IF(RC[-1]=0,0,RC[-3]/RC[-1]) -> -999 | P254: =IF(RC[-2]=0,0,RC[-3]/RC[-2]) -> -999 | Q254: =IF(R[+63]C[-3]=0,0,RC[-3]/R[+63]C[-3]) -> -999
A255: EA-18G | B255: F414-GE-400 | C255: 266L | D255: Depart and ReEnter Runway 32 | E255: 32PL | F255: Closed Pattern | G255: 32 | H255: NMap | I255: Based | J255: No | K255: Depart and Re-enter Pattern | L255: 0 | M255: 0 | N255: =SUM(RC[-2]:RC[-1]) -> -999 | O255: =IF(RC[-1]=0,0,RC[-3]/RC[-1]) -> -999 | P255: =IF(RC[-2]=0,0,RC[-3]/RC[-2]) -> -999 | Q255: =IF(R[+62]C[-3]=0,0,RC[-3]/R[+62]C[-3]) -> -999
A256: EA-18G | B256: F414-GE-400 | C256: 266R | D256: Depart and ReEnter Runway 32 | E256: 32PR | F256: Closed Pattern | G256: 32 | H256: NMap | I256: Based | J256: No | K256: Depart and Re-enter Pattern | L256: 0 | M256: 0 | N256: =SUM(RC[-2]:RC[-1]) -> -999 | O256: =IF(RC[-1]=0,0,RC[-3]/RC[-1]) -> -999 | P256: =IF(RC[-2]=0,0,RC[-3]/RC[-2]) -> -999 | Q256: =IF(R[+61]C[-3]=0,0,RC[-3]/R[+61]C[-3]) -> -999
A257: EA-18G | B257: F414-GE-400 | C257: 267A | D257: T&G at Ault; Midfield turn | E257: 07F1B | F257: Closed Pattern | G257: 07 | H257: NMap | I257: Based | J257: No | K257: Touch and Go at Ault Field | L257: 1.2857143 | M257: 0 | N257: =SUM(RC[-2]:RC[-1]) -> -999 | O257: =IF(RC[-1]=0,0,RC[-3]/RC[-1]) -> -999 | P257: =IF(RC[-2]=0,0,RC[-3]/RC[-2]) -> -999 | Q257: =IF(R[+60]C[-3]=0,0,RC[-3]/R[+60]C[-3]) -> -999
A258: EA-18G | B258: F414-GE-400 | C258: 267B | D258: T&G at Ault; Upwind # turn | E258: 07F1C | F258: Closed Pattern | G258: 07 | H258: NMap | I258: Based | J258: No | K258: Touch and Go at Ault Field | L258: 0.14285714 | M258: 0 | N258: =SUM(RC[-2]:RC[-1]) -> -999 | O258: =IF(RC[-1]=0,0,RC[-3]/RC[-1]) -> -999 | P258: =IF(RC[-2]=0,0,RC[-3]/RC[-2]) -> -999 | Q258: =IF(R[+59]C[-3]=0,0,RC[-3]/R[+59]C[-3]) -> -999
A259: EA-18G | B259: F414-GE-400 | C259: 268A | D259: T&G at Ault; Midfield turn | E259: 14F1B | F259: Closed Pattern | G259: 14 | H259: NMap | I259: Based | J259: Yes | K259: Touch and Go at Ault Field | L259: 0 | M259: 0 | N259: =SUM(RC[-2]:RC[-1]) -> -999 | O259: =IF(RC[-1]=0,0,RC[-3]/RC[-1]) -> -999 | P259: =IF(RC[-2]=0,0,RC[-3]/RC[-2]) -> -999 | Q259: =IF(R[+58]C[-3]=0,0,RC[-3]/R[+58]C[-3]) -> -999
A260: EA-18G | B260: F414-GE-400 | C260: 268B | D260: T&G at Ault; Upwind # turn | E260: 14F1C | F260: Closed Pattern | G260: 14 | H260: NMap | I260: Based | J260: No | K260: Touch and Go at Ault Field | L260: 0 | M260: 0 | N260: =SUM(RC[-2]:RC[-1]) -> -999 | O260: =IF(RC[-1]=0,0,RC[-3]/RC[-1]) -> -999 | P260: =IF(RC[-2]=0,0,RC[-3]/RC[-2]) -> -999 | Q260: =IF(R[+57]C[-3]=0,0,RC[-3]/R[+57]C[-3]) -> -999
A261: EA-18G | B261: F414-GE-400 | C261: 269A | D261: T&G at Ault; Midfield turn | E261: 25F1B | F261: Closed Pattern | G261: 25 | H261: NMap | I261: Based | J261: No | K261: Touch and Go at Ault Field | L261: 0.85714286 | M261: 0 | N261: =SUM(RC[-2]:RC[-1]) -> -999 | O261: =IF(RC[-1]=0,0,RC[-3]/RC[-1]) -> -999 | P261: =IF(RC[-2]=0,0,RC[-3]/RC[-2]) -> -999 | Q261: =IF(R[+56]C[-3]=0,0,RC[-3]/R[+56]C[-3]) -> -999
A262: EA-18G | B262: F414-GE-400 | C262: 269B | D262: T&G at Ault; Porkchop | E262: 25F1C | F262: Closed Pattern | G262: 25 | H262: NMap | I262: Based | J262: Yes | K262: Touch and Go at Ault Field | L262: 1.2857143 | M262: 0 | N262: =SUM(RC[-2]:RC[-1]) -> -999 | O262: =IF(RC[-1]=0,0,RC[-3]/RC[-1]) -> -999 | P262: =IF(RC[-2]=0,0,RC[-3]/RC[-2]) -> -999 | Q262: =IF(R[+55]C[-3]=0,0,RC[-3]/R[+55]C[-3]) -> -999
A263: EA-18G | B263: F414-GE-400 | C263: 270B | D263: T&G at Ault; Upwind # turn | E263: 32F1C | F263: Closed Pattern | G263: 32 | H263: NMap | I263: Based | J263: No | K263: Touch and Go at Ault Field | L263: 1.1428571 | M263: 0 | N263: =SUM(RC[-2]:RC[-1]) -> -999 | O263: =IF(RC[-1]=0,0,RC[-3]/RC[-1]) -> -999 | P263: =IF(RC[-2]=0,0,RC[-3]/RC[-2]) -> -999 | Q263: =IF(R[+54]C[-3]=0,0,RC[-3]/R[+54]C[-3]) -> -999
A264: EA-18G | B264: F414-GE-400 | C264: 273PDA | D264: Proposed FCLP | E264: 14FCP1 | F264: Closed Pattern | G264: 14_OLF | H264: NMap | I264: Based | J264: No | K264: FCLP at Coupeville | L264: 0 | M264: 0 | N264: =SUM(RC[-2]:RC[-1]) -> -999 | O264: =IF(RC[-1]=0,0,RC[-3]/RC[-1]) -> -999 | P264: =IF(RC[-2]=0,0,RC[-3]/RC[-2]) -> -999 | Q264: =IF(R[+53]C[-3]=0,0,RC[-3]/R[+53]C[-3]) -> -999
A265: EA-18G | B265: F414-GE-400 | C265: 273PDB | D265: Proposed FCLP | E265: 14FCP2 | F265: Closed Pattern | G265: 14_OLF | H265: NMap | I265: Based | J265: Yes | K265: FCLP at Coupeville | L265: 0 | M265: 0 | N265: =SUM(RC[-2]:RC[-1]) -> -999 | O265: =IF(RC[-1]=0,0,RC[-3]/RC[-1]) -> -999 | P265: =IF(RC[-2]=0,0,RC[-3]/RC[-2]) -> -999 | Q265: =IF(R[+52]C[-3]=0,0,RC[-3]/R[+52]C[-3]) -> -999
A266: EA-18G | B266: F414-GE-400 | C266: 273PDC | D266: Proposed FCLP | E266: 14FCP3 | F266: Closed Pattern | G266: 14_OLF | H266: NMap | I266: Based | J266: No | K266: FCLP at Coupeville | L266: 0 | M266: 0 | N266: =SUM(RC[-2]:RC[-1]) -> -999 | O266: =IF(RC[-1]=0,0,RC[-3]/RC[-1]) -> -999 | P266: =IF(RC[-2]=0,0,RC[-3]/RC[-2]) -> -999 | Q266: =IF(R[+51]C[-3]=0,0,RC[-3]/R[+51]C[-3]) -> -999
A267: EA-18G | B267: F414-GE-400 | C267: 273PDX | D267: Proposed FCLP | E267: 14FCPX | F267: Closed Pattern | G267: 14_OLF | H267: NMap | I267: Based | J267: Yes | K267: FCLP at Coupeville | L267: 0 | M267: 0 | N267: =SUM(RC[-2]:RC[-1]) -> -999 | O267: =IF(RC[-1]=0,0,RC[-3]/RC[-1]) -> -999 | P267: =IF(RC[-2]=0,0,RC[-3]/RC[-2]) -> -999 | Q267: =IF(R[+50]C[-3]=0,0,RC[-3]/R[+50]C[-3]) -> -999
A268: EA-18G | B268: F414-GE-400 | C268: 273PDY | D268: Proposed FCLP | E268: 14FCPY | F268: Closed Pattern | G268: 14_OLF | H268: NMap | I268: Based | J268: Yes | K268: FCLP at Coupeville | L268: 0 | M268: 0 | N268: =SUM(RC[-2]:RC[-1]) -> -999 | O268: =IF(RC[-1]=0,0,RC[-3]/RC[-1]) -> -999 | P268: =IF(RC[-2]=0,0,RC[-3]/RC[-2]) -> -999 | Q268: =IF(R[+49]C[-3]=0,0,RC[-3]/R[+49]C[-3]) -> -999
A269: EA-18G | B269: F414-GE-400 | C269: 276PDA | D269: Proposed FCLP | E269: 32FCP1 | F269: Closed Pattern | G269: 32_OLF | H269: NMap | I269: Based | J269: No | K269: FCLP at Coupeville | L269: 0 | M269: 0 | N269: =SUM(RC[-2]:RC[-1]) -> -999 | O269: =IF(RC[-1]=0,0,RC[-3]/RC[-1]) -> -999 | P269: =IF(RC[-2]=0,0,RC[-3]/RC[-2]) -> -999 | Q269: =IF(R[+48]C[-3]=0,0,RC[-3]/R[+48]C[-3]) -> -999
A270: EA-18G | B270: F414-GE-400 | C270: 276PDB | D270: Proposed FCLP | E270: 32FCP2 | F270: Closed Pattern | G270: 32_OLF | H270: NMap | I270: Based | J270: No | K270: FCLP at Coupeville | L270: 0 | M270: 0 | N270: =SUM(RC[-2]:RC[-1]) -> -999 | O270: =IF(RC[-1]=0,0,RC[-3]/RC[-1]) -> -999 | P270: =IF(RC[-2]=0,0,RC[-3]/RC[-2]) -> -999 | Q270: =IF(R[+47]C[-3]=0,0,RC[-3]/R[+47]C[-3]) -> -999
A271: EA-18G | B271: F414-GE-400 | C271: 276PDC | D271: Proposed FCLP | E271: 32FCP3 | F271: Closed Pattern | G271: 32_OLF | H271: NMap | I271: Based | J271: No | K271: FCLP at Coupeville | L271: 0 | M271: 0 | N271: =SUM(RC[-2]:RC[-1]) -> -999 | O271: =IF(RC[-1]=0,0,RC[-3]/RC[-1]) -> -999 | P271: =IF(RC[-2]=0,0,RC[-3]/RC[-2]) -> -999 | Q271: =IF(R[+46]C[-3]=0,0,RC[-3]/R[+46]C[-3]) -> -999
A272: EA-18G | B272: F414-GE-400 | C272: 276PDX | D272: Proposed FCLP | E272: 32FCPX | F272: Closed Pattern | G272: 32_OLF | H272: NMap | I272: Based | J272: Yes | K272: FCLP at Coupeville | L272: 0 | M272: 0 | N272: =SUM(RC[-2]:RC[-1]) -> -999 | O272: =IF(RC[-1]=0,0,RC[-3]/RC[-1]) -> -999 | P272: =IF(RC[-2]=0,0,RC[-3]/RC[-2]) -> -999 | Q272: =IF(R[+45]C[-3]=0,0,RC[-3]/R[+45]C[-3]) -> -999
A273: EA-18G | B273: F414-GE-400 | C273: 276PDY | D273: New observed "early turn" pattern | E273: 32FCPY | F273: Closed Pattern | G273: 32_OLF | H273: NMap | I273: Based | J273: Yes | K273: FCLP at Coupeville | L273: 3 | M273: 0 | N273: =SUM(RC[-2]:RC[-1]) -> -999 | O273: =IF(RC[-1]=0,0,RC[-3]/RC[-1]) -> -999 | P273: =IF(RC[-2]=0,0,RC[-3]/RC[-2]) -> -999 | Q273: =IF(R[+44]C[-3]=0,0,RC[-3]/R[+44]C[-3]) -> -999
A274: EA-18G | B274: F414-GE-400 | C274: 277A_EXP | E274: 07G1A | F274: Closed Pattern | G274: 07 | H274: NMap | I274: Based | J274: No | K274: GCA Pattern | L274: 0 | M274: 0 | N274: =SUM(RC[-2]:RC[-1]) -> -999 | O274: =IF(RC[-1]=0,0,RC[-3]/RC[-1]) -> -999 | P274: =IF(RC[-2]=0,0,RC[-3]/RC[-2]) -> -999 | Q274: =IF(R[+43]C[-3]=0,0,RC[-3]/R[+43]C[-3]) -> -999
A275: EA-18G | B275: F414-GE-400 | C275: 277A_FLT | E275: 07G1A | F275: Closed Pattern | G275: 07 | H275: NMap | I275: Based | J275: No | K275: GCA Pattern | L275: 0 | M275: 0 | N275: =SUM(RC[-2]:RC[-1]) -> -999 | O275: =IF(RC[-1]=0,0,RC[-3]/RC[-1]) -> -999 | P275: =IF(RC[-2]=0,0,RC[-3]/RC[-2]) -> -999 | Q275: =IF(R[+42]C[-3]=0,0,RC[-3]/R[+42]C[-3]) -> -999
A276: EA-18G | B276: F414-GE-400 | C276: 277A_FRS | E276: 07G1A | F276: Closed Pattern | G276: 07 | H276: NMap | I276: Based | J276: No | K276: GCA Pattern | L276: 0 | M276: 0 | N276: =SUM(RC[-2]:RC[-1]) -> -999 | O276: =IF(RC[-1]=0,0,RC[-3]/RC[-1]) -> -999 | P276: =IF(RC[-2]=0,0,RC[-3]/RC[-2]) -> -999 | Q276: =IF(R[+41]C[-3]=0,0,RC[-3]/R[+41]C[-3]) -> -999
A277: EA-18G | B277: F414-GE-400 | C277: 277B_EXP | E277: 07G1B | F277: Closed Pattern | G277: 07 | H277: NMap | I277: Based | J277: No | K277: GCA Pattern | L277: 0 | M277: 0 | N277: =SUM(RC[-2]:RC[-1]) -> -999 | O277: =IF(RC[-1]=0,0,RC[-3]/RC[-1]) -> -999 | P277: =IF(RC[-2]=0,0,RC[-3]/RC[-2]) -> -999 | Q277: =IF(R[+40]C[-3]=0,0,RC[-3]/R[+40]C[-3]) -> -999
A278: EA-18G | B278: F414-GE-400 | C278: 277B_FLT | E278: 07G1B | F278: Closed Pattern | G278: 07 | H278: NMap | I278: Based | J278: No | K278: GCA Pattern | L278: 0 | M278: 0 | N278: =SUM(RC[-2]:RC[-1]) -> -999 | O278: =IF(RC[-1]=0,0,RC[-3]/RC[-1]) -> -999 | P278: =IF(RC[-2]=0,0,RC[-3]/RC[-2]) -> -999 | Q278: =IF(R[+39]C[-3]=0,0,RC[-3]/R[+39]C[-3]) -> -999
A279: EA-18G | B279: F414-GE-400 | C279: 277B_FRS | E279: 07G1B | F279: Closed Pattern | G279: 07 | H279: NMap | I279: Based | J279: No | K279: GCA Pattern | L279: 0 | M279: 0 | N279: =SUM(RC[-2]:RC[-1]) -> -999 | O279: =IF(RC[-1]=0,0,RC[-3]/RC[-1]) -> -999 | P279: =IF(RC[-2]=0,0,RC[-3]/RC[-2]) -> -999 | Q279: =IF(R[+38]C[-3]=0,0,RC[-3]/R[+38]C[-3]) -> -999
A280: EA-18G | B280: F414-GE-400 | C280: 277C_EXP | E280: 07G1C | F280: Closed Pattern | G280: 07 | H280: NMap | I280: Based | J280: No | K280: GCA Pattern | L280: 0 | M280: 0 | N280: =SUM(RC[-2]:RC[-1]) -> -999 | O280: =IF(RC[-1]=0,0,RC[-3]/RC[-1]) -> -999 | P280: =IF(RC[-2]=0,0,RC[-3]/RC[-2]) -> -999 | Q280: =IF(R[+37]C[-3]=0,0,RC[-3]/R[+37]C[-3]) -> -999
A281: EA-18G | B281: F414-GE-400 | C281: 277C_FLT | E281: 07G1C | F281: Closed Pattern | G281: 07 | H281: NMap | I281: Based | J281: No | K281: GCA Pattern | L281: 0 | M281: 0 | N281: =SUM(RC[-2]:RC[-1]) -> -999 | O281: =IF(RC[-1]=0,0,RC[-3]/RC[-1]) -> -999 | P281: =IF(RC[-2]=0,0,RC[-3]/RC[-2]) -> -999 | Q281: =IF(R[+36]C[-3]=0,0,RC[-3]/R[+36]C[-3]) -> -999
A282: EA-18G | B282: F414-GE-400 | C282: 277C_FRS | E282: 07G1C | F282: Closed Pattern | G282: 07 | H282: NMap | I282: Based | J282: No | K282: GCA Pattern | L282: 0 | M282: 0 | N282: =SUM(RC[-2]:RC[-1]) -> -999 | O282: =IF(RC[-1]=0,0,RC[-3]/RC[-1]) -> -999 | P282: =IF(RC[-2]=0,0,RC[-3]/RC[-2]) -> -999 | Q282: =IF(R[+35]C[-3]=0,0,RC[-3]/R[+35]C[-3]) -> -999
A283: EA-18G | B283: F414-GE-400 | C283: 278A_EXP | D283: Rep - GCA Box at Whidbey Runway 14 - 3NM Wide | E283: 14G1A | F283: Closed Pattern | G283: 14 | H283: NMap | I283: Based | J283: Yes | K283: GCA Pattern | L283: 0 | M283: 0 | N283: =SUM(RC[-2]:RC[-1]) -> -999 | O283: =IF(RC[-1]=0,0,RC[-3]/RC[-1]) -> -999 | P283: =IF(RC[-2]=0,0,RC[-3]/RC[-2]) -> -999 | Q283: =IF(R[+34]C[-3]=0,0,RC[-3]/R[+34]C[-3]) -> -999
A284: EA-18G | B284: F414-GE-400 | C284: 278A_FLT | D284: Rep - GCA Box at Whidbey Runway 14 - 3NM Wide | E284: 14G1A | F284: Closed Pattern | G284: 14 | H284: NMap | I284: Based | J284: Yes | K284: GCA Pattern | L284: 0 | M284: 0 | N284: =SUM(RC[-2]:RC[-1]) -> -999 | O284: =IF(RC[-1]=0,0,RC[-3]/RC[-1]) -> -999 | P284: =IF(RC[-2]=0,0,RC[-3]/RC[-2]) -> -999 | Q284: =IF(R[+33]C[-3]=0,0,RC[-3]/R[+33]C[-3]) -> -999
A285: EA-18G | B285: F414-GE-400 | C285: 278A_FRS | D285: Rep - GCA Box at Whidbey Runway 14 - 3NM Wide | E285: 14G1A | F285: Closed Pattern | G285: 14 | H285: NMap | I285: Based | J285: Yes | K285: GCA Pattern | L285: 0 | M285: 0 | N285: =SUM(RC[-2]:RC[-1]) -> -999 | O285: =IF(RC[-1]=0,0,RC[-3]/RC[-1]) -> -999 | P285: =IF(RC[-2]=0,0,RC[-3]/RC[-2]) -> -999 | Q285: =IF(R[+32]C[-3]=0,0,RC[-3]/R[+32]C[-3]) -> -999
A286: EA-18G | B286: F414-GE-400 | C286: 278B_EXP | E286: 14G1B | F286: Closed Pattern | G286: 14 | H286: NMap | I286: Based | J286: No | K286: GCA Pattern | L286: 0 | M286: 0 | N286: =SUM(RC[-2]:RC[-1]) -> -999 | O286: =IF(RC[-1]=0,0,RC[-3]/RC[-1]) -> -999 | P286: =IF(RC[-2]=0,0,RC[-3]/RC[-2]) -> -999 | Q286: =IF(R[+31]C[-3]=0,0,RC[-3]/R[+31]C[-3]) -> -999
A287: EA-18G | B287: F414-GE-400 | C287: 278B_FLT | E287: 14G1B | F287: Closed Pattern | G287: 14 | H287: NMap | I287: Based | J287: No | K287: GCA Pattern | L287: 0 | M287: 0 | N287: =SUM(RC[-2]:RC[-1]) -> -999 | O287: =IF(RC[-1]=0,0,RC[-3]/RC[-1]) -> -999 | P287: =IF(RC[-2]=0,0,RC[-3]/RC[-2]) -> -999 | Q287: =IF(R[+30]C[-3]=0,0,RC[-3]/R[+30]C[-3]) -> -999
A288: EA-18G | B288: F414-GE-400 | C288: 278B_FRS | E288: 14G1B | F288: Closed Pattern | G288: 14 | H288: NMap | I288: Based | J288: No | K288: GCA Pattern | L288: 0 | M288: 0 | N288: =SUM(RC[-2]:RC[-1]) -> -999 | O288: =IF(RC[-1]=0,0,RC[-3]/RC[-1]) -> -999 | P288: =IF(RC[-2]=0,0,RC[-3]/RC[-2]) -> -999 | Q288: =IF(R[+29]C[-3]=0,0,RC[-3]/R[+29]C[-3]) -> -999
A289: EA-18G | B289: F414-GE-400 | C289: 278C_EXP | E289: 14G1C | F289: Closed Pattern | G289: 14 | H289: NMap | I289: Based | J289: No | K289: GCA Pattern | L289: 0 | M289: 0 | N289: =SUM(RC[-2]:RC[-1]) -> -999 | O289: =IF(RC[-1]=0,0,RC[-3]/RC[-1]) -> -999 | P289: =IF(RC[-2]=0,0,RC[-3]/RC[-2]) -> -999 | Q289: =IF(R[+28]C[-3]=0,0,RC[-3]/R[+28]C[-3]) -> -999
A290: EA-18G | B290: F414-GE-400 | C290: 278C_FLT | E290: 14G1C | F290: Closed Pattern | G290: 14 | H290: NMap | I290: Based | J290: No | K290: GCA Pattern | L290: 0 | M290: 0 | N290: =SUM(RC[-2]:RC[-1]) -> -999 | O290: =IF(RC[-1]=0,0,RC[-3]/RC[-1]) -> -999 | P290: =IF(RC[-2]=0,0,RC[-3]/RC[-2]) -> -999 | Q290: =IF(R[+27]C[-3]=0,0,RC[-3]/R[+27]C[-3]) -> -999
A291: EA-18G | B291: F414-GE-400 | C291: 278C_FRS | E291: 14G1C | F291: Closed Pattern | G291: 14 | H291: NMap | I291: Based | J291: No | K291: GCA Pattern | L291: 0 | M291: 0 | N291: =SUM(RC[-2]:RC[-1]) -> -999 | O291: =IF(RC[-1]=0,0,RC[-3]/RC[-1]) -> -999 | P291: =IF(RC[-2]=0,0,RC[-3]/RC[-2]) -> -999 | Q291: =IF(R[+26]C[-3]=0,0,RC[-3]/R[+26]C[-3]) -> -999
A292: EA-18G | B292: F414-GE-400 | C292: 279A_EXP | E292: 25G1A | F292: Closed Pattern | G292: 25 | H292: NMap | I292: Based | J292: No | K292: GCA Pattern | L292: 0 | M292: 0 | N292: =SUM(RC[-2]:RC[-1]) -> -999 | O292: =IF(RC[-1]=0,0,RC[-3]/RC[-1]) -> -999 | P292: =IF(RC[-2]=0,0,RC[-3]/RC[-2]) -> -999 | Q292: =IF(R[+25]C[-3]=0,0,RC[-3]/R[+25]C[-3]) -> -999
A293: EA-18G | B293: F414-GE-400 | C293: 279A_FLT | E293: 25G1A | F293: Closed Pattern | G293: 25 | H293: NMap | I293: Based | J293: No | K293: GCA Pattern | L293: 0 | M293: 0 | N293: =SUM(RC[-2]:RC[-1]) -> -999 | O293: =IF(RC[-1]=0,0,RC[-3]/RC[-1]) -> -999 | P293: =IF(RC[-2]=0,0,RC[-3]/RC[-2]) -> -999 | Q293: =IF(R[+24]C[-3]=0,0,RC[-3]/R[+24]C[-3]) -> -999
A294: EA-18G | B294: F414-GE-400 | C294: 279A_FRS | E294: 25G1A | F294: Closed Pattern | G294: 25 | H294: NMap | I294: Based | J294: No | K294: GCA Pattern | L294: 0.57142857 | M294: 0 | N294: =SUM(RC[-2]:RC[-1]) -> -999 | O294: =IF(RC[-1]=0,0,RC[-3]/RC[-1]) -> -999 | P294: =IF(RC[-2]=0,0,RC[-3]/RC[-2]) -> -999 | Q294: =IF(R[+23]C[-3]=0,0,RC[-3]/R[+23]C[-3]) -> -999
A295: EA-18G | B295: F414-GE-400 | C295: 279B_EXP | E295: 25G1B | F295: Closed Pattern | G295: 25 | H295: NMap | I295: Based | J295: No | K295: GCA Pattern | L295: 0 | M295: 0 | N295: =SUM(RC[-2]:RC[-1]) -> -999 | O295: =IF(RC[-1]=0,0,RC[-3]/RC[-1]) -> -999 | P295: =IF(RC[-2]=0,0,RC[-3]/RC[-2]) -> -999 | Q295: =IF(R[+22]C[-3]=0,0,RC[-3]/R[+22]C[-3]) -> -999
A296: EA-18G | B296: F414-GE-400 | C296: 279B_FLT | E296: 25G1B | F296: Closed Pattern | G296: 25 | H296: NMap | I296: Based | J296: No | K296: GCA Pattern | L296: 0 | M296: 0 | N296: =SUM(RC[-2]:RC[-1]) -> -999 | O296: =IF(RC[-1]=0,0,RC[-3]/RC[-1]) -> -999 | P296: =IF(RC[-2]=0,0,RC[-3]/RC[-2]) -> -999 | Q296: =IF(R[+21]C[-3]=0,0,RC[-3]/R[+21]C[-3]) -> -999
A297: EA-18G | B297: F414-GE-400 | C297: 279B_FRS | E297: 25G1B | F297: Closed Pattern | G297: 25 | H297: NMap | I297: Based | J297: No | K297: GCA Pattern | L297: 0.85714286 | M297: 0 | N297: =SUM(RC[-2]:RC[-1]) -> -999 | O297: =IF(RC[-1]=0,0,RC[-3]/RC[-1]) -> -999 | P297: =IF(RC[-2]=0,0,RC[-3]/RC[-2]) -> -999 | Q297: =IF(R[+20]C[-3]=0,0,RC[-3]/R[+20]C[-3]) -> -999
A298: EA-18G | B298: F414-GE-400 | C298: 279C_EXP | E298: 25G1C | F298: Closed Pattern | G298: 25 | H298: NMap | I298: Based | J298: No | K298: GCA Pattern | L298: 0 | M298: 0 | N298: =SUM(RC[-2]:RC[-1]) -> -999 | O298: =IF(RC[-1]=0,0,RC[-3]/RC[-1]) -> -999 | P298: =IF(RC[-2]=0,0,RC[-3]/RC[-2]) -> -999 | Q298: =IF(R[+19]C[-3]=0,0,RC[-3]/R[+19]C[-3]) -> -999
A299: EA-18G | B299: F414-GE-400 | C299: 279C_FLT | E299: 25G1C | F299: Closed Pattern | G299: 25 | H299: NMap | I299: Based | J299: No | K299: GCA Pattern | L299: 0 | M299: 0 | N299: =SUM(RC[-2]:RC[-1]) -> -999 | O299: =IF(RC[-1]=0,0,RC[-3]/RC[-1]) -> -999 | P299: =IF(RC[-2]=0,0,RC[-3]/RC[-2]) -> -999 | Q299: =IF(R[+18]C[-3]=0,0,RC[-3]/R[+18]C[-3]) -> -999
A300: EA-18G | B300: F414-GE-400 | C300: 279C_FRS | E300: 25G1C | F300: Closed Pattern | G300: 25 | H300: NMap | I300: Based | J300: No | K300: GCA Pattern | L300: 0 | M300: 0 | N300: =SUM(RC[-2]:RC[-1]) -> -999 | O300: =IF(RC[-1]=0,0,RC[-3]/RC[-1]) -> -999 | P300: =IF(RC[-2]=0,0,RC[-3]/RC[-2]) -> -999 | Q300: =IF(R[+17]C[-3]=0,0,RC[-3]/R[+17]C[-3]) -> -999
A301: EA-18G | B301: F414-GE-400 | C301: 280A_EXP | E301: 32G1A | F301: Closed Pattern | G301: 32 | H301: NMap | I301: Based | J301: No | K301: GCA Pattern | L301: 0.42857143 | M301: 0 | N301: =SUM(RC[-2]:RC[-1]) -> -999 | O301: =IF(RC[-1]=0,0,RC[-3]/RC[-1]) -> -999 | P301: =IF(RC[-2]=0,0,RC[-3]/RC[-2]) -> -999 | Q301: =IF(R[+16]C[-3]=0,0,RC[-3]/R[+16]C[-3]) -> -999
A302: EA-18G | B302: F414-GE-400 | C302: 280A_FLT | E302: 32G1A | F302: Closed Pattern | G302: 32 | H302: NMap | I302: Based | J302: No | K302: GCA Pattern | L302: 0 | M302: 0 | N302: =SUM(RC[-2]:RC[-1]) -> -999 | O302: =IF(RC[-1]=0,0,RC[-3]/RC[-1]) -> -999 | P302: =IF(RC[-2]=0,0,RC[-3]/RC[-2]) -> -999 | Q302: =IF(R[+15]C[-3]=0,0,RC[-3]/R[+15]C[-3]) -> -999
A303: EA-18G | B303: F414-GE-400 | C303: 280A_FRS | E303: 32G1A | F303: Closed Pattern | G303: 32 | H303: NMap | I303: Based | J303: No | K303: GCA Pattern | L303: 0.14285714 | M303: 0 | N303: =SUM(RC[-2]:RC[-1]) -> -999 | O303: =IF(RC[-1]=0,0,RC[-3]/RC[-1]) -> -999 | P303: =IF(RC[-2]=0,0,RC[-3]/RC[-2]) -> -999 | Q303: =IF(R[+14]C[-3]=0,0,RC[-3]/R[+14]C[-3]) -> -999
A304: EA-18G | B304: F414-GE-400 | C304: 280B_EXP | E304: 32G1B | F304: Closed Pattern | G304: 32 | H304: NMap | I304: Based | J304: No | K304: GCA Pattern | L304: 0 | M304: 0 | N304: =SUM(RC[-2]:RC[-1]) -> -999 | O304: =IF(RC[-1]=0,0,RC[-3]/RC[-1]) -> -999 | P304: =IF(RC[-2]=0,0,RC[-3]/RC[-2]) -> -999 | Q304: =IF(R[+13]C[-3]=0,0,RC[-3]/R[+13]C[-3]) -> -999
A305: EA-18G | B305: F414-GE-400 | C305: 280B_FLT | E305: 32G1B | F305: Closed Pattern | G305: 32 | H305: NMap | I305: Based | J305: No | K305: GCA Pattern | L305: 0 | M305: 0 | N305: =SUM(RC[-2]:RC[-1]) -> -999 | O305: =IF(RC[-1]=0,0,RC[-3]/RC[-1]) -> -999 | P305: =IF(RC[-2]=0,0,RC[-3]/RC[-2]) -> -999 | Q305: =IF(R[+12]C[-3]=0,0,RC[-3]/R[+12]C[-3]) -> -999
A306: EA-18G | B306: F414-GE-400 | C306: 280B_FRS | E306: 32G1B | F306: Closed Pattern | G306: 32 | H306: NMap | I306: Based | J306: No | K306: GCA Pattern | L306: 0.57142857 | M306: 0 | N306: =SUM(RC[-2]:RC[-1]) -> -999 | O306: =IF(RC[-1]=0,0,RC[-3]/RC[-1]) -> -999 | P306: =IF(RC[-2]=0,0,RC[-3]/RC[-2]) -> -999 | Q306: =IF(R[+11]C[-3]=0,0,RC[-3]/R[+11]C[-3]) -> -999
A307: EA-18G | B307: F414-GE-400 | C307: 280C_EXP | E307: 32G1C | F307: Closed Pattern | G307: 32 | H307: NMap | I307: Based | J307: No | K307: GCA Pattern | L307: 0 | M307: 0 | N307: =SUM(RC[-2]:RC[-1]) -> -999 | O307: =IF(RC[-1]=0,0,RC[-3]/RC[-1]) -> -999 | P307: =IF(RC[-2]=0,0,RC[-3]/RC[-2]) -> -999 | Q307: =IF(R[+10]C[-3]=0,0,RC[-3]/R[+10]C[-3]) -> -999
A308: EA-18G | B308: F414-GE-400 | C308: 280C_FLT | E308: 32G1C | F308: Closed Pattern | G308: 32 | H308: NMap | I308: Based | J308: No | K308: GCA Pattern | L308: 0 | M308: 0 | N308: =SUM(RC[-2]:RC[-1]) -> -999 | O308: =IF(RC[-1]=0,0,RC[-3]/RC[-1]) -> -999 | P308: =IF(RC[-2]=0,0,RC[-3]/RC[-2]) -> -999 | Q308: =IF(R[+9]C[-3]=0,0,RC[-3]/R[+9]C[-3]) -> -999
A309: EA-18G | B309: F414-GE-400 | C309: 280C_FRS | E309: 32G1C | F309: Closed Pattern | G309: 32 | H309: NMap | I309: Based | J309: No | K309: GCA Pattern | L309: 0 | M309: 0 | N309: =SUM(RC[-2]:RC[-1]) -> -999 | O309: =IF(RC[-1]=0,0,RC[-3]/RC[-1]) -> -999 | P309: =IF(RC[-2]=0,0,RC[-3]/RC[-2]) -> -999 | Q309: =IF(R[+8]C[-3]=0,0,RC[-3]/R[+8]C[-3]) -> -999
A310: EA-18G | B310: F414-GE-400 | C310: 281A_m | D310: FCLP Whidbey Runway 07 - Short | E310: 07F1B | F310: Closed Pattern | G310: 07 | H310: NMap | I310: Based | J310: No | K310: FCLP at Ault Field | L310: 0 | M310: 0 | N310: =SUM(RC[-2]:RC[-1]) -> -999 | O310: =IF(RC[-1]=0,0,RC[-3]/RC[-1]) -> -999 | P310: =IF(RC[-2]=0,0,RC[-3]/RC[-2]) -> -999 | Q310: =IF(R[+7]C[-3]=0,0,RC[-3]/R[+7]C[-3]) -> -999
A311: EA-18G | B311: F414-GE-400 | C311: 281B_m | D311: FCLP at Whidbey Runway 07 - Long | E311: 07F1C | F311: Closed Pattern | G311: 07 | H311: NMap | I311: Based | J311: No | K311: FCLP at Ault Field | L311: 0 | M311: 0 | N311: =SUM(RC[-2]:RC[-1]) -> -999 | O311: =IF(RC[-1]=0,0,RC[-3]/RC[-1]) -> -999 | P311: =IF(RC[-2]=0,0,RC[-3]/RC[-2]) -> -999 | Q311: =IF(R[+6]C[-3]=0,0,RC[-3]/R[+6]C[-3]) -> -999
A312: EA-18G | B312: F414-GE-400 | C312: 282A_m | D312: FCLP Whidbey Runway 14 - Short | E312: 14F1B | F312: Closed Pattern | G312: 14 | H312: NMap | I312: Based | J312: No | K312: FCLP at Ault Field | L312: 0 | M312: 0 | N312: =SUM(RC[-2]:RC[-1]) -> -999 | O312: =IF(RC[-1]=0,0,RC[-3]/RC[-1]) -> -999 | P312: =IF(RC[-2]=0,0,RC[-3]/RC[-2]) -> -999 | Q312: =IF(R[+5]C[-3]=0,0,RC[-3]/R[+5]C[-3]) -> -999
A313: EA-18G | B313: F414-GE-400 | C313: 282B_m | D313: Rep - FCLP at Whidbey Runway 14 - Upwind Numbers | E313: 14F1C | F313: Closed Pattern | G313: 14 | H313: NMap | I313: Based | J313: Yes | K313: FCLP at Ault Field | L313: 0.14285714 | M313: 0 | N313: =SUM(RC[-2]:RC[-1]) -> -999 | O313: =IF(RC[-1]=0,0,RC[-3]/RC[-1]) -> -999 | P313: =IF(RC[-2]=0,0,RC[-3]/RC[-2]) -> -999 | Q313: =IF(R[+4]C[-3]=0,0,RC[-3]/R[+4]C[-3]) -> -999
A314: EA-18G | B314: F414-GE-400 | C314: 283A_m | D314: FCLP Whidbey Runway 25 Midfield -- Orginal | E314: 25F1B | F314: Closed Pattern | G314: 25 | H314: NMap | I314: Based | J314: No | K314: FCLP at Ault Field | L314: 0 | M314: 0 | N314: =SUM(RC[-2]:RC[-1]) -> -999 | O314: =IF(RC[-1]=0,0,RC[-3]/RC[-1]) -> -999 | P314: =IF(RC[-2]=0,0,RC[-3]/RC[-2]) -> -999 | Q314: =IF(R[+3]C[-3]=0,0,RC[-3]/R[+3]C[-3]) -> -999
A315: EA-18G | B315: F414-GE-400 | C315: 283B_m | D315: Rep - FCLP at Whidbey Runway 25 Upwind -- Original | E315: 25F1C | F315: Closed Pattern | G315: 25 | H315: NMap | I315: Based | J315: Yes | K315: FCLP at Ault Field | L315: 0 | M315: 0 | N315: =SUM(RC[-2]:RC[-1]) -> -999 | O315: =IF(RC[-1]=0,0,RC[-3]/RC[-1]) -> -999 | P315: =IF(RC[-2]=0,0,RC[-3]/RC[-2]) -> -999 | Q315: =IF(R[+2]C[-3]=0,0,RC[-3]/R[+2]C[-3]) -> -999
A316: EA-18G | B316: F414-GE-400 | C316: 284B_m | D316: FCLP at Whidbey Runway 32 - Long | E316: 32F1C | F316: Closed Pattern | G316: 32 | H316: NMap | I316: Based | J316: No | K316: FCLP at Ault Field | L316: 0 | M316: 0 | N316: =SUM(RC[-2]:RC[-1]) -> -999 | O316: =IF(RC[-1]=0,0,RC[-3]/RC[-1]) -> -999 | P316: =IF(RC[-2]=0,0,RC[-3]/RC[-2]) -> -999 | Q316: =IF(R[+1]C[-3]=0,0,RC[-3]/R[+1]C[-3]) -> -999
K317: Subtotal | L317: =SUM(R[-68]C:R[-1]C) -> -999 | M317: =SUM(R[-68]C:R[-1]C) -> -999 | N317: =SUM(R[-68]C:R[-1]C) -> -999 | O317: =IF(RC[-1]=0,0,RC[-3]/RC[-1]) -> -999 | P317: =IF(RC[-2]=0,0,RC[-3]/RC[-2]) -> -999
A319: EA-18G | B319: F414-GE-400 | C319: 255_FLT | D319: Interfacility OLF Rwy 14 to Whidbey Rwy 07 | E319: 14CW07_FLT | F319: Interfacility | G319: 14_OLF | H319: NMap | I319: Based | J319: Yes | K319: Interfacility Coupeville to Ault Field | L319: 0 | M319: 0 | N319: =SUM(RC[-2]:RC[-1]) -> -999 | O319: =IF(RC[-1]=0,0,RC[-3]/RC[-1]) -> -999 | P319: =IF(RC[-2]=0,0,RC[-3]/RC[-2]) -> -999 | Q319: =IF(R[+16]C[-3]=0,0,RC[-3]/R[+16]C[-3]) -> -999
A320: EA-18G | B320: F414-GE-400 | C320: 255_FRS | D320: Interfacility OLF Rwy 14 to Whidbey Rwy 07 | E320: 14CW07_FRS | F320: Interfacility | G320: 14_OLF | H320: NMap | I320: Based | J320: Yes | K320: Interfacility Coupeville to Ault Field | L320: 0 | M320: 0 | N320: =SUM(RC[-2]:RC[-1]) -> -999 | O320: =IF(RC[-1]=0,0,RC[-3]/RC[-1]) -> -999 | P320: =IF(RC[-2]=0,0,RC[-3]/RC[-2]) -> -999 | Q320: =IF(R[+15]C[-3]=0,0,RC[-3]/R[+15]C[-3]) -> -999
A321: EA-18G | B321: F414-GE-400 | C321: 256_FLT | D321: Interfacility OLF Rwy 14 to Whidbey Rwy 14 | E321: 14CW14_FLT | F321: Interfacility | G321: 14_OLF | H321: NMap | I321: Based | J321: No | K321: Interfacility Coupeville to Ault Field | L321: 0 | M321: 0 | N321: =SUM(RC[-2]:RC[-1]) -> -999 | O321: =IF(RC[-1]=0,0,RC[-3]/RC[-1]) -> -999 | P321: =IF(RC[-2]=0,0,RC[-3]/RC[-2]) -> -999 | Q321: =IF(R[+14]C[-3]=0,0,RC[-3]/R[+14]C[-3]) -> -999
A322: EA-18G | B322: F414-GE-400 | C322: 256_FRS | D322: Interfacility OLF Rwy 14 to Whidbey Rwy 14 | E322: 14CW14_FRS | F322: Interfacility | G322: 14_OLF | H322: NMap | I322: Based | J322: No | K322: Interfacility Coupeville to Ault Field | L322: 0 | M322: 0 | N322: =SUM(RC[-2]:RC[-1]) -> -999 | O322: =IF(RC[-1]=0,0,RC[-3]/RC[-1]) -> -999 | P322: =IF(RC[-2]=0,0,RC[-3]/RC[-2]) -> -999 | Q322: =IF(R[+13]C[-3]=0,0,RC[-3]/R[+13]C[-3]) -> -999
A323: EA-18G | B323: F414-GE-400 | C323: 257_FLT | D323: Interfacility: Coupeville RWY14 to Ault RWY25 -- Original | E323: 14CW25_FLT | F323: Interfacility | G323: 14_OLF | H323: NMap | I323: Based | J323: Yes | K323: Interfacility Coupeville to Ault Field | L323: 0 | M323: 0 | N323: =SUM(RC[-2]:RC[-1]) -> -999 | O323: =IF(RC[-1]=0,0,RC[-3]/RC[-1]) -> -999 | P323: =IF(RC[-2]=0,0,RC[-3]/RC[-2]) -> -999 | Q323: =IF(R[+12]C[-3]=0,0,RC[-3]/R[+12]C[-3]) -> -999
A324: EA-18G | B324: F414-GE-400 | C324: 257_FRS | D324: Interfacility: Coupeville RWY14 to Ault RWY25 -- Original | E324: 14CW25_FRS | F324: Interfacility | G324: 14_OLF | H324: NMap | I324: Based | J324: Yes | K324: Interfacility Coupeville to Ault Field | L324: 0 | M324: 0 | N324: =SUM(RC[-2]:RC[-1]) -> -999 | O324: =IF(RC[-1]=0,0,RC[-3]/RC[-1]) -> -999 | P324: =IF(RC[-2]=0,0,RC[-3]/RC[-2]) -> -999 | Q324: =IF(R[+11]C[-3]=0,0,RC[-3]/R[+11]C[-3]) -> -999
A325: EA-18G | B325: F414-GE-400 | C325: 258_FLT | D325: Interfacility OLF Rwy 14 to Whidbey Rwy 32 | E325: 14CW32_FLT | F325: Interfacility | G325: 14_OLF | H325: NMap | I325: Based | J325: No | K325: Interfacility Coupeville to Ault Field | L325: 0 | M325: 0 | N325: =SUM(RC[-2]:RC[-1]) -> -999 | O325: =IF(RC[-1]=0,0,RC[-3]/RC[-1]) -> -999 | P325: =IF(RC[-2]=0,0,RC[-3]/RC[-2]) -> -999 | Q325: =IF(R[+10]C[-3]=0,0,RC[-3]/R[+10]C[-3]) -> -999
A326: EA-18G | B326: F414-GE-400 | C326: 258_FRS | D326: Interfacility OLF Rwy 14 to Whidbey Rwy 32 | E326: 14CW32_FRS | F326: Interfacility | G326: 14_OLF | H326: NMap | I326: Based | J326: No | K326: Interfacility Coupeville to Ault Field | L326: 0 | M326: 0 | N326: =SUM(RC[-2]:RC[-1]) -> -999 | O326: =IF(RC[-1]=0,0,RC[-3]/RC[-1]) -> -999 | P326: =IF(RC[-2]=0,0,RC[-3]/RC[-2]) -> -999 | Q326: =IF(R[+9]C[-3]=0,0,RC[-3]/R[+9]C[-3]) -> -999
A327: EA-18G | B327: F414-GE-400 | C327: 259_FLT | D327: Interfacility OLF Rwy 32 to Whidbey Rwy 07 | E327: 32CW07_FLT | F327: Interfacility | G327: 32_OLF | H327: NMap | I327: Based | J327: No | K327: Interfacility Coupeville to Ault Field | L327: 0 | M327: 0 | N327: =SUM(RC[-2]:RC[-1]) -> -999 | O327: =IF(RC[-1]=0,0,RC[-3]/RC[-1]) -> -999 | P327: =IF(RC[-2]=0,0,RC[-3]/RC[-2]) -> -999 | Q327: =IF(R[+8]C[-3]=0,0,RC[-3]/R[+8]C[-3]) -> -999
A328: EA-18G | B328: F414-GE-400 | C328: 259_FRS | D328: Interfacility OLF Rwy 32 to Whidbey Rwy 07 | E328: 32CW07_FRS | F328: Interfacility | G328: 32_OLF | H328: NMap | I328: Based | J328: No | K328: Interfacility Coupeville to Ault Field | L328: 0.14285714 | M328: 0 | N328: =SUM(RC[-2]:RC[-1]) -> -999 | O328: =IF(RC[-1]=0,0,RC[-3]/RC[-1]) -> -999 | P328: =IF(RC[-2]=0,0,RC[-3]/RC[-2]) -> -999 | Q328: =IF(R[+7]C[-3]=0,0,RC[-3]/R[+7]C[-3]) -> -999
A329: EA-18G | B329: F414-GE-400 | C329: 260_FLT | D329: Interfacility OLF Rwy 32 to Whidbey Rwy 14 | E329: 32CW14_FLT | F329: Interfacility | G329: 32_OLF | H329: NMap | I329: Based | J329: No | K329: Interfacility Coupeville to Ault Field | L329: 0 | M329: 0 | N329: =SUM(RC[-2]:RC[-1]) -> -999 | O329: =IF(RC[-1]=0,0,RC[-3]/RC[-1]) -> -999 | P329: =IF(RC[-2]=0,0,RC[-3]/RC[-2]) -> -999 | Q329: =IF(R[+6]C[-3]=0,0,RC[-3]/R[+6]C[-3]) -> -999
A330: EA-18G | B330: F414-GE-400 | C330: 260_FRS | D330: Interfacility OLF Rwy 32 to Whidbey Rwy 14 | E330: 32CW14_FRS | F330: Interfacility | G330: 32_OLF | H330: NMap | I330: Based | J330: No | K330: Interfacility Coupeville to Ault Field | L330: 0 | M330: 0 | N330: =SUM(RC[-2]:RC[-1]) -> -999 | O330: =IF(RC[-1]=0,0,RC[-3]/RC[-1]) -> -999 | P330: =IF(RC[-2]=0,0,RC[-3]/RC[-2]) -> -999 | Q330: =IF(R[+5]C[-3]=0,0,RC[-3]/R[+5]C[-3]) -> -999
A331: EA-18G | B331: F414-GE-400 | C331: 261_FLT | D331: Interfacility: Coupeville RWY32 to Ault RWY25 -- Original | E331: 32CW25_FLT | F331: Interfacility | G331: 32_OLF | H331: NMap | I331: Based | J331: No | K331: Interfacility Coupeville to Ault Field | L331: 0 | M331: 0 | N331: =SUM(RC[-2]:RC[-1]) -> -999 | O331: =IF(RC[-1]=0,0,RC[-3]/RC[-1]) -> -999 | P331: =IF(RC[-2]=0,0,RC[-3]/RC[-2]) -> -999 | Q331: =IF(R[+4]C[-3]=0,0,RC[-3]/R[+4]C[-3]) -> -999
A332: EA-18G | B332: F414-GE-400 | C332: 261_FRS | D332: Interfacility: Coupeville RWY32 to Ault RWY25 -- Original | E332: 32CW25_FRS | F332: Interfacility | G332: 32_OLF | H332: NMap | I332: Based | J332: No | K332: Interfacility Coupeville to Ault Field | L332: 1.8571429 | M332: 0 | N332: =SUM(RC[-2]:RC[-1]) -> -999 | O332: =IF(RC[-1]=0,0,RC[-3]/RC[-1]) -> -999 | P332: =IF(RC[-2]=0,0,RC[-3]/RC[-2]) -> -999 | Q332: =IF(R[+3]C[-3]=0,0,RC[-3]/R[+3]C[-3]) -> -999
A333: EA-18G | B333: F414-GE-400 | C333: 262_FLT | D333: Interfacility OLF to Whidbey Runway 32 | E333: 32CW32_FLT | F333: Interfacility | G333: 32_OLF | H333: NMap | I333: Based | J333: No | K333: Interfacility Coupeville to Ault Field | L333: 0 | M333: 0 | N333: =SUM(RC[-2]:RC[-1]) -> -999 | O333: =IF(RC[-1]=0,0,RC[-3]/RC[-1]) -> -999 | P333: =IF(RC[-2]=0,0,RC[-3]/RC[-2]) -> -999 | Q333: =IF(R[+2]C[-3]=0,0,RC[-3]/R[+2]C[-3]) -> -999
A334: EA-18G | B334: F414-GE-400 | C334: 262_FRS | D334: Interfacility OLF to Whidbey Runway 32 | E334: 32CW32_FRS | F334: Interfacility | G334: 32_OLF | H334: NMap | I334: Based | J334: No | K334: Interfacility Coupeville to Ault Field | L334: 0 | M334: 0 | N334: =SUM(RC[-2]:RC[-1]) -> -999 | O334: =IF(RC[-1]=0,0,RC[-3]/RC[-1]) -> -999 | P334: =IF(RC[-2]=0,0,RC[-3]/RC[-2]) -> -999 | Q334: =IF(R[+1]C[-3]=0,0,RC[-3]/R[+1]C[-3]) -> -999
K335: Subtotal | L335: =SUM(R[-16]C:R[-1]C) -> -999 | M335: =SUM(R[-16]C:R[-1]C) -> -999 | N335: =SUM(R[-16]C:R[-1]C) -> -999 | O335: =IF(RC[-1]=0,0,RC[-3]/RC[-1]) -> -999 | P335: =IF(RC[-2]=0,0,RC[-3]/RC[-2]) -> -999
A336: Aircraft | B336: Engine | C336: Profile | D336: Long Name | E336: Track | F336: Track Type | G336: Runway | H336: Noise Model | I336: A/C Category | J336: Rep | K336: Track Group | L336: Num Day | M336: Num Night | N336: Num Total | O336: % Day | P336: % Night | Q336: % Total
A337: P-3C | B337: T56-A-14 | C337: 321 | D337: Straight-In Arrival Runway 07 | E337: 07A1A | F337: Arrival | G337: 07 | H337: NMap | I337: Based | J337: No | K337: P3 P8 C9 VFR non breaks | L337: 0 | M337: 0 | N337: =SUM(RC[-2]:RC[-1]) -> -999 | O337: =IF(RC[-1]=0,0,RC[-3]/RC[-1]) -> -999 | P337: =IF(RC[-2]=0,0,RC[-3]/RC[-2]) -> -999 | Q337: =IF(R[+26]C[-3]=0,0,RC[-3]/R[+26]C[-3]) -> -999
A338: P-3C | B338: T56-A-14 | C338: 322 | D338: Straight-In Arrival Runway 07 | E338: 07A4D | F338: Arrival | G338: 07 | H338: NMap | I338: Based | J338: No | K338: P3 P8 C9 VFR non breaks | L338: 0 | M338: 0 | N338: =SUM(RC[-2]:RC[-1]) -> -999 | O338: =IF(RC[-1]=0,0,RC[-3]/RC[-1]) -> -999 | P338: =IF(RC[-2]=0,0,RC[-3]/RC[-2]) -> -999 | Q338: =IF(R[+25]C[-3]=0,0,RC[-3]/R[+25]C[-3]) -> -999
A339: P-3C | B339: T56-A-14 | C339: 323 | D339: Straight-In Arrival Runway 07 | E339: 07A3B | F339: Arrival | G339: 07 | H339: NMap | I339: Based | J339: No | K339: P3 P8 C9 VFR non breaks | L339: 0 | M339: 0 | N339: =SUM(RC[-2]:RC[-1]) -> -999 | O339: =IF(RC[-1]=0,0,RC[-3]/RC[-1]) -> -999 | P339: =IF(RC[-2]=0,0,RC[-3]/RC[-2]) -> -999 | Q339: =IF(R[+24]C[-3]=0,0,RC[-3]/R[+24]C[-3]) -> -999
A340: P-3C | B340: T56-A-14 | C340: 324 | D340: Straight-In Arrival Runway 25 | E340: 25A3D | F340: Arrival | G340: 25 | H340: NMap | I340: Based | J340: No | K340: P3 P8 C9 VFR non breaks | L340: 0 | M340: 0 | N340: =SUM(RC[-2]:RC[-1]) -> -999 | O340: =IF(RC[-1]=0,0,RC[-3]/RC[-1]) -> -999 | P340: =IF(RC[-2]=0,0,RC[-3]/RC[-2]) -> -999 | Q340: =IF(R[+23]C[-3]=0,0,RC[-3]/R[+23]C[-3]) -> -999
A341: P-3C | B341: T56-A-14 | C341: 325 | D341: Rep - Straight-In Arrival Runway 25 | E341: 25A4B | F341: Arrival | G341: 25 | H341: NMap | I341: Based | J341: Yes | K341: P3 P8 C9 VFR non breaks | L341: 0 | M341: 0 | N341: =SUM(RC[-2]:RC[-1]) -> -999 | O341: =IF(RC[-1]=0,0,RC[-3]/RC[-1]) -> -999 | P341: =IF(RC[-2]=0,0,RC[-3]/RC[-2]) -> -999 | Q341: =IF(R[+22]C[-3]=0,0,RC[-3]/R[+22]C[-3]) -> -999
A342: P-3C | B342: T56-A-14 | C342: 326 | D342: Straight-In Arrival Runway 25 | E342: 25A4C | F342: Arrival | G342: 25 | H342: NMap | I342: Based | J342: No | K342: P3 P8 C9 VFR non breaks | L342: 0 | M342: 0 | N342: =SUM(RC[-2]:RC[-1]) -> -999 | O342: =IF(RC[-1]=0,0,RC[-3]/RC[-1]) -> -999 | P342: =IF(RC[-2]=0,0,RC[-3]/RC[-2]) -> -999 | Q342: =IF(R[+21]C[-3]=0,0,RC[-3]/R[+21]C[-3]) -> -999
A343: P-3C | B343: T56-A-14 | C343: 328 | D343: Straight-In Arrival Runway 14 | E343: 14A3D | F343: Arrival | G343: 14 | H343: NMap | I343: Based | J343: No | K343: P3 P8 C9 VFR non breaks | L343: 0 | M343: 0 | N343: =SUM(RC[-2]:RC[-1]) -> -999 | O343: =IF(RC[-1]=0,0,RC[-3]/RC[-1]) -> -999 | P343: =IF(RC[-2]=0,0,RC[-3]/RC[-2]) -> -999 | Q343: =IF(R[+20]C[-3]=0,0,RC[-3]/R[+20]C[-3]) -> -999
A344: P-3C | B344: T56-A-14 | C344: 330 | D344: Straight-In Arrival Runway 14 | E344: 14A4D | F344: Arrival | G344: 14 | H344: NMap | I344: Based | J344: No | K344: P3 P8 C9 VFR non breaks | L344: 0 | M344: 0 | N344: =SUM(RC[-2]:RC[-1]) -> -999 | O344: =IF(RC[-1]=0,0,RC[-3]/RC[-1]) -> -999 | P344: =IF(RC[-2]=0,0,RC[-3]/RC[-2]) -> -999 | Q344: =IF(R[+19]C[-3]=0,0,RC[-3]/R[+19]C[-3]) -> -999
A345: P-3C | B345: T56-A-14 | C345: 332 | D345: Straight-In Arrival Runway 32 | E345: 32A3D | F345: Arrival | G345: 32 | H345: NMap | I345: Based | J345: No | K345: P3 P8 C9 VFR non breaks | L345: 0 | M345: 0 | N345: =SUM(RC[-2]:RC[-1]) -> -999 | O345: =IF(RC[-1]=0,0,RC[-3]/RC[-1]) -> -999 | P345: =IF(RC[-2]=0,0,RC[-3]/RC[-2]) -> -999 | Q345: =IF(R[+18]C[-3]=0,0,RC[-3]/R[+18]C[-3]) -> -999
A346: P-3C | B346: T56-A-14 | C346: 334 | D346: Straight-In Arrival Runway 32 | E346: 32A4D | F346: Arrival | G346: 32 | H346: NMap | I346: Based | J346: No | K346: P3 P8 C9 VFR non breaks | L346: 0.14285714 | M346: 0 | N346: =SUM(RC[-2]:RC[-1]) -> -999 | O346: =IF(RC[-1]=0,0,RC[-3]/RC[-1]) -> -999 | P346: =IF(RC[-2]=0,0,RC[-3]/RC[-2]) -> -999 | Q346: =IF(R[+17]C[-3]=0,0,RC[-3]/R[+17]C[-3]) -> -999
A347: P-3C | B347: T56-A-14 | C347: 336B | D347: Straight-In Arrival Runway 07 | E347: 07A2B | F347: Arrival | G347: 07 | H347: NMap | I347: Based | J347: No | K347: P3 P8 IFR and Growler VFR non breaks | L347: 0 | M347: 0.14285714 | N347: =SUM(RC[-2]:RC[-1]) -> -999 | O347: =IF(RC[-1]=0,0,RC[-3]/RC[-1]) -> -999 | P347: =IF(RC[-2]=0,0,RC[-3]/RC[-2]) -> -999 | Q347: =IF(R[+16]C[-3]=0,0,RC[-3]/R[+16]C[-3]) -> -999
A348: P-3C | B348: T56-A-14 | C348: 336C | D348: Straight-In Arrival Runway 07 | E348: 07A2C | F348: Arrival | G348: 07 | H348: NMap | I348: Based | J348: No | K348: P3 P8 IFR and Growler VFR non breaks | L348: 0 | M348: 0 | N348: =SUM(RC[-2]:RC[-1]) -> -999 | O348: =IF(RC[-1]=0,0,RC[-3]/RC[-1]) -> -999 | P348: =IF(RC[-2]=0,0,RC[-3]/RC[-2]) -> -999 | Q348: =IF(R[+15]C[-3]=0,0,RC[-3]/R[+15]C[-3]) -> -999
A349: P-3C | B349: T56-A-14 | C349: 337B | D349: Rep - Straight-In Arrival Runway 14 | E349: 14A1B | F349: Arrival | G349: 14 | H349: NMap | I349: Based | J349: Yes | K349: P3 P8 IFR and Growler VFR non breaks | L349: 0 | M349: 0 | N349: =SUM(RC[-2]:RC[-1]) -> -999 | O349: =IF(RC[-1]=0,0,RC[-3]/RC[-1]) -> -999 | P349: =IF(RC[-2]=0,0,RC[-3]/RC[-2]) -> -999 | Q349: =IF(R[+14]C[-3]=0,0,RC[-3]/R[+14]C[-3]) -> -999
A350: P-3C | B350: T56-A-14 | C350: 337C | D350: Straight-In Arrival Runway 14 | E350: 14A1C | F350: Arrival | G350: 14 | H350: NMap | I350: Based | J350: No | K350: P3 P8 IFR and Growler VFR non breaks | L350: 0 | M350: 0 | N350: =SUM(RC[-2]:RC[-1]) -> -999 | O350: =IF(RC[-1]=0,0,RC[-3]/RC[-1]) -> -999 | P350: =IF(RC[-2]=0,0,RC[-3]/RC[-2]) -> -999 | Q350: =IF(R[+13]C[-3]=0,0,RC[-3]/R[+13]C[-3]) -> -999
A351: P-3C | B351: T56-A-14 | C351: 338B | D351: Straight-In Arrival Runway 14 | E351: 14A2B | F351: Arrival | G351: 14 | H351: NMap | I351: Based | J351: No | K351: P3 P8 IFR and Growler VFR non breaks | L351: 0 | M351: 0 | N351: =SUM(RC[-2]:RC[-1]) -> -999 | O351: =IF(RC[-1]=0,0,RC[-3]/RC[-1]) -> -999 | P351: =IF(RC[-2]=0,0,RC[-3]/RC[-2]) -> -999 | Q351: =IF(R[+12]C[-3]=0,0,RC[-3]/R[+12]C[-3]) -> -999
A352: P-3C | B352: T56-A-14 | C352: 338C | D352: Straight-In Arrival Runway 14 | E352: 14A2C | F352: Arrival | G352: 14 | H352: NMap | I352: Based | J352: No | K352: P3 P8 IFR and Growler VFR non breaks | L352: 0 | M352: 0 | N352: =SUM(RC[-2]:RC[-1]) -> -999 | O352: =IF(RC[-1]=0,0,RC[-3]/RC[-1]) -> -999 | P352: =IF(RC[-2]=0,0,RC[-3]/RC[-2]) -> -999 | Q352: =IF(R[+11]C[-3]=0,0,RC[-3]/R[+11]C[-3]) -> -999
A353: P-3C | B353: T56-A-14 | C353: 339D | D353: Straight-In Arrival Runway 25 from East | E353: 25A1D | F353: Arrival | G353: 25 | H353: NMap | I353: Based | J353: No | K353: P3 P8 IFR and Growler VFR non breaks | L353: 0.42857143 | M353: 0 | N353: =SUM(RC[-2]:RC[-1]) -> -999 | O353: =IF(RC[-1]=0,0,RC[-3]/RC[-1]) -> -999 | P353: =IF(RC[-2]=0,0,RC[-3]/RC[-2]) -> -999 | Q353: =IF(R[+10]C[-3]=0,0,RC[-3]/R[+10]C[-3]) -> -999
A354: P-3C | B354: T56-A-14 | C354: 340B | D354: Rep - Straight-In Arrival Runway 25 | E354: 25A2B | F354: Arrival | G354: 25 | H354: NMap | I354: Based | J354: Yes | K354: P3 P8 IFR and Growler VFR non breaks | L354: 0.57142857 | M354: 0 | N354: =SUM(RC[-2]:RC[-1]) -> -999 | O354: =IF(RC[-1]=0,0,RC[-3]/RC[-1]) -> -999 | P354: =IF(RC[-2]=0,0,RC[-3]/RC[-2]) -> -999 | Q354: =IF(R[+9]C[-3]=0,0,RC[-3]/R[+9]C[-3]) -> -999
A355: P-3C | B355: T56-A-14 | C355: 340C | D355: Straight-In Arrival Runway 25 | E355: 25A2C | F355: Arrival | G355: 25 | H355: NMap | I355: Based | J355: No | K355: P3 P8 IFR and Growler VFR non breaks | L355: 0.28571429 | M355: 0 | N355: =SUM(RC[-2]:RC[-1]) -> -999 | O355: =IF(RC[-1]=0,0,RC[-3]/RC[-1]) -> -999 | P355: =IF(RC[-2]=0,0,RC[-3]/RC[-2]) -> -999 | Q355: =IF(R[+8]C[-3]=0,0,RC[-3]/R[+8]C[-3]) -> -999
A356: P-3C | B356: T56-A-14 | C356: 341C | D356: Straight-In Arrival Runway 32 | E356: 32A1C | F356: Arrival | G356: 32 | H356: NMap | I356: Based | J356: No | K356: P3 P8 IFR and Growler VFR non breaks | L356: 0 | M356: 0 | N356: =SUM(RC[-2]:RC[-1]) -> -999 | O356: =IF(RC[-1]=0,0,RC[-3]/RC[-1]) -> -999 | P356: =IF(RC[-2]=0,0,RC[-3]/RC[-2]) -> -999 | Q356: =IF(R[+7]C[-3]=0,0,RC[-3]/R[+7]C[-3]) -> -999
A357: P-3C | B357: T56-A-14 | C357: 342B | D357: Straight-In Arrival Runway 32 | E357: 32A2B | F357: Arrival | G357: 32 | H357: NMap | I357: Based | J357: No | K357: P3 P8 IFR and Growler VFR non breaks | L357: 0 | M357: 0 | N357: =SUM(RC[-2]:RC[-1]) -> -999 | O357: =IF(RC[-1]=0,0,RC[-3]/RC[-1]) -> -999 | P357: =IF(RC[-2]=0,0,RC[-3]/RC[-2]) -> -999 | Q357: =IF(R[+6]C[-3]=0,0,RC[-3]/R[+6]C[-3]) -> -999
A358: P-3C | B358: T56-A-14 | C358: 342C | D358: Straight-In Arrival Runway 32 | E358: 32A2C | F358: Arrival | G358: 32 | H358: NMap | I358: Based | J358: No | K358: P3 P8 IFR and Growler VFR non breaks | L358: 0 | M358: 0 | N358: =SUM(RC[-2]:RC[-1]) -> -999 | O358: =IF(RC[-1]=0,0,RC[-3]/RC[-1]) -> -999 | P358: =IF(RC[-2]=0,0,RC[-3]/RC[-2]) -> -999 | Q358: =IF(R[+5]C[-3]=0,0,RC[-3]/R[+5]C[-3]) -> -999
A359: P-3C | B359: T56-A-14 | C359: 343 | D359: Low TACAN Arrival Runway 07 | E359: 07ALT | F359: Arrival | G359: 07 | H359: NMap | I359: Based | J359: No | K359: HI TACAN Arrival | L359: 0 | M359: 0 | N359: =SUM(RC[-2]:RC[-1]) -> -999 | O359: =IF(RC[-1]=0,0,RC[-3]/RC[-1]) -> -999 | P359: =IF(RC[-2]=0,0,RC[-3]/RC[-2]) -> -999 | Q359: =IF(R[+4]C[-3]=0,0,RC[-3]/R[+4]C[-3]) -> -999
A360: P-3C | B360: T56-A-14 | C360: 344 | D360: Rep - Low TACAN Arrival Runway 14 | E360: 14ALT | F360: Arrival | G360: 14 | H360: NMap | I360: Based | J360: Yes | K360: HI TACAN Arrival | L360: 0 | M360: 0 | N360: =SUM(RC[-2]:RC[-1]) -> -999 | O360: =IF(RC[-1]=0,0,RC[-3]/RC[-1]) -> -999 | P360: =IF(RC[-2]=0,0,RC[-3]/RC[-2]) -> -999 | Q360: =IF(R[+3]C[-3]=0,0,RC[-3]/R[+3]C[-3]) -> -999
A361: P-3C | B361: T56-A-14 | C361: 345 | D361: Low TACAN Arrival Runway 25 | E361: 25ALT | F361: Arrival | G361: 25 | H361: NMap | I361: Based | J361: No | K361: HI TACAN Arrival | L361: 0 | M361: 0 | N361: =SUM(RC[-2]:RC[-1]) -> -999 | O361: =IF(RC[-1]=0,0,RC[-3]/RC[-1]) -> -999 | P361: =IF(RC[-2]=0,0,RC[-3]/RC[-2]) -> -999 | Q361: =IF(R[+2]C[-3]=0,0,RC[-3]/R[+2]C[-3]) -> -999
A362: P-3C | B362: T56-A-14 | C362: 346 | D362: Low TACAN Arrival Runway 32 | E362: 32ALT | F362: Arrival | G362: 32 | H362: NMap | I362: Based | J362: No | K362: HI TACAN Arrival | L362: 0 | M362: 0 | N362: =SUM(RC[-2]:RC[-1]) -> -999 | O362: =IF(RC[-1]=0,0,RC[-3]/RC[-1]) -> -999 | P362: =IF(RC[-2]=0,0,RC[-3]/RC[-2]) -> -999 | Q362: =IF(R[+1]C[-3]=0,0,RC[-3]/R[+1]C[-3]) -> -999
K363: Subtotal | L363: =SUM(R[-26]C:R[-1]C) -> -999 | M363: =SUM(R[-26]C:R[-1]C) -> -999 | N363: =SUM(R[-26]C:R[-1]C) -> -999 | O363: =IF(RC[-1]=0,0,RC[-3]/RC[-1]) -> -999 | P363: =IF(RC[-2]=0,0,RC[-3]/RC[-2]) -> -999
A365: P-3C | B365: T56-A-14 | C365: 301 | D365: Departure Runway 07 - East Center | E365: 07D1B | F365: Departure | G365: 07 | H365: NMap | I365: Based | J365: No | K365: Departure | L365: 0 | M365: 0 | N365: =SUM(RC[-2]:RC[-1]) -> -999 | O365: =IF(RC[-1]=0,0,RC[-3]/RC[-1]) -> -999 | P365: =IF(RC[-2]=0,0,RC[-3]/RC[-2]) -> -999 | Q365: =IF(R[+16]C[-3]=0,0,RC[-3]/R[+16]C[-3]) -> -999
A366: P-3C | B366: T56-A-14 | C366: 302 | D366: Departure Runway 07 - East Long | E366: 07D1C | F366: Departure | G366: 07 | H366: NMap | I366: Based | J366: No | K366: Departure | L366: 0 | M366: 0 | N366: =SUM(RC[-2]:RC[-1]) -> -999 | O366: =IF(RC[-1]=0,0,RC[-3]/RC[-1]) -> -999 | P366: =IF(RC[-2]=0,0,RC[-3]/RC[-2]) -> -999 | Q366: =IF(R[+15]C[-3]=0,0,RC[-3]/R[+15]C[-3]) -> -999
A367: P-3C | B367: T56-A-14 | C367: 303 | D367: Departure Runway 07 - South Center | E367: 07D2B | F367: Departure | G367: 07 | H367: NMap | I367: Based | J367: No | K367: Departure | L367: 0.42857143 | M367: 0 | N367: =SUM(RC[-2]:RC[-1]) -> -999 | O367: =IF(RC[-1]=0,0,RC[-3]/RC[-1]) -> -999 | P367: =IF(RC[-2]=0,0,RC[-3]/RC[-2]) -> -999 | Q367: =IF(R[+14]C[-3]=0,0,RC[-3]/R[+14]C[-3]) -> -999
A368: P-3C | B368: T56-A-14 | C368: 304 | D368: Departure Runway 07 - South Long | E368: 07D2C | F368: Departure | G368: 07 | H368: NMap | I368: Based | J368: No | K368: Departure | L368: 0 | M368: 0 | N368: =SUM(RC[-2]:RC[-1]) -> -999 | O368: =IF(RC[-1]=0,0,RC[-3]/RC[-1]) -> -999 | P368: =IF(RC[-2]=0,0,RC[-3]/RC[-2]) -> -999 | Q368: =IF(R[+13]C[-3]=0,0,RC[-3]/R[+13]C[-3]) -> -999
A369: P-3C | B369: T56-A-14 | C369: 305 | D369: Departure Runway 13 - East Center | E369: 14D1B | F369: Departure | G369: 14 | H369: NMap | I369: Based | J369: No | K369: Departure | L369: 0 | M369: 0 | N369: =SUM(RC[-2]:RC[-1]) -> -999 | O369: =IF(RC[-1]=0,0,RC[-3]/RC[-1]) -> -999 | P369: =IF(RC[-2]=0,0,RC[-3]/RC[-2]) -> -999 | Q369: =IF(R[+12]C[-3]=0,0,RC[-3]/R[+12]C[-3]) -> -999
A370: P-3C | B370: T56-A-14 | C370: 306 | D370: Departure Runway 13 - East Long | E370: 14D1C | F370: Departure | G370: 14 | H370: NMap | I370: Based | J370: No | K370: Departure | L370: 0 | M370: 0 | N370: =SUM(RC[-2]:RC[-1]) -> -999 | O370: =IF(RC[-1]=0,0,RC[-3]/RC[-1]) -> -999 | P370: =IF(RC[-2]=0,0,RC[-3]/RC[-2]) -> -999 | Q370: =IF(R[+11]C[-3]=0,0,RC[-3]/R[+11]C[-3]) -> -999
A371: P-3C | B371: T56-A-14 | C371: 307 | D371: Departure Runway 13 - South Center | E371: 14D2B | F371: Departure | G371: 14 | H371: NMap | I371: Based | J371: No | K371: Departure | L371: 0 | M371: 0 | N371: =SUM(RC[-2]:RC[-1]) -> -999 | O371: =IF(RC[-1]=0,0,RC[-3]/RC[-1]) -> -999 | P371: =IF(RC[-2]=0,0,RC[-3]/RC[-2]) -> -999 | Q371: =IF(R[+10]C[-3]=0,0,RC[-3]/R[+10]C[-3]) -> -999
A372: P-3C | B372: T56-A-14 | C372: 308 | D372: Departure Runway 13 - South Long | E372: 14D2C | F372: Departure | G372: 14 | H372: NMap | I372: Based | J372: No | K372: Departure | L372: 0 | M372: 0 | N372: =SUM(RC[-2]:RC[-1]) -> -999 | O372: =IF(RC[-1]=0,0,RC[-3]/RC[-1]) -> -999 | P372: =IF(RC[-2]=0,0,RC[-3]/RC[-2]) -> -999 | Q372: =IF(R[+9]C[-3]=0,0,RC[-3]/R[+9]C[-3]) -> -999
A373: P-3C | B373: T56-A-14 | C373: 309 | D373: Departure Runway 25 - East Center | E373: 25D1B | F373: Departure | G373: 25 | H373: NMap | I373: Based | J373: No | K373: Departure | L373: 0.42857143 | M373: 0 | N373: =SUM(RC[-2]:RC[-1]) -> -999 | O373: =IF(RC[-1]=0,0,RC[-3]/RC[-1]) -> -999 | P373: =IF(RC[-2]=0,0,RC[-3]/RC[-2]) -> -999 | Q373: =IF(R[+8]C[-3]=0,0,RC[-3]/R[+8]C[-3]) -> -999
A374: P-3C | B374: T56-A-14 | C374: 310 | D374: Departure Runway 25 - East Long | E374: 25D1C | F374: Departure | G374: 25 | H374: NMap | I374: Based | J374: No | K374: Departure | L374: 0 | M374: 0 | N374: =SUM(RC[-2]:RC[-1]) -> -999 | O374: =IF(RC[-1]=0,0,RC[-3]/RC[-1]) -> -999 | P374: =IF(RC[-2]=0,0,RC[-3]/RC[-2]) -> -999 | Q374: =IF(R[+7]C[-3]=0,0,RC[-3]/R[+7]C[-3]) -> -999
A375: P-3C | B375: T56-A-14 | C375: 311 | D375: Rep - Departure Runway 25 - South Center | E375: 25D2B | F375: Departure | G375: 25 | H375: NMap | I375: Based | J375: Yes | K375: Departure | L375: 0.71428571 | M375: 0 | N375: =SUM(RC[-2]:RC[-1]) -> -999 | O375: =IF(RC[-1]=0,0,RC[-3]/RC[-1]) -> -999 | P375: =IF(RC[-2]=0,0,RC[-3]/RC[-2]) -> -999 | Q375: =IF(R[+6]C[-3]=0,0,RC[-3]/R[+6]C[-3]) -> -999
A376: P-3C | B376: T56-A-14 | C376: 312 | D376: Departure Runway 25 - South Long | E376: 25D2C | F376: Departure | G376: 25 | H376: NMap | I376: Based | J376: No | K376: Departure | L376: 0 | M376: 0 | N376: =SUM(RC[-2]:RC[-1]) -> -999 | O376: =IF(RC[-1]=0,0,RC[-3]/RC[-1]) -> -999 | P376: =IF(RC[-2]=0,0,RC[-3]/RC[-2]) -> -999 | Q376: =IF(R[+5]C[-3]=0,0,RC[-3]/R[+5]C[-3]) -> -999
A377: P-3C | B377: T56-A-14 | C377: 313 | D377: Departure Runway 31 - East Center | E377: 32D1B | F377: Departure | G377: 32 | H377: NMap | I377: Based | J377: No | K377: Departure | L377: 0.14285714 | M377: 0 | N377: =SUM(RC[-2]:RC[-1]) -> -999 | O377: =IF(RC[-1]=0,0,RC[-3]/RC[-1]) -> -999 | P377: =IF(RC[-2]=0,0,RC[-3]/RC[-2]) -> -999 | Q377: =IF(R[+4]C[-3]=0,0,RC[-3]/R[+4]C[-3]) -> -999
A378: P-3C | B378: T56-A-14 | C378: 314 | D378: Departure Runway 31 - East Long | E378: 32D1C | F378: Departure | G378: 32 | H378: NMap | I378: Based | J378: No | K378: Departure | L378: 0 | M378: 0 | N378: =SUM(RC[-2]:RC[-1]) -> -999 | O378: =IF(RC[-1]=0,0,RC[-3]/RC[-1]) -> -999 | P378: =IF(RC[-2]=0,0,RC[-3]/RC[-2]) -> -999 | Q378: =IF(R[+3]C[-3]=0,0,RC[-3]/R[+3]C[-3]) -> -999
A379: P-3C | B379: T56-A-14 | C379: 315 | D379: Departure Runway 31 - South Center | E379: 32D2B | F379: Departure | G379: 32 | H379: NMap | I379: Based | J379: No | K379: Departure | L379: 0 | M379: 0 | N379: =SUM(RC[-2]:RC[-1]) -> -999 | O379: =IF(RC[-1]=0,0,RC[-3]/RC[-1]) -> -999 | P379: =IF(RC[-2]=0,0,RC[-3]/RC[-2]) -> -999 | Q379: =IF(R[+2]C[-3]=0,0,RC[-3]/R[+2]C[-3]) -> -999
A380: P-3C | B380: T56-A-14 | C380: 316 | D380: Departure Runway 31 - South Long | E380: 32D2C | F380: Departure | G380: 32 | H380: NMap | I380: Based | J380: No | K380: Departure | L380: 0 | M380: 0 | N380: =SUM(RC[-2]:RC[-1]) -> -999 | O380: =IF(RC[-1]=0,0,RC[-3]/RC[-1]) -> -999 | P380: =IF(RC[-2]=0,0,RC[-3]/RC[-2]) -> -999 | Q380: =IF(R[+1]C[-3]=0,0,RC[-3]/R[+1]C[-3]) -> -999
K381: Subtotal | L381: =SUM(R[-16]C:R[-1]C) -> -999 | M381: =SUM(R[-16]C:R[-1]C) -> -999 | N381: =SUM(R[-16]C:R[-1]C) -> -999 | O381: =IF(RC[-1]=0,0,RC[-3]/RC[-1]) -> -999 | P381: =IF(RC[-2]=0,0,RC[-3]/RC[-2]) -> -999
A383: P-3C | B383: T56-A-14 | C383: 347B | D383: GCA Box Pattern Whidbey Runway 07 - Center | E383: 07G1B | F383: Closed Pattern | G383: 07 | H383: NMap | I383: Based | J383: No | K383: GCA Pattern | L383: 0 | M383: 0 | N383: =SUM(RC[-2]:RC[-1]) -> -999 | O383: =IF(RC[-1]=0,0,RC[-3]/RC[-1]) -> -999 | P383: =IF(RC[-2]=0,0,RC[-3]/RC[-2]) -> -999 | Q383: =IF(R[+12]C[-3]=0,0,RC[-3]/R[+12]C[-3]) -> -999
A384: P-3C | B384: T56-A-14 | C384: 347C | D384: GCA Box Pattern Whidbey Runway 07 - Long | E384: 07G1C | F384: Closed Pattern | G384: 07 | H384: NMap | I384: Based | J384: No | K384: GCA Pattern | L384: 0 | M384: 0 | N384: =SUM(RC[-2]:RC[-1]) -> -999 | O384: =IF(RC[-1]=0,0,RC[-3]/RC[-1]) -> -999 | P384: =IF(RC[-2]=0,0,RC[-3]/RC[-2]) -> -999 | Q384: =IF(R[+11]C[-3]=0,0,RC[-3]/R[+11]C[-3]) -> -999
A385: P-3C | B385: T56-A-14 | C385: 348B | D385: GCA Box Pattern Whidbey Runway 14 - Center | E385: 14G1B | F385: Closed Pattern | G385: 14 | H385: NMap | I385: Based | J385: No | K385: GCA Pattern | L385: 0 | M385: 0 | N385: =SUM(RC[-2]:RC[-1]) -> -999 | O385: =IF(RC[-1]=0,0,RC[-3]/RC[-1]) -> -999 | P385: =IF(RC[-2]=0,0,RC[-3]/RC[-2]) -> -999 | Q385: =IF(R[+10]C[-3]=0,0,RC[-3]/R[+10]C[-3]) -> -999
A386: P-3C | B386: T56-A-14 | C386: 348C | D386: GCA Box Pattern Whidbey Runway 14 - Long | E386: 14G1C | F386: Closed Pattern | G386: 14 | H386: NMap | I386: Based | J386: No | K386: GCA Pattern | L386: 0 | M386: 0 | N386: =SUM(RC[-2]:RC[-1]) -> -999 | O386: =IF(RC[-1]=0,0,RC[-3]/RC[-1]) -> -999 | P386: =IF(RC[-2]=0,0,RC[-3]/RC[-2]) -> -999 | Q386: =IF(R[+9]C[-3]=0,0,RC[-3]/R[+9]C[-3]) -> -999
A387: P-3C | B387: T56-A-14 | C387: 349B | D387: Rep - GCA Box Pattern Whidbey Runway 25 - Center | E387: 25G1B | F387: Closed Pattern | G387: 25 | H387: NMap | I387: Based | J387: Yes | K387: GCA Pattern | L387: 0.71428571 | M387: 0 | N387: =SUM(RC[-2]:RC[-1]) -> -999 | O387: =IF(RC[-1]=0,0,RC[-3]/RC[-1]) -> -999 | P387: =IF(RC[-2]=0,0,RC[-3]/RC[-2]) -> -999 | Q387: =IF(R[+8]C[-3]=0,0,RC[-3]/R[+8]C[-3]) -> -999
A388: P-3C | B388: T56-A-14 | C388: 349C | D388: GCA Box Pattern Whidbey Runway 25 - Long | E388: 25G1C | F388: Closed Pattern | G388: 25 | H388: NMap | I388: Based | J388: No | K388: GCA Pattern | L388: 0 | M388: 0 | N388: =SUM(RC[-2]:RC[-1]) -> -999 | O388: =IF(RC[-1]=0,0,RC[-3]/RC[-1]) -> -999 | P388: =IF(RC[-2]=0,0,RC[-3]/RC[-2]) -> -999 | Q388: =IF(R[+7]C[-3]=0,0,RC[-3]/R[+7]C[-3]) -> -999
A389: P-3C | B389: T56-A-14 | C389: 350B | D389: GCA Box Pattern Whidbey Runway 32 - Center | E389: 32G1B | F389: Closed Pattern | G389: 32 | H389: NMap | I389: Based | J389: No | K389: GCA Pattern | L389: 0 | M389: 0 | N389: =SUM(RC[-2]:RC[-1]) -> -999 | O389: =IF(RC[-1]=0,0,RC[-3]/RC[-1]) -> -999 | P389: =IF(RC[-2]=0,0,RC[-3]/RC[-2]) -> -999 | Q389: =IF(R[+6]C[-3]=0,0,RC[-3]/R[+6]C[-3]) -> -999
A390: P-3C | B390: T56-A-14 | C390: 350C | D390: GCA Box Pattern Whidbey Runway 32 - Long | E390: 32G1C | F390: Closed Pattern | G390: 32 | H390: NMap | I390: Based | J390: No | K390: GCA Pattern | L390: 0 | M390: 0 | N390: =SUM(RC[-2]:RC[-1]) -> -999 | O390: =IF(RC[-1]=0,0,RC[-3]/RC[-1]) -> -999 | P390: =IF(RC[-2]=0,0,RC[-3]/RC[-2]) -> -999 | Q390: =IF(R[+5]C[-3]=0,0,RC[-3]/R[+5]C[-3]) -> -999
A391: P-3C | B391: T56-A-14 | C391: 351B | D391: Touch and Go Whidbey Runway 32 - Daytime Wide | E391: 07TU1C | F391: Closed Pattern | G391: 07 | H391: NMap | I391: Based | J391: No | K391: Touch and Go at Ault Field | L391: 0 | M391: 0 | N391: =SUM(RC[-2]:RC[-1]) -> -999 | O391: =IF(RC[-1]=0,0,RC[-3]/RC[-1]) -> -999 | P391: =IF(RC[-2]=0,0,RC[-3]/RC[-2]) -> -999 | Q391: =IF(R[+4]C[-3]=0,0,RC[-3]/R[+4]C[-3]) -> -999
A392: P-3C | B392: T56-A-14 | C392: 352B | D392: Touch and Go Whidbey Runway 32 - Daytime Wide | E392: 14TU1C | F392: Closed Pattern | G392: 14 | H392: NMap | I392: Based | J392: Yes | K392: Touch and Go at Ault Field | L392: 0 | M392: 0 | N392: =SUM(RC[-2]:RC[-1]) -> -999 | O392: =IF(RC[-1]=0,0,RC[-3]/RC[-1]) -> -999 | P392: =IF(RC[-2]=0,0,RC[-3]/RC[-2]) -> -999 | Q392: =IF(R[+3]C[-3]=0,0,RC[-3]/R[+3]C[-3]) -> -999
A393: P-3C | B393: T56-A-14 | C393: 353B | D393: Touch and Go Whidbey Runway 32 - Daytime Wide | E393: 25TU1C | F393: Closed Pattern | G393: 25 | H393: NMap | I393: Based | J393: No | K393: Touch and Go at Ault Field | L393: 3.7142857 | M393: 0 | N393: =SUM(RC[-2]:RC[-1]) -> -999 | O393: =IF(RC[-1]=0,0,RC[-3]/RC[-1]) -> -999 | P393: =IF(RC[-2]=0,0,RC[-3]/RC[-2]) -> -999 | Q393: =IF(R[+2]C[-3]=0,0,RC[-3]/R[+2]C[-3]) -> -999
A394: P-3C | B394: T56-A-14 | C394: 354B | D394: Touch and Go Whidbey Runway 32 - Daytime Wide | E394: 32TU1C | F394: Closed Pattern | G394: 32 | H394: NMap | I394: Based | J394: No | K394: Touch and Go at Ault Field | L394: 0 | M394: 0 | N394: =SUM(RC[-2]:RC[-1]) -> -999 | O394: =IF(RC[-1]=0,0,RC[-3]/RC[-1]) -> -999 | P394: =IF(RC[-2]=0,0,RC[-3]/RC[-2]) -> -999 | Q394: =IF(R[+1]C[-3]=0,0,RC[-3]/R[+1]C[-3]) -> -999
K395: Subtotal | L395: =SUM(R[-12]C:R[-1]C) -> -999 | M395: =SUM(R[-12]C:R[-1]C) -> -999 | N395: =SUM(R[-12]C:R[-1]C) -> -999 | O395: =IF(RC[-1]=0,0,RC[-3]/RC[-1]) -> -999 | P395: =IF(RC[-2]=0,0,RC[-3]/RC[-2]) -> -999
A396: Aircraft | B396: Engine | C396: Profile | D396: Long Name | E396: Track | F396: Track Type | G396: Runway | H396: Noise Model | I396: A/C Category | J396: Rep | K396: Track Group | L396: Num Day | M396: Num Night | N396: Num Total | O396: % Day | P396: % Night | Q396: % Total
A397: P-8 | B397: CFM56-7B-24 | C397: 521 | D397: Arrival | E397: 07A1A | F397: Arrival | G397: 07 | H397: NMap | I397: Based | J397: No | K397: P3 P8 C9 VFR non breaks | L397: 0 | M397: 0 | N397: =SUM(RC[-2]:RC[-1]) -> -999 | O397: =IF(RC[-1]=0,0,RC[-3]/RC[-1]) -> -999 | P397: =IF(RC[-2]=0,0,RC[-3]/RC[-2]) -> -999 | Q397: =IF(R[+26]C[-3]=0,0,RC[-3]/R[+26]C[-3]) -> -999
A398: P-8 | B398: CFM56-7B-24 | C398: 522 | D398: Arrival | E398: 07A3B | F398: Arrival | G398: 07 | H398: NMap | I398: Based | J398: No | K398: P3 P8 C9 VFR non breaks | L398: 0 | M398: 0 | N398: =SUM(RC[-2]:RC[-1]) -> -999 | O398: =IF(RC[-1]=0,0,RC[-3]/RC[-1]) -> -999 | P398: =IF(RC[-2]=0,0,RC[-3]/RC[-2]) -> -999 | Q398: =IF(R[+25]C[-3]=0,0,RC[-3]/R[+25]C[-3]) -> -999
A399: P-8 | B399: CFM56-7B-24 | C399: 523 | D399: Arrival | E399: 07A4D | F399: Arrival | G399: 07 | H399: NMap | I399: Based | J399: No | K399: P3 P8 C9 VFR non breaks | L399: 0 | M399: 0 | N399: =SUM(RC[-2]:RC[-1]) -> -999 | O399: =IF(RC[-1]=0,0,RC[-3]/RC[-1]) -> -999 | P399: =IF(RC[-2]=0,0,RC[-3]/RC[-2]) -> -999 | Q399: =IF(R[+24]C[-3]=0,0,RC[-3]/R[+24]C[-3]) -> -999
A400: P-8 | B400: CFM56-7B-24 | C400: 525 | D400: Arrival | E400: 14A3D | F400: Arrival | G400: 14 | H400: NMap | I400: Based | J400: No | K400: P3 P8 C9 VFR non breaks | L400: 0 | M400: 0 | N400: =SUM(RC[-2]:RC[-1]) -> -999 | O400: =IF(RC[-1]=0,0,RC[-3]/RC[-1]) -> -999 | P400: =IF(RC[-2]=0,0,RC[-3]/RC[-2]) -> -999 | Q400: =IF(R[+23]C[-3]=0,0,RC[-3]/R[+23]C[-3]) -> -999
A401: P-8 | B401: CFM56-7B-24 | C401: 527 | D401: Arrival | E401: 14A4D | F401: Arrival | G401: 14 | H401: NMap | I401: Based | J401: No | K401: P3 P8 C9 VFR non breaks | L401: 0.14285714 | M401: 0 | N401: =SUM(RC[-2]:RC[-1]) -> -999 | O401: =IF(RC[-1]=0,0,RC[-3]/RC[-1]) -> -999 | P401: =IF(RC[-2]=0,0,RC[-3]/RC[-2]) -> -999 | Q401: =IF(R[+22]C[-3]=0,0,RC[-3]/R[+22]C[-3]) -> -999
A402: P-8 | B402: CFM56-7B-24 | C402: 528 | D402: Arrival | E402: 25A3D | F402: Arrival | G402: 25 | H402: NMap | I402: Based | J402: No | K402: P3 P8 C9 VFR non breaks | L402: 0 | M402: 0 | N402: =SUM(RC[-2]:RC[-1]) -> -999 | O402: =IF(RC[-1]=0,0,RC[-3]/RC[-1]) -> -999 | P402: =IF(RC[-2]=0,0,RC[-3]/RC[-2]) -> -999 | Q402: =IF(R[+21]C[-3]=0,0,RC[-3]/R[+21]C[-3]) -> -999
A403: P-8 | B403: CFM56-7B-24 | C403: 529 | D403: Rep - Arrival | E403: 25A4B | F403: Arrival | G403: 25 | H403: NMap | I403: Based | J403: Yes | K403: P3 P8 C9 VFR non breaks | L403: 0.28571429 | M403: 0 | N403: =SUM(RC[-2]:RC[-1]) -> -999 | O403: =IF(RC[-1]=0,0,RC[-3]/RC[-1]) -> -999 | P403: =IF(RC[-2]=0,0,RC[-3]/RC[-2]) -> -999 | Q403: =IF(R[+20]C[-3]=0,0,RC[-3]/R[+20]C[-3]) -> -999
A404: P-8 | B404: CFM56-7B-24 | C404: 530 | D404: Arrival | E404: 25A4C | F404: Arrival | G404: 25 | H404: NMap | I404: Based | J404: No | K404: P3 P8 C9 VFR non breaks | L404: 0 | M404: 0 | N404: =SUM(RC[-2]:RC[-1]) -> -999 | O404: =IF(RC[-1]=0,0,RC[-3]/RC[-1]) -> -999 | P404: =IF(RC[-2]=0,0,RC[-3]/RC[-2]) -> -999 | Q404: =IF(R[+19]C[-3]=0,0,RC[-3]/R[+19]C[-3]) -> -999
A405: P-8 | B405: CFM56-7B-24 | C405: 532 | D405: Arrival | E405: 32A3D | F405: Arrival | G405: 32 | H405: NMap | I405: Based | J405: No | K405: P3 P8 C9 VFR non breaks | L405: 0.14285714 | M405: 0 | N405: =SUM(RC[-2]:RC[-1]) -> -999 | O405: =IF(RC[-1]=0,0,RC[-3]/RC[-1]) -> -999 | P405: =IF(RC[-2]=0,0,RC[-3]/RC[-2]) -> -999 | Q405: =IF(R[+18]C[-3]=0,0,RC[-3]/R[+18]C[-3]) -> -999
A406: P-8 | B406: CFM56-7B-24 | C406: 534 | D406: Arrival | E406: 32A4D | F406: Arrival | G406: 32 | H406: NMap | I406: Based | J406: No | K406: P3 P8 C9 VFR non breaks | L406: 0 | M406: 0 | N406: =SUM(RC[-2]:RC[-1]) -> -999 | O406: =IF(RC[-1]=0,0,RC[-3]/RC[-1]) -> -999 | P406: =IF(RC[-2]=0,0,RC[-3]/RC[-2]) -> -999 | Q406: =IF(R[+17]C[-3]=0,0,RC[-3]/R[+17]C[-3]) -> -999
A407: P-8 | B407: CFM56-7B-24 | C407: 536B_mod | D407: Arrival | E407: 07A2B | F407: Arrival | G407: 07 | H407: NMap | I407: Based | J407: No | K407: P3 P8 IFR and Growler VFR non breaks | L407: 0 | M407: 0 | N407: =SUM(RC[-2]:RC[-1]) -> -999 | O407: =IF(RC[-1]=0,0,RC[-3]/RC[-1]) -> -999 | P407: =IF(RC[-2]=0,0,RC[-3]/RC[-2]) -> -999 | Q407: =IF(R[+16]C[-3]=0,0,RC[-3]/R[+16]C[-3]) -> -999
A408: P-8 | B408: CFM56-7B-24 | C408: 536C_mod | D408: Arrival | E408: 07A2C | F408: Arrival | G408: 07 | H408: NMap | I408: Based | J408: No | K408: P3 P8 IFR and Growler VFR non breaks | L408: 0 | M408: 0 | N408: =SUM(RC[-2]:RC[-1]) -> -999 | O408: =IF(RC[-1]=0,0,RC[-3]/RC[-1]) -> -999 | P408: =IF(RC[-2]=0,0,RC[-3]/RC[-2]) -> -999 | Q408: =IF(R[+15]C[-3]=0,0,RC[-3]/R[+15]C[-3]) -> -999
A409: P-8 | B409: CFM56-7B-24 | C409: 537B_mod | D409: Rep - Arrival | E409: 14A1B | F409: Arrival | G409: 14 | H409: NMap | I409: Based | J409: Yes | K409: P3 P8 IFR and Growler VFR non breaks | L409: 0 | M409: 0 | N409: =SUM(RC[-2]:RC[-1]) -> -999 | O409: =IF(RC[-1]=0,0,RC[-3]/RC[-1]) -> -999 | P409: =IF(RC[-2]=0,0,RC[-3]/RC[-2]) -> -999 | Q409: =IF(R[+14]C[-3]=0,0,RC[-3]/R[+14]C[-3]) -> -999
A410: P-8 | B410: CFM56-7B-24 | C410: 537C_mod | D410: Arrival | E410: 14A1C | F410: Arrival | G410: 14 | H410: NMap | I410: Based | J410: No | K410: P3 P8 IFR and Growler VFR non breaks | L410: 0 | M410: 0 | N410: =SUM(RC[-2]:RC[-1]) -> -999 | O410: =IF(RC[-1]=0,0,RC[-3]/RC[-1]) -> -999 | P410: =IF(RC[-2]=0,0,RC[-3]/RC[-2]) -> -999 | Q410: =IF(R[+13]C[-3]=0,0,RC[-3]/R[+13]C[-3]) -> -999
A411: P-8 | B411: CFM56-7B-24 | C411: 538B_mod | D411: Arrival | E411: 14A2B | F411: Arrival | G411: 14 | H411: NMap | I411: Based | J411: No | K411: P3 P8 IFR and Growler VFR non breaks | L411: 0 | M411: 0 | N411: =SUM(RC[-2]:RC[-1]) -> -999 | O411: =IF(RC[-1]=0,0,RC[-3]/RC[-1]) -> -999 | P411: =IF(RC[-2]=0,0,RC[-3]/RC[-2]) -> -999 | Q411: =IF(R[+12]C[-3]=0,0,RC[-3]/R[+12]C[-3]) -> -999
A412: P-8 | B412: CFM56-7B-24 | C412: 538C_mod | D412: Arrival | E412: 14A2C | F412: Arrival | G412: 14 | H412: NMap | I412: Based | J412: No | K412: P3 P8 IFR and Growler VFR non breaks | L412: 0 | M412: 0 | N412: =SUM(RC[-2]:RC[-1]) -> -999 | O412: =IF(RC[-1]=0,0,RC[-3]/RC[-1]) -> -999 | P412: =IF(RC[-2]=0,0,RC[-3]/RC[-2]) -> -999 | Q412: =IF(R[+11]C[-3]=0,0,RC[-3]/R[+11]C[-3]) -> -999
A413: P-8 | B413: CFM56-7B-24 | C413: 539D | D413: Arrival from East | E413: 25A1D | F413: Arrival | G413: 25 | H413: NMap | I413: Based | J413: No | K413: P3 P8 IFR and Growler VFR non breaks | L413: 1.7142857 | M413: 0 | N413: =SUM(RC[-2]:RC[-1]) -> -999 | O413: =IF(RC[-1]=0,0,RC[-3]/RC[-1]) -> -999 | P413: =IF(RC[-2]=0,0,RC[-3]/RC[-2]) -> -999 | Q413: =IF(R[+10]C[-3]=0,0,RC[-3]/R[+10]C[-3]) -> -999
A414: P-8 | B414: CFM56-7B-24 | C414: 540B_mod | D414: Rep - Arrival | E414: 25A2B | F414: Arrival | G414: 25 | H414: NMap | I414: Based | J414: Yes | K414: P3 P8 IFR and Growler VFR non breaks | L414: 1 | M414: 0 | N414: =SUM(RC[-2]:RC[-1]) -> -999 | O414: =IF(RC[-1]=0,0,RC[-3]/RC[-1]) -> -999 | P414: =IF(RC[-2]=0,0,RC[-3]/RC[-2]) -> -999 | Q414: =IF(R[+9]C[-3]=0,0,RC[-3]/R[+9]C[-3]) -> -999
A415: P-8 | B415: CFM56-7B-24 | C415: 540C_mod | D415: Arrival | E415: 25A2C | F415: Arrival | G415: 25 | H415: NMap | I415: Based | J415: No | K415: P3 P8 IFR and Growler VFR non breaks | L415: 0.14285714 | M415: 0 | N415: =SUM(RC[-2]:RC[-1]) -> -999 | O415: =IF(RC[-1]=0,0,RC[-3]/RC[-1]) -> -999 | P415: =IF(RC[-2]=0,0,RC[-3]/RC[-2]) -> -999 | Q415: =IF(R[+8]C[-3]=0,0,RC[-3]/R[+8]C[-3]) -> -999
A416: P-8 | B416: CFM56-7B-24 | C416: 541C_mod | D416: Arrival | E416: 32A1C | F416: Arrival | G416: 32 | H416: NMap | I416: Based | J416: No | K416: P3 P8 IFR and Growler VFR non breaks | L416: 0 | M416: 0 | N416: =SUM(RC[-2]:RC[-1]) -> -999 | O416: =IF(RC[-1]=0,0,RC[-3]/RC[-1]) -> -999 | P416: =IF(RC[-2]=0,0,RC[-3]/RC[-2]) -> -999 | Q416: =IF(R[+7]C[-3]=0,0,RC[-3]/R[+7]C[-3]) -> -999
A417: P-8 | B417: CFM56-7B-24 | C417: 542B_mod | D417: Arrival | E417: 32A2B | F417: Arrival | G417: 32 | H417: NMap | I417: Based | J417: No | K417: P3 P8 IFR and Growler VFR non breaks | L417: 0.14285714 | M417: 0 | N417: =SUM(RC[-2]:RC[-1]) -> -999 | O417: =IF(RC[-1]=0,0,RC[-3]/RC[-1]) -> -999 | P417: =IF(RC[-2]=0,0,RC[-3]/RC[-2]) -> -999 | Q417: =IF(R[+6]C[-3]=0,0,RC[-3]/R[+6]C[-3]) -> -999
A418: P-8 | B418: CFM56-7B-24 | C418: 542C_mod | D418: Arrival | E418: 32A2C | F418: Arrival | G418: 32 | H418: NMap | I418: Based | J418: No | K418: P3 P8 IFR and Growler VFR non breaks | L418: 0 | M418: 0 | N418: =SUM(RC[-2]:RC[-1]) -> -999 | O418: =IF(RC[-1]=0,0,RC[-3]/RC[-1]) -> -999 | P418: =IF(RC[-2]=0,0,RC[-3]/RC[-2]) -> -999 | Q418: =IF(R[+5]C[-3]=0,0,RC[-3]/R[+5]C[-3]) -> -999
A419: P-8 | B419: CFM56-7B-24 | C419: 543 | D419: Low TACAN Arrival Runway 07 | E419: 07ALT | F419: Arrival | G419: 07 | H419: NMap | I419: Based | J419: No | K419: HI TACAN Arrival | L419: 0 | M419: 0 | N419: =SUM(RC[-2]:RC[-1]) -> -999 | O419: =IF(RC[-1]=0,0,RC[-3]/RC[-1]) -> -999 | P419: =IF(RC[-2]=0,0,RC[-3]/RC[-2]) -> -999 | Q419: =IF(R[+4]C[-3]=0,0,RC[-3]/R[+4]C[-3]) -> -999
A420: P-8 | B420: CFM56-7B-24 | C420: 544 | D420: Rep - Low TACAN Arrival Runway 14 | E420: 14ALT | F420: Arrival | G420: 14 | H420: NMap | I420: Based | J420: Yes | K420: HI TACAN Arrival | L420: 0 | M420: 0 | N420: =SUM(RC[-2]:RC[-1]) -> -999 | O420: =IF(RC[-1]=0,0,RC[-3]/RC[-1]) -> -999 | P420: =IF(RC[-2]=0,0,RC[-3]/RC[-2]) -> -999 | Q420: =IF(R[+3]C[-3]=0,0,RC[-3]/R[+3]C[-3]) -> -999
A421: P-8 | B421: CFM56-7B-24 | C421: 545 | D421: Low TACAN Arrival Runway 25 | E421: 25ALT | F421: Arrival | G421: 25 | H421: NMap | I421: Based | J421: No | K421: HI TACAN Arrival | L421: 0 | M421: 0 | N421: =SUM(RC[-2]:RC[-1]) -> -999 | O421: =IF(RC[-1]=0,0,RC[-3]/RC[-1]) -> -999 | P421: =IF(RC[-2]=0,0,RC[-3]/RC[-2]) -> -999 | Q421: =IF(R[+2]C[-3]=0,0,RC[-3]/R[+2]C[-3]) -> -999
A422: P-8 | B422: CFM56-7B-24 | C422: 546 | D422: Low TACAN Arrival Runway 32 | E422: 32ALT | F422: Arrival | G422: 32 | H422: NMap | I422: Based | J422: No | K422: HI TACAN Arrival | L422: 0 | M422: 0 | N422: =SUM(RC[-2]:RC[-1]) -> -999 | O422: =IF(RC[-1]=0,0,RC[-3]/RC[-1]) -> -999 | P422: =IF(RC[-2]=0,0,RC[-3]/RC[-2]) -> -999 | Q422: =IF(R[+1]C[-3]=0,0,RC[-3]/R[+1]C[-3]) -> -999
K423: Subtotal | L423: =SUM(R[-26]C:R[-1]C) -> -999 | M423: =SUM(R[-26]C:R[-1]C) -> -999 | N423: =SUM(R[-26]C:R[-1]C) -> -999 | O423: =IF(RC[-1]=0,0,RC[-3]/RC[-1]) -> -999 | P423: =IF(RC[-2]=0,0,RC[-3]/RC[-2]) -> -999
A425: P-8 | B425: CFM56-7B-24 | C425: 501_mod | D425: Departure | E425: 07D1B | F425: Departure | G425: 07 | H425: NMap | I425: Based | J425: No | K425: Departure | L425: 1.1428571 | M425: 0 | N425: =SUM(RC[-2]:RC[-1]) -> -999 | O425: =IF(RC[-1]=0,0,RC[-3]/RC[-1]) -> -999 | P425: =IF(RC[-2]=0,0,RC[-3]/RC[-2]) -> -999 | Q425: =IF(R[+16]C[-3]=0,0,RC[-3]/R[+16]C[-3]) -> -999
A426: P-8 | B426: CFM56-7B-24 | C426: 502_mod | D426: Departure | E426: 07D1C | F426: Departure | G426: 07 | H426: NMap | I426: Based | J426: No | K426: Departure | L426: 0 | M426: 0 | N426: =SUM(RC[-2]:RC[-1]) -> -999 | O426: =IF(RC[-1]=0,0,RC[-3]/RC[-1]) -> -999 | P426: =IF(RC[-2]=0,0,RC[-3]/RC[-2]) -> -999 | Q426: =IF(R[+15]C[-3]=0,0,RC[-3]/R[+15]C[-3]) -> -999
A427: P-8 | B427: CFM56-7B-24 | C427: 503_mod | D427: Departure | E427: 07D2B | F427: Departure | G427: 07 | H427: NMap | I427: Based | J427: No | K427: Departure | L427: 0.42857143 | M427: 0 | N427: =SUM(RC[-2]:RC[-1]) -> -999 | O427: =IF(RC[-1]=0,0,RC[-3]/RC[-1]) -> -999 | P427: =IF(RC[-2]=0,0,RC[-3]/RC[-2]) -> -999 | Q427: =IF(R[+14]C[-3]=0,0,RC[-3]/R[+14]C[-3]) -> -999
A428: P-8 | B428: CFM56-7B-24 | C428: 504_mod | D428: Departure | E428: 07D2C | F428: Departure | G428: 07 | H428: NMap | I428: Based | J428: No | K428: Departure | L428: 0 | M428: 0 | N428: =SUM(RC[-2]:RC[-1]) -> -999 | O428: =IF(RC[-1]=0,0,RC[-3]/RC[-1]) -> -999 | P428: =IF(RC[-2]=0,0,RC[-3]/RC[-2]) -> -999 | Q428: =IF(R[+13]C[-3]=0,0,RC[-3]/R[+13]C[-3]) -> -999
A429: P-8 | B429: CFM56-7B-24 | C429: 505_mod | D429: Departure | E429: 14D1B | F429: Departure | G429: 14 | H429: NMap | I429: Based | J429: No | K429: Departure | L429: 0 | M429: 0 | N429: =SUM(RC[-2]:RC[-1]) -> -999 | O429: =IF(RC[-1]=0,0,RC[-3]/RC[-1]) -> -999 | P429: =IF(RC[-2]=0,0,RC[-3]/RC[-2]) -> -999 | Q429: =IF(R[+12]C[-3]=0,0,RC[-3]/R[+12]C[-3]) -> -999
A430: P-8 | B430: CFM56-7B-24 | C430: 506_mod | D430: Departure | E430: 14D1C | F430: Departure | G430: 14 | H430: NMap | I430: Based | J430: No | K430: Departure | L430: 0 | M430: 0 | N430: =SUM(RC[-2]:RC[-1]) -> -999 | O430: =IF(RC[-1]=0,0,RC[-3]/RC[-1]) -> -999 | P430: =IF(RC[-2]=0,0,RC[-3]/RC[-2]) -> -999 | Q430: =IF(R[+11]C[-3]=0,0,RC[-3]/R[+11]C[-3]) -> -999
A431: P-8 | B431: CFM56-7B-24 | C431: 507_mod | D431: Departure | E431: 14D2B | F431: Departure | G431: 14 | H431: NMap | I431: Based | J431: No | K431: Departure | L431: 0 | M431: 0 | N431: =SUM(RC[-2]:RC[-1]) -> -999 | O431: =IF(RC[-1]=0,0,RC[-3]/RC[-1]) -> -999 | P431: =IF(RC[-2]=0,0,RC[-3]/RC[-2]) -> -999 | Q431: =IF(R[+10]C[-3]=0,0,RC[-3]/R[+10]C[-3]) -> -999
A432: P-8 | B432: CFM56-7B-24 | C432: 508_mod | D432: Departure | E432: 14D2C | F432: Departure | G432: 14 | H432: NMap | I432: Based | J432: No | K432: Departure | L432: 0 | M432: 0 | N432: =SUM(RC[-2]:RC[-1]) -> -999 | O432: =IF(RC[-1]=0,0,RC[-3]/RC[-1]) -> -999 | P432: =IF(RC[-2]=0,0,RC[-3]/RC[-2]) -> -999 | Q432: =IF(R[+9]C[-3]=0,0,RC[-3]/R[+9]C[-3]) -> -999
A433: P-8 | B433: CFM56-7B-24 | C433: 509_mod | D433: Departure | E433: 25D1B | F433: Departure | G433: 25 | H433: NMap | I433: Based | J433: No | K433: Departure | L433: 0.71428571 | M433: 0 | N433: =SUM(RC[-2]:RC[-1]) -> -999 | O433: =IF(RC[-1]=0,0,RC[-3]/RC[-1]) -> -999 | P433: =IF(RC[-2]=0,0,RC[-3]/RC[-2]) -> -999 | Q433: =IF(R[+8]C[-3]=0,0,RC[-3]/R[+8]C[-3]) -> -999
A434: P-8 | B434: CFM56-7B-24 | C434: 510_mod | D434: Departure | E434: 25D1C | F434: Departure | G434: 25 | H434: NMap | I434: Based | J434: No | K434: Departure | L434: 0 | M434: 0 | N434: =SUM(RC[-2]:RC[-1]) -> -999 | O434: =IF(RC[-1]=0,0,RC[-3]/RC[-1]) -> -999 | P434: =IF(RC[-2]=0,0,RC[-3]/RC[-2]) -> -999 | Q434: =IF(R[+7]C[-3]=0,0,RC[-3]/R[+7]C[-3]) -> -999
A435: P-8 | B435: CFM56-7B-24 | C435: 511_mod | D435: Rep - Departure | E435: 25D2B | F435: Departure | G435: 25 | H435: NMap | I435: Based | J435: Yes | K435: Departure | L435: 0.85714286 | M435: 0 | N435: =SUM(RC[-2]:RC[-1]) -> -999 | O435: =IF(RC[-1]=0,0,RC[-3]/RC[-1]) -> -999 | P435: =IF(RC[-2]=0,0,RC[-3]/RC[-2]) -> -999 | Q435: =IF(R[+6]C[-3]=0,0,RC[-3]/R[+6]C[-3]) -> -999
A436: P-8 | B436: CFM56-7B-24 | C436: 512_mod | D436: Departure | E436: 25D2C | F436: Departure | G436: 25 | H436: NMap | I436: Based | J436: No | K436: Departure | L436: 0 | M436: 0 | N436: =SUM(RC[-2]:RC[-1]) -> -999 | O436: =IF(RC[-1]=0,0,RC[-3]/RC[-1]) -> -999 | P436: =IF(RC[-2]=0,0,RC[-3]/RC[-2]) -> -999 | Q436: =IF(R[+5]C[-3]=0,0,RC[-3]/R[+5]C[-3]) -> -999
A437: P-8 | B437: CFM56-7B-24 | C437: 513_mod | D437: Departure | E437: 32D1B | F437: Departure | G437: 32 | H437: NMap | I437: Based | J437: No | K437: Departure | L437: 0.14285714 | M437: 0 | N437: =SUM(RC[-2]:RC[-1]) -> -999 | O437: =IF(RC[-1]=0,0,RC[-3]/RC[-1]) -> -999 | P437: =IF(RC[-2]=0,0,RC[-3]/RC[-2]) -> -999 | Q437: =IF(R[+4]C[-3]=0,0,RC[-3]/R[+4]C[-3]) -> -999
A438: P-8 | B438: CFM56-7B-24 | C438: 514_mod | D438: Departure | E438: 32D1C | F438: Departure | G438: 32 | H438: NMap | I438: Based | J438: No | K438: Departure | L438: 0 | M438: 0 | N438: =SUM(RC[-2]:RC[-1]) -> -999 | O438: =IF(RC[-1]=0,0,RC[-3]/RC[-1]) -> -999 | P438: =IF(RC[-2]=0,0,RC[-3]/RC[-2]) -> -999 | Q438: =IF(R[+3]C[-3]=0,0,RC[-3]/R[+3]C[-3]) -> -999
A439: P-8 | B439: CFM56-7B-24 | C439: 515_mod | D439: Departure | E439: 32D2B | F439: Departure | G439: 32 | H439: NMap | I439: Based | J439: No | K439: Departure | L439: 0 | M439: 0 | N439: =SUM(RC[-2]:RC[-1]) -> -999 | O439: =IF(RC[-1]=0,0,RC[-3]/RC[-1]) -> -999 | P439: =IF(RC[-2]=0,0,RC[-3]/RC[-2]) -> -999 | Q439: =IF(R[+2]C[-3]=0,0,RC[-3]/R[+2]C[-3]) -> -999
A440: P-8 | B440: CFM56-7B-24 | C440: 516_mod | D440: Departure | E440: 32D2C | F440: Departure | G440: 32 | H440: NMap | I440: Based | J440: No | K440: Departure | L440: 0 | M440: 0 | N440: =SUM(RC[-2]:RC[-1]) -> -999 | O440: =IF(RC[-1]=0,0,RC[-3]/RC[-1]) -> -999 | P440: =IF(RC[-2]=0,0,RC[-3]/RC[-2]) -> -999 | Q440: =IF(R[+1]C[-3]=0,0,RC[-3]/R[+1]C[-3]) -> -999
K441: Subtotal | L441: =SUM(R[-16]C:R[-1]C) -> -999 | M441: =SUM(R[-16]C:R[-1]C) -> -999 | N441: =SUM(R[-16]C:R[-1]C) -> -999 | O441: =IF(RC[-1]=0,0,RC[-3]/RC[-1]) -> -999 | P441: =IF(RC[-2]=0,0,RC[-3]/RC[-2]) -> -999
A443: P-8 | B443: CFM56-7B-24 | C443: 547B_mod | D443: GCA Box Pattern Whidbey Runway 07 - Center | E443: 07G1B | F443: Closed Pattern | G443: 07 | H443: NMap | I443: Based | J443: No | K443: GCA Pattern | L443: 0 | M443: 0.28571429 | N443: =SUM(RC[-2]:RC[-1]) -> -999 | O443: =IF(RC[-1]=0,0,RC[-3]/RC[-1]) -> -999 | P443: =IF(RC[-2]=0,0,RC[-3]/RC[-2]) -> -999 | Q443: =IF(R[+12]C[-3]=0,0,RC[-3]/R[+12]C[-3]) -> -999
A444: P-8 | B444: CFM56-7B-24 | C444: 547C_mod | D444: GCA Box Pattern Whidbey Runway 07 - Long | E444: 07G1C | F444: Closed Pattern | G444: 07 | H444: NMap | I444: Based | J444: No | K444: GCA Pattern | L444: 0 | M444: 0 | N444: =SUM(RC[-2]:RC[-1]) -> -999 | O444: =IF(RC[-1]=0,0,RC[-3]/RC[-1]) -> -999 | P444: =IF(RC[-2]=0,0,RC[-3]/RC[-2]) -> -999 | Q444: =IF(R[+11]C[-3]=0,0,RC[-3]/R[+11]C[-3]) -> -999
A445: P-8 | B445: CFM56-7B-24 | C445: 548B_mod | D445: GCA Box Pattern Whidbey Runway 14 - Center | E445: 14G1B | F445: Closed Pattern | G445: 14 | H445: NMap | I445: Based | J445: No | K445: GCA Pattern | L445: 0 | M445: 0 | N445: =SUM(RC[-2]:RC[-1]) -> -999 | O445: =IF(RC[-1]=0,0,RC[-3]/RC[-1]) -> -999 | P445: =IF(RC[-2]=0,0,RC[-3]/RC[-2]) -> -999 | Q445: =IF(R[+10]C[-3]=0,0,RC[-3]/R[+10]C[-3]) -> -999
A446: P-8 | B446: CFM56-7B-24 | C446: 548C_mod | D446: GCA Box Pattern Whidbey Runway 14 - Long | E446: 14G1C | F446: Closed Pattern | G446: 14 | H446: NMap | I446: Based | J446: No | K446: GCA Pattern | L446: 0 | M446: 0 | N446: =SUM(RC[-2]:RC[-1]) -> -999 | O446: =IF(RC[-1]=0,0,RC[-3]/RC[-1]) -> -999 | P446: =IF(RC[-2]=0,0,RC[-3]/RC[-2]) -> -999 | Q446: =IF(R[+9]C[-3]=0,0,RC[-3]/R[+9]C[-3]) -> -999
A447: P-8 | B447: CFM56-7B-24 | C447: 549B_mod | D447: Rep - GCA Box Pattern Whidbey Runway 25 - Center | E447: 25G1B | F447: Closed Pattern | G447: 25 | H447: NMap | I447: Based | J447: Yes | K447: GCA Pattern | L447: 0.57142857 | M447: 0 | N447: =SUM(RC[-2]:RC[-1]) -> -999 | O447: =IF(RC[-1]=0,0,RC[-3]/RC[-1]) -> -999 | P447: =IF(RC[-2]=0,0,RC[-3]/RC[-2]) -> -999 | Q447: =IF(R[+8]C[-3]=0,0,RC[-3]/R[+8]C[-3]) -> -999
A448: P-8 | B448: CFM56-7B-24 | C448: 549C_mod | D448: GCA Box Pattern Whidbey Runway 25 - Long | E448: 25G1C | F448: Closed Pattern | G448: 25 | H448: NMap | I448: Based | J448: No | K448: GCA Pattern | L448: 0 | M448: 0 | N448: =SUM(RC[-2]:RC[-1]) -> -999 | O448: =IF(RC[-1]=0,0,RC[-3]/RC[-1]) -> -999 | P448: =IF(RC[-2]=0,0,RC[-3]/RC[-2]) -> -999 | Q448: =IF(R[+7]C[-3]=0,0,RC[-3]/R[+7]C[-3]) -> -999
A449: P-8 | B449: CFM56-7B-24 | C449: 550B_mod | D449: GCA Box Pattern Whidbey Runway 32 - Center | E449: 32G1B | F449: Closed Pattern | G449: 32 | H449: NMap | I449: Based | J449: No | K449: GCA Pattern | L449: 0 | M449: 0 | N449: =SUM(RC[-2]:RC[-1]) -> -999 | O449: =IF(RC[-1]=0,0,RC[-3]/RC[-1]) -> -999 | P449: =IF(RC[-2]=0,0,RC[-3]/RC[-2]) -> -999 | Q449: =IF(R[+6]C[-3]=0,0,RC[-3]/R[+6]C[-3]) -> -999
A450: P-8 | B450: CFM56-7B-24 | C450: 550C_mod | D450: GCA Box Pattern Whidbey Runway 32 - Long | E450: 32G1C | F450: Closed Pattern | G450: 32 | H450: NMap | I450: Based | J450: No | K450: GCA Pattern | L450: 0 | M450: 0 | N450: =SUM(RC[-2]:RC[-1]) -> -999 | O450: =IF(RC[-1]=0,0,RC[-3]/RC[-1]) -> -999 | P450: =IF(RC[-2]=0,0,RC[-3]/RC[-2]) -> -999 | Q450: =IF(R[+5]C[-3]=0,0,RC[-3]/R[+5]C[-3]) -> -999
A451: P-8 | B451: CFM56-7B-24 | C451: 551B_mod | D451: Touch & Go | E451: 07TU2C | F451: Closed Pattern | G451: 07 | H451: NMap | I451: Based | J451: No | K451: Touch and Go at Ault Field | L451: 0 | M451: 0 | N451: =SUM(RC[-2]:RC[-1]) -> -999 | O451: =IF(RC[-1]=0,0,RC[-3]/RC[-1]) -> -999 | P451: =IF(RC[-2]=0,0,RC[-3]/RC[-2]) -> -999 | Q451: =IF(R[+4]C[-3]=0,0,RC[-3]/R[+4]C[-3]) -> -999
A452: P-8 | B452: CFM56-7B-24 | C452: 552B_mod | D452: Touch & Go | E452: 14TU2C | F452: Closed Pattern | G452: 14 | H452: NMap | I452: Based | J452: Yes | K452: Touch and Go at Ault Field | L452: 0 | M452: 0 | N452: =SUM(RC[-2]:RC[-1]) -> -999 | O452: =IF(RC[-1]=0,0,RC[-3]/RC[-1]) -> -999 | P452: =IF(RC[-2]=0,0,RC[-3]/RC[-2]) -> -999 | Q452: =IF(R[+3]C[-3]=0,0,RC[-3]/R[+3]C[-3]) -> -999
A453: P-8 | B453: CFM56-7B-24 | C453: 553B_mod | D453: Touch & Go | E453: 25TU2C | F453: Closed Pattern | G453: 25 | H453: NMap | I453: Based | J453: No | K453: Touch and Go at Ault Field | L453: 0.57142857 | M453: 0 | N453: =SUM(RC[-2]:RC[-1]) -> -999 | O453: =IF(RC[-1]=0,0,RC[-3]/RC[-1]) -> -999 | P453: =IF(RC[-2]=0,0,RC[-3]/RC[-2]) -> -999 | Q453: =IF(R[+2]C[-3]=0,0,RC[-3]/R[+2]C[-3]) -> -999
A454: P-8 | B454: CFM56-7B-24 | C454: 554B_mod | D454: Touch & Go | E454: 32TU2C | F454: Closed Pattern | G454: 32 | H454: NMap | I454: Based | J454: No | K454: Touch and Go at Ault Field | L454: 0 | M454: 0 | N454: =SUM(RC[-2]:RC[-1]) -> -999 | O454: =IF(RC[-1]=0,0,RC[-3]/RC[-1]) -> -999 | P454: =IF(RC[-2]=0,0,RC[-3]/RC[-2]) -> -999 | Q454: =IF(R[+1]C[-3]=0,0,RC[-3]/R[+1]C[-3]) -> -999
K455: Subtotal | L455: =SUM(R[-12]C:R[-1]C) -> -999 | M455: =SUM(R[-12]C:R[-1]C) -> -999 | N455: =SUM(R[-12]C:R[-1]C) -> -999 | O455: =IF(RC[-1]=0,0,RC[-3]/RC[-1]) -> -999 | P455: =IF(RC[-2]=0,0,RC[-3]/RC[-2]) -> -999
A456: Aircraft | B456: Engine | C456: Profile | D456: Long Name | E456: Track | F456: Track Type | G456: Runway | H456: Noise Model | I456: A/C Category | J456: Rep | K456: Track Group | L456: Num Day | M456: Num Night | N456: Num Total | O456: % Day | P456: % Night | Q456: % Total
A457: Transient Jet | B457: CFM56-7B-24 | C457: 417 | D457: Arrival VFR | E457: 07A1A | F457: Arrival | G457: 07 | H457: NMap | I457: Transient | J457: No | K457: P3 P8 C9 VFR non breaks | L457: 0 | M457: 0 | N457: =SUM(RC[-2]:RC[-1]) -> -999 | O457: =IF(RC[-1]=0,0,RC[-3]/RC[-1]) -> -999 | P457: =IF(RC[-2]=0,0,RC[-3]/RC[-2]) -> -999 | Q457: =IF(R[+22]C[-3]=0,0,RC[-3]/R[+22]C[-3]) -> -999
A458: Transient Jet | B458: CFM56-7B-24 | C458: 418 | D458: Arrival VFR | E458: 07A3B | F458: Arrival | G458: 07 | H458: NMap | I458: Transient | J458: No | K458: P3 P8 C9 VFR non breaks | L458: 0 | M458: 0 | N458: =SUM(RC[-2]:RC[-1]) -> -999 | O458: =IF(RC[-1]=0,0,RC[-3]/RC[-1]) -> -999 | P458: =IF(RC[-2]=0,0,RC[-3]/RC[-2]) -> -999 | Q458: =IF(R[+21]C[-3]=0,0,RC[-3]/R[+21]C[-3]) -> -999
A459: Transient Jet | B459: CFM56-7B-24 | C459: 419 | D459: Arrival VFR | E459: 07A4D | F459: Arrival | G459: 07 | H459: NMap | I459: Transient | J459: No | K459: P3 P8 C9 VFR non breaks | L459: 0 | M459: 0 | N459: =SUM(RC[-2]:RC[-1]) -> -999 | O459: =IF(RC[-1]=0,0,RC[-3]/RC[-1]) -> -999 | P459: =IF(RC[-2]=0,0,RC[-3]/RC[-2]) -> -999 | Q459: =IF(R[+20]C[-3]=0,0,RC[-3]/R[+20]C[-3]) -> -999
A460: Transient Jet | B460: CFM56-7B-24 | C460: 421 | D460: Arrival VFR | E460: 14A3D | F460: Arrival | G460: 14 | H460: NMap | I460: Transient | J460: No | K460: P3 P8 C9 VFR non breaks | L460: 0 | M460: 0 | N460: =SUM(RC[-2]:RC[-1]) -> -999 | O460: =IF(RC[-1]=0,0,RC[-3]/RC[-1]) -> -999 | P460: =IF(RC[-2]=0,0,RC[-3]/RC[-2]) -> -999 | Q460: =IF(R[+19]C[-3]=0,0,RC[-3]/R[+19]C[-3]) -> -999
A461: Transient Jet | B461: CFM56-7B-24 | C461: 423 | D461: Arrival VFR | E461: 14A4D | F461: Arrival | G461: 14 | H461: NMap | I461: Transient | J461: No | K461: P3 P8 C9 VFR non breaks | L461: 0 | M461: 0 | N461: =SUM(RC[-2]:RC[-1]) -> -999 | O461: =IF(RC[-1]=0,0,RC[-3]/RC[-1]) -> -999 | P461: =IF(RC[-2]=0,0,RC[-3]/RC[-2]) -> -999 | Q461: =IF(R[+18]C[-3]=0,0,RC[-3]/R[+18]C[-3]) -> -999
A462: Transient Jet | B462: CFM56-7B-24 | C462: 424 | D462: Arrival VFR | E462: 25A3D | F462: Arrival | G462: 25 | H462: NMap | I462: Transient | J462: No | K462: P3 P8 C9 VFR non breaks | L462: 0.14285714 | M462: 0 | N462: =SUM(RC[-2]:RC[-1]) -> -999 | O462: =IF(RC[-1]=0,0,RC[-3]/RC[-1]) -> -999 | P462: =IF(RC[-2]=0,0,RC[-3]/RC[-2]) -> -999 | Q462: =IF(R[+17]C[-3]=0,0,RC[-3]/R[+17]C[-3]) -> -999
A463: Transient Jet | B463: CFM56-7B-24 | C463: 425 | D463: Arrival VFR | E463: 25A4B | F463: Arrival | G463: 25 | H463: NMap | I463: Transient | J463: No | K463: P3 P8 C9 VFR non breaks | L463: 0 | M463: 0 | N463: =SUM(RC[-2]:RC[-1]) -> -999 | O463: =IF(RC[-1]=0,0,RC[-3]/RC[-1]) -> -999 | P463: =IF(RC[-2]=0,0,RC[-3]/RC[-2]) -> -999 | Q463: =IF(R[+16]C[-3]=0,0,RC[-3]/R[+16]C[-3]) -> -999
A464: Transient Jet | B464: CFM56-7B-24 | C464: 426 | D464: Arrival VFR | E464: 25A4C | F464: Arrival | G464: 25 | H464: NMap | I464: Transient | J464: No | K464: P3 P8 C9 VFR non breaks | L464: 0 | M464: 0 | N464: =SUM(RC[-2]:RC[-1]) -> -999 | O464: =IF(RC[-1]=0,0,RC[-3]/RC[-1]) -> -999 | P464: =IF(RC[-2]=0,0,RC[-3]/RC[-2]) -> -999 | Q464: =IF(R[+15]C[-3]=0,0,RC[-3]/R[+15]C[-3]) -> -999
A465: Transient Jet | B465: CFM56-7B-24 | C465: 428 | D465: Arrival VFR | E465: 32A3D | F465: Arrival | G465: 32 | H465: NMap | I465: Transient | J465: No | K465: P3 P8 C9 VFR non breaks | L465: 0 | M465: 0 | N465: =SUM(RC[-2]:RC[-1]) -> -999 | O465: =IF(RC[-1]=0,0,RC[-3]/RC[-1]) -> -999 | P465: =IF(RC[-2]=0,0,RC[-3]/RC[-2]) -> -999 | Q465: =IF(R[+14]C[-3]=0,0,RC[-3]/R[+14]C[-3]) -> -999
A466: Transient Jet | B466: CFM56-7B-24 | C466: 430 | D466: Arrival VFR | E466: 32A4D | F466: Arrival | G466: 32 | H466: NMap | I466: Transient | J466: No | K466: P3 P8 C9 VFR non breaks | L466: 0 | M466: 0 | N466: =SUM(RC[-2]:RC[-1]) -> -999 | O466: =IF(RC[-1]=0,0,RC[-3]/RC[-1]) -> -999 | P466: =IF(RC[-2]=0,0,RC[-3]/RC[-2]) -> -999 | Q466: =IF(R[+13]C[-3]=0,0,RC[-3]/R[+13]C[-3]) -> -999
A467: Transient Jet | B467: CFM56-7B-24 | C467: 436B | D467: Arrival | E467: 07A2B | F467: Arrival | G467: 07 | H467: NMap | I467: Transient | J467: No | K467: P3 P8 IFR and Growler VFR non breaks | L467: 0 | M467: 0 | N467: =SUM(RC[-2]:RC[-1]) -> -999 | O467: =IF(RC[-1]=0,0,RC[-3]/RC[-1]) -> -999 | P467: =IF(RC[-2]=0,0,RC[-3]/RC[-2]) -> -999 | Q467: =IF(R[+12]C[-3]=0,0,RC[-3]/R[+12]C[-3]) -> -999
A468: Transient Jet | B468: CFM56-7B-24 | C468: 436C | D468: Arrival | E468: 07A2C | F468: Arrival | G468: 07 | H468: NMap | I468: Transient | J468: No | K468: P3 P8 IFR and Growler VFR non breaks | L468: 0 | M468: 0 | N468: =SUM(RC[-2]:RC[-1]) -> -999 | O468: =IF(RC[-1]=0,0,RC[-3]/RC[-1]) -> -999 | P468: =IF(RC[-2]=0,0,RC[-3]/RC[-2]) -> -999 | Q468: =IF(R[+11]C[-3]=0,0,RC[-3]/R[+11]C[-3]) -> -999
A469: Transient Jet | B469: CFM56-7B-24 | C469: 437B | D469: Rep - Arrival | E469: 14A1B | F469: Arrival | G469: 14 | H469: NMap | I469: Transient | J469: Yes | K469: P3 P8 IFR and Growler VFR non breaks | L469: 0 | M469: 0 | N469: =SUM(RC[-2]:RC[-1]) -> -999 | O469: =IF(RC[-1]=0,0,RC[-3]/RC[-1]) -> -999 | P469: =IF(RC[-2]=0,0,RC[-3]/RC[-2]) -> -999 | Q469: =IF(R[+10]C[-3]=0,0,RC[-3]/R[+10]C[-3]) -> -999
A470: Transient Jet | B470: CFM56-7B-24 | C470: 437C | D470: Arrival | E470: 14A1C | F470: Arrival | G470: 14 | H470: NMap | I470: Transient | J470: No | K470: P3 P8 IFR and Growler VFR non breaks | L470: 0 | M470: 0 | N470: =SUM(RC[-2]:RC[-1]) -> -999 | O470: =IF(RC[-1]=0,0,RC[-3]/RC[-1]) -> -999 | P470: =IF(RC[-2]=0,0,RC[-3]/RC[-2]) -> -999 | Q470: =IF(R[+9]C[-3]=0,0,RC[-3]/R[+9]C[-3]) -> -999
A471: Transient Jet | B471: CFM56-7B-24 | C471: 438B | D471: Arrival | E471: 14A2B | F471: Arrival | G471: 14 | H471: NMap | I471: Transient | J471: No | K471: P3 P8 IFR and Growler VFR non breaks | L471: 0 | M471: 0 | N471: =SUM(RC[-2]:RC[-1]) -> -999 | O471: =IF(RC[-1]=0,0,RC[-3]/RC[-1]) -> -999 | P471: =IF(RC[-2]=0,0,RC[-3]/RC[-2]) -> -999 | Q471: =IF(R[+8]C[-3]=0,0,RC[-3]/R[+8]C[-3]) -> -999
A472: Transient Jet | B472: CFM56-7B-24 | C472: 438C | D472: Arrival | E472: 14A2C | F472: Arrival | G472: 14 | H472: NMap | I472: Transient | J472: No | K472: P3 P8 IFR and Growler VFR non breaks | L472: 0 | M472: 0 | N472: =SUM(RC[-2]:RC[-1]) -> -999 | O472: =IF(RC[-1]=0,0,RC[-3]/RC[-1]) -> -999 | P472: =IF(RC[-2]=0,0,RC[-3]/RC[-2]) -> -999 | Q472: =IF(R[+7]C[-3]=0,0,RC[-3]/R[+7]C[-3]) -> -999
A473: Transient Jet | B473: CFM56-7B-24 | C473: 439D | D473: Arrival from East | E473: 25A1D | F473: Arrival | G473: 25 | H473: NMap | I473: Based | J473: No | K473: P3 P8 IFR and Growler VFR non breaks | L473: 1 | M473: 0 | N473: =SUM(RC[-2]:RC[-1]) -> -999 | O473: =IF(RC[-1]=0,0,RC[-3]/RC[-1]) -> -999 | P473: =IF(RC[-2]=0,0,RC[-3]/RC[-2]) -> -999 | Q473: =IF(R[+6]C[-3]=0,0,RC[-3]/R[+6]C[-3]) -> -999
A474: Transient Jet | B474: CFM56-7B-24 | C474: 440B | D474: Rep - Arrival | E474: 25A2B | F474: Arrival | G474: 25 | H474: NMap | I474: Transient | J474: Yes | K474: P3 P8 IFR and Growler VFR non breaks | L474: 0 | M474: 0 | N474: =SUM(RC[-2]:RC[-1]) -> -999 | O474: =IF(RC[-1]=0,0,RC[-3]/RC[-1]) -> -999 | P474: =IF(RC[-2]=0,0,RC[-3]/RC[-2]) -> -999 | Q474: =IF(R[+5]C[-3]=0,0,RC[-3]/R[+5]C[-3]) -> -999
A475: Transient Jet | B475: CFM56-7B-24 | C475: 440C | D475: Arrival | E475: 25A2C | F475: Arrival | G475: 25 | H475: NMap | I475: Transient | J475: No | K475: P3 P8 IFR and Growler VFR non breaks | L475: 0 | M475: 0 | N475: =SUM(RC[-2]:RC[-1]) -> -999 | O475: =IF(RC[-1]=0,0,RC[-3]/RC[-1]) -> -999 | P475: =IF(RC[-2]=0,0,RC[-3]/RC[-2]) -> -999 | Q475: =IF(R[+4]C[-3]=0,0,RC[-3]/R[+4]C[-3]) -> -999
A476: Transient Jet | B476: CFM56-7B-24 | C476: 441C | D476: Arrival | E476: 32A1C | F476: Arrival | G476: 32 | H476: NMap | I476: Transient | J476: No | K476: P3 P8 IFR and Growler VFR non breaks | L476: 0 | M476: 0 | N476: =SUM(RC[-2]:RC[-1]) -> -999 | O476: =IF(RC[-1]=0,0,RC[-3]/RC[-1]) -> -999 | P476: =IF(RC[-2]=0,0,RC[-3]/RC[-2]) -> -999 | Q476: =IF(R[+3]C[-3]=0,0,RC[-3]/R[+3]C[-3]) -> -999
A477: Transient Jet | B477: CFM56-7B-24 | C477: 442B | D477: Arrival | E477: 32A2B | F477: Arrival | G477: 32 | H477: NMap | I477: Transient | J477: No | K477: P3 P8 IFR and Growler VFR non breaks | L477: 0 | M477: 0 | N477: =SUM(RC[-2]:RC[-1]) -> -999 | O477: =IF(RC[-1]=0,0,RC[-3]/RC[-1]) -> -999 | P477: =IF(RC[-2]=0,0,RC[-3]/RC[-2]) -> -999 | Q477: =IF(R[+2]C[-3]=0,0,RC[-3]/R[+2]C[-3]) -> -999
A478: Transient Jet | B478: CFM56-7B-24 | C478: 442C | D478: Arrival | E478: 32A2C | F478: Arrival | G478: 32 | H478: NMap | I478: Transient | J478: No | K478: P3 P8 IFR and Growler VFR non breaks | L478: 0 | M478: 0 | N478: =SUM(RC[-2]:RC[-1]) -> -999 | O478: =IF(RC[-1]=0,0,RC[-3]/RC[-1]) -> -999 | P478: =IF(RC[-2]=0,0,RC[-3]/RC[-2]) -> -999 | Q478: =IF(R[+1]C[-3]=0,0,RC[-3]/R[+1]C[-3]) -> -999
K479: Subtotal | L479: =SUM(R[-22]C:R[-1]C) -> -999 | M479: =SUM(R[-22]C:R[-1]C) -> -999 | N479: =SUM(R[-22]C:R[-1]C) -> -999 | O479: =IF(RC[-1]=0,0,RC[-3]/RC[-1]) -> -999 | P479: =IF(RC[-2]=0,0,RC[-3]/RC[-2]) -> -999
A481: Transient Jet | B481: CFM56-7B-24 | C481: 401 | D481: Departure Runway 07 - East Center | E481: 07D1B | F481: Departure | G481: 07 | H481: NMap | I481: Transient | J481: No | K481: Departure | L481: 0.28571429 | M481: 0 | N481: =SUM(RC[-2]:RC[-1]) -> -999 | O481: =IF(RC[-1]=0,0,RC[-3]/RC[-1]) -> -999 | P481: =IF(RC[-2]=0,0,RC[-3]/RC[-2]) -> -999 | Q481: =IF(R[+16]C[-3]=0,0,RC[-3]/R[+16]C[-3]) -> -999
A482: Transient Jet | B482: CFM56-7B-24 | C482: 402 | D482: Departure Runway 07 - East Long | E482: 07D1C | F482: Departure | G482: 07 | H482: NMap | I482: Transient | J482: No | K482: Departure | L482: 0 | M482: 0 | N482: =SUM(RC[-2]:RC[-1]) -> -999 | O482: =IF(RC[-1]=0,0,RC[-3]/RC[-1]) -> -999 | P482: =IF(RC[-2]=0,0,RC[-3]/RC[-2]) -> -999 | Q482: =IF(R[+15]C[-3]=0,0,RC[-3]/R[+15]C[-3]) -> -999
A483: Transient Jet | B483: CFM56-7B-24 | C483: 403 | D483: Departure Runway 07 - South Center | E483: 07D2B | F483: Departure | G483: 07 | H483: NMap | I483: Transient | J483: No | K483: Departure | L483: 0 | M483: 0 | N483: =SUM(RC[-2]:RC[-1]) -> -999 | O483: =IF(RC[-1]=0,0,RC[-3]/RC[-1]) -> -999 | P483: =IF(RC[-2]=0,0,RC[-3]/RC[-2]) -> -999 | Q483: =IF(R[+14]C[-3]=0,0,RC[-3]/R[+14]C[-3]) -> -999
A484: Transient Jet | B484: CFM56-7B-24 | C484: 404 | D484: Departure Runway 07 - South Long | E484: 07D2C | F484: Departure | G484: 07 | H484: NMap | I484: Transient | J484: No | K484: Departure | L484: 0 | M484: 0 | N484: =SUM(RC[-2]:RC[-1]) -> -999 | O484: =IF(RC[-1]=0,0,RC[-3]/RC[-1]) -> -999 | P484: =IF(RC[-2]=0,0,RC[-3]/RC[-2]) -> -999 | Q484: =IF(R[+13]C[-3]=0,0,RC[-3]/R[+13]C[-3]) -> -999
A485: Transient Jet | B485: CFM56-7B-24 | C485: 405 | D485: Rep - Departure Runway 14 - East Center | E485: 14D1B | F485: Departure | G485: 14 | H485: NMap | I485: Transient | J485: Yes | K485: Departure | L485: 0 | M485: 0 | N485: =SUM(RC[-2]:RC[-1]) -> -999 | O485: =IF(RC[-1]=0,0,RC[-3]/RC[-1]) -> -999 | P485: =IF(RC[-2]=0,0,RC[-3]/RC[-2]) -> -999 | Q485: =IF(R[+12]C[-3]=0,0,RC[-3]/R[+12]C[-3]) -> -999
A486: Transient Jet | B486: CFM56-7B-24 | C486: 406 | D486: Departure Runway 14 - East Long | E486: 14D1C | F486: Departure | G486: 14 | H486: NMap | I486: Transient | J486: No | K486: Departure | L486: 0.14285714 | M486: 0 | N486: =SUM(RC[-2]:RC[-1]) -> -999 | O486: =IF(RC[-1]=0,0,RC[-3]/RC[-1]) -> -999 | P486: =IF(RC[-2]=0,0,RC[-3]/RC[-2]) -> -999 | Q486: =IF(R[+11]C[-3]=0,0,RC[-3]/R[+11]C[-3]) -> -999
A487: Transient Jet | B487: CFM56-7B-24 | C487: 407 | D487: Departure Runway 14 - South Center | E487: 14D2B | F487: Departure | G487: 14 | H487: NMap | I487: Transient | J487: No | K487: Departure | L487: 0 | M487: 0 | N487: =SUM(RC[-2]:RC[-1]) -> -999 | O487: =IF(RC[-1]=0,0,RC[-3]/RC[-1]) -> -999 | P487: =IF(RC[-2]=0,0,RC[-3]/RC[-2]) -> -999 | Q487: =IF(R[+10]C[-3]=0,0,RC[-3]/R[+10]C[-3]) -> -999
A488: Transient Jet | B488: CFM56-7B-24 | C488: 408 | D488: Departure Runway 14 - South Long | E488: 14D2C | F488: Departure | G488: 14 | H488: NMap | I488: Transient | J488: No | K488: Departure | L488: 0 | M488: 0 | N488: =SUM(RC[-2]:RC[-1]) -> -999 | O488: =IF(RC[-1]=0,0,RC[-3]/RC[-1]) -> -999 | P488: =IF(RC[-2]=0,0,RC[-3]/RC[-2]) -> -999 | Q488: =IF(R[+9]C[-3]=0,0,RC[-3]/R[+9]C[-3]) -> -999
A489: Transient Jet | B489: CFM56-7B-24 | C489: 409 | D489: Departure Runway 25 - East Center | E489: 25D1B | F489: Departure | G489: 25 | H489: NMap | I489: Transient | J489: No | K489: Departure | L489: 0.14285714 | M489: 0 | N489: =SUM(RC[-2]:RC[-1]) -> -999 | O489: =IF(RC[-1]=0,0,RC[-3]/RC[-1]) -> -999 | P489: =IF(RC[-2]=0,0,RC[-3]/RC[-2]) -> -999 | Q489: =IF(R[+8]C[-3]=0,0,RC[-3]/R[+8]C[-3]) -> -999
A490: Transient Jet | B490: CFM56-7B-24 | C490: 410 | D490: Departure Runway 25 - East Long | E490: 25D1C | F490: Departure | G490: 25 | H490: NMap | I490: Transient | J490: No | K490: Departure | L490: 0 | M490: 0 | N490: =SUM(RC[-2]:RC[-1]) -> -999 | O490: =IF(RC[-1]=0,0,RC[-3]/RC[-1]) -> -999 | P490: =IF(RC[-2]=0,0,RC[-3]/RC[-2]) -> -999 | Q490: =IF(R[+7]C[-3]=0,0,RC[-3]/R[+7]C[-3]) -> -999
A491: Transient Jet | B491: CFM56-7B-24 | C491: 411 | D491: Departure Runway 25 - South Center | E491: 25D2B | F491: Departure | G491: 25 | H491: NMap | I491: Transient | J491: No | K491: Departure | L491: 0 | M491: 0 | N491: =SUM(RC[-2]:RC[-1]) -> -999 | O491: =IF(RC[-1]=0,0,RC[-3]/RC[-1]) -> -999 | P491: =IF(RC[-2]=0,0,RC[-3]/RC[-2]) -> -999 | Q491: =IF(R[+6]C[-3]=0,0,RC[-3]/R[+6]C[-3]) -> -999
A492: Transient Jet | B492: CFM56-7B-24 | C492: 412 | D492: Departure Runway 25 - South Long | E492: 25D2C | F492: Departure | G492: 25 | H492: NMap | I492: Transient | J492: No | K492: Departure | L492: 0 | M492: 0 | N492: =SUM(RC[-2]:RC[-1]) -> -999 | O492: =IF(RC[-1]=0,0,RC[-3]/RC[-1]) -> -999 | P492: =IF(RC[-2]=0,0,RC[-3]/RC[-2]) -> -999 | Q492: =IF(R[+5]C[-3]=0,0,RC[-3]/R[+5]C[-3]) -> -999
A493: Transient Jet | B493: CFM56-7B-24 | C493: 413 | D493: Departure Runway 32 - East Center | E493: 32D1B | F493: Departure | G493: 32 | H493: NMap | I493: Transient | J493: No | K493: Departure | L493: 0.14285714 | M493: 0 | N493: =SUM(RC[-2]:RC[-1]) -> -999 | O493: =IF(RC[-1]=0,0,RC[-3]/RC[-1]) -> -999 | P493: =IF(RC[-2]=0,0,RC[-3]/RC[-2]) -> -999 | Q493: =IF(R[+4]C[-3]=0,0,RC[-3]/R[+4]C[-3]) -> -999
A494: Transient Jet | B494: CFM56-7B-24 | C494: 414 | D494: Departure Runway 32 - East Long | E494: 32D1C | F494: Departure | G494: 32 | H494: NMap | I494: Transient | J494: No | K494: Departure | L494: 0 | M494: 0 | N494: =SUM(RC[-2]:RC[-1]) -> -999 | O494: =IF(RC[-1]=0,0,RC[-3]/RC[-1]) -> -999 | P494: =IF(RC[-2]=0,0,RC[-3]/RC[-2]) -> -999 | Q494: =IF(R[+3]C[-3]=0,0,RC[-3]/R[+3]C[-3]) -> -999
A495: Transient Jet | B495: CFM56-7B-24 | C495: 415 | D495: Departure Runway 32 - South Center | E495: 32D2B | F495: Departure | G495: 32 | H495: NMap | I495: Transient | J495: No | K495: Departure | L495: 0 | M495: 0 | N495: =SUM(RC[-2]:RC[-1]) -> -999 | O495: =IF(RC[-1]=0,0,RC[-3]/RC[-1]) -> -999 | P495: =IF(RC[-2]=0,0,RC[-3]/RC[-2]) -> -999 | Q495: =IF(R[+2]C[-3]=0,0,RC[-3]/R[+2]C[-3]) -> -999
A496: Transient Jet | B496: CFM56-7B-24 | C496: 416 | D496: Departure Runway 32 - South Long | E496: 32D2C | F496: Departure | G496: 32 | H496: NMap | I496: Transient | J496: No | K496: Departure | L496: 0 | M496: 0 | N496: =SUM(RC[-2]:RC[-1]) -> -999 | O496: =IF(RC[-1]=0,0,RC[-3]/RC[-1]) -> -999 | P496: =IF(RC[-2]=0,0,RC[-3]/RC[-2]) -> -999 | Q496: =IF(R[+1]C[-3]=0,0,RC[-3]/R[+1]C[-3]) -> -999
K497: Subtotal | L497: =SUM(R[-16]C:R[-1]C) -> -999 | M497: =SUM(R[-16]C:R[-1]C) -> -999 | N497: =SUM(R[-16]C:R[-1]C) -> -999 | O497: =IF(RC[-1]=0,0,RC[-3]/RC[-1]) -> -999 | P497: =IF(RC[-2]=0,0,RC[-3]/RC[-2]) -> -999
A499: Transient Jet | B499: CFM56-7B-24 | C499: 447B | D499: GCA Box Pattern Whidbey Runway 07 - Center | E499: 07G1B | F499: Closed Pattern | G499: 07 | H499: NMap | I499: Transient | J499: No | K499: GCA Pattern | L499: 0 | M499: 0 | N499: =SUM(RC[-2]:RC[-1]) -> -999 | O499: =IF(RC[-1]=0,0,RC[-3]/RC[-1]) -> -999 | P499: =IF(RC[-2]=0,0,RC[-3]/RC[-2]) -> -999 | Q499: =IF(R[+12]C[-3]=0,0,RC[-3]/R[+12]C[-3]) -> -999
A500: Transient Jet | B500: CFM56-7B-24 | C500: 447C | D500: GCA Box Pattern Whidbey Runway 07 - Long | E500: 07G1C | F500: Closed Pattern | G500: 07 | H500: NMap | I500: Transient | J500: No | K500: GCA Pattern | L500: 0 | M500: 0 | N500: =SUM(RC[-2]:RC[-1]) -> -999 | O500: =IF(RC[-1]=0,0,RC[-3]/RC[-1]) -> -999 | P500: =IF(RC[-2]=0,0,RC[-3]/RC[-2]) -> -999 | Q500: =IF(R[+11]C[-3]=0,0,RC[-3]/R[+11]C[-3]) -> -999
A501: Transient Jet | B501: CFM56-7B-24 | C501: 448B | D501: GCA Box Pattern Whidbey Runway 14 - Center | E501: 14G1B | F501: Closed Pattern | G501: 14 | H501: NMap | I501: Transient | J501: No | K501: GCA Pattern | L501: 0.28571429 | M501: 0 | N501: =SUM(RC[-2]:RC[-1]) -> -999 | O501: =IF(RC[-1]=0,0,RC[-3]/RC[-1]) -> -999 | P501: =IF(RC[-2]=0,0,RC[-3]/RC[-2]) -> -999 | Q501: =IF(R[+10]C[-3]=0,0,RC[-3]/R[+10]C[-3]) -> -999
A502: Transient Jet | B502: CFM56-7B-24 | C502: 448C | D502: GCA Box Pattern Whidbey Runway 14 - Long | E502: 14G1C | F502: Closed Pattern | G502: 14 | H502: NMap | I502: Transient | J502: No | K502: GCA Pattern | L502: 0 | M502: 0 | N502: =SUM(RC[-2]:RC[-1]) -> -999 | O502: =IF(RC[-1]=0,0,RC[-3]/RC[-1]) -> -999 | P502: =IF(RC[-2]=0,0,RC[-3]/RC[-2]) -> -999 | Q502: =IF(R[+9]C[-3]=0,0,RC[-3]/R[+9]C[-3]) -> -999
A503: Transient Jet | B503: CFM56-7B-24 | C503: 449B | D503: Rep - GCA Box Pattern Whidbey Runway 25 - Center | E503: 25G1B | F503: Closed Pattern | G503: 25 | H503: NMap | I503: Transient | J503: Yes | K503: GCA Pattern | L503: 0.42857143 | M503: 0 | N503: =SUM(RC[-2]:RC[-1]) -> -999 | O503: =IF(RC[-1]=0,0,RC[-3]/RC[-1]) -> -999 | P503: =IF(RC[-2]=0,0,RC[-3]/RC[-2]) -> -999 | Q503: =IF(R[+8]C[-3]=0,0,RC[-3]/R[+8]C[-3]) -> -999
A504: Transient Jet | B504: CFM56-7B-24 | C504: 449C | D504: GCA Box Pattern Whidbey Runway 25 - Long | E504: 25G1C | F504: Closed Pattern | G504: 25 | H504: NMap | I504: Transient | J504: No | K504: GCA Pattern | L504: 0 | M504: 0 | N504: =SUM(RC[-2]:RC[-1]) -> -999 | O504: =IF(RC[-1]=0,0,RC[-3]/RC[-1]) -> -999 | P504: =IF(RC[-2]=0,0,RC[-3]/RC[-2]) -> -999 | Q504: =IF(R[+7]C[-3]=0,0,RC[-3]/R[+7]C[-3]) -> -999
A505: Transient Jet | B505: CFM56-7B-24 | C505: 450B | D505: GCA Box Pattern Whidbey Runway 32 - Center | E505: 32G1B | F505: Closed Pattern | G505: 32 | H505: NMap | I505: Transient | J505: No | K505: GCA Pattern | L505: 0 | M505: 0 | N505: =SUM(RC[-2]:RC[-1]) -> -999 | O505: =IF(RC[-1]=0,0,RC[-3]/RC[-1]) -> -999 | P505: =IF(RC[-2]=0,0,RC[-3]/RC[-2]) -> -999 | Q505: =IF(R[+6]C[-3]=0,0,RC[-3]/R[+6]C[-3]) -> -999
A506: Transient Jet | B506: CFM56-7B-24 | C506: 450C | D506: GCA Box Pattern Whidbey Runway 32 - Long | E506: 32G1C | F506: Closed Pattern | G506: 32 | H506: NMap | I506: Transient | J506: No | K506: GCA Pattern | L506: 0 | M506: 0 | N506: =SUM(RC[-2]:RC[-1]) -> -999 | O506: =IF(RC[-1]=0,0,RC[-3]/RC[-1]) -> -999 | P506: =IF(RC[-2]=0,0,RC[-3]/RC[-2]) -> -999 | Q506: =IF(R[+5]C[-3]=0,0,RC[-3]/R[+5]C[-3]) -> -999
A507: Transient Jet | B507: CFM56-7B-24 | C507: 451B | D507: Touch & Go | E507: 07TU2C | F507: Closed Pattern | G507: 07 | H507: NMap | I507: Transient | J507: No | K507: Touch and Go at Ault Field | L507: 0 | M507: 0 | N507: =SUM(RC[-2]:RC[-1]) -> -999 | O507: =IF(RC[-1]=0,0,RC[-3]/RC[-1]) -> -999 | P507: =IF(RC[-2]=0,0,RC[-3]/RC[-2]) -> -999 | Q507: =IF(R[+4]C[-3]=0,0,RC[-3]/R[+4]C[-3]) -> -999
A508: Transient Jet | B508: CFM56-7B-24 | C508: 452B | D508: Touch & Go | E508: 14TU2C | F508: Closed Pattern | G508: 14 | H508: NMap | I508: Transient | J508: Yes | K508: Touch and Go at Ault Field | L508: 0 | M508: 0 | N508: =SUM(RC[-2]:RC[-1]) -> -999 | O508: =IF(RC[-1]=0,0,RC[-3]/RC[-1]) -> -999 | P508: =IF(RC[-2]=0,0,RC[-3]/RC[-2]) -> -999 | Q508: =IF(R[+3]C[-3]=0,0,RC[-3]/R[+3]C[-3]) -> -999
A509: Transient Jet | B509: CFM56-7B-24 | C509: 453B | D509: Touch & Go | E509: 25TU2C | F509: Closed Pattern | G509: 25 | H509: NMap | I509: Transient | J509: No | K509: Touch and Go at Ault Field | L509: 0 | M509: 0 | N509: =SUM(RC[-2]:RC[-1]) -> -999 | O509: =IF(RC[-1]=0,0,RC[-3]/RC[-1]) -> -999 | P509: =IF(RC[-2]=0,0,RC[-3]/RC[-2]) -> -999 | Q509: =IF(R[+2]C[-3]=0,0,RC[-3]/R[+2]C[-3]) -> -999
A510: Transient Jet | B510: CFM56-7B-24 | C510: 454B | D510: Touch & Go | E510: 32TU2C | F510: Closed Pattern | G510: 32 | H510: NMap | I510: Transient | J510: No | K510: Touch and Go at Ault Field | L510: 0 | M510: 0 | N510: =SUM(RC[-2]:RC[-1]) -> -999 | O510: =IF(RC[-1]=0,0,RC[-3]/RC[-1]) -> -999 | P510: =IF(RC[-2]=0,0,RC[-3]/RC[-2]) -> -999 | Q510: =IF(R[+1]C[-3]=0,0,RC[-3]/R[+1]C[-3]) -> -999
K511: Subtotal | L511: =SUM(R[-12]C:R[-1]C) -> -999 | M511: =SUM(R[-12]C:R[-1]C) -> -999 | N511: =SUM(R[-12]C:R[-1]C) -> -999 | O511: =IF(RC[-1]=0,0,RC[-3]/RC[-1]) -> -999 | P511: =IF(RC[-2]=0,0,RC[-3]/RC[-2]) -> -999